reference_id,authors,title,journal,year,volume,citation_footer,citation_type,citation,urls,pubmed_id,doi,header,reference_type,study_id,exclusion_reason
CD010019-bib-0001,"Aujesky D, Roy PM, Verschuren F, Righini M, Osterwalder J, Egloff M, et al.","An international, randomized non-inferiority trial of outpatient versus inpatient treatment for pulmonary embolism", Journal of General Internal Medicine ,2011,26,    ,['citation-journal']," Aujesky D, Roy PM, Verschuren F, Righini M, Osterwalder J, Egloff M, et al.An international, randomized non-inferiority trial of outpatient versus inpatient treatment for pulmonary embolism.  Journal of General Internal Medicine 2011;26(10):1220. CENTRAL    Google Scholar     ","['', 'https://scholar.google.com/scholar_lookup?title=An+international,+randomized+non-inferiority+trial+of+outpatient+versus+inpatient+treatment+for+pulmonary+embolism+&author=D+Aujesky&author=PM+Roy&author=F+Verschuren&author=M+Righini&author=J+Osterwalder&author=M+Egloff&publication_year=2011&hl=en']",,, Aujesky 2011 {published data only}  ,included,CD010019-bbs2-0001,
CD010019-bib-0002,"Aujesky D, Roy PM, Verschuren F, Righini M, Osterwalder J, Egloff M, et al.","Outpatient versus inpatient treatment for patients with acute pulmonary embolism: an international, open-label, randomised, non-inferiority trial", Lancet ,2011,378,    ,['citation-journal']," Aujesky D, Roy PM, Verschuren F, Righini M, Osterwalder J, Egloff M, et al.Outpatient versus inpatient treatment for patients with acute pulmonary embolism: an international, open-label, randomised, non-inferiority trial.  Lancet 2011;378(9785):41-8. CENTRAL    Link to article     PubMed     Google Scholar     ","['', 'https://doi.org/10.1016/S0140-6736(11)60824-6', 'https://www.ncbi.nlm.nih.gov/pubmed/21703676', 'https://scholar.google.com/scholar_lookup?title=Outpatient+versus+inpatient+treatment+for+patients+with+acute+pulmonary+embolism:+an+international,+open-label,+randomised,+non-inferiority+trial+&author=D+Aujesky&author=PM+Roy&author=F+Verschuren&author=M+Righini&author=J+Osterwalder&author=M+Egloff&publication_year=2011&hl=en']",21703676,https://doi.org/10.1016/S0140-6736(11)60824-6, Aujesky 2011 {published data only}  ,included,CD010019-bbs2-0001,
CD010019-bib-0003,NCT02584660.,A study of rivaroxaban for early discharge of low risk pulmonary embolism from the emergency department (MERCURY PE),,,,   ,['citation-other'], NCT02584660.A study of rivaroxaban for early discharge of low risk pulmonary embolism from the emergency department (MERCURY PE). clinicaltrials.gov/ct2/show/NCT02584660 (first received 22 October 2015). CENTRAL    ,[''],,, Peacock 2018 {published data only}  ,included,CD010019-bbs2-0002,
CD010019-bib-0004,"Peacock WF, Coleman CI, Diercks DB, Francis S, Kabrhel C, Keay C, et al.",Emergency department discharge of pulmonary embolus patients,,2018,25,    ,['citation-other']," Peacock WF, Coleman CI, Diercks DB, Francis S, Kabrhel C, Keay C, et al.Emergency department discharge of pulmonary embolus patients. Academic Emergency Medicine2018;25(9):995-1003. CENTRAL    Google Scholar     ","['', 'https://scholar.google.com/scholar_lookup?title=Emergency+department+discharge+of+pulmonary+embolus+patients&author=WF+Peacock&author=CI+Coleman&author=DB+Diercks&author=S+Francis&author=C+Kabrhel&author=C+Keay&publication_year=2018&hl=en']",,, Peacock 2018 {published data only}  ,included,CD010019-bbs2-0002,
CD010019-bib-0005,"Singer AJ, Xiang J, Kabrhel C, Merli GJ, Pollack C, Tapson VF, et al.",MulticEnter trial of Rivaroxaban for early disCharge of pUlmonaRY embolism from the Emergency Department (MERCURY PE): rationale and design, Academic Emergency Medicine ,2016,23,    ,['citation-journal']," Singer AJ, Xiang J, Kabrhel C, Merli GJ, Pollack C, Tapson VF, et al.MulticEnter trial of Rivaroxaban for early disCharge of pUlmonaRY embolism from the Emergency Department (MERCURY PE): rationale and design.  Academic Emergency Medicine 2016;23(11):1280-6. CENTRAL    Link to article     PubMed     Google Scholar     ","['', 'https://doi.org/10.1111/acem.13072', 'https://www.ncbi.nlm.nih.gov/pubmed/27537530', 'https://scholar.google.com/scholar_lookup?title=MulticEnter+trial+of+Rivaroxaban+for+early+disCharge+of+pUlmonaRY+embolism+from+the+Emergency+Department+(MERCURY+PE):+rationale+and+design+&author=AJ+Singer&author=J+Xiang&author=C+Kabrhel&author=GJ+Merli&author=C+Pollack&author=VF+Tapson&publication_year=2016&hl=en']",27537530,https://doi.org/10.1111/acem.13072, Peacock 2018 {published data only}  ,included,CD010019-bbs2-0002,
CD010019-bib-0006,"Den Exter PL, Zondag W, Klok FA, Brouwer RE, Dolsma J, Eijsvogel M, et al.",Efficacy and safety of outpatient treatment based on the Hestia clinical decision rule with or without N-terminal pro–brain natriuretic peptide testing in patients with acute pulmonary embolism, American Journal of Respiratory and Critical Care Medicine ,2016,194,    ,['citation-journal']," Den Exter PL, Zondag W, Klok FA, Brouwer RE, Dolsma J, Eijsvogel M, et al.Efficacy and safety of outpatient treatment based on the Hestia clinical decision rule with or without N-terminal pro–brain natriuretic peptide testing in patients with acute pulmonary embolism.  American Journal of Respiratory and Critical Care Medicine 2016;194(8):998-1006. CENTRAL    Link to article     PubMed     Google Scholar     ","['', 'https://doi.org/10.1164/rccm.201512-2494OC', 'https://www.ncbi.nlm.nih.gov/pubmed/27030891', 'https://scholar.google.com/scholar_lookup?title=Efficacy+and+safety+of+outpatient+treatment+based+on+the+Hestia+clinical+decision+rule+with+or+without+N-terminal+pro–brain+natriuretic+peptide+testing+in+patients+with+acute+pulmonary+embolism+&author=PL+DenExter&author=W+Zondag&author=FA+Klok&author=RE+Brouwer&author=J+Dolsma&author=M+Eijsvogel&publication_year=2016&hl=en']",27030891,https://doi.org/10.1164/rccm.201512-2494OC, Den Exter 2016a {published data only}  ,excluded,CD010019-bbs2-0003," Participants were randomised to either outpatient treatment or to management based on NT‐proBNP levels, and not to either outpatient or inpatient management.  "
CD010019-bib-0007,"Roy PM, Gable B.",Hospitalization or Out-treatment ManagEment of Patients with Pulmonary Embolism: a randomized controlled trial (HOME-PE),,,,   ,['citation-other']," Roy PM, Gable B.Hospitalization or Out-treatment ManagEment of Patients with Pulmonary Embolism: a randomized controlled trial (HOME-PE). clinicaltrials.gov/ct2/show/NCT02811237 (first received 23 June 2016). CENTRAL    ",[''],,, HOME Study {published data only}  ,excluded,CD010019-bbs2-0004," Participants were randomised to either Hestia or PESI management, and not randomised to either inpatient or outpatient treatment.  "
CD010019-bib-0008,"Kovacs MJ, Rodger M, Anderson DR, Morrow B, Kells G, Kovacs J, et al.","Comparison of 10-mg and 5-mg warfarin initiation nomograms together with low-molecular-weight heparin for outpatient treatment of acute venous thromboembolism. A randomized, double-blind, controlled trial", Annals of Internal Medicine ,2003,138,    ,['citation-journal']," Kovacs MJ, Rodger M, Anderson DR, Morrow B, Kells G, Kovacs J, et al.Comparison of 10-mg and 5-mg warfarin initiation nomograms together with low-molecular-weight heparin for outpatient treatment of acute venous thromboembolism. A randomized, double-blind, controlled trial.  Annals of Internal Medicine 2003;138(9):714-9. CENTRAL    Link to article     PubMed     Google Scholar     ","['', 'https://doi.org/10.7326/0003-4819-138-9-200305060-00007', 'https://www.ncbi.nlm.nih.gov/pubmed/12729425', 'https://scholar.google.com/scholar_lookup?title=Comparison+of+10-mg+and+5-mg+warfarin+initiation+nomograms+together+with+low-molecular-weight+heparin+for+outpatient+treatment+of+acute+venous+thromboembolism.+A+randomized,+double-blind,+controlled+trial+&author=MJ+Kovacs&author=M+Rodger&author=DR+Anderson&author=B+Morrow&author=G+Kells&author=J+Kovacs&publication_year=2003&hl=en']",12729425,https://doi.org/10.7326/0003-4819-138-9-200305060-00007, Kovacs 2003 {published data only}  ,excluded,CD010019-bbs2-0005, RCT which evaluated different doses of warfarin in outpatients and not randomised to outpatient or inpatient treatment  
CD010019-bib-0009,"Medina A, Raskob G, Ageno W, Cohen AT, Brekelmans MP, Chen CZ, et al.",Outpatient management in patients with venous thromboembolism with edoxaban: a post hoc analysis of the Hokusai-VTE study, Thrombosis and Haemostasis ,2017,117,    ,['citation-journal']," Medina A, Raskob G, Ageno W, Cohen AT, Brekelmans MP, Chen CZ, et al.Outpatient management in patients with venous thromboembolism with edoxaban: a post hoc analysis of the Hokusai-VTE study.  Thrombosis and Haemostasis 2017;117(12):2406-14. CENTRAL [DOI: 10.1160/TH17-05-0523]    Link to article     PubMed     Google Scholar     ","['', 'https://doi.org/10.1160/TH17-05-0523', 'https://www.ncbi.nlm.nih.gov/pubmed/29212128', 'https://scholar.google.com/scholar_lookup?title=Outpatient+management+in+patients+with+venous+thromboembolism+with+edoxaban:+a+post+hoc+analysis+of+the+Hokusai-VTE+study+&author=A+Medina&author=G+Raskob&author=W+Ageno&author=AT+Cohen&author=MP+Brekelmans&author=CZ+Chen&publication_year=2017&hl=en']",29212128,https://doi.org/10.1160/TH17-05-0523, Medina 2017 {published data only}  ,excluded,CD010019-bbs2-0006, Not randomised to inpatient or outpatient treatment (post‐hoc analysis) 
CD010019-bib-0010,"Otero R, Uresandi F, Jiménez D, Cabezudo MA, Oribe M, Nauffal D, et al.",Home treatment in pulmonary embolism, Thrombosis Research ,2010,126,    ,['citation-journal']," Otero R, Uresandi F, Jiménez D, Cabezudo MA, Oribe M, Nauffal D, et al.Home treatment in pulmonary embolism.  Thrombosis Research 2010;126(1):e1-5. CENTRAL    Link to article     PubMed     Google Scholar     ","['', 'https://doi.org/10.1016/j.thromres.2009.09.026', 'https://www.ncbi.nlm.nih.gov/pubmed/19853892', 'https://scholar.google.com/scholar_lookup?title=Home+treatment+in+pulmonary+embolism&author=R+Otero&author=F+Uresandi&author=D+Jiménez&author=MA+Cabezudo&author=M+Oribe&author=D+Nauffal&publication_year=2010&hl=en']",19853892,https://doi.org/10.1016/j.thromres.2009.09.026, Otero 2010 {published data only}  ,excluded,CD010019-bbs2-0007, RCT considered early discharge to be at 3 to 5 days from admission 
CD010019-bib-0011,"Zondag W, Mos IC, Creemers-Schild D, Hoogerbrugge AD, Dekkers OM, Dolsma J, et al.",Outpatient treatment in patients with acute pulmonary embolism: the Hestia Study, Journal of Thrombosis and Haemostasis ,2011,9,    ,['citation-journal']," Zondag W, Mos IC, Creemers-Schild D, Hoogerbrugge AD, Dekkers OM, Dolsma J, et al.Outpatient treatment in patients with acute pulmonary embolism: the Hestia Study.  Journal of Thrombosis and Haemostasis 2011;9(8):1500-7. CENTRAL    Link to article     PubMed     Google Scholar     ","['', 'https://doi.org/10.1111/j.1538-7836.2011.04388.x', 'https://www.ncbi.nlm.nih.gov/pubmed/21645235', 'https://scholar.google.com/scholar_lookup?title=Outpatient+treatment+in+patients+with+acute+pulmonary+embolism:+the+Hestia+Study&author=W+Zondag&author=IC+Mos&author=D+Creemers-Schild&author=AD+Hoogerbrugge&author=OM+Dekkers&author=J+Dolsma&publication_year=2011&hl=en']",21645235,https://doi.org/10.1111/j.1538-7836.2011.04388.x, Zondag 2011 {published data only}  ,excluded,CD010019-bbs2-0008, Cohort study 
CD010019-bib-0012,"Agterof MJ, Schutgens RE, Snijder RJ, Epping G, Peltenburg HG, Posthuma EF, et al.",Out of hospital treatment of acute pulmonary embolism in patients with a low NT-proBNP level, Journal of Thrombosis and Haemostasis ,2010,8,    ,['citation-journal']," Agterof MJ, Schutgens RE, Snijder RJ, Epping G, Peltenburg HG, Posthuma EF, et al.Out of hospital treatment of acute pulmonary embolism in patients with a low NT-proBNP level.  Journal of Thrombosis and Haemostasis 2010;8(6):1235-41.    Link to article     PubMed     Google Scholar     ","['https://doi.org/10.1111/j.1538-7836.2010.03831.x', 'https://www.ncbi.nlm.nih.gov/pubmed/20230418', 'https://scholar.google.com/scholar_lookup?title=Out+of+hospital+treatment+of+acute+pulmonary+embolism+in+patients+with+a+low+NT-proBNP+level+&author=MJ+Agterof&author=RE+Schutgens&author=RJ+Snijder&author=G+Epping&author=HG+Peltenburg&author=EF+Posthuma&publication_year=2010&hl=en']",20230418,https://doi.org/10.1111/j.1538-7836.2010.03831.x, Agterof 2010 ,additional,CD010019-bbs2-0009,
CD010019-bib-0013,"Aujesky D, Obrosky DS, Stone RA, Auble TE, Perrier A, Cornuz J, et al.",Derivation and validation of a prognostic model for pulmonary embolism, American Journal of Respiratory and Critical Care Medicine ,2005,172,    ,['citation-journal']," Aujesky D, Obrosky DS, Stone RA, Auble TE, Perrier A, Cornuz J, et al.Derivation and validation of a prognostic model for pulmonary embolism.  American Journal of Respiratory and Critical Care Medicine 2005;172(8):1041-6.    Link to article     PubMed     Google Scholar     ","['https://doi.org/10.1164/rccm.200506-862OC', 'https://www.ncbi.nlm.nih.gov/pubmed/16020800', 'https://scholar.google.com/scholar_lookup?title=Derivation+and+validation+of+a+prognostic+model+for+pulmonary+embolism&author=D+Aujesky&author=DS+Obrosky&author=RA+Stone&author=TE+Auble&author=A+Perrier&author=J+Cornuz&publication_year=2005&hl=en']",16020800,https://doi.org/10.1164/rccm.200506-862OC, Aujesky 2005 ,additional,CD010019-bbs2-0010,
CD010019-bib-0014,"Aujesky D, Perrier A, Roy PM, Stone RA, Cornuz J, Meyer G, et al.",Validation of a clinical prognostic model to identify low-risk patients with pulmonary embolism, Journal of Internal Medicine ,2007,261,    ,['citation-journal']," Aujesky D, Perrier A, Roy PM, Stone RA, Cornuz J, Meyer G, et al.Validation of a clinical prognostic model to identify low-risk patients with pulmonary embolism.  Journal of Internal Medicine 2007;261(6):597-604.    Link to article     PubMed     Google Scholar     ","['https://doi.org/10.1111/j.1365-2796.2007.01785.x', 'https://www.ncbi.nlm.nih.gov/pubmed/17547715', 'https://scholar.google.com/scholar_lookup?title=Validation+of+a+clinical+prognostic+model+to+identify+low-risk+patients+with+pulmonary+embolism+&author=D+Aujesky&author=A+Perrier&author=PM+Roy&author=RA+Stone&author=J+Cornuz&author=G+Meyer&publication_year=2007&hl=en']",17547715,https://doi.org/10.1111/j.1365-2796.2007.01785.x, Aujesky 2007 ,additional,CD010019-bbs2-0011,
CD010019-bib-0015,Baglin T.,Fifty per cent of patients with pulmonary embolism can be treated as outpatients, Journal of Thrombosis and Haemostasis ,2010,8,    ,['citation-journal'], Baglin T.Fifty per cent of patients with pulmonary embolism can be treated as outpatients.  Journal of Thrombosis and Haemostasis 2010;8(11):2404-5.    Link to article     PubMed     Google Scholar     ,"['https://doi.org/10.1111/j.1538-7836.2010.04055.x', 'https://www.ncbi.nlm.nih.gov/pubmed/21251192', 'https://scholar.google.com/scholar_lookup?title=Fifty+per+cent+of+patients+with+pulmonary+embolism+can+be+treated+as+outpatients&author=T+Baglin&publication_year=2010&hl=en']",21251192,https://doi.org/10.1111/j.1538-7836.2010.04055.x, Baglin 2010 ,additional,CD010019-bbs2-0012,
CD010019-bib-0016,"Barco S, Mahmoudpour SH, Planquette B, Sanchez O, Konstantinides SV, Meyer G.",Prognostic value of right ventricular dysfunction or elevated cardiac biomarkers in patients with low-risk pulmonary embolism: a systematic review and meta-analysis, European Heart Journal ,2019,40,    ,['citation-journal']," Barco S, Mahmoudpour SH, Planquette B, Sanchez O, Konstantinides SV, Meyer G.Prognostic value of right ventricular dysfunction or elevated cardiac biomarkers in patients with low-risk pulmonary embolism: a systematic review and meta-analysis.  European Heart Journal 2019;40(11):902-10.    Link to article     PubMed     Google Scholar     ","['https://doi.org/10.1093/eurheartj/ehy873', 'https://www.ncbi.nlm.nih.gov/pubmed/30590531', 'https://scholar.google.com/scholar_lookup?title=Prognostic+value+of+right+ventricular+dysfunction+or+elevated+cardiac+biomarkers+in+patients+with+low-risk+pulmonary+embolism:+a+systematic+review+and+meta-analysis+&author=S+Barco&author=SH+Mahmoudpour&author=B+Planquette&author=O+Sanchez&author=SV+Konstantinides&author=G+Meyer&publication_year=2019&hl=en']",30590531,https://doi.org/10.1093/eurheartj/ehy873, Barco 2019 ,additional,CD010019-bbs2-0013,
CD010019-bib-0017,"Barco S, Mahmoudpour SH, Valerio L, Klok FA, Münzel T, Middeldorp S, et al.","Trends in mortality related to pulmonary embolism in the European Region, 2000-15: analysis of vital registration data from the WHO Mortality Database", Lancet Respiratory Medicine ,2020,8,    ,['citation-journal']," Barco S, Mahmoudpour SH, Valerio L, Klok FA, Münzel T, Middeldorp S, et al.Trends in mortality related to pulmonary embolism in the European Region, 2000-15: analysis of vital registration data from the WHO Mortality Database.  Lancet Respiratory Medicine 2020;8(3):277-87.    Link to article     PubMed     Google Scholar     ","['https://doi.org/10.1016/S2213-2600(19)30354-6', 'https://www.ncbi.nlm.nih.gov/pubmed/31615719', 'https://scholar.google.com/scholar_lookup?title=Trends+in+mortality+related+to+pulmonary+embolism+in+the+European+Region,+2000-15:+analysis+of+vital+registration+data+from+the+WHO+Mortality+Database+&author=S+Barco&author=SH+Mahmoudpour&author=L+Valerio&author=FA+Klok&author=T+Münzel&author=S+Middeldorp&publication_year=2020&hl=en']",31615719,https://doi.org/10.1016/S2213-2600(19)30354-6, Barco 2020 ,additional,CD010019-bbs2-0014,
CD010019-bib-0018,"Barra SN, Paiva L, Providência R, Fernandes A, Marques AL.",A review on state-of-the-art data regarding safe early discharge following admission for pulmonary embolism: what do we know?, Clinical Cardiology ,2013,36,    ,['citation-journal']," Barra SN, Paiva L, Providência R, Fernandes A, Marques AL.A review on state-of-the-art data regarding safe early discharge following admission for pulmonary embolism: what do we know? Clinical Cardiology 2013;36(9):507-15.    Link to article     PubMed     Google Scholar     ","['https://doi.org/10.1002/clc.22144', 'https://www.ncbi.nlm.nih.gov/pubmed/23720225', 'https://scholar.google.com/scholar_lookup?title=A+review+on+state-of-the-art+data+regarding+safe+early+discharge+following+admission+for+pulmonary+embolism:+what+do+we+know?+&author=SN+Barra&author=L+Paiva&author=R+Providência&author=A+Fernandes&author=AL+Marques&publication_year=2013&hl=en']",23720225,https://doi.org/10.1002/clc.22144, Barra 2013 ,additional,CD010019-bbs2-0015,
CD010019-bib-0019,"Becattini C, Agnelli G.",Acute treatment of venous thromboembolism, Blood ,2020,135,    ,['citation-journal']," Becattini C, Agnelli G.Acute treatment of venous thromboembolism.  Blood 2020;135(5):305-16.    Link to article     PubMed     Google Scholar     ","['https://doi.org/10.1182/blood.2019001881', 'https://www.ncbi.nlm.nih.gov/pubmed/31917399', 'https://scholar.google.com/scholar_lookup?title=Acute+treatment+of+venous+thromboembolism&author=C+Becattini&author=G+Agnelli&publication_year=2020&hl=en']",31917399,https://doi.org/10.1182/blood.2019001881, Becattini 2020 ,additional,CD010019-bbs2-0016,
CD010019-bib-0020,"Bledsoe J, Woller S, Stevens S, Aston V, Patten R, Allen T, et al.",Management of low-risk pulmonary embolism (LoPE) patients without hospitalization: the LoPE prospective management study, Chest ,2018,154,    ,['citation-journal']," Bledsoe J, Woller S, Stevens S, Aston V, Patten R, Allen T, et al.Management of low-risk pulmonary embolism (LoPE) patients without hospitalization: the LoPE prospective management study.  Chest 2018;154(2):249-56.    Link to article     PubMed     Google Scholar     ","['https://doi.org/10.1016/j.chest.2018.01.035', 'https://www.ncbi.nlm.nih.gov/pubmed/29410163', 'https://scholar.google.com/scholar_lookup?title=Management+of+low-risk+pulmonary+embolism+(LoPE)+patients+without+hospitalization:+the+LoPE+prospective+management+study+&author=J+Bledsoe&author=S+Woller&author=S+Stevens&author=V+Aston&author=R+Patten&author=T+Allen&publication_year=2018&hl=en']",29410163,https://doi.org/10.1016/j.chest.2018.01.035, Bledsoe 2018 ,additional,CD010019-bbs2-0017,
CD010019-bib-0021,"Buller HR, Davidson BL, Decousus H, Gallus A, Gent M, Piovella F, et al.",Subcutaneous fondaparinux versus intravenous unfractionated heparin in the initial treatment of pulmonary embolism, New England Journal of Medicine ,2003,349,    ,['citation-journal']," Buller HR, Davidson BL, Decousus H, Gallus A, Gent M, Piovella F, et al.Subcutaneous fondaparinux versus intravenous unfractionated heparin in the initial treatment of pulmonary embolism.  New England Journal of Medicine 2003;349(18):1695-702.    PubMed     Google Scholar     ","['https://www.ncbi.nlm.nih.gov/pubmed/14585937', 'https://scholar.google.com/scholar_lookup?title=Subcutaneous+fondaparinux+versus+intravenous+unfractionated+heparin+in+the+initial+treatment+of+pulmonary+embolism+&author=HR+Buller&author=BL+Davidson&author=H+Decousus&author=A+Gallus&author=M+Gent&author=F+Piovella&publication_year=2003&hl=en']",14585937,, Buller 2003 ,additional,CD010019-bbs2-0018,
CD010019-bib-0022,"Cohen AT, Agnelli G, Anderson FA, Arcelus JI, Bergqvist D, Brecht JG, et al.",Venous thromboembolism (VTE) in Europe. The number of VTE events and associated morbidity and mortality, Thrombosis and Haemostasis ,2007,98,    ,['citation-journal']," Cohen AT, Agnelli G, Anderson FA, Arcelus JI, Bergqvist D, Brecht JG, et al.Venous thromboembolism (VTE) in Europe. The number of VTE events and associated morbidity and mortality.  Thrombosis and Haemostasis 2007;98(4):756-64.    PubMed     Google Scholar     ","['https://www.ncbi.nlm.nih.gov/pubmed/17938798', 'https://scholar.google.com/scholar_lookup?title=Venous+thromboembolism+(VTE)+in+Europe.+The+number+of+VTE+events+and+associated+morbidity+and+mortality+&author=AT+Cohen&author=G+Agnelli&author=FA+Anderson&author=JI+Arcelus&author=D+Bergqvist&author=JG+Brecht&publication_year=2007&hl=en']",17938798,, Cohen 2007 ,additional,CD010019-bbs2-0019,
CD010019-bib-0023,"Dasta JF, Pilon D, Mody SH, Lopatto K, Laliberté G, Germain G, et al.",Daily hospitalization costs in patients with deep vein thrombosis or pulmonary embolism treated with anticoagulant therapy, Thrombosis Research ,2015,135,    ,['citation-journal']," Dasta JF, Pilon D, Mody SH, Lopatto K, Laliberté G, Germain G, et al.Daily hospitalization costs in patients with deep vein thrombosis or pulmonary embolism treated with anticoagulant therapy.  Thrombosis Research 2015;135(2):303-10.    Link to article     PubMed     Google Scholar     ","['https://doi.org/10.1016/j.thromres.2014.11.024', 'https://www.ncbi.nlm.nih.gov/pubmed/25555319', 'https://scholar.google.com/scholar_lookup?title=Daily+hospitalization+costs+in+patients+with+deep+vein+thrombosis+or+pulmonary+embolism+treated+with+anticoagulant+therapy+&author=JF+Dasta&author=D+Pilon&author=SH+Mody&author=K+Lopatto&author=G+Laliberté&author=G+Germain&publication_year=2015&hl=en']",25555319,https://doi.org/10.1016/j.thromres.2014.11.024, Dasta 2015 ,additional,CD010019-bbs2-0020,
CD010019-bib-0024,"Deeks JJ, Higgins JP, Altman DG (editors).","Chapter 10: Analysing data and undertaking meta-analyses. In: Higgins JP, Thomas J, Chandler J, Cumpston M, Li T, Page MJ, et al (editors). Cochrane Handbook for Systematic Reviews of Interventions version 6.2 (updated February 2021). Cochrane, 2021",,,,. Available from training.cochrane.org/handbook/archive/v6.2/chapter-10.   ,['citation-other']," Deeks JJ, Higgins JP, Altman DG (editors).Chapter 10: Analysing data and undertaking meta-analyses. In: Higgins JP, Thomas J, Chandler J, Cumpston M, Li T, Page MJ, et al (editors). Cochrane Handbook for Systematic Reviews of Interventions version 6.2 (updated February 2021). Cochrane, 2021. Available from training.cochrane.org/handbook/archive/v6.2/chapter-10.    ",[],,, Deeks 2011 ,additional,CD010019-bbs2-0021,
CD010019-bib-0025,"den Exter PL, Zondag W, Klok FA, Brouwer RE, Dolsma J, Eijsvogel M, et al.",Efficacy and safety of outpatient treatment based on the Hestia clinical decision rule with or without N-terminal pro–brain natriuretic peptide testing in patients with acute pulmonary embolism, American Journal of Respiratory and Critical Care Medicine ,2016,194,    ,['citation-journal']," den Exter PL, Zondag W, Klok FA, Brouwer RE, Dolsma J, Eijsvogel M, et al.Efficacy and safety of outpatient treatment based on the Hestia clinical decision rule with or without N-terminal pro–brain natriuretic peptide testing in patients with acute pulmonary embolism.  American Journal of Respiratory and Critical Care Medicine 2016;194(8):998-1006.    Link to article     PubMed     Google Scholar     ","['https://doi.org/10.1164/rccm.201512-2494OC', 'https://www.ncbi.nlm.nih.gov/pubmed/27030891', 'https://scholar.google.com/scholar_lookup?title=Efficacy+and+safety+of+outpatient+treatment+based+on+the+Hestia+clinical+decision+rule+with+or+without+N-terminal+pro–brain+natriuretic+peptide+testing+in+patients+with+acute+pulmonary+embolism+&author=PL+denExter&author=W+Zondag&author=FA+Klok&author=RE+Brouwer&author=J+Dolsma&author=M+Eijsvogel&publication_year=2016&hl=en']",27030891,https://doi.org/10.1164/rccm.201512-2494OC, Den Exter 2016b ,additional,CD010019-bbs2-0022,
