reference_id,authors,title,journal,year,volume,citation_footer,citation_type,citation,urls,pubmed_id,doi,header,reference_type,study_id,exclusion_reason
CD010386-bib-0058,"Dubois B, Feldman HH, Jacova C, Cummings JL, Dekosky ST, Barberger‐Gateau P, et al. ",Revising the definition of Alzheimer's disease: a new lexicon, Lancet Neurology ,2010,9,    ,['citation-journal']," Dubois B, Feldman HH, Jacova C, Cummings JL, Dekosky ST, Barberger‐Gateau P, et al. Revising the definition of Alzheimer's disease: a new lexicon.  Lancet Neurology 2010;9(11):1118‐27.    Link to article     Google Scholar     ","['https://doi.org/10.1016/S1474-4422(10)70223-4', ""https://scholar.google.com/scholar_lookup?title=Revising+the+definition+of+Alzheimer's+disease:+a+new+lexicon&author=B+Dubois&author=HH+Feldman&author=C+Jacova&author=JL+Cummings&author=ST+Dekosky&author=P+Barberger‐Gateau&publication_year=2010&hl=en""]",,https://doi.org/10.1016/S1474-4422(10)70223-4, Dubois 2010 ,additional,CD010386-bbs2-0038,
CD010386-bib-0059,"Ducharme S, Guiot MC, Nikelski J, Chertkow H. ",Does a positive Pittsburgh compound B scan in a patient with dementia equal Alzheimer disease?, JAMA Neurology ,2013,70,    ,['citation-journal']," Ducharme S, Guiot MC, Nikelski J, Chertkow H. Does a positive Pittsburgh compound B scan in a patient with dementia equal Alzheimer disease?.  JAMA Neurology 2013;70(7):912‐4.    Link to article     Google Scholar     ","['https://doi.org/10.1001/jamaneurol.2013.420', 'https://scholar.google.com/scholar_lookup?title=Does+a+positive+Pittsburgh+compound+B+scan+in+a+patient+with+dementia+equal+Alzheimer+disease?+&author=S+Ducharme&author=MC+Guiot&author=J+Nikelski&author=H+Chertkow&publication_year=2013&hl=en']",,https://doi.org/10.1001/jamaneurol.2013.420, Ducharme 2013 ,additional,CD010386-bbs2-0039,
CD010386-bib-0060,"Ellis KA, Rowe C, Masters C, Szoeke C, Taddei K, Martins R, et al. ","Predictors of cognitive decline at 18 month follow up among 1112 participants in the australian imaging, biomarkers and lifestyle flagship study of ageing (AIBL)",,2011,,    ,['citation-other']," Ellis KA, Rowe C, Masters C, Szoeke C, Taddei K, Martins R, et al. Predictors of cognitive decline at 18 month follow up among 1112 participants in the australian imaging, biomarkers and lifestyle flagship study of ageing (AIBL) [Conference: Alzheimer's Association International Conference, AAIC 11 Paris France. Conference Start: 20110716 Conference End: 20110721. Conference Publication: (var.pagings)]. Alzheimer's & Dementia2011; Vol. 7, issue 4 Suppl 1:S158.    Google Scholar     ","['https://scholar.google.com/scholar_lookup?title=Predictors+of+cognitive+decline+at+18+month+follow+up+among+1112+participants+in+the+australian+imaging,+biomarkers+and+lifestyle+flagship+study+of+ageing+(AIBL)+&author=KA+Ellis&author=C+Rowe&author=C+Masters&author=C+Szoeke&author=K+Taddei&author=R+Martins&publication_year=2011&hl=en']",,, Ellis 2011 ,additional,CD010386-bbs2-0040,
CD010386-bib-0061,"Engler H, Santillo AF, Wang SX, Lindau M, Savitcheva I, Nordberg A, et al. ",In vivo amyloid imaging with PET in frontotemporal dementia, European Journal of Nuclear Medicine and Molecular Imaging ,2008,35,    ,['citation-journal']," Engler H, Santillo AF, Wang SX, Lindau M, Savitcheva I, Nordberg A, et al. In vivo amyloid imaging with PET in frontotemporal dementia.  European Journal of Nuclear Medicine and Molecular Imaging 2008;35(1):100‐6.    Link to article     Google Scholar     ","['https://doi.org/10.1007/s00259-007-0523-1', 'https://scholar.google.com/scholar_lookup?title=In+vivo+amyloid+imaging+with+PET+in+frontotemporal+dementia&author=H+Engler&author=AF+Santillo&author=SX+Wang&author=M+Lindau&author=I+Savitcheva&author=A+Nordberg&publication_year=2008&hl=en']",,https://doi.org/10.1007/s00259-007-0523-1, Engler 2008 ,additional,CD010386-bbs2-0041,
CD010386-bib-0062,"Espinosa A, Alegret M, Valero S, Vinyes‐Junque G, Hernandez I, Mauleon A, et al. ",A longitudinal follow‐up of 550 mild cognitive impairment patients: evidence for large conversion to dementia rates and detection of major risk factors involved, Journal of Alzheimer's Disease ,2013,34,    ,['citation-journal']," Espinosa A, Alegret M, Valero S, Vinyes‐Junque G, Hernandez I, Mauleon A, et al. A longitudinal follow‐up of 550 mild cognitive impairment patients: evidence for large conversion to dementia rates and detection of major risk factors involved.  Journal of Alzheimer's Disease 2013;34(3):769‐80.doi:10.3233/JAD‐122002.    Link to article     Google Scholar     ","['https://doi.org/10.3233/JAD-122002', 'https://scholar.google.com/scholar_lookup?title=A+longitudinal+follow‐up+of+550+mild+cognitive+impairment+patients:+evidence+for+large+conversion+to+dementia+rates+and+detection+of+major+risk+factors+involved+&author=A+Espinosa&author=M+Alegret&author=S+Valero&author=G+Vinyes‐Junque&author=I+Hernandez&author=A+Mauleon&publication_year=2013&hl=en']",,https://doi.org/10.3233/JAD-122002, Espinosa 2013 ,additional,CD010386-bbs2-0042,
CD010386-bib-0063,"Forman MS, Farmer J, Johnson JK, Clark CM, Arnold SE, Coslett HB, et al. ",Frontotemporal dementia: clinicopathological correlations, Annals of Neurology ,2006,59,    ,['citation-journal']," Forman MS, Farmer J, Johnson JK, Clark CM, Arnold SE, Coslett HB, et al. Frontotemporal dementia: clinicopathological correlations.  Annals of Neurology 2006;59(6):952‐62. doi:10.1002/ana.20873.    Link to article     Google Scholar     ","['https://doi.org/10.1002/ana.20873', 'https://scholar.google.com/scholar_lookup?title=Frontotemporal+dementia:+clinicopathological+correlations&author=MS+Forman&author=J+Farmer&author=JK+Johnson&author=CM+Clark&author=SE+Arnold&author=HB+Coslett&publication_year=2006&hl=en']",,https://doi.org/10.1002/ana.20873, Forman 2006 ,additional,CD010386-bbs2-0043,
CD010386-bib-0064,"Foster ER. Campbell MC, Burack MA, Hartlein J, Flores HP, Cairns NJ, et al. ",Amyloid imaging of Lewy body‐associated disorders, Movement Disorders ,2010,25,    ,['citation-journal']," Foster ER. Campbell MC, Burack MA, Hartlein J, Flores HP, Cairns NJ, et al. Amyloid imaging of Lewy body‐associated disorders.  Movement Disorders 2010;25(15):2516‐23.    Link to article     Google Scholar     ","['https://doi.org/10.1002/mds.23393', 'https://scholar.google.com/scholar_lookup?title=Amyloid+imaging+of+Lewy+body‐associated+disorders&author=MC+FosterER.Campbell&author=MA+Burack&author=J+Hartlein&author=HP+Flores&author=NJ+Cairns&publication_year=2010&hl=en']",,https://doi.org/10.1002/mds.23393, Foster 2010 ,additional,CD010386-bbs2-0044,
CD010386-bib-0065,Friedrich MJ. ,Researchers test strategies to prevent Alzheimer disease, JAMA ,2014,311,    ,['citation-journal'], Friedrich MJ. Researchers test strategies to prevent Alzheimer disease.  JAMA 2014;311(16):1596‐8. doi:10.1001/jama.2014.3891.    Link to article     Google Scholar     ,"['https://doi.org/10.1001/jama.2014.3891', 'https://scholar.google.com/scholar_lookup?title=Researchers+test+strategies+to+prevent+Alzheimer+disease&author=MJ+Friedrich&publication_year=2014&hl=en']",,https://doi.org/10.1001/jama.2014.3891, Friedrich 2014 ,additional,CD010386-bbs2-0045,
CD010386-bib-0066,"Geslani DM, Tierney MC, Herrmann N, Szalai JP. ",Mild cognitive impairment: an operational definition and its conversion rate to Alzheimer's disease, Dementia and Geriatric Cognitive Disorders ,2005,19,    ,['citation-journal']," Geslani DM, Tierney MC, Herrmann N, Szalai JP. Mild cognitive impairment: an operational definition and its conversion rate to Alzheimer's disease.  Dementia and Geriatric Cognitive Disorders 2005;19(5‐6):383‐9.    Link to article     Google Scholar     ","['https://doi.org/10.1159/000084709', ""https://scholar.google.com/scholar_lookup?title=Mild+cognitive+impairment:+an+operational+definition+and+its+conversion+rate+to+Alzheimer's+disease+&author=DM+Geslani&author=MC+Tierney&author=N+Herrmann&author=JP+Szalai&publication_year=2005&hl=en""]",,https://doi.org/10.1159/000084709, Geslani 2005 ,additional,CD010386-bbs2-0046,
CD010386-bib-0067,"Gomperts SN, Locascio JJ, Marquie M, Santarlasci AL, Rentz DM, Maye J, et al. ",Brain amyloid and cognition in Lewy body diseases, Movement Disorders ,2012,27,    ,['citation-journal']," Gomperts SN, Locascio JJ, Marquie M, Santarlasci AL, Rentz DM, Maye J, et al. Brain amyloid and cognition in Lewy body diseases.  Movement Disorders 2012;27(8):965‐73.    Link to article     Google Scholar     ","['https://doi.org/10.1002/mds.25048', 'https://scholar.google.com/scholar_lookup?title=Brain+amyloid+and+cognition+in+Lewy+body+diseases&author=SN+Gomperts&author=JJ+Locascio&author=M+Marquie&author=AL+Santarlasci&author=DM+Rentz&author=J+Maye&publication_year=2012&hl=en']",,https://doi.org/10.1002/mds.25048, Gomperts 2012 ,additional,CD010386-bbs2-0047,
CD010386-bib-0068,"Gomperts SN, Locascio JJ, Rentz D, Santarlasci A, Marquie M, Johnson K.A, et al. ",Amyloid is linked to cognitive decline in patients with Parkinson disease without dementia, Neurology ,2013,801,    ,['citation-journal']," Gomperts SN, Locascio JJ, Rentz D, Santarlasci A, Marquie M, Johnson K.A, et al. Amyloid is linked to cognitive decline in patients with Parkinson disease without dementia.  Neurology 2013;801(1):85‐91.    Link to article     Google Scholar     ","['https://doi.org/10.1212/WNL.0b013e31827b1a07', 'https://scholar.google.com/scholar_lookup?title=Amyloid+is+linked+to+cognitive+decline+in+patients+with+Parkinson+disease+without+dementia+&author=SN+Gomperts&author=JJ+Locascio&author=D+Rentz&author=A+Santarlasci&author=M+Marquie&author=K.A+Johnson&publication_year=2013&hl=en']",,https://doi.org/10.1212/WNL.0b013e31827b1a07, Gomperts 2013 ,additional,CD010386-bbs2-0048,
CD010386-bib-0069,"Hampe H, Lista S, Khachaturian ZS. ",Development of biomarkers to chart all Alzheimer's disease stages: the royal road to cutting the therapeutic Gordian knot, Alzheimer's & Dementia ,2012,8,    ,['citation-journal']," Hampe H, Lista S, Khachaturian ZS. Development of biomarkers to chart all Alzheimer's disease stages: the royal road to cutting the therapeutic Gordian knot.  Alzheimer's & Dementia 2012;8(4):312‐36. doi:10.1016/j.jalz.2012.05.2116.    Google Scholar     ","[""https://scholar.google.com/scholar_lookup?title=Development+of+biomarkers+to+chart+all+Alzheimer's+disease+stages:+the+royal+road+to+cutting+the+therapeutic+Gordian+knot+&author=H+Hampe&author=S+Lista&author=ZS+Khachaturian&publication_year=2012&hl=en""]",,, Hampel 2012 ,additional,CD010386-bbs2-0049,
CD010386-bib-0070,"Hatashita S, Yamasaki H. ",PET biomarkers of beta‐amyloid deposition and neuronal injury in mild cognitive impairment due to Alzheimer's disease,,2012,,    ,['citation-other']," Hatashita S, Yamasaki H. PET biomarkers of beta‐amyloid deposition and neuronal injury in mild cognitive impairment due to Alzheimer's disease. European Journal of Nuclear Medicine and Molecular Imaging2012; Vol. 39:S407.    Google Scholar     ","[""https://scholar.google.com/scholar_lookup?title=PET+biomarkers+of+beta‐amyloid+deposition+and+neuronal+injury+in+mild+cognitive+impairment+due+to+Alzheimer's+disease+&author=S+Hatashita&author=H+Yamasaki&publication_year=2012&hl=en""]",,, Hatashita 2012 ,additional,CD010386-bbs2-0050,
CD010386-bib-0071,"Holland D, McEvoy LK, Desikan RS, Dale AM. ",Enrichment and stratification for predementia Alzheimer disease clinical trials, PLoS One ,2012,7,    ,['citation-journal']," Holland D, McEvoy LK, Desikan RS, Dale AM. Enrichment and stratification for predementia Alzheimer disease clinical trials.  PLoS One 2012;7(10):e47739. doi:10.1371/journal.pone.0047739.    Link to article     Google Scholar     ","['https://doi.org/10.1371/journal.pone.0047739', 'https://scholar.google.com/scholar_lookup?title=Enrichment+and+stratification+for+predementia+Alzheimer+disease+clinical+trials&author=D+Holland&author=LK+McEvoy&author=RS+Desikan&author=AM+Dale&publication_year=2012&hl=en']",,https://doi.org/10.1371/journal.pone.0047739, Holland 2012 ,additional,CD010386-bbs2-0051,
CD010386-bib-0072,"Jack CR, Lowe VJ, Senjem ML, Weigand SD, Kemp BJ, Shiung MN, et al. ",11CPIB and structural MRI provide complementary information in imaging of Alzheimer's disease and amnestic mild cognitive impairment, Brain ,2008,131,    ,['citation-journal']," Jack CR, Lowe VJ, Senjem ML, Weigand SD, Kemp BJ, Shiung MN, et al. 11CPIB and structural MRI provide complementary information in imaging of Alzheimer's disease and amnestic mild cognitive impairment.  Brain 2008;131:665‐80.    Link to article     Google Scholar     ","['https://doi.org/10.1093/brain/awm336', ""https://scholar.google.com/scholar_lookup?title=11CPIB+and+structural+MRI+provide+complementary+information+in+imaging+of+Alzheimer's+disease+and+amnestic+mild+cognitive+impairment+&author=CR+Jack&author=VJ+Lowe&author=ML+Senjem&author=SD+Weigand&author=BJ+Kemp&author=MN+Shiung&publication_year=2008&hl=en""]",,https://doi.org/10.1093/brain/awm336, Jack 2008 ,additional,CD010386-bbs2-0052,
CD010386-bib-0073,"Johnson KA, Gregas M, Becker JA, Kinnecom C, Moran DH, Smith EK, et al. ",Imaging of amyloid burden and distribution in cerebral amyloid angiopathy, Annals of Neurology ,2007,62,    ,['citation-journal']," Johnson KA, Gregas M, Becker JA, Kinnecom C, Moran DH, Smith EK, et al. Imaging of amyloid burden and distribution in cerebral amyloid angiopathy.  Annals of Neurology 2007;62:229‐34.    Link to article     Google Scholar     ","['https://doi.org/10.1002/ana.21164', 'https://scholar.google.com/scholar_lookup?title=Imaging+of+amyloid+burden+and+distribution+in+cerebral+amyloid+angiopathy&author=KA+Johnson&author=M+Gregas&author=JA+Becker&author=C+Kinnecom&author=DH+Moran&author=EK+Smith&publication_year=2007&hl=en']",,https://doi.org/10.1002/ana.21164, Johnson 2007 ,additional,CD010386-bbs2-0053,
CD010386-bib-0074,"Johnson KA, Minoshima S, Bohnen NI, Donohoe KJ, Foste NL, Herscovitch P, et al. ","Update on appropriate use criteria for amyloid PET imaging: dementia experts, mild cognitive impairment, and education. Amyloid Imaging Task Force of the Alzheimer's Association and Society for Nuclear Medicine and Molecular Imaging", Alzheimer's & Dementia ,2013,9,    ,['citation-journal']," Johnson KA, Minoshima S, Bohnen NI, Donohoe KJ, Foste NL, Herscovitch P, et al. Update on appropriate use criteria for amyloid PET imaging: dementia experts, mild cognitive impairment, and education. Amyloid Imaging Task Force of the Alzheimer's Association and Society for Nuclear Medicine and Molecular Imaging.  Alzheimer's & Dementia 2013;9(4):e106‐9. doi:10.1016/j.jalz.2013.06.001.    Link to article     Google Scholar     ","['https://doi.org/10.1016/j.jalz.2013.06.001', ""https://scholar.google.com/scholar_lookup?title=Update+on+appropriate+use+criteria+for+amyloid+PET+imaging:+dementia+experts,+mild+cognitive+impairment,+and+education.+Amyloid+Imaging+Task+Force+of+the+Alzheimer's+Association+and+Society+for+Nuclear+Medicine+and+Molecular+Imaging+&author=KA+Johnson&author=S+Minoshima&author=NI+Bohnen&author=KJ+Donohoe&author=NL+Foste&author=P+Herscovitch&publication_year=2013&hl=en""]",,https://doi.org/10.1016/j.jalz.2013.06.001, Johnson 2013 ,additional,CD010386-bbs2-0054,
CD010386-bib-0075,"Kemppainen NM, Scheinin NM, Koivunen J, Johansson J, Toivonen JT, Nagren K, et al. ",Five‐year follow‐up of 11C‐PIB uptake in Alzheimer's disease and MCI, European Journal of Nuclear Medicine and Molecular Imaging ,2014,41,    ,['citation-journal']," Kemppainen NM, Scheinin NM, Koivunen J, Johansson J, Toivonen JT, Nagren K, et al. Five‐year follow‐up of 11C‐PIB uptake in Alzheimer's disease and MCI.  European Journal of Nuclear Medicine and Molecular Imaging 2014;41(2):283‐9. doi:10.1007/s00259‐013‐2562‐0.    Link to article     Google Scholar     ","['https://doi.org/10.1007/s00259-013-2562-0', ""https://scholar.google.com/scholar_lookup?title=Five‐year+follow‐up+of+11C‐PIB+uptake+in+Alzheimer's+disease+and+MCI&author=NM+Kemppainen&author=NM+Scheinin&author=J+Koivunen&author=J+Johansson&author=JT+Toivonen&author=K+Nagren&publication_year=2014&hl=en""]",,https://doi.org/10.1007/s00259-013-2562-0, Kemppainen 2014 ,additional,CD010386-bbs2-0055,
CD010386-bib-0076,"Klunk WE, Engler H, Nordberg A, Wang Y, Blomqvist G, Holt DP, et al. ",Imaging brain amyloid in Alzheimer's disease with Pittsburgh Compound‐B, Ann Neurol ,2004,55,    ,['citation-journal']," Klunk WE, Engler H, Nordberg A, Wang Y, Blomqvist G, Holt DP, et al. Imaging brain amyloid in Alzheimer's disease with Pittsburgh Compound‐B.  Ann Neurol 2004;55(3):306‐19.    Link to article     Google Scholar     ","['https://doi.org/10.1002/ana.20009', ""https://scholar.google.com/scholar_lookup?title=Imaging+brain+amyloid+in+Alzheimer's+disease+with+Pittsburgh+Compound‐B&author=WE+Klunk&author=H+Engler&author=A+Nordberg&author=Y+Wang&author=G+Blomqvist&author=DP+Holt&publication_year=2004&hl=en""]",,https://doi.org/10.1002/ana.20009, Klunk 2004 ,additional,CD010386-bbs2-0056,
CD010386-bib-0077,"Knotnerus A, van Weel C, Muris JWM. ",Evaluation of diagnostic procedures, BMJ ,2002,324,    ,['citation-journal']," Knotnerus A, van Weel C, Muris JWM. Evaluation of diagnostic procedures.  BMJ 2002;324:477‐80.    Link to article     Google Scholar     ","['https://doi.org/10.1136/bmj.324.7335.477', 'https://scholar.google.com/scholar_lookup?title=Evaluation+of+diagnostic+procedures&author=A+Knotnerus&author=C+Weel&author=JWM+Muris&publication_year=2002&hl=en']",,https://doi.org/10.1136/bmj.324.7335.477, Knotnerus 2002 ,additional,CD010386-bbs2-0057,
CD010386-bib-0078,"Leeflang MM, Moons KG, Reitsma JB, Zwinderman AH. ","Bias in sensitivity and specificity caused by data‐driven selection of optimal cutoff values: mechanisms, magnitude, and solutions", Clinical Chemistry ,2008,54,    ,['citation-journal']," Leeflang MM, Moons KG, Reitsma JB, Zwinderman AH. Bias in sensitivity and specificity caused by data‐driven selection of optimal cutoff values: mechanisms, magnitude, and solutions.  Clinical Chemistry 2008;54(4):729‐37.    Link to article     Google Scholar     ","['https://doi.org/10.1373/clinchem.2007.096032', 'https://scholar.google.com/scholar_lookup?title=Bias+in+sensitivity+and+specificity+caused+by+data‐driven+selection+of+optimal+cutoff+values:+mechanisms,+magnitude,+and+solutions+&author=MM+Leeflang&author=KG+Moons&author=JB+Reitsma&author=AH+Zwinderman&publication_year=2008&hl=en']",,https://doi.org/10.1373/clinchem.2007.096032, Leeflang 2008 ,additional,CD010386-bbs2-0058,
CD010386-bib-0079,"Leinonen V, Alafuzoff I, Aalto S, Suotunen T, Savolainen S, Nagren K, et al. ",Assessment of beta‐amyloid in a frontal cortical brain biopsy specimen and by positron emission tomography with carbon 11‐labeled Pittsburgh compound B, Archives of Neurology ,2008,65,    ,['citation-journal']," Leinonen V, Alafuzoff I, Aalto S, Suotunen T, Savolainen S, Nagren K, et al. Assessment of beta‐amyloid in a frontal cortical brain biopsy specimen and by positron emission tomography with carbon 11‐labeled Pittsburgh compound B.  Archives of Neurology 2008;65(10):1304‐9.    Link to article     Google Scholar     ","['https://doi.org/10.1001/archneur.65.10.noc80013', 'https://scholar.google.com/scholar_lookup?title=Assessment+of+beta‐amyloid+in+a+frontal+cortical+brain+biopsy+specimen+and+by+positron+emission+tomography+with+carbon+11‐labeled+Pittsburgh+compound+B+&author=V+Leinonen&author=I+Alafuzoff&author=S+Aalto&author=T+Suotunen&author=S+Savolainen&author=K+Nagren&publication_year=2008&hl=en']",,https://doi.org/10.1001/archneur.65.10.noc80013, Leinonen 2008 ,additional,CD010386-bbs2-0059,
CD010386-bib-0080,"Maruff P, Ellis K, Harrington K, Gale J, Fredrickson A, Darby D, et al. ",Determining rate of decline in prealzheimer's and Alzheimer's disease AIBL participants using a regular brief cognitive assessment,,2011,,    ,['citation-other']," Maruff P, Ellis K, Harrington K, Gale J, Fredrickson A, Darby D, et al. Determining rate of decline in prealzheimer's and Alzheimer's disease AIBL participants using a regular brief cognitive assessment [Conference: Alzheimer's Association International Conference, AAIC 11 Paris France. Conference Start: 20110716 Conference End: 20110721. Conference Publication: (var.pagings)]. Alzheimer's & Dementia2011; Vol. 7, issue 4 Suppl 1:S255.    Google Scholar     ","[""https://scholar.google.com/scholar_lookup?title=Determining+rate+of+decline+in+prealzheimer's+and+Alzheimer's+disease+AIBL+participants+using+a+regular+brief+cognitive+assessment+&author=P+Maruff&author=K+Ellis&author=K+Harrington&author=J+Gale&author=A+Fredrickson&author=D+Darby&publication_year=2011&hl=en""]",,, Maruff 2011 ,additional,CD010386-bbs2-0060,
CD010386-bib-0081,"Masliah E, Rockenstein E, Veinbergs I, Sagara Y, Mallory M, Hashimoto M, et al. ",Beta‐amyloid peptides enhance alpha‐synuclein accumulation and neuronal deficits in a transgenic mouse model linking Alzheimer's disease and Parkinson's disease, Proceedings of the National Academy of the Sciences of the United States of America ,2001,98,    ,['citation-journal']," Masliah E, Rockenstein E, Veinbergs I, Sagara Y, Mallory M, Hashimoto M, et al. Beta‐amyloid peptides enhance alpha‐synuclein accumulation and neuronal deficits in a transgenic mouse model linking Alzheimer's disease and Parkinson's disease.  Proceedings of the National Academy of the Sciences of the United States of America 2001;98(21):12245‐50.    Google Scholar     ","[""https://scholar.google.com/scholar_lookup?title=Beta‐amyloid+peptides+enhance+alpha‐synuclein+accumulation+and+neuronal+deficits+in+a+transgenic+mouse+model+linking+Alzheimer's+disease+and+Parkinson's+disease+&author=E+Masliah&author=E+Rockenstein&author=I+Veinbergs&author=Y+Sagara&author=M+Mallory&author=M+Hashimoto&publication_year=2001&hl=en""]",,, Masliah 2001 ,additional,CD010386-bbs2-0061,
CD010386-bib-0082,"Matthews FE, Stephan BC, McKeith IG, Bond J, Brayne C, Medical Research Council Cognitive Function and Ageing Study. ",Two‐year progression from mild cognitive impairment to dementia: to what extent do different definitions agree?, Journal of the American Geriatrics Society ,2008,56,    ,['citation-journal']," Matthews FE, Stephan BC, McKeith IG, Bond J, Brayne C, Medical Research Council Cognitive Function and Ageing Study. Two‐year progression from mild cognitive impairment to dementia: to what extent do different definitions agree?.  Journal of the American Geriatrics Society 2008;56(8):1424‐33.    Link to article     Google Scholar     ","['https://doi.org/10.1111/j.1532-5415.2008.01820.x', 'https://scholar.google.com/scholar_lookup?title=Two‐year+progression+from+mild+cognitive+impairment+to+dementia:+to+what+extent+do+different+definitions+agree?+&author=FE+Matthews&author=BC+Stephan&author=IG+McKeith&author=J+Bond&author=C+Brayne&publication_year=2008&hl=en']",,https://doi.org/10.1111/j.1532-5415.2008.01820.x, Matthews 2008 ,additional,CD010386-bbs2-0062,
CD010386-bib-0083,"Mattsson N, Zetterberg H, Hansson O, Andreasen N, Parnetti L, Jonsson M, et al. ",CSF biomarkers and incipient Alzheimer disease in patients with mild cognitive impairment, JAMA ,2009,302,    ,['citation-journal']," Mattsson N, Zetterberg H, Hansson O, Andreasen N, Parnetti L, Jonsson M, et al. CSF biomarkers and incipient Alzheimer disease in patients with mild cognitive impairment.  JAMA 2009;302(4):385‐93.    Link to article     Google Scholar     ","['https://doi.org/10.1001/jama.2009.1064', 'https://scholar.google.com/scholar_lookup?title=CSF+biomarkers+and+incipient+Alzheimer+disease+in+patients+with+mild+cognitive+impairment&author=N+Mattsson&author=H+Zetterberg&author=O+Hansson&author=N+Andreasen&author=L+Parnetti&author=M+Jonsson&publication_year=2009&hl=en']",,https://doi.org/10.1001/jama.2009.1064, Mattsson 2009 ,additional,CD010386-bbs2-0063,
CD010386-bib-0084,"McKeith IG, Galasko D, Kosaka K, Perry EK, Dickson DW, Hansen LA, et al. ",Consensus guidelines for the clinical and pathologic diagnosis of dementia with Lewy bodies (DLB): report of the Consortium on DLB international workshop, Neurology ,1996,47,    ,['citation-journal']," McKeith IG, Galasko D, Kosaka K, Perry EK, Dickson DW, Hansen LA, et al. Consensus guidelines for the clinical and pathologic diagnosis of dementia with Lewy bodies (DLB): report of the Consortium on DLB international workshop.  Neurology 1996;47(5):1113‐24.    Link to article     Google Scholar     ","['https://doi.org/10.1212/WNL.47.5.1113', 'https://scholar.google.com/scholar_lookup?title=Consensus+guidelines+for+the+clinical+and+pathologic+diagnosis+of+dementia+with+Lewy+bodies+(DLB):+report+of+the+Consortium+on+DLB+international+workshop+&author=IG+McKeith&author=D+Galasko&author=K+Kosaka&author=EK+Perry&author=DW+Dickson&author=LA+Hansen&publication_year=1996&hl=en']",,https://doi.org/10.1212/WNL.47.5.1113, McKeith 1996 ,additional,CD010386-bbs2-0064,
