reference_id,authors,title,journal,year,volume,citation_footer,citation_type,citation,urls,pubmed_id,doi,header,reference_type,study_id,exclusion_reason
CD010386-bib-0085,"McKeith IG, Dickson DW, Lowe J, Emre M, O'Brien JT, Feldman H, et al. ",Diagnosis and management of dementia with Lewy bodies: third report of the DLB Consortium, Neurology ,2005,65,    ,['citation-journal']," McKeith IG, Dickson DW, Lowe J, Emre M, O'Brien JT, Feldman H, et al. Diagnosis and management of dementia with Lewy bodies: third report of the DLB Consortium.  Neurology 2005;65:1863‐72.    Link to article     Google Scholar     ","['https://doi.org/10.1212/01.wnl.0000187889.17253.b1', ""https://scholar.google.com/scholar_lookup?title=Diagnosis+and+management+of+dementia+with+Lewy+bodies:+third+report+of+the+DLB+Consortium&author=IG+McKeith&author=DW+Dickson&author=J+Lowe&author=M+Emre&author=JT+O'Brien&author=H+Feldman&publication_year=2005&hl=en""]",,https://doi.org/10.1212/01.wnl.0000187889.17253.b1, McKeith 2005 ,additional,CD010386-bbs2-0065,
CD010386-bib-0086,"McKhann GM, Drachman D, Folstein M, Katzman R, Price D, Stadlan EM. ",Clinical diagnosis of Alzheimer's disease: report of the NINCDS‐ADRDA Work Group under the auspices of Department of Health and Human Services Task Force on Alzheimer's Disease, Neurology ,1984,34,    ,['citation-journal']," McKhann GM, Drachman D, Folstein M, Katzman R, Price D, Stadlan EM. Clinical diagnosis of Alzheimer's disease: report of the NINCDS‐ADRDA Work Group under the auspices of Department of Health and Human Services Task Force on Alzheimer's Disease.  Neurology 1984;34(7):939‐44.    Link to article     Google Scholar     ","['https://doi.org/10.1212/WNL.34.7.939', ""https://scholar.google.com/scholar_lookup?title=Clinical+diagnosis+of+Alzheimer's+disease:+report+of+the+NINCDS‐ADRDA+Work+Group+under+the+auspices+of+Department+of+Health+and+Human+Services+Task+Force+on+Alzheimer's+Disease+&author=GM+McKhann&author=D+Drachman&author=M+Folstein&author=R+Katzman&author=D+Price&author=EM+Stadlan&publication_year=1984&hl=en""]",,https://doi.org/10.1212/WNL.34.7.939, McKhann 1984 ,additional,CD010386-bbs2-0066,
CD010386-bib-0087,"McKhann GM, Knopman DS, Chertkow H, Hyman BT, Clifford RJ, Kawas CH, et al. ",The diagnosis of dementia due to Alzheimer’s disease: recommendation from the National Institute on Ageing and Alzheimer’s Association workgroup,,2011,,    ,['citation-other']," McKhann GM, Knopman DS, Chertkow H, Hyman BT, Clifford RJ, Kawas CH, et al. The diagnosis of dementia due to Alzheimer’s disease: recommendation from the National Institute on Ageing and Alzheimer’s Association workgroup. Alzheimer’s & Dementia2011; Vol. 7, issue 3:263‐9.    Google Scholar     ",['https://scholar.google.com/scholar_lookup?title=The+diagnosis+of+dementia+due+to+Alzheimer’s+disease:+recommendation+from+the+National+Institute+on+Ageing+and+Alzheimer’s+Association+workgroup+&author=GM+McKhann&author=DS+Knopman&author=H+Chertkow&author=BT+Hyman&author=RJ+Clifford&author=CH+Kawas&publication_year=2011&hl=en'],,, McKhann 2011 ,additional,CD010386-bbs2-0067,
CD010386-bib-0088,"McShane R, Areosa Sastre A, Minakaran N. ",Memantine for dementia, Cochrane Database of Systematic Reviews ,2006,,    ,['citation-journal']," McShane R, Areosa Sastre A, Minakaran N. Memantine for dementia.  Cochrane Database of Systematic Reviews 2006, Issue 2. [DOI: 10.1002/14651858.CD003154.pub5]    Link to article     Google Scholar     ","['https://doi.org/10.1002/14651858.CD003154.pub5', 'https://scholar.google.com/scholar_lookup?title=Memantine+for+dementia&author=R+McShane&author=A+AreosaSastre&author=N+Minakaran&publication_year=2006&hl=en']",,https://doi.org/10.1002/14651858.CD003154.pub5, McShane 2006 ,additional,CD010386-bbs2-0068,
CD010386-bib-0089,"Mirra SS, Heyman A, McKeel D, Sumi SM, Crain BJ, Brownlee LM, et al. ",The Consortium to Establish a Registry for Alzheimer's Disease (CERAD). Part II. Standardization of the neuropathologic assessment of Alzheimer's disease, Neurology ,1991,41,    ,['citation-journal']," Mirra SS, Heyman A, McKeel D, Sumi SM, Crain BJ, Brownlee LM, et al. The Consortium to Establish a Registry for Alzheimer's Disease (CERAD). Part II. Standardization of the neuropathologic assessment of Alzheimer's disease.  Neurology 1991;41(4):479‐86.    Link to article     Google Scholar     ","['https://doi.org/10.1212/WNL.41.4.479', ""https://scholar.google.com/scholar_lookup?title=The+Consortium+to+Establish+a+Registry+for+Alzheimer's+Disease+(CERAD).+Part+II.+Standardization+of+the+neuropathologic+assessment+of+Alzheimer's+disease+&author=SS+Mirra&author=A+Heyman&author=D+McKeel&author=SM+Sumi&author=BJ+Crain&author=LM+Brownlee&publication_year=1991&hl=en""]",,https://doi.org/10.1212/WNL.41.4.479, Mirra 1991 ,additional,CD010386-bbs2-0069,
CD010386-bib-0090,"Mitchell AJ, Shiri‐Feshki M. ",Rate of progression of mild cognitive impairment to dementia‐‐meta‐analysis of 41 robust inception cohort studies, Acta Psychiatrica Scandinavica ,2009,119,    ,['citation-journal']," Mitchell AJ, Shiri‐Feshki M. Rate of progression of mild cognitive impairment to dementia‐‐meta‐analysis of 41 robust inception cohort studies.  Acta Psychiatrica Scandinavica 2009;119(4):252‐65.    Link to article     Google Scholar     ","['https://doi.org/10.1111/j.1600-0447.2008.01326.x', 'https://scholar.google.com/scholar_lookup?title=Rate+of+progression+of+mild+cognitive+impairment+to+dementia‐‐meta‐analysis+of+41+robust+inception+cohort+studies+&author=AJ+Mitchell&author=M+Shiri‐Feshki&publication_year=2009&hl=en']",,https://doi.org/10.1111/j.1600-0447.2008.01326.x, Mitchell 2009 ,additional,CD010386-bbs2-0070,
CD010386-bib-0091,Morris JC. ,The Clinical Dementia Rating (CDR): current version and scoring rules, Neurology ,1993,43,    ,['citation-journal'], Morris JC. The Clinical Dementia Rating (CDR): current version and scoring rules.  Neurology 1993;43:2412‐4.    Link to article     Google Scholar     ,"['https://doi.org/10.1212/WNL.43.11.2412-a', 'https://scholar.google.com/scholar_lookup?title=The+Clinical+Dementia+Rating+(CDR):+current+version+and+scoring+rules&author=JC+Morris&publication_year=1993&hl=en']",,https://doi.org/10.1212/WNL.43.11.2412-a, Morris 1993 ,additional,CD010386-bbs2-0071,
CD010386-bib-0092,"Mosconi L, Matthews D, Schmidt M, Andrews R. ","Characterizing brain amyloid changes using PIB‐PET: Progression, clinical correlates, PIB status and optimized sampling",,2012,,    ,['citation-other']," Mosconi L, Matthews D, Schmidt M, Andrews R. Characterizing brain amyloid changes using PIB‐PET: Progression, clinical correlates, PIB status and optimized sampling [Conference: Alzheimer's Association International Conference 2012 Vancouver, BC Canada. Conference Start: 20120714 Conference End: 20120719. Conference Publication: (var.pagings)]. Alzheimer's & Dementia2012.    Google Scholar     ","['https://scholar.google.com/scholar_lookup?title=Characterizing+brain+amyloid+changes+using+PIB‐PET:+Progression,+clinical+correlates,+PIB+status+and+optimized+sampling+&author=L+Mosconi&author=D+Matthews&author=M+Schmidt&author=R+Andrews&publication_year=2012&hl=en']",,, Mosconi 2012 ,additional,CD010386-bbs2-0072,
CD010386-bib-0093,"Neary D, Snowden JS, Gustafson L, Passant U, Stuss D, Black S, et al. ",Frontotemporal lobar degeneration: a consensus on clinical diagnostic criteria, Neurology ,1998,51,    ,['citation-journal']," Neary D, Snowden JS, Gustafson L, Passant U, Stuss D, Black S, et al. Frontotemporal lobar degeneration: a consensus on clinical diagnostic criteria.  Neurology 1998;51:1546‐54.    Link to article     Google Scholar     ","['https://doi.org/10.1212/WNL.51.6.1546', 'https://scholar.google.com/scholar_lookup?title=Frontotemporal+lobar+degeneration:+a+consensus+on+clinical+diagnostic+criteria&author=D+Neary&author=JS+Snowden&author=L+Gustafson&author=U+Passant&author=D+Stuss&author=S+Black&publication_year=1998&hl=en']",,https://doi.org/10.1212/WNL.51.6.1546, Neary 1988 ,additional,CD010386-bbs2-0073,
CD010386-bib-0094,"Newell KL, Hyman BT, Growdon JH, Hedley‐Whyte ET. ",Application of the National Institute on Aging (NIA)‐Reagan Institute criteria for the neuropathological diagnosis of Alzheimer disease, Journal of Neuropathology and Experimental Neurology ,1999,58,    ,['citation-journal']," Newell KL, Hyman BT, Growdon JH, Hedley‐Whyte ET. Application of the National Institute on Aging (NIA)‐Reagan Institute criteria for the neuropathological diagnosis of Alzheimer disease.  Journal of Neuropathology and Experimental Neurology 1999;58(11):1147‐55.    Link to article     Google Scholar     ","['https://doi.org/10.1097/00005072-199911000-00004', 'https://scholar.google.com/scholar_lookup?title=Application+of+the+National+Institute+on+Aging+(NIA)‐Reagan+Institute+criteria+for+the+neuropathological+diagnosis+of+Alzheimer+disease+&author=KL+Newell&author=BT+Hyman&author=JH+Growdon&author=ET+Hedley‐Whyte&publication_year=1999&hl=en']",,https://doi.org/10.1097/00005072-199911000-00004, Newell 1999 ,additional,CD010386-bbs2-0074,
CD010386-bib-0095,"Oddo S, Billings L, Kesslak JP, Cribbs DH, LaFerla FM. ","Abeta immunotherapy leads to clearance of early, but not late, hyperphosphorylated tau aggregates via the proteasome", Neuron ,2004,43,    ,['citation-journal']," Oddo S, Billings L, Kesslak JP, Cribbs DH, LaFerla FM. Abeta immunotherapy leads to clearance of early, but not late, hyperphosphorylated tau aggregates via the proteasome.  Neuron 2004;43(3):321‐32.    Link to article     Google Scholar     ","['https://doi.org/10.1016/j.neuron.2004.07.003', 'https://scholar.google.com/scholar_lookup?title=Abeta+immunotherapy+leads+to+clearance+of+early,+but+not+late,+hyperphosphorylated+tau+aggregates+via+the+proteasome+&author=S+Oddo&author=L+Billings&author=JP+Kesslak&author=DH+Cribbs&author=FM+LaFerla&publication_year=2004&hl=en']",,https://doi.org/10.1016/j.neuron.2004.07.003, Oddo 2004 ,additional,CD010386-bbs2-0075,
CD010386-bib-0096,"Okello A, Edison P, Archer H, Hinz R, Fox N, Kennedy A, et al. ",Amyloid deposition and cerebral glucose metabolism in mild cognitive impairment: a longitudinal 11c‐PIB and 18f‐FDG PET study,,2007,,    ,['citation-other']," Okello A, Edison P, Archer H, Hinz R, Fox N, Kennedy A, et al. Amyloid deposition and cerebral glucose metabolism in mild cognitive impairment: a longitudinal 11c‐PIB and 18f‐FDG PET study. Journal of Neurology, Neurosurgery, and Psychiatry2007; Vol. 78, issue 2:219‐20.    Google Scholar     ",['https://scholar.google.com/scholar_lookup?title=Amyloid+deposition+and+cerebral+glucose+metabolism+in+mild+cognitive+impairment:+a+longitudinal+11c‐PIB+and+18f‐FDG+PET+study+&author=A+Okello&author=P+Edison&author=H+Archer&author=R+Hinz&author=N+Fox&author=A+Kennedy&publication_year=2007&hl=en'],,, Okello 2007 ,additional,CD010386-bbs2-0076,
CD010386-bib-0097,"Perrotin A, Desgranges B, Duval C, La Joie R, Mezenge F, Landeau B, et al. ",The imap project: How does the awareness of memory deficits evolve in the course of Alzheimer's disease? Insights from its relationships to PET b‐amyloid and metabolism measurements,,2011,,    ,['citation-other']," Perrotin A, Desgranges B, Duval C, La Joie R, Mezenge F, Landeau B, et al. The imap project: How does the awareness of memory deficits evolve in the course of Alzheimer's disease? Insights from its relationships to PET b‐amyloid and metabolism measurements [Conference: Alzheimer's Association International Conference, AAIC 11 Paris France. Conference Start: 20110716 Conference End: 20110721. Conference Publication: (var.pagings)]. Alzheimer's & Dementia2011; Vol. 7, issue 4 Suppl 1:S742‐3.    Google Scholar     ","[""https://scholar.google.com/scholar_lookup?title=The+imap+project:+How+does+the+awareness+of+memory+deficits+evolve+in+the+course+of+Alzheimer's+disease?+Insights+from+its+relationships+to+PET+b‐amyloid+and+metabolism+measurements+&author=A+Perrotin&author=B+Desgranges&author=C+Duval&author=R+Joie&author=F+Mezenge&author=B+Landeau&publication_year=2011&hl=en""]",,, Perrotin 2011 ,additional,CD010386-bbs2-0077,
CD010386-bib-0098,"Petersen RC, Smith GE, Waring SC, Ivnik RJ, Tangalos EG, Kokmen E. ",Mild cognitive impairment: clinical characterization and outcome, Archives of Neurology ,1999,56,    ,['citation-journal']," Petersen RC, Smith GE, Waring SC, Ivnik RJ, Tangalos EG, Kokmen E. Mild cognitive impairment: clinical characterization and outcome.  Archives of Neurology 1999;56:303‐8.    Link to article     Google Scholar     ","['https://doi.org/10.1001/archneur.56.3.303', 'https://scholar.google.com/scholar_lookup?title=Mild+cognitive+impairment:+clinical+characterization+and+outcome&author=RC+Petersen&author=GE+Smith&author=SC+Waring&author=RJ+Ivnik&author=EG+Tangalos&author=E+Kokmen&publication_year=1999&hl=en']",,https://doi.org/10.1001/archneur.56.3.303, Petersen 1999 ,additional,CD010386-bbs2-0078,
CD010386-bib-0099,Petersen RC. ,Mild cognitive impairment as a diagnostic entity, Journal of Internal Medicine ,2004,256,    ,['citation-journal'], Petersen RC. Mild cognitive impairment as a diagnostic entity.  Journal of Internal Medicine 2004;256:183‐94.    Link to article     Google Scholar     ,"['https://doi.org/10.1111/j.1365-2796.2004.01388.x', 'https://scholar.google.com/scholar_lookup?title=Mild+cognitive+impairment+as+a+diagnostic+entity&author=RC+Petersen&publication_year=2004&hl=en']",,https://doi.org/10.1111/j.1365-2796.2004.01388.x, Petersen 2004 ,additional,CD010386-bbs2-0079,
CD010386-bib-0100,"Petersen R, Knopman D, Boeve B, Geda YE, Ivnik RJ, Smith GE, et al. ",Mild cognitive impairment: ten years later, Archives of Neurology ,2009,66,    ,['citation-journal']," Petersen R, Knopman D, Boeve B, Geda YE, Ivnik RJ, Smith GE, et al. Mild cognitive impairment: ten years later.  Archives of Neurology 2009;66:1447‐55.    Link to article     Google Scholar     ","['https://doi.org/10.1001/archneurol.2009.266', 'https://scholar.google.com/scholar_lookup?title=Mild+cognitive+impairment:+ten+years+later&author=R+Petersen&author=D+Knopman&author=B+Boeve&author=YE+Geda&author=RJ+Ivnik&author=GE+Smith&publication_year=2009&hl=en']",,https://doi.org/10.1001/archneurol.2009.266, Petersen 2009 ,additional,CD010386-bbs2-0080,
CD010386-bib-0101,"Price JC, Klunk WE, Loprestil BJ, Lu X, Hoge JA, Ziolko SK, et al. ",Kinetic modelling of amyloid binding in humans using PET imaging and Pittsburgh compound‐B, Journal of Cerebral Blood Flow and Metabolism ,2005,25,    ,['citation-journal']," Price JC, Klunk WE, Loprestil BJ, Lu X, Hoge JA, Ziolko SK, et al. Kinetic modelling of amyloid binding in humans using PET imaging and Pittsburgh compound‐B.  Journal of Cerebral Blood Flow and Metabolism 2005;25:1528‐47.    Link to article     Google Scholar     ","['https://doi.org/10.1038/sj.jcbfm.9600146', 'https://scholar.google.com/scholar_lookup?title=Kinetic+modelling+of+amyloid+binding+in+humans+using+PET+imaging+and+Pittsburgh+compound‐B&author=JC+Price&author=WE+Klunk&author=BJ+Loprestil&author=X+Lu&author=JA+Hoge&author=SK+Ziolko&publication_year=2005&hl=en']",,https://doi.org/10.1038/sj.jcbfm.9600146, Price 2005 ,additional,CD010386-bbs2-0081,
CD010386-bib-0102,"Quinn TJ, Fearon P, Noel‐Storr AH, Young C, McShane R, Stott DJ. ",Informant Questionnaire on Cognitive Decline in the Elderly (IQCODE) for the diagnosis of dementia within community dwelling populations, Cochrane Database of Systematic Reviews ,2014,,    ,['citation-journal']," Quinn TJ, Fearon P, Noel‐Storr AH, Young C, McShane R, Stott DJ. Informant Questionnaire on Cognitive Decline in the Elderly (IQCODE) for the diagnosis of dementia within community dwelling populations.  Cochrane Database of Systematic Reviews 2014, Issue Issue 4. Art. No.: CD010079. DOI: 10.1002/14651858.CD010079.pub2.    Link to article     Google Scholar     ","['https://doi.org/10.1002/14651858.CD010079.pub2', 'https://scholar.google.com/scholar_lookup?title=Informant+Questionnaire+on+Cognitive+Decline+in+the+Elderly+(IQCODE)+for+the+diagnosis+of+dementia+within+community+dwelling+populations+&author=TJ+Quinn&author=P+Fearon&author=AH+Noel‐Storr&author=C+Young&author=R+McShane&author=DJ+Stott&publication_year=2014&hl=en']",,https://doi.org/10.1002/14651858.CD010079.pub2, Quinn 2014 ,additional,CD010386-bbs2-0082,
CD010386-bib-0103,"Rabinovici GD, Furst AJ, O'Neil JP, Racine CA, Mormino EC, Baker SL, et al. ",11C‐PIB PET imaging in Alzheimer disease and frontotemporal lobar degeneration, Neurology ,2007,68,    ,['citation-journal']," Rabinovici GD, Furst AJ, O'Neil JP, Racine CA, Mormino EC, Baker SL, et al. 11C‐PIB PET imaging in Alzheimer disease and frontotemporal lobar degeneration.  Neurology 2007;68(15):1205‐12.    Link to article     Google Scholar     ","['https://doi.org/10.1212/01.wnl.0000259035.98480.ed', ""https://scholar.google.com/scholar_lookup?title=11C‐PIB+PET+imaging+in+Alzheimer+disease+and+frontotemporal+lobar+degeneration&author=GD+Rabinovici&author=AJ+Furst&author=JP+O'Neil&author=CA+Racine&author=EC+Mormino&author=SL+Baker&publication_year=2007&hl=en""]",,https://doi.org/10.1212/01.wnl.0000259035.98480.ed, Rabinovici 2007 ,additional,CD010386-bbs2-0083,
CD010386-bib-0104,"Rabinovici GD, Rosen HJ, Alkalay A, Kornak J, Furst AJ, Agarwal N, et al. ",Amyloid vs FDG‐PET in the differential diagnosis of AD and FTLD, Neurology ,2011,77,    ,['citation-journal']," Rabinovici GD, Rosen HJ, Alkalay A, Kornak J, Furst AJ, Agarwal N, et al. Amyloid vs FDG‐PET in the differential diagnosis of AD and FTLD.  Neurology 2011;77(23):2034‐42.    Link to article     Google Scholar     ","['https://doi.org/10.1212/WNL.0b013e31823b9c5e', 'https://scholar.google.com/scholar_lookup?title=Amyloid+vs+FDG‐PET+in+the+differential+diagnosis+of+AD+and+FTLD&author=GD+Rabinovici&author=HJ+Rosen&author=A+Alkalay&author=J+Kornak&author=AJ+Furst&author=N+Agarwal&publication_year=2011&hl=en']",,https://doi.org/10.1212/WNL.0b013e31823b9c5e, Rabinovici 2011 ,additional,CD010386-bbs2-0084,
CD010386-bib-0105,"Rentz D, Betensky R, Becker A, England R, Maye J, Gidicsin C, et al. ",Amyloid deposition in non‐demented elderly predicts longitudinal cognitive decline,,2011,,    ,['citation-other']," Rentz D, Betensky R, Becker A, England R, Maye J, Gidicsin C, et al. Amyloid deposition in non‐demented elderly predicts longitudinal cognitive decline [Conference: Alzheimer's Association International Conference, AAIC 11 Paris France. Conference Start: 20110716 Conference End: 20110721. Conference Publication: (var.pagings)]. Alzheimer's & Dementia2011; Vol. 7, issue 4 Suppl 1:S221.    Google Scholar     ",['https://scholar.google.com/scholar_lookup?title=Amyloid+deposition+in+non‐demented+elderly+predicts+longitudinal+cognitive+decline&author=D+Rentz&author=R+Betensky&author=A+Becker&author=R+England&author=J+Maye&author=C+Gidicsin&publication_year=2011&hl=en'],,, Rentz 2011 ,additional,CD010386-bbs2-0085,
CD010386-bib-0106,"Rinne JO, Brooks DJ, Rossor MN, Fox NC, Bullock R, Klunk WE, et al. ","11C‐PiB PET assessment of change in fibrillar amyloid‐beta load in patients with Alzheimer's disease treated with bapineuzumab: a phase 2, double‐blind, placebo‐controlled, ascending‐dose study", Lancet Neurology ,2010,9,    ,['citation-journal']," Rinne JO, Brooks DJ, Rossor MN, Fox NC, Bullock R, Klunk WE, et al. 11C‐PiB PET assessment of change in fibrillar amyloid‐beta load in patients with Alzheimer's disease treated with bapineuzumab: a phase 2, double‐blind, placebo‐controlled, ascending‐dose study.  Lancet Neurology 2010;9(4):363‐72. doi:10.1016/S1474‐4422(10)70043‐0.    Link to article     Google Scholar     ","['https://doi.org/10.1016/S1474-4422(10)70043-0', ""https://scholar.google.com/scholar_lookup?title=11C‐PiB+PET+assessment+of+change+in+fibrillar+amyloid‐beta+load+in+patients+with+Alzheimer's+disease+treated+with+bapineuzumab:+a+phase+2,+double‐blind,+placebo‐controlled,+ascending‐dose+study+&author=JO+Rinne&author=DJ+Brooks&author=MN+Rossor&author=NC+Fox&author=R+Bullock&author=WE+Klunk&publication_year=2010&hl=en""]",,https://doi.org/10.1016/S1474-4422(10)70043-0, Rinne 2010 ,additional,CD010386-bbs2-0086,
CD010386-bib-0107,"Roman GC, Tatemichi TK, Erkinjuntti T, Cummings JL, Masdeu JC, Garcia JH, et al. ",Vascular dementia: diagnostic criteria for research studies. Report of the NINDS‐AIREN International Workshop, Neurology ,1993,43,    ,['citation-journal']," Roman GC, Tatemichi TK, Erkinjuntti T, Cummings JL, Masdeu JC, Garcia JH, et al. Vascular dementia: diagnostic criteria for research studies. Report of the NINDS‐AIREN International Workshop.  Neurology 1993;43(2):250‐60.    Link to article     Google Scholar     ","['https://doi.org/10.1212/WNL.43.2.250', 'https://scholar.google.com/scholar_lookup?title=Vascular+dementia:+diagnostic+criteria+for+research+studies.+Report+of+the+NINDS‐AIREN+International+Workshop+&author=GC+Roman&author=TK+Tatemichi&author=T+Erkinjuntti&author=JL+Cummings&author=JC+Masdeu&author=JH+Garcia&publication_year=1993&hl=en']",,https://doi.org/10.1212/WNL.43.2.250, Roman 1993 ,additional,CD010386-bbs2-0087,
CD010386-bib-0108,"Rowe CC, Ng S, Ackermann U, Gong SJ, Pike K, Savage G, et al. ",Imaging beta‐amyloid burden in aging and dementia, Neurology ,2007,68,    ,['citation-journal']," Rowe CC, Ng S, Ackermann U, Gong SJ, Pike K, Savage G, et al. Imaging beta‐amyloid burden in aging and dementia.  Neurology 2007;68(20):1718‐25.    Link to article     Google Scholar     ","['https://doi.org/10.1212/01.wnl.0000261919.22630.ea', 'https://scholar.google.com/scholar_lookup?title=Imaging+beta‐amyloid+burden+in+aging+and+dementia&author=CC+Rowe&author=S+Ng&author=U+Ackermann&author=SJ+Gong&author=K+Pike&author=G+Savage&publication_year=2007&hl=en']",,https://doi.org/10.1212/01.wnl.0000261919.22630.ea, Rowe 2007 ,additional,CD010386-bbs2-0088,
CD010386-bib-0109,"Royall DR, Palmer RF. ",The temporospatial evolution of neuritic plaque‐related and independent tauopathies: implications for dementia staging, Journal of Alzheimer's Disease ,2014,40,    ,['citation-journal']," Royall DR, Palmer RF. The temporospatial evolution of neuritic plaque‐related and independent tauopathies: implications for dementia staging.  Journal of Alzheimer's Disease 2014;40(3):541‐9. doi:10.3233/JAD‐131733.    Link to article     Google Scholar     ","['https://doi.org/10.3233/JAD-131733', 'https://scholar.google.com/scholar_lookup?title=The+temporospatial+evolution+of+neuritic+plaque‐related+and+independent+tauopathies:+implications+for+dementia+staging+&author=DR+Royall&author=RF+Palmer&publication_year=2014&hl=en']",,https://doi.org/10.3233/JAD-131733, Royall 2014 ,additional,CD010386-bbs2-0089,
CD010386-bib-0110,"Rutter CA, Gatsonis CA. ",A hierarchical regression approach to meta‐analysis of diagnostic test accuracy evaluations, Statistics in Medicine ,2001,20,    ,['citation-journal']," Rutter CA, Gatsonis CA. A hierarchical regression approach to meta‐analysis of diagnostic test accuracy evaluations.  Statistics in Medicine 2001;20:2865‐84.    Link to article     Google Scholar     ","['https://doi.org/10.1002/sim.942', 'https://scholar.google.com/scholar_lookup?title=A+hierarchical+regression+approach+to+meta‐analysis+of+diagnostic+test+accuracy+evaluations&author=CA+Rutter&author=CA+Gatsonis&publication_year=2001&hl=en']",,https://doi.org/10.1002/sim.942, Rutter 2001 ,additional,CD010386-bbs2-0090,
CD010386-bib-0111,"Salloway S, Sperling R, Fox NC, Blennow K, Klunk W, Raskind M, et al. ",Two phase 3 trials of bapineuzumab in mild‐to‐moderate Alzheimer's disease, New England Journal of Medicine ,2014,370,    ,['citation-journal']," Salloway S, Sperling R, Fox NC, Blennow K, Klunk W, Raskind M, et al. Two phase 3 trials of bapineuzumab in mild‐to‐moderate Alzheimer's disease.  New England Journal of Medicine 2014;370(4):322‐33. doi:10.1056/NEJMoa1304839.    Link to article     Google Scholar     ","['https://doi.org/10.1056/NEJMoa1304839', ""https://scholar.google.com/scholar_lookup?title=Two+phase+3+trials+of+bapineuzumab+in+mild‐to‐moderate+Alzheimer's+disease&author=S+Salloway&author=R+Sperling&author=NC+Fox&author=K+Blennow&author=W+Klunk&author=M+Raskind&publication_year=2014&hl=en""]",,https://doi.org/10.1056/NEJMoa1304839, Salloway 2014 ,additional,CD010386-bbs2-0091,
CD010386-bib-0112,SAS Institute Inc. 2011. ,"SAS/OR® 9.3 User’s Guide: Mathematical Programming. Cary, NC: SAS Institute Inc. SAS/OR® 9.3 User’s Guide: Mathematical Programming Copyright © 2011"," SAS Institute Inc., Cary, NC, USA http://support.sas.com/documentation/cdl/en/ormpug/63975/PDF/default/ormpug.pdf ",,, (access 18 January 2013) .   ,['citation-journal']," SAS Institute Inc. 2011. SAS/OR® 9.3 User’s Guide: Mathematical Programming. Cary, NC: SAS Institute Inc. SAS/OR® 9.3 User’s Guide: Mathematical Programming Copyright © 2011.  SAS Institute Inc., Cary, NC, USA http://support.sas.com/documentation/cdl/en/ormpug/63975/PDF/default/ormpug.pdf  (access 18 January 2013) .    ",[],,, SAS Institute 2011 ,additional,CD010386-bbs2-0092,
