reference_id,authors,title,journal,year,volume,citation_footer,citation_type,citation,urls,pubmed_id,doi,header,reference_type,study_id,exclusion_reason
CD012668-bib-0063,"Uebersax JS, Wyman JF, Shumaker SA, McClish DK, Fantl JA. ",Short forms to assess life quality and symptom distress for urinary incontinence in women: the Incontinence Impact Questionnaire and the Urogenital Distress Inventory. Continence Program for Women Research Group, Neurourology and Urodynamics ,1995,14,    ,['citation-journal']," Uebersax JS, Wyman JF, Shumaker SA, McClish DK, Fantl JA. Short forms to assess life quality and symptom distress for urinary incontinence in women: the Incontinence Impact Questionnaire and the Urogenital Distress Inventory. Continence Program for Women Research Group.  Neurourology and Urodynamics 1995;14(2):131‐9. [PUBMED: 7780440]    Link to article     PubMed     Google Scholar     ","['https://doi.org/10.1002/nau.1930140206', 'https://www.ncbi.nlm.nih.gov/pubmed/7780440', 'https://scholar.google.com/scholar_lookup?title=Short+forms+to+assess+life+quality+and+symptom+distress+for+urinary+incontinence+in+women:+the+Incontinence+Impact+Questionnaire+and+the+Urogenital+Distress+Inventory.+Continence+Program+for+Women+Research+Group+&author=JS+Uebersax&author=JF+Wyman&author=SA+Shumaker&author=DK+McClish&author=JA+Fantl&publication_year=1995&hl=en']",7780440,https://doi.org/10.1002/nau.1930140206, Uebersax 1995 ,additional,CD012668-bbs2-0057,
CD012668-bib-0064,"Wallace SA, Roe B, Williams K, Palmer M. ",Bladder training for urinary incontinence in adults, Cochrane Database of Systematic Reviews ,2004,,    ,['citation-journal']," Wallace SA, Roe B, Williams K, Palmer M. Bladder training for urinary incontinence in adults.  Cochrane Database of Systematic Reviews 2004, Issue 1. [DOI: 10.1002/14651858.CD001308.pub2; PUBMED: 14973967]    Link to article     Google Scholar     ","['https://doi.org/10.1002/14651858.CD001308.pub2', 'https://scholar.google.com/scholar_lookup?title=Bladder+training+for+urinary+incontinence+in+adults&author=SA+Wallace&author=B+Roe&author=K+Williams&author=M+Palmer&publication_year=2004&hl=en']",,https://doi.org/10.1002/14651858.CD001308.pub2, Wallace 2004 ,additional,CD012668-bbs2-0058,
CD012668-bib-0065,"Wieland LS, Manheimer E, Sampson M, Barnabas JP, Bouter LM, Cho K, et al. ",Bibliometric and content analysis of the Cochrane Complementary Medicine Field specialized register of controlled trials, Systematic Reviews ,2013,2,    ,['citation-journal']," Wieland LS, Manheimer E, Sampson M, Barnabas JP, Bouter LM, Cho K, et al. Bibliometric and content analysis of the Cochrane Complementary Medicine Field specialized register of controlled trials.  Systematic Reviews 2013;2:51. [PUBMED: 23826877]    Link to article     PubMed     Google Scholar     ","['https://doi.org/10.1186/2046-4053-2-51', 'https://www.ncbi.nlm.nih.gov/pubmed/23826877', 'https://scholar.google.com/scholar_lookup?title=Bibliometric+and+content+analysis+of+the+Cochrane+Complementary+Medicine+Field+specialized+register+of+controlled+trials+&author=LS+Wieland&author=E+Manheimer&author=M+Sampson&author=JP+Barnabas&author=LM+Bouter&author=K+Cho&publication_year=2013&hl=en']",23826877,https://doi.org/10.1186/2046-4053-2-51, Wieland 2013 ,additional,CD012668-bbs2-0059,
CD012668-bib-0066,"Wójtowicz U, Plaszewska‐Zywko L, Stangel‐Wójcikiewicz K, Basta A. ",Barriers in entering treatment among women with urinary incontinence, Ginekologia Polska ,2014,85,    ,['citation-journal']," Wójtowicz U, Plaszewska‐Zywko L, Stangel‐Wójcikiewicz K, Basta A. Barriers in entering treatment among women with urinary incontinence.  Ginekologia Polska 2014;85(5):342‐7. [PUBMED: 25011214]    Link to article     PubMed     Google Scholar     ","['https://doi.org/10.17772/gp/1734', 'https://www.ncbi.nlm.nih.gov/pubmed/25011214', 'https://scholar.google.com/scholar_lookup?title=Barriers+in+entering+treatment+among+women+with+urinary+incontinence&author=U+Wójtowicz&author=L+Plaszewska‐Zywko&author=K+Stangel‐Wójcikiewicz&author=A+Basta&publication_year=2014&hl=en']",25011214,https://doi.org/10.17772/gp/1734, Wójtowicz 2014 ,additional,CD012668-bbs2-0060,
CD012668-bib-0013,"Huang A, Chesney M, Schembri M, Subak L. ",A randomized trial of a group‐based therapeutic yoga program for ambulatory women with urinary incontinence, Journal of Urology ,2018,199,    ,['citation-journal']," Huang A, Chesney M, Schembri M, Subak L. A randomized trial of a group‐based therapeutic yoga program for ambulatory women with urinary incontinence.  Journal of Urology 2018;199(4 Suppl):e645. [DOI: 10.1016/j.juro.2018.02.1544; Abstract number PD32‐01; sr‐incont77829]CENTRAL    Link to article     Google Scholar     ","['', 'https://doi.org/10.1016/j.juro.2018.02.1544', 'https://scholar.google.com/scholar_lookup?title=A+randomized+trial+of+a+group‐based+therapeutic+yoga+program+for+ambulatory+women+with+urinary+incontinence+&author=A+Huang&author=M+Chesney&author=M+Schembri&author=L+Subak&publication_year=2018&hl=en']",,https://doi.org/10.1016/j.juro.2018.02.1544, Huang 2018 {unpublished data only}  ,awaiting_assessment,CD012668-bbs2-0008,
CD012668-bib-0014,NCT02342678. ,Lessening incontinence through low‐impact activity (LILA),,,,   ,['citation-other']," NCT02342678. Lessening incontinence through low‐impact activity (LILA) [Lessening incontinence through low‐impact activity, a.k.a. yoga to enhance behavioral self‐management of urinary incontinence in women]. clinicaltrials.gov/ct2/show/NCT02342678 (first received 21 January 2015). [sr‐incont67528]CENTRAL    ",[''],,, Huang 2018 {unpublished data only}  ,awaiting_assessment,CD012668-bbs2-0008,
CD012668-bib-0067,"Wieland LS, Shrestha N, Lassi ZS, Panda S, Chiaramonte D, Skoetz N. ",Yoga for treatment of urinary incontinence in women, Cochrane Database of Systematic Reviews ,2017,,    ,['citation-journal']," Wieland LS, Shrestha N, Lassi ZS, Panda S, Chiaramonte D, Skoetz N. Yoga for treatment of urinary incontinence in women.  Cochrane Database of Systematic Reviews 2017, Issue 5. [DOI: 10.1002/14651858.CD012668]    Link to article     Google Scholar     ","['https://doi.org/10.1002/14651858.CD012668', 'https://scholar.google.com/scholar_lookup?title=Yoga+for+treatment+of+urinary+incontinence+in+women&author=LS+Wieland&author=N+Shrestha&author=ZS+Lassi&author=S+Panda&author=D+Chiaramonte&author=N+Skoetz&publication_year=2017&hl=en']",,https://doi.org/10.1002/14651858.CD012668, Wieland 2017 ,other_versions,CD012668-bbs2-0061,
