reference_id,authors,title,journal,year,volume,citation_footer,citation_type,citation,urls,pubmed_id,doi,header,reference_type,study_id,exclusion_reason
CD010680-bib-0001,"Vega J, Romani S, Garciperez J, Vicente L, Pacheco N, Zamorano J, et al. ",Peripheral arterial disease: efficacy of the oscillometric method, Revista Espanola De Cardiologia ,2011,64,    ,['citation-journal']," Vega J, Romani S, Garciperez J, Vicente L, Pacheco N, Zamorano J, et al. Peripheral arterial disease: efficacy of the oscillometric method.  Revista Espanola De Cardiologia 2011;64(7):619‐21. CENTRAL    Link to article     Google Scholar     ","['', 'https://doi.org/10.1016/j.recesp.2010.10.019', 'https://scholar.google.com/scholar_lookup?title=Peripheral+arterial+disease:+efficacy+of+the+oscillometric+method&author=J+Vega&author=S+Romani&author=J+Garciperez&author=L+Vicente&author=N+Pacheco&author=J+Zamorano&publication_year=2011&hl=en']",,https://doi.org/10.1016/j.recesp.2010.10.019, Vega 2011 {published data only}  ,included,CD010680-bbs2-0001,
CD010680-bib-0002,"Akhtar B, Siddique S, Khan RA, Zulfiqar S. ",Detection of atherosclerosis by ankle brachial index: evaluation of palpatory method versus ultrasound Doppler technique," Journal of Ayub Medical College, Abbottabad ",2009,21,    ,['citation-journal']," Akhtar B, Siddique S, Khan RA, Zulfiqar S. Detection of atherosclerosis by ankle brachial index: evaluation of palpatory method versus ultrasound Doppler technique.  Journal of Ayub Medical College, Abbottabad 2009;21(1):11‐6. CENTRAL    Google Scholar     ","['', 'https://scholar.google.com/scholar_lookup?title=Detection+of+atherosclerosis+by+ankle+brachial+index:+evaluation+of+palpatory+method+versus+ultrasound+Doppler+technique+&author=B+Akhtar&author=S+Siddique&author=RA+Khan&author=S+Zulfiqar&publication_year=2009&hl=en']",,, Akhtar 2009 {published data only}  ,excluded,CD010680-bbs2-0002," Study did not use duplex ultrasonography nor angiography as reference standard. Case‐control study comparing different techniques for measurement of the ABI (hand‐held doppler ABI vs palpatory ABI) in healthy, high‐risk asymptomatic and known PAD patients  "
CD010680-bib-0003,"Alnaeb ME, Crabtree VP, Boutin A, Mikhailidis DP, Seifalian AM, Hamilton G. ",Prospective assessment of lower‐extremity peripheral arterial disease in diabetic patients using a novel automated optical device, Angiology ,2007,58,    ,['citation-journal']," Alnaeb ME, Crabtree VP, Boutin A, Mikhailidis DP, Seifalian AM, Hamilton G. Prospective assessment of lower‐extremity peripheral arterial disease in diabetic patients using a novel automated optical device.  Angiology 2007;58(5):579. CENTRAL    Link to article     Google Scholar     ","['', 'https://doi.org/10.1177/0003319707305685', 'https://scholar.google.com/scholar_lookup?title=Prospective+assessment+of+lower‐extremity+peripheral+arterial+disease+in+diabetic+patients+using+a+novel+automated+optical+device+&author=ME+Alnaeb&author=VP+Crabtree&author=A+Boutin&author=DP+Mikhailidis&author=AM+Seifalian&author=G+Hamilton&publication_year=2007&hl=en']",,https://doi.org/10.1177/0003319707305685, Alnaeb 2007 {published data only}  ,excluded,CD010680-bbs2-0003," Study population not defined as presenting with exertional leg pain. Patients with diabetes, recruited from hospital vascular clinic, and control patients from an orthopaedic outpatient clinic used to compare ABI and photoplethysmography with duplex ultrasonography  "
CD010680-bib-0004,"Alnaeb ME, Boutin A, Crabtree VP, Mikhailidis DP, Seifalian AM, Hamilton G. ",Assessment of lower extremity peripheral arterial disease using a novel automated optical device, Vascular and Endovascular Surgery ,2008,41,    ,['citation-journal']," Alnaeb ME, Boutin A, Crabtree VP, Mikhailidis DP, Seifalian AM, Hamilton G. Assessment of lower extremity peripheral arterial disease using a novel automated optical device.  Vascular and Endovascular Surgery 2008;41(6):522‐7. CENTRAL    Link to article     Google Scholar     ","['', 'https://doi.org/10.1177/1538574407305092', 'https://scholar.google.com/scholar_lookup?title=Assessment+of+lower+extremity+peripheral+arterial+disease+using+a+novel+automated+optical+device+&author=ME+Alnaeb&author=A+Boutin&author=VP+Crabtree&author=DP+Mikhailidis&author=AM+Seifalian&author=G+Hamilton&publication_year=2008&hl=en']",,https://doi.org/10.1177/1538574407305092, Alnaeb 2008 {published data only}  ,excluded,CD010680-bbs2-0004, Study population not defined as presenting with exertional leg pain. PAD and non‐PAD patients recruited from vascular outpatient clinic for comparison of ABI and photoplethysmography with duplex ultrasonography  
CD010680-bib-0005,"Armstrong DWJ, Tobin C, Matangi MF. ",The accuracy of the physical examination for the detection of lower extremity peripheral arterial disease, Canadian Journal of Cardiology ,2010,26,    ,['citation-journal']," Armstrong DWJ, Tobin C, Matangi MF. The accuracy of the physical examination for the detection of lower extremity peripheral arterial disease.  Canadian Journal of Cardiology 2010;26(10):e346‐50. CENTRAL    Link to article     Google Scholar     ","['', 'https://doi.org/10.1016/S0828-282X(10)70467-0', 'https://scholar.google.com/scholar_lookup?title=The+accuracy+of+the+physical+examination+for+the+detection+of+lower+extremity+peripheral+arterial+disease+&author=DWJ+Armstrong&author=C+Tobin&author=MF+Matangi&publication_year=2010&hl=en']",,https://doi.org/10.1016/S0828-282X(10)70467-0, Armstrong 2010 {published data only}  ,excluded,CD010680-bbs2-0005, Study did not use duplex ultrasonography nor angiography as reference standard. Study comparing physical examination with ABI in people suspected of having or at high risk for PAD  
CD010680-bib-0006,"Baxter GM, Polak JF. ",Lower limb colour flow imaging: a comparison with ankle:brachial measurements and angiography, Clinical Radiology ,1993,47,    ,['citation-journal']," Baxter GM, Polak JF. Lower limb colour flow imaging: a comparison with ankle:brachial measurements and angiography.  Clinical Radiology 1993;47:91‐5. CENTRAL    Link to article     Google Scholar     ","['', 'https://doi.org/10.1016/S0009-9260(05)81179-1', 'https://scholar.google.com/scholar_lookup?title=Lower+limb+colour+flow+imaging:+a+comparison+with+ankle:brachial+measurements+and+angiography+&author=GM+Baxter&author=JF+Polak&publication_year=1993&hl=en']",,https://doi.org/10.1016/S0009-9260(05)81179-1, Baxter 1993 {published data only}  ,excluded,CD010680-bbs2-0006," Study population not selected owing to exertional leg pain. Patients with lower limb claudication, rest pain or cellulitis assessed with ABI, colour doppler ultrasonography and arteriography. Separate data for claudication population sought from study author, who replied that data were not available  "
CD010680-bib-0007,"Beckman JA, Higgins CO, Gerhard‐Herman M. ",Automated oscillometric determination of the ankle‐brachial index provides accuracy necessary for office practice, Hypertension ,2005,47,    ,['citation-journal']," Beckman JA, Higgins CO, Gerhard‐Herman M. Automated oscillometric determination of the ankle‐brachial index provides accuracy necessary for office practice.  Hypertension 2005;47:35‐8. CENTRAL    Google Scholar     ","['', 'https://scholar.google.com/scholar_lookup?title=Automated+oscillometric+determination+of+the+ankle‐brachial+index+provides+accuracy+necessary+for+office+practice+&author=JA+Beckman&author=CO+Higgins&author=M+Gerhard‐Herman&publication_year=2005&hl=en']",,, Beckman 2005 {published data only}  ,excluded,CD010680-bbs2-0007, Study did not use duplex ultrasonography nor angiography as reference standard. Comparison of 2 different types of ABI (oscillometric and continuous wave doppler ultrasonography) in participants referred to lab for evaluation of PAD  
CD010680-bib-0008,"Benchimol D, Pillois X, Benchimol A, Houitte A, Sagardiluz P, Tortelier L, et al. ",Accuracy of ankle‐brachial index using an automatic blood pressure device to detect peripheral artery disease in preventive medicine, Archives of Cardiovascular Diseases ,2009,102,    ,['citation-journal']," Benchimol D, Pillois X, Benchimol A, Houitte A, Sagardiluz P, Tortelier L, et al. Accuracy of ankle‐brachial index using an automatic blood pressure device to detect peripheral artery disease in preventive medicine.  Archives of Cardiovascular Diseases 2009;102:519‐24. CENTRAL    Link to article     Google Scholar     ","['', 'https://doi.org/10.1016/j.acvd.2009.03.011', 'https://scholar.google.com/scholar_lookup?title=Accuracy+of+ankle‐brachial+index+using+an+automatic+blood+pressure+device+to+detect+peripheral+artery+disease+in+preventive+medicine+&author=D+Benchimol&author=X+Pillois&author=A+Benchimol&author=A+Houitte&author=P+Sagardiluz&author=L+Tortelier&publication_year=2009&hl=en']",,https://doi.org/10.1016/j.acvd.2009.03.011, Benchimol 2009 {published data only}  ,excluded,CD010680-bbs2-0008, Study did not use duplex ultrasonography nor angiography as reference standard. Comparison of ABI measuring methods (automated vs doppler ultrasonography) in participants recruited by physicians in preventive medicine attending annual check‐up  
CD010680-bib-0009,"Beutner F, Teren A, Gielen S, Schuler G, Wirkner K, Tiller D, et al. ",Automated photoplethysmography‐based determination of ankle‐brachial: a validation study against doppler sonography, Clinical Research in Cardiology ,2012,101,    ,['citation-journal']," Beutner F, Teren A, Gielen S, Schuler G, Wirkner K, Tiller D, et al. Automated photoplethysmography‐based determination of ankle‐brachial: a validation study against doppler sonography.  Clinical Research in Cardiology 2012;101:875‐83. CENTRAL    Link to article     Google Scholar     ","['', 'https://doi.org/10.1007/s00392-012-0471-z', 'https://scholar.google.com/scholar_lookup?title=Automated+photoplethysmography‐based+determination+of+ankle‐brachial:+a+validation+study+against+doppler+sonography+&author=F+Beutner&author=A+Teren&author=S+Gielen&author=G+Schuler&author=K+Wirkner&author=D+Tiller&publication_year=2012&hl=en']",,https://doi.org/10.1007/s00392-012-0471-z, Beutner 2012 {published data only}  ,excluded,CD010680-bbs2-0009, Study did not use duplex ultrasonography nor angiography as reference standard. Study compared 2 different ABI measurement methods in healthy participants and in participants with confirmed lower limb PAD before revascularisation  
CD010680-bib-0010,"Bogomolov MS, Sedov VM, Slobodianiuk VV. ",Reliability of doppler examination and measurement of ABI for diagnostic peripheral arterial disease, Khirurglia ,2012,9,    ,['citation-journal']," Bogomolov MS, Sedov VM, Slobodianiuk VV. Reliability of doppler examination and measurement of ABI for diagnostic peripheral arterial disease.  Khirurglia 2012;9:78‐81. CENTRAL    Google Scholar     ","['', 'https://scholar.google.com/scholar_lookup?title=Reliability+of+doppler+examination+and+measurement+of+ABI+for+diagnostic+peripheral+arterial+disease+&author=MS+Bogomolov&author=VM+Sedov&author=VV+Slobodianiuk&publication_year=2012&hl=en']",,, Bogomolov 2012 {published data only}  ,excluded,CD010680-bbs2-0010, Study did not use duplex ultrasonography nor angiography as reference standard. Unclear whether study population was selected for exertional leg pain. Study performed ABI and doppler examination in people with and without diabetes  
CD010680-bib-0011,"Cacoub P, Luizy F, Saadoun D, Michon‐Pasturel M, Le Hello C, Frances Y, et al. ",Screening for peripheral arterial disease by the ankle‐brachial pressure index (ABPI) using Stethoflux™ in comparison to continuous wave doppler,,2005,,    ,['citation-other']," Cacoub P, Luizy F, Saadoun D, Michon‐Pasturel M, Le Hello C, Frances Y, et al. Screening for peripheral arterial disease by the ankle‐brachial pressure index (ABPI) using Stethoflux™ in comparison to continuous wave doppler. Circulation. 2005; Vol. 112, issue 17:U863‐U864. CENTRAL    Google Scholar     ","['', 'https://scholar.google.com/scholar_lookup?title=Screening+for+peripheral+arterial+disease+by+the+ankle‐brachial+pressure+index+(ABPI)+using+Stethoflux™+in+comparison+to+continuous+wave+doppler+&author=P+Cacoub&author=F+Luizy&author=D+Saadoun&author=M+Michon‐Pasturel&author=C+Hello&author=Y+Frances&publication_year=2005&hl=en']",,, Cacoub 2005 {published data only}  ,excluded,CD010680-bbs2-0011, Comparison of 2 types of ABI measurements (stethoflux and continuous wave doppler) in patients recruited consecutively from vascular laboratory  
CD010680-bib-0012,"Carmo GAL, Mandil A, Nascimento BR, Arantes BD, Brittencourt JC, Falqueto EB, et al. ",Can we measure the ankle‐brachial index using only a stethoscope? A pilot study, Family Practice ,2009,26,    ,['citation-journal']," Carmo GAL, Mandil A, Nascimento BR, Arantes BD, Brittencourt JC, Falqueto EB, et al. Can we measure the ankle‐brachial index using only a stethoscope? A pilot study.  Family Practice 2009;26:22‐6. CENTRAL    Google Scholar     ","['', 'https://scholar.google.com/scholar_lookup?title=Can+we+measure+the+ankle‐brachial+index+using+only+a+stethoscope?+A+pilot+study&author=GAL+Carmo&author=A+Mandil&author=BR+Nascimento&author=BD+Arantes&author=JC+Brittencourt&author=EB+Falqueto&publication_year=2009&hl=en']",,, Carmo 2009 {published data only}  ,excluded,CD010680-bbs2-0012," Study did not use duplex ultrasonography nor angiography as reference standard. Comparison of ABI measured by stethoscope and doppler in people referred to haemodynamic laboratory of Fekicio Rocho Hospital for peripheral, renal, coronary and cerebral vascular territory diagnostic and interventional angiographic examinations  "
CD010680-bib-0013,"Clairotte C, Retout S, Potier L, Roussel R, Escoubet B. ",Automated ankle‐brachial pressure index measurement by clinical staff for peripheral arterial disease diagnosis in nondiabetic and diabetic patients, Diabetes Care ,2009,32,    ,['citation-journal']," Clairotte C, Retout S, Potier L, Roussel R, Escoubet B. Automated ankle‐brachial pressure index measurement by clinical staff for peripheral arterial disease diagnosis in nondiabetic and diabetic patients.  Diabetes Care 2009;32(7):1231‐6. CENTRAL    Link to article     Google Scholar     ","['', 'https://doi.org/10.2337/dc08-2230', 'https://scholar.google.com/scholar_lookup?title=Automated+ankle‐brachial+pressure+index+measurement+by+clinical+staff+for+peripheral+arterial+disease+diagnosis+in+nondiabetic+and+diabetic+patients+&author=C+Clairotte&author=S+Retout&author=L+Potier&author=R+Roussel&author=B+Escoubet&publication_year=2009&hl=en']",,https://doi.org/10.2337/dc08-2230, Clairotte 2009 {published data only}  ,excluded,CD010680-bbs2-0013, Unclear whether study population selected because of exertional leg pain. Study assessed oscillometric ABI vs doppler ABI in patients referred to physiology department for doppler ultrasound examination of PAD. Two‐dimensional ultrasound measurement reported but not used as reference standard  
CD010680-bib-0014,"Cortez‐Cooper MY, Supak JA, Tanaka H. ",A new screening device for automatic measurements of arterial stiffness and ankle brachial index, American Journal of Hypertension ,2003,16,    ,['citation-journal']," Cortez‐Cooper MY, Supak JA, Tanaka H. A new screening device for automatic measurements of arterial stiffness and ankle brachial index.  American Journal of Hypertension 2003;16(81):138A. CENTRAL    Google Scholar     ","['', 'https://scholar.google.com/scholar_lookup?title=A+new+screening+device+for+automatic+measurements+of+arterial+stiffness+and+ankle+brachial+index+&author=MY+Cortez‐Cooper&author=JA+Supak&author=H+Tanaka&publication_year=2003&hl=en']",,, Cortez‐Cooper 2003 {published data only}  ,excluded,CD010680-bbs2-0014, Study did not use duplex ultrasonography nor angiography as reference standard. Study compared automated device with manual method for assessment of ABI in normotensive and hypertensive participants.  
CD010680-bib-0015,"Eason SL, Petersen NJ, Suarez‐Almazor M, Davis B, Collins TC. ","Diabetes mellitus, smoking, and the risk for asymptomatic peripheral arterial disease: whom should we screen?", Journal of the American Board of Family Practice / American Board of Family Practice ,2005,18,    ,['citation-journal']," Eason SL, Petersen NJ, Suarez‐Almazor M, Davis B, Collins TC. Diabetes mellitus, smoking, and the risk for asymptomatic peripheral arterial disease: whom should we screen?.  Journal of the American Board of Family Practice / American Board of Family Practice 2005;18:355‐61. CENTRAL    Link to article     Google Scholar     ","['', 'https://doi.org/10.3122/jabfm.18.5.355', 'https://scholar.google.com/scholar_lookup?title=Diabetes+mellitus,+smoking,+and+the+risk+for+asymptomatic+peripheral+arterial+disease:+whom+should+we+screen?+&author=SL+Eason&author=NJ+Petersen&author=M+Suarez‐Almazor&author=B+Davis&author=TC+Collins&publication_year=2005&hl=en']",,https://doi.org/10.3122/jabfm.18.5.355, Eason 2005 {published data only}  ,excluded,CD010680-bbs2-0015, Study did not use duplex ultrasonography nor angiography as reference standard. Study in asymptomatic PAD population (patients with symptomatic PAD were excluded). PAD assessed via ABI and the San Diego claudication questionnaire  
CD010680-bib-0016,"Ena J, Lozano T, Verdú G, Argente CR, González VL. ",Accuracy of ankle‐brachial index obtained by automated blood pressure measuring devices in patients with diabetes mellitus, Diabetes Research and Clinical Practice ,2011,92,    ,['citation-journal']," Ena J, Lozano T, Verdú G, Argente CR, González VL. Accuracy of ankle‐brachial index obtained by automated blood pressure measuring devices in patients with diabetes mellitus.  Diabetes Research and Clinical Practice 2011;92:329‐36. CENTRAL    Link to article     Google Scholar     ","['', 'https://doi.org/10.1016/j.diabres.2011.02.015', 'https://scholar.google.com/scholar_lookup?title=Accuracy+of+ankle‐brachial+index+obtained+by+automated+blood+pressure+measuring+devices+in+patients+with+diabetes+mellitus+&author=J+Ena&author=T+Lozano&author=G+Verdú&author=CR+Argente&author=VL+González&publication_year=2011&hl=en']",,https://doi.org/10.1016/j.diabres.2011.02.015, Ena 2011 {published data only}  ,excluded,CD010680-bbs2-0016, Study did not use duplex ultrasonography nor angiography as reference standard. Study compared ABI measured with upper arm automated blood pressure device vs ABI measured by hand‐held doppler in diabetic patients attending screening for PAD.  
CD010680-bib-0017,"Espeland MA, Regensteiner JG, Jaramillo SA, Gregg E, Knowler WC, Wagenknecht LE, et al. ",Measurement characteristics of the ankle‐brachial Index: results from action for health in diabetes study, Vascular Medicine ,2008,13,    ,['citation-journal']," Espeland MA, Regensteiner JG, Jaramillo SA, Gregg E, Knowler WC, Wagenknecht LE, et al. Measurement characteristics of the ankle‐brachial Index: results from action for health in diabetes study.  Vascular Medicine 2008;13:225‐33. CENTRAL    Link to article     Google Scholar     ","['', 'https://doi.org/10.1177/1358863X08091338', 'https://scholar.google.com/scholar_lookup?title=Measurement+characteristics+of+the+ankle‐brachial+Index:+results+from+action+for+health+in+diabetes+study+&author=MA+Espeland&author=JG+Regensteiner&author=SA+Jaramillo&author=E+Gregg&author=WC+Knowler&author=LE+Wagenknecht&publication_year=2008&hl=en']",,https://doi.org/10.1177/1358863X08091338, Espeland 2008 {published data only}  ,excluded,CD010680-bbs2-0017, Study did not use duplex ultrasonography nor angiography as reference standard. Population not presenting with exertional leg pain. Study compared different systolic blood pressure protocols for measuring ABI in a trial population of overweight/obese volunteers with type 2 diabetes.  
CD010680-bib-0018,"Feigelson HS, Criqui MH, Fronek A, Langer RD, Molgaard CA. ","Screening for peripheral arterial disease: the sensitivity, specificity, and predictive value of noninvasive tests in a defined population", American Journal of Epidemiology ,1994,140,    ,['citation-journal']," Feigelson HS, Criqui MH, Fronek A, Langer RD, Molgaard CA. Screening for peripheral arterial disease: the sensitivity, specificity, and predictive value of noninvasive tests in a defined population.  American Journal of Epidemiology 1994;140(6):526‐34. CENTRAL    Link to article     Google Scholar     ","['', 'https://doi.org/10.1093/oxfordjournals.aje.a117279', 'https://scholar.google.com/scholar_lookup?title=Screening+for+peripheral+arterial+disease:+the+sensitivity,+specificity,+and+predictive+value+of+noninvasive+tests+in+a+defined+population+&author=HS+Feigelson&author=MH+Criqui&author=A+Fronek&author=RD+Langer&author=CA+Molgaard&publication_year=1994&hl=en']",,https://doi.org/10.1093/oxfordjournals.aje.a117279, Feigelson 1994 {published data only}  ,excluded,CD010680-bbs2-0018, Study population not identified as presenting with exertional leg pain. Participants were a population‐based cohort of adults screened for large‐vessel PAD.  
CD010680-bib-0019,"Fronek A, Oglevie S, Curran B, Fronek K. ",Combination of pressure and velocity parameters in the non‐invasive diagnosis of aorto‐iliac disease," Vascular Medicine (London, England) ",1999,4,    ,['citation-journal']," Fronek A, Oglevie S, Curran B, Fronek K. Combination of pressure and velocity parameters in the non‐invasive diagnosis of aorto‐iliac disease.  Vascular Medicine (London, England) 1999;4:77‐81. CENTRAL    Link to article     Google Scholar     ","['', 'https://doi.org/10.1177/1358836X9900400204', 'https://scholar.google.com/scholar_lookup?title=Combination+of+pressure+and+velocity+parameters+in+the+non‐invasive+diagnosis+of+aorto‐iliac+disease+&author=A+Fronek&author=S+Oglevie&author=B+Curran&author=K+Fronek&publication_year=1999&hl=en']",,https://doi.org/10.1177/1358836X9900400204, Fronek 1999 {published data only}  ,excluded,CD010680-bbs2-0019, Index test was upper thigh/brachial index measurement rather than ankle/brachial index measurement. Study performed in patients referred to the Veterans' Administration Vascular Laboratory with suspected arterial occlusive disease of lower extremities.  
CD010680-bib-0020,"Guo X, Pang W, Zhao M, Luo Y, Sun Y, Hu D. ",Sensitivity and specificity of ankle‐brachial index for detecting angiographic stenosis of peripheral arteries, Ciculation Journal ,2008,72,    ,['citation-journal']," Guo X, Pang W, Zhao M, Luo Y, Sun Y, Hu D. Sensitivity and specificity of ankle‐brachial index for detecting angiographic stenosis of peripheral arteries.  Ciculation Journal 2008;72:605‐10. CENTRAL    Google Scholar     ","['', 'https://scholar.google.com/scholar_lookup?title=Sensitivity+and+specificity+of+ankle‐brachial+index+for+detecting+angiographic+stenosis+of+peripheral+arteries+&author=X+Guo&author=W+Pang&author=M+Zhao&author=Y+Luo&author=Y+Sun&author=D+Hu&publication_year=2008&hl=en']",,, Guo 2008 {published data only}  ,excluded,CD010680-bbs2-0020, Population not identified as presenting with exertional leg pain to primary care or outpatient clinic. Participants recruited from cardiology hospital ward  
CD010680-bib-0021,"Heidrich H, Blank B. ",Does the measurement of the digital arterial pressure using the doppler ultrasonic technique without testing for vasospasm to detect digital arterial occlusions make good sense?, Vasa‐Journal of Vascular Diseases ,1998,27,    ,['citation-journal']," Heidrich H, Blank B. Does the measurement of the digital arterial pressure using the doppler ultrasonic technique without testing for vasospasm to detect digital arterial occlusions make good sense?.  Vasa‐Journal of Vascular Diseases 1998;27(3):158‐62. CENTRAL    Google Scholar     ","['', 'https://scholar.google.com/scholar_lookup?title=Does+the+measurement+of+the+digital+arterial+pressure+using+the+doppler+ultrasonic+technique+without+testing+for+vasospasm+to+detect+digital+arterial+occlusions+make+good+sense?+&author=H+Heidrich&author=B+Blank&publication_year=1998&hl=en']",,, Heidrich 1998 {published data only}  ,excluded,CD010680-bbs2-0021, Index test involved measurement of BP in upper limb digital arteries. Study population consisted of people with primary or secondary Raynaud's disease or digital occlusions.  
CD010680-bib-0022,"Hoyer C, Sanderman J, Petersen LJ. ",Randomised diagnostic accuracy study of a fully automated portable device for diagnosing peripheral arterial disease by measuring the toe‐brachial index, European Journal of Vascular and Endovascular Surgery ,2013,45,    ,['citation-journal']," Hoyer C, Sanderman J, Petersen LJ. Randomised diagnostic accuracy study of a fully automated portable device for diagnosing peripheral arterial disease by measuring the toe‐brachial index.  European Journal of Vascular and Endovascular Surgery 2013;45(1):57‐64. CENTRAL    Link to article     Google Scholar     ","['', 'https://doi.org/10.1016/j.ejvs.2012.09.022', 'https://scholar.google.com/scholar_lookup?title=Randomised+diagnostic+accuracy+study+of+a+fully+automated+portable+device+for+diagnosing+peripheral+arterial+disease+by+measuring+the+toe‐brachial+index+&author=C+Hoyer&author=J+Sanderman&author=LJ+Petersen&publication_year=2013&hl=en']",,https://doi.org/10.1016/j.ejvs.2012.09.022, Hoyer 2012 {published data only}  ,excluded,CD010680-bbs2-0022, Index test was new portable photoplethysmography device for diagnosing ABI; reference standard was strain‐gauge plethysmography.  
