reference_id,authors,title,journal,year,volume,citation_footer,citation_type,citation,urls,pubmed_id,doi,header,reference_type,study_id,exclusion_reason
CD008759-bib-0001,"Abd‐Elsalam S, Habba E, Elkhalawany W, Tawfeek S, Elbatea H, El‐Kalla F, et al. ",Correlation of platelet count with endoscopic findings in a cohort of Egyptian patients with liver cirrhosis, Medicine (Baltimore) ,2016,95,    ,['citation-journal']," Abd‐Elsalam S, Habba E, Elkhalawany W, Tawfeek S, Elbatea H, El‐Kalla F, et al. Correlation of platelet count with endoscopic findings in a cohort of Egyptian patients with liver cirrhosis.  Medicine (Baltimore) 2016;95:e3853. CENTRAL    Link to article     PubMed     Google Scholar     ","['', 'https://doi.org/10.1097/MD.0000000000003853', 'https://www.ncbi.nlm.nih.gov/pubmed/27281094', 'https://scholar.google.com/scholar_lookup?title=Correlation+of+platelet+count+with+endoscopic+findings+in+a+cohort+of+Egyptian+patients+with+liver+cirrhosis+&author=S+Abd‐Elsalam&author=E+Habba&author=W+Elkhalawany&author=S+Tawfeek&author=H+Elbatea&author=F+El‐Kalla&publication_year=2016&hl=en']",27281094,https://doi.org/10.1097/MD.0000000000003853, Abd‐Elsalam 2016b {published data only}  ,included,CD008759-bbs2-0001,
CD008759-bib-0002,"Habba E, Abd‐Elsalam S, Ibrahim S, Dwidar A. ",Correlation of platelet count with endoscopic findings in Egyptian patients with liver cirrhosis, Hepatology International ,2016,10,    ,['citation-journal']," Habba E, Abd‐Elsalam S, Ibrahim S, Dwidar A. Correlation of platelet count with endoscopic findings in Egyptian patients with liver cirrhosis.  Hepatology International 2016;10:S365. CENTRAL    Google Scholar     ","['', 'https://scholar.google.com/scholar_lookup?title=Correlation+of+platelet+count+with+endoscopic+findings+in+Egyptian+patients+with+liver+cirrhosis+&author=E+Habba&author=S+Abd‐Elsalam&author=S+Ibrahim&author=A+Dwidar&publication_year=2016&hl=en']",,, Abd‐Elsalam 2016b {published data only}  ,included,CD008759-bbs2-0001,
CD008759-bib-0003,"Abu El Makarem MA, Shatat ME, Shaker Y, Abdel Aleem AA, El Sherif AM, Moaty MA, et al. ",Platelet count/bipolar spleen diameter ratio for the prediction of esophageal varices: the special Egyptian situation, Hepatitis Monthly ,2011,11,    ,['citation-journal']," Abu El Makarem MA, Shatat ME, Shaker Y, Abdel Aleem AA, El Sherif AM, Moaty MA, et al. Platelet count/bipolar spleen diameter ratio for the prediction of esophageal varices: the special Egyptian situation.  Hepatitis Monthly 2011;11(4):278‐84. CENTRAL    PubMed     Google Scholar     ","['', 'https://www.ncbi.nlm.nih.gov/pubmed/22087154', 'https://scholar.google.com/scholar_lookup?title=Platelet+count/bipolar+spleen+diameter+ratio+for+the+prediction+of+esophageal+varices:+the+special+Egyptian+situation+&author=MA+AbuElMakarem&author=ME+Shatat&author=Y+Shaker&author=AA+AbdelAleem&author=AM+Sherif&author=MA+Moaty&publication_year=2011&hl=en']",22087154,, Abu 2011 {published data only}  ,included,CD008759-bbs2-0002,
CD008759-bib-0004,"Adami MR, Ferreira CT, Kieling CO, Hirakata V, Vieira SMG. ",Noninvasive methods for prediction of esophageal varices in pediatric patients with portal hypertension, World Journal of Gastroenterology ,2013,19,    ,['citation-journal']," Adami MR, Ferreira CT, Kieling CO, Hirakata V, Vieira SMG. Noninvasive methods for prediction of esophageal varices in pediatric patients with portal hypertension.  World Journal of Gastroenterology 2013;19(13):2053‐9. CENTRAL    Link to article     PubMed     Google Scholar     ","['', 'https://doi.org/10.3748/wjg.v19.i13.2053', 'https://www.ncbi.nlm.nih.gov/pubmed/23599624', 'https://scholar.google.com/scholar_lookup?title=Noninvasive+methods+for+prediction+of+esophageal+varices+in+pediatric+patients+with+portal+hypertension+&author=MR+Adami&author=CT+Ferreira&author=CO+Kieling&author=V+Hirakata&author=SMG+Vieira&publication_year=2013&hl=en']",23599624,https://doi.org/10.3748/wjg.v19.i13.2053, Adami 2013 {published data only}  ,included,CD008759-bbs2-0003,
CD008759-bib-0005,"Agha A, Anwar E, Bashir K, Savarino V, Giannini EG. ",External validation of the platelet count/spleen diameter ratio for the diagnosis of esophageal varices in hepatitis C virus‐related cirrhosis, Digestive Diseases and Sciences ,2009,54,    ,['citation-journal']," Agha A, Anwar E, Bashir K, Savarino V, Giannini EG. External validation of the platelet count/spleen diameter ratio for the diagnosis of esophageal varices in hepatitis C virus‐related cirrhosis.  Digestive Diseases and Sciences 2009;54(3):654‐60. [PUBMED: 18594972]CENTRAL    Link to article     PubMed     Google Scholar     ","['', 'https://doi.org/10.1007/s10620-008-0367-y', 'https://www.ncbi.nlm.nih.gov/pubmed/18594972', 'https://scholar.google.com/scholar_lookup?title=External+validation+of+the+platelet+count/spleen+diameter+ratio+for+the+diagnosis+of+esophageal+varices+in+hepatitis+C+virus‐related+cirrhosis+&author=A+Agha&author=E+Anwar&author=K+Bashir&author=V+Savarino&author=EG+Giannini&publication_year=2009&hl=en']",18594972,https://doi.org/10.1007/s10620-008-0367-y, Agha 2009 {published data only}  ,included,CD008759-bbs2-0004,
CD008759-bib-0006,"Agha A, Abdulhadi MM, Marenco S, Bella A, Alsaudi D, El Haddad A, et al. ",Use of the platelet count/spleen diameter ratio for the noninvasive diagnosis of esophageal varices in patients with schistosomiasis, Saudi Journal of Gastroenterology ,2011,17,    ,['citation-journal']," Agha A, Abdulhadi MM, Marenco S, Bella A, Alsaudi D, El Haddad A, et al. Use of the platelet count/spleen diameter ratio for the noninvasive diagnosis of esophageal varices in patients with schistosomiasis.  Saudi Journal of Gastroenterology 2011;17(5):307‐11. CENTRAL    PubMed     Google Scholar     ","['', 'https://www.ncbi.nlm.nih.gov/pubmed/21912056', 'https://scholar.google.com/scholar_lookup?title=Use+of+the+platelet+count/spleen+diameter+ratio+for+the+noninvasive+diagnosis+of+esophageal+varices+in+patients+with+schistosomiasis+&author=A+Agha&author=MM+Abdulhadi&author=S+Marenco&author=A+Bella&author=D+Alsaudi&author=A+Haddad&publication_year=2011&hl=en']",21912056,, Agha 2011 {published data only}  ,included,CD008759-bbs2-0005,
CD008759-bib-0007,"Alcantara RV, Yamada RM, De Tommaso A, Bellomo‐Brandão MA, Hessel G. ",Non‐invasive predictors of esophageal varices in children and adolescents with chronic liver disease or extrahepatic portal venous obstruction, Jornal de Pediatria ,2012,88,    ,['citation-journal']," Alcantara RV, Yamada RM, De Tommaso A, Bellomo‐Brandão MA, Hessel G. Non‐invasive predictors of esophageal varices in children and adolescents with chronic liver disease or extrahepatic portal venous obstruction.  Jornal de Pediatria 2012;88(4):341‐6. CENTRAL    Link to article     PubMed     Google Scholar     ","['', 'https://doi.org/10.2223/JPED.2205', 'https://www.ncbi.nlm.nih.gov/pubmed/22915236', 'https://scholar.google.com/scholar_lookup?title=Non‐invasive+predictors+of+esophageal+varices+in+children+and+adolescents+with+chronic+liver+disease+or+extrahepatic+portal+venous+obstruction+&author=RV+Alcantara&author=RM+Yamada&author=A+Tommaso&author=MA+Bellomo‐Brandão&author=G+Hessel&publication_year=2012&hl=en']",22915236,https://doi.org/10.2223/JPED.2205, Alcantara 2012 {published data only}  ,included,CD008759-bbs2-0006,
CD008759-bib-0008,"Amin K, Muhammad D, Anjum A, Jamil K, Hassan A. ",Platelet count to spleen diameter ratio as a predictor of esophageal varices in patients of liver cirrhosis due to hepatitis C virus, Journal of University Medical Dental College ,2012,3,    ,['citation-journal']," Amin K, Muhammad D, Anjum A, Jamil K, Hassan A. Platelet count to spleen diameter ratio as a predictor of esophageal varices in patients of liver cirrhosis due to hepatitis C virus.  Journal of University Medical Dental College 2012;3:6‐11. CENTRAL    Google Scholar     ","['', 'https://scholar.google.com/scholar_lookup?title=Platelet+count+to+spleen+diameter+ratio+as+a+predictor+of+esophageal+varices+in+patients+of+liver+cirrhosis+due+to+hepatitis+C+virus+&author=K+Amin&author=D+Muhammad&author=A+Anjum&author=K+Jamil&author=A+Hassan&publication_year=2012&hl=en']",,, Amin 2012 {published data only}  ,included,CD008759-bbs2-0007,
CD008759-bib-0009,"Aqodad N, Ighoudane H, Elyousfi M, Mellouki I, Elabkari M, Benajeh D, et al. ",Correlation of platelet count with grading of esophageal varices in cirrhotic patients, Hepatology International ,2011,5,    ,['citation-journal']," Aqodad N, Ighoudane H, Elyousfi M, Mellouki I, Elabkari M, Benajeh D, et al. Correlation of platelet count with grading of esophageal varices in cirrhotic patients.  Hepatology International 2011;5(1):362. CENTRAL    Google Scholar     ","['', 'https://scholar.google.com/scholar_lookup?title=Correlation+of+platelet+count+with+grading+of+esophageal+varices+in+cirrhotic+patients&author=N+Aqodad&author=H+Ighoudane&author=M+Elyousfi&author=I+Mellouki&author=M+Elabkari&author=D+Benajeh&publication_year=2011&hl=en']",,, Aqodad 2011 {published data only}  ,included,CD008759-bbs2-0008,
CD008759-bib-0010,"Baig WW, Nagaraja MV, Varma M, Prabhu R. ",Platelet count to spleen diameter ratio for the diagnosis of esophageal varices: is it feasible?, Canadian Journal of Gastroenterology ,2008,22,    ,['citation-journal']," Baig WW, Nagaraja MV, Varma M, Prabhu R. Platelet count to spleen diameter ratio for the diagnosis of esophageal varices: is it feasible?.  Canadian Journal of Gastroenterology 2008;22(10):825‐8. CENTRAL    Link to article     PubMed     Google Scholar     ","['', 'https://doi.org/10.1155/2008/287274', 'https://www.ncbi.nlm.nih.gov/pubmed/18925306', 'https://scholar.google.com/scholar_lookup?title=Platelet+count+to+spleen+diameter+ratio+for+the+diagnosis+of+esophageal+varices:+is+it+feasible?+&author=WW+Baig&author=MV+Nagaraja&author=M+Varma&author=R+Prabhu&publication_year=2008&hl=en']",18925306,https://doi.org/10.1155/2008/287274, Baig 2008 {published data only}  ,included,CD008759-bbs2-0009,
CD008759-bib-0011,"Barikbin R, Hekmatnia A, Omidifar N, Farghadani M, Adibi P. ",Prediction severity of esophageal varices: a new cutoff point for platelet count/spleen diameter ratio, Minerva Gastroenterologica e Dietologica ,2010,56,    ,['citation-journal']," Barikbin R, Hekmatnia A, Omidifar N, Farghadani M, Adibi P. Prediction severity of esophageal varices: a new cutoff point for platelet count/spleen diameter ratio.  Minerva Gastroenterologica e Dietologica 2010;56(1):1‐6. CENTRAL    PubMed     Google Scholar     ","['', 'https://www.ncbi.nlm.nih.gov/pubmed/20190717', 'https://scholar.google.com/scholar_lookup?title=Prediction+severity+of+esophageal+varices:+a+new+cutoff+point+for+platelet+count/spleen+diameter+ratio+&author=R+Barikbin&author=A+Hekmatnia&author=N+Omidifar&author=M+Farghadani&author=P+Adibi&publication_year=2010&hl=en']",20190717,, Barikbin 2010 {published data only}  ,included,CD008759-bbs2-0010,
CD008759-bib-0012,"Burton JR, Liangpunsakul S, Lapidus J, Giannini E, Chalasani N, Zaman A. ",Validation of a multivariate model predicting presence and size of varices, Journal of Clinical Gastroenterology ,2007,41,    ,['citation-journal']," Burton JR, Liangpunsakul S, Lapidus J, Giannini E, Chalasani N, Zaman A. Validation of a multivariate model predicting presence and size of varices.  Journal of Clinical Gastroenterology 2007;41(6):609‐15. CENTRAL    Link to article     PubMed     Google Scholar     ","['', 'https://doi.org/10.1097/01.mcg.0000225669.84099.04', 'https://www.ncbi.nlm.nih.gov/pubmed/17577118', 'https://scholar.google.com/scholar_lookup?title=Validation+of+a+multivariate+model+predicting+presence+and+size+of+varices&author=JR+Burton&author=S+Liangpunsakul&author=J+Lapidus&author=E+Giannini&author=N+Chalasani&author=A+Zaman&publication_year=2007&hl=en']",17577118,https://doi.org/10.1097/01.mcg.0000225669.84099.04, Burton 2007a {published data only}  ,included,CD008759-bbs2-0011,
CD008759-bib-0013,"Burton JR, Liangpunsakul S, Lapidus J, Giannini E, Chalasani N, Zaman A. ",Validation of a multivariate model predicting presence and size of varices, Journal of Clinical Gastroenterology ,2007,41,    ,['citation-journal']," Burton JR, Liangpunsakul S, Lapidus J, Giannini E, Chalasani N, Zaman A. Validation of a multivariate model predicting presence and size of varices.  Journal of Clinical Gastroenterology 2007;41(6):609‐15. CENTRAL    Link to article     PubMed     Google Scholar     ","['', 'https://doi.org/10.1097/01.mcg.0000225669.84099.04', 'https://www.ncbi.nlm.nih.gov/pubmed/17577118', 'https://scholar.google.com/scholar_lookup?title=Validation+of+a+multivariate+model+predicting+presence+and+size+of+varices&author=JR+Burton&author=S+Liangpunsakul&author=J+Lapidus&author=E+Giannini&author=N+Chalasani&author=A+Zaman&publication_year=2007&hl=en']",17577118,https://doi.org/10.1097/01.mcg.0000225669.84099.04, Burton 2007b {published data only}  ,included,CD008759-bbs2-0012,
CD008759-bib-0014,"Burton JR, Liangpunsakul S, Lapidus J, Giannini E, Chalasani N, Zaman A. ",Validation of a multivariate model predicting presence and size of varices, Journal of Clinical Gastroenterology ,2007,41,    ,['citation-journal']," Burton JR, Liangpunsakul S, Lapidus J, Giannini E, Chalasani N, Zaman A. Validation of a multivariate model predicting presence and size of varices.  Journal of Clinical Gastroenterology 2007;41(6):609‐15. CENTRAL    Link to article     PubMed     Google Scholar     ","['', 'https://doi.org/10.1097/01.mcg.0000225669.84099.04', 'https://www.ncbi.nlm.nih.gov/pubmed/17577118', 'https://scholar.google.com/scholar_lookup?title=Validation+of+a+multivariate+model+predicting+presence+and+size+of+varices&author=JR+Burton&author=S+Liangpunsakul&author=J+Lapidus&author=E+Giannini&author=N+Chalasani&author=A+Zaman&publication_year=2007&hl=en']",17577118,https://doi.org/10.1097/01.mcg.0000225669.84099.04, Burton 2007c {published data only}  ,included,CD008759-bbs2-0013,
CD008759-bib-0015,"Burton JR, Liangpunsakul S, Lapidus J, Giannini E, Chalasani N, Zaman A. ",Validation of a multivariate model predicting presence and size of varices, Journal of Clinical Gastroenterology ,2007,41,    ,['citation-journal']," Burton JR, Liangpunsakul S, Lapidus J, Giannini E, Chalasani N, Zaman A. Validation of a multivariate model predicting presence and size of varices.  Journal of Clinical Gastroenterology 2007;41(6):609‐15. CENTRAL    Link to article     PubMed     Google Scholar     ","['', 'https://doi.org/10.1097/01.mcg.0000225669.84099.04', 'https://www.ncbi.nlm.nih.gov/pubmed/17577118', 'https://scholar.google.com/scholar_lookup?title=Validation+of+a+multivariate+model+predicting+presence+and+size+of+varices&author=JR+Burton&author=S+Liangpunsakul&author=J+Lapidus&author=E+Giannini&author=N+Chalasani&author=A+Zaman&publication_year=2007&hl=en']",17577118,https://doi.org/10.1097/01.mcg.0000225669.84099.04, Burton 2007d {published data only}  ,included,CD008759-bbs2-0014,
CD008759-bib-0016,"Camma C, Petta S, Di Marco V, Bronte F, Ciminnisi S, Licata G, et al. ",Insulin resistance is a risk factor for esophageal varices in hepatitis C virus cirrhosis," Hepatology (Baltimore, Md) ",2009,49,    ,['citation-journal']," Camma C, Petta S, Di Marco V, Bronte F, Ciminnisi S, Licata G, et al. Insulin resistance is a risk factor for esophageal varices in hepatitis C virus cirrhosis.  Hepatology (Baltimore, Md) 2009;49(1):195‐203. [PUBMED: 19065558]CENTRAL    Link to article     PubMed     Google Scholar     ","['', 'https://doi.org/10.1002/hep.22655', 'https://www.ncbi.nlm.nih.gov/pubmed/19065558', 'https://scholar.google.com/scholar_lookup?title=Insulin+resistance+is+a+risk+factor+for+esophageal+varices+in+hepatitis+C+virus+cirrhosis&author=C+Camma&author=S+Petta&author=V+Marco&author=F+Bronte&author=S+Ciminnisi&author=G+Licata&publication_year=2009&hl=en']",19065558,https://doi.org/10.1002/hep.22655, Camma 2009 {published data only}  ,included,CD008759-bbs2-0015,
CD008759-bib-0017,"Castera L, Le Bail B, Roudot‐Thoraval F, Bernard PH, Foucher J, Merrouche W, et al. ",Early detection in routine clinical practice of cirrhosis and oesophageal varices in chronic hepatitis C: comparison of transient elastography (FibroScan) with standard laboratory tests and non‐invasive scores, Journal of Hepatology ,2009,50,    ,['citation-journal']," Castera L, Le Bail B, Roudot‐Thoraval F, Bernard PH, Foucher J, Merrouche W, et al. Early detection in routine clinical practice of cirrhosis and oesophageal varices in chronic hepatitis C: comparison of transient elastography (FibroScan) with standard laboratory tests and non‐invasive scores.  Journal of Hepatology 2009;50(1):59‐68. CENTRAL    Link to article     PubMed     Google Scholar     ","['', 'https://doi.org/10.1016/j.jhep.2008.08.018', 'https://www.ncbi.nlm.nih.gov/pubmed/19013661', 'https://scholar.google.com/scholar_lookup?title=Early+detection+in+routine+clinical+practice+of+cirrhosis+and+oesophageal+varices+in+chronic+hepatitis+C:+comparison+of+transient+elastography+(FibroScan)+with+standard+laboratory+tests+and+non‐invasive+scores+&author=L+Castera&author=B+Bail&author=F+Roudot‐Thoraval&author=PH+Bernard&author=J+Foucher&author=W+Merrouche&publication_year=2009&hl=en']",19013661,https://doi.org/10.1016/j.jhep.2008.08.018, Castera 2009 {published data only}  ,included,CD008759-bbs2-0016,
CD008759-bib-0018,"Cherian JV, Deepak N, Ponnusamy RP, Somasundaram A, Jayanthi V. ",Non‐invasive predictors of esophageal varices, Saudi Journal of Gastroenterology ,2011,17,    ,['citation-journal']," Cherian JV, Deepak N, Ponnusamy RP, Somasundaram A, Jayanthi V. Non‐invasive predictors of esophageal varices.  Saudi Journal of Gastroenterology 2011;17(1):64‐8. CENTRAL    PubMed     Google Scholar     ","['', 'https://www.ncbi.nlm.nih.gov/pubmed/21196656', 'https://scholar.google.com/scholar_lookup?title=Non‐invasive+predictors+of+esophageal+varices&author=JV+Cherian&author=N+Deepak&author=RP+Ponnusamy&author=A+Somasundaram&author=V+Jayanthi&publication_year=2011&hl=en']",21196656,, Cherian 2011 {published data only}  ,included,CD008759-bbs2-0017,
CD008759-bib-0019,"Chiodi D, Hernandez N, Saona G, Sanchez A, Berrueta J, Mescia G, et al. ",[Noninvasive diagnosis of esophageal varices in cirrhotic patients] [Spanish], Acta Gastroenterologica Latinoamericana ,2014,44,    ,['citation-journal']," Chiodi D, Hernandez N, Saona G, Sanchez A, Berrueta J, Mescia G, et al. [Noninvasive diagnosis of esophageal varices in cirrhotic patients] [Spanish].  Acta Gastroenterologica Latinoamericana 2014;44(2):108‐13. CENTRAL    PubMed     Google Scholar     ","['', 'https://www.ncbi.nlm.nih.gov/pubmed/25199304', 'https://scholar.google.com/scholar_lookup?title=[Noninvasive+diagnosis+of+esophageal+varices+in+cirrhotic+patients]+[Spanish]&author=D+Chiodi&author=N+Hernandez&author=G+Saona&author=A+Sanchez&author=J+Berrueta&author=G+Mescia&publication_year=2014&hl=en']",25199304,, Chiodi 2014 {published data only}  ,included,CD008759-bbs2-0018,
CD008759-bib-0020,"Colecchia A, Di Biase AR, Scaioli E, Predieri B, Iughetti L, Reggiani MLB, et al. ",Non‐invasive methods can predict oesophageal varices in patients with biliary atresia after a Kasai procedure, Digestive and Liver Disease ,2011,43,    ,['citation-journal']," Colecchia A, Di Biase AR, Scaioli E, Predieri B, Iughetti L, Reggiani MLB, et al. Non‐invasive methods can predict oesophageal varices in patients with biliary atresia after a Kasai procedure.  Digestive and Liver Disease 2011;43(8):659‐63. CENTRAL    Link to article     PubMed     Google Scholar     ","['', 'https://doi.org/10.1016/j.dld.2011.04.006', 'https://www.ncbi.nlm.nih.gov/pubmed/21596631', 'https://scholar.google.com/scholar_lookup?title=Non‐invasive+methods+can+predict+oesophageal+varices+in+patients+with+biliary+atresia+after+a+Kasai+procedure+&author=A+Colecchia&author=AR+Biase&author=E+Scaioli&author=B+Predieri&author=L+Iughetti&author=MLB+Reggiani&publication_year=2011&hl=en']",21596631,https://doi.org/10.1016/j.dld.2011.04.006, Colecchia 2011 {published data only}  ,included,CD008759-bbs2-0019,
CD008759-bib-0021,"Colecchia A, Montrone L, Scaioli E, Bacchi‐Reggiani ML, Colli A, Casazza G, et al. ",Measurement of spleen stiffness to evaluate portal hypertension and the presence of esophageal varices in patients with HCV‐related cirrhosis, Gastroenterology ,2012,143,    ,['citation-journal']," Colecchia A, Montrone L, Scaioli E, Bacchi‐Reggiani ML, Colli A, Casazza G, et al. Measurement of spleen stiffness to evaluate portal hypertension and the presence of esophageal varices in patients with HCV‐related cirrhosis.  Gastroenterology 2012;143(3):646‐54. CENTRAL    Link to article     PubMed     Google Scholar     ","['', 'https://doi.org/10.1053/j.gastro.2012.05.035', 'https://www.ncbi.nlm.nih.gov/pubmed/22643348', 'https://scholar.google.com/scholar_lookup?title=Measurement+of+spleen+stiffness+to+evaluate+portal+hypertension+and+the+presence+of+esophageal+varices+in+patients+with+HCV‐related+cirrhosis+&author=A+Colecchia&author=L+Montrone&author=E+Scaioli&author=ML+Bacchi‐Reggiani&author=A+Colli&author=G+Casazza&publication_year=2012&hl=en']",22643348,https://doi.org/10.1053/j.gastro.2012.05.035, Colecchia 2012 {published data only}  ,included,CD008759-bbs2-0020,
CD008759-bib-0022,"De Mattos AZ, De Mattos AA, Vianna FF, Musskopf MI, Pereira‐Lima JC, Maciel AC. ",Platelet count/spleen diameter ratio: analysis of its capacity as a predictor of the existence of esophageal varices, Arquivos de Gastroenterologia ,2010,47,    ,['citation-journal']," De Mattos AZ, De Mattos AA, Vianna FF, Musskopf MI, Pereira‐Lima JC, Maciel AC. Platelet count/spleen diameter ratio: analysis of its capacity as a predictor of the existence of esophageal varices.  Arquivos de Gastroenterologia 2010;47(3):275‐8. CENTRAL    Link to article     PubMed     Google Scholar     ","['', 'https://doi.org/10.1590/S0004-28032010000300012', 'https://www.ncbi.nlm.nih.gov/pubmed/21140089', 'https://scholar.google.com/scholar_lookup?title=Platelet+count/spleen+diameter+ratio:+analysis+of+its+capacity+as+a+predictor+of+the+existence+of+esophageal+varices+&author=AZ+Mattos&author=AA+Mattos&author=FF+Vianna&author=MI+Musskopf&author=JC+Pereira‐Lima&author=AC+Maciel&publication_year=2010&hl=en']",21140089,https://doi.org/10.1590/S0004-28032010000300012, De Mattos 2010 {published data only}  ,included,CD008759-bbs2-0021,
CD008759-bib-0023,"Ding NS, Nguyen T, Iser DM, Hong T, Flanagan E, Wong A, et al. ",Liver stiffness plus platelet count can be used to exclude high‐risk oesophageal varices, Liver International ,2016,36,    ,['citation-journal']," Ding NS, Nguyen T, Iser DM, Hong T, Flanagan E, Wong A, et al. Liver stiffness plus platelet count can be used to exclude high‐risk oesophageal varices.  Liver International 2016;36(2):240‐5. [CRS: 6800131000104399; EMBASE: 20151018144]CENTRAL    Link to article     PubMed     Google Scholar     ","['', 'https://doi.org/10.1111/liv.12916', 'https://www.ncbi.nlm.nih.gov/pubmed/26212020', 'https://scholar.google.com/scholar_lookup?title=Liver+stiffness+plus+platelet+count+can+be+used+to+exclude+high‐risk+oesophageal+varices&author=NS+Ding&author=T+Nguyen&author=DM+Iser&author=T+Hong&author=E+Flanagan&author=A+Wong&publication_year=2016&hl=en']",26212020,https://doi.org/10.1111/liv.12916, Ding 2016 {published data only}  ,included,CD008759-bbs2-0022,
CD008759-bib-0024,"Ditchfield MR, Gibson RN, Donlan JD, Gibson PR. ","Duplex Doppler ultrasound signs of portal hypertension: relative diagnostic value of examination of paraumbilical vein, portal vein and spleen", Australasian Radiology ,1992,36,    ,['citation-journal']," Ditchfield MR, Gibson RN, Donlan JD, Gibson PR. Duplex Doppler ultrasound signs of portal hypertension: relative diagnostic value of examination of paraumbilical vein, portal vein and spleen.  Australasian Radiology 1992;36(2):102‐5. [PUBMED: 1520164]CENTRAL    Link to article     PubMed     Google Scholar     ","['', 'https://doi.org/10.1111/j.1440-1673.1992.tb03090.x', 'https://www.ncbi.nlm.nih.gov/pubmed/1520164', 'https://scholar.google.com/scholar_lookup?title=Duplex+Doppler+ultrasound+signs+of+portal+hypertension:+relative+diagnostic+value+of+examination+of+paraumbilical+vein,+portal+vein+and+spleen+&author=MR+Ditchfield&author=RN+Gibson&author=JD+Donlan&author=PR+Gibson&publication_year=1992&hl=en']",1520164,https://doi.org/10.1111/j.1440-1673.1992.tb03090.x, Ditchfield 1992 {published data only}  ,included,CD008759-bbs2-0023,
CD008759-bib-0025,"Abu El Makarem MA, Shatat ME, Shaker Y, Abdel Aleem AA, El Sherif AM, Moaty MA, et al. ",Platelet count/bipolar spleen diameter ratio for the prediction of esophageal varices: the special Egyptian situation, Hepatitis Monthly ,2011,11,    ,['citation-journal']," Abu El Makarem MA, Shatat ME, Shaker Y, Abdel Aleem AA, El Sherif AM, Moaty MA, et al. Platelet count/bipolar spleen diameter ratio for the prediction of esophageal varices: the special Egyptian situation.  Hepatitis Monthly 2011;11:278‐84. CENTRAL    PubMed     Google Scholar     ","['', 'https://www.ncbi.nlm.nih.gov/pubmed/22087154', 'https://scholar.google.com/scholar_lookup?title=Platelet+count/bipolar+spleen+diameter+ratio+for+the+prediction+of+esophageal+varices:+the+special+Egyptian+situation+&author=MA+AbuElMakarem&author=ME+Shatat&author=Y+Shaker&author=AA+AbdelAleem&author=AM+Sherif&author=MA+Moaty&publication_year=2011&hl=en']",22087154,, El Makarem 2011 {published data only}  ,included,CD008759-bbs2-0024,
