reference_id,authors,title,journal,year,volume,citation_footer,citation_type,citation,urls,pubmed_id,doi,header,reference_type,study_id,exclusion_reason
CD008759-bib-0101,"Thayumanavan L, Jaisankar P, Ramani R, Kannan M, Sangumani J, Sreeraj V. ",Validating the usefulness of doppler study of hepatic veins in predicting esophageal varices in cirrhotic patients, Journal of Clinical and Experimental Hepatology ,2012,2,    ,['citation-journal']," Thayumanavan L, Jaisankar P, Ramani R, Kannan M, Sangumani J, Sreeraj V. Validating the usefulness of doppler study of hepatic veins in predicting esophageal varices in cirrhotic patients.  Journal of Clinical and Experimental Hepatology 2012;2(1 Suppl):S19. CENTRAL    Link to article     Google Scholar     ","['', 'https://doi.org/10.1016/S0973-6883(12)60031-0', 'https://scholar.google.com/scholar_lookup?title=Validating+the+usefulness+of+doppler+study+of+hepatic+veins+in+predicting+esophageal+varices+in+cirrhotic+patients+&author=L+Thayumanavan&author=P+Jaisankar&author=R+Ramani&author=M+Kannan&author=J+Sangumani&author=V+Sreeraj&publication_year=2012&hl=en']",,https://doi.org/10.1016/S0973-6883(12)60031-0, Thayumanavan 2012 {published data only}  ,excluded,CD008759-bbs2-0098, No data for 2 × 2 table 
CD008759-bib-0102,"Thomopoulos KC, Labropoulou‐Karatza C, Mimidis KP, Katsakoulis EC, Iconomou G, Nikolopoulou VN. ",Non‐invasive predictors of the presence of large oesophageal varices in patients with cirrhosis, Digestive and Liver Disease ,2003,35,    ,['citation-journal']," Thomopoulos KC, Labropoulou‐Karatza C, Mimidis KP, Katsakoulis EC, Iconomou G, Nikolopoulou VN. Non‐invasive predictors of the presence of large oesophageal varices in patients with cirrhosis.  Digestive and Liver Disease 2003;35(7):473‐8. [PUBMED: 12870732]CENTRAL    Link to article     PubMed     Google Scholar     ","['', 'https://doi.org/10.1016/S1590-8658(03)00219-6', 'https://www.ncbi.nlm.nih.gov/pubmed/12870732', 'https://scholar.google.com/scholar_lookup?title=Non‐invasive+predictors+of+the+presence+of+large+oesophageal+varices+in+patients+with+cirrhosis+&author=KC+Thomopoulos&author=C+Labropoulou‐Karatza&author=KP+Mimidis&author=EC+Katsakoulis&author=G+Iconomou&author=VN+Nikolopoulou&publication_year=2003&hl=en']",12870732,https://doi.org/10.1016/S1590-8658(03)00219-6, Thomopoulos 2003 {published data only}  ,excluded,CD008759-bbs2-0099, No data for 2 × 2 table 
CD008759-bib-0103,"Treeprasertsuk S, Kowdley KV, Luketic VAC, Harrison ME, Mccashland T, Befeler AS. ",The predictors of the presence of varices in patients with primary sclerosing cholangitis," Hepatology (Baltimore, Md) ",2010,51,    ,['citation-journal']," Treeprasertsuk S, Kowdley KV, Luketic VAC, Harrison ME, Mccashland T, Befeler AS. The predictors of the presence of varices in patients with primary sclerosing cholangitis.  Hepatology (Baltimore, Md) 2010;51:1302‐10. CENTRAL    Link to article     PubMed     Google Scholar     ","['', 'https://doi.org/10.1002/hep.23432', 'https://www.ncbi.nlm.nih.gov/pubmed/20044810', 'https://scholar.google.com/scholar_lookup?title=The+predictors+of+the+presence+of+varices+in+patients+with+primary+sclerosing+cholangitis&author=S+Treeprasertsuk&author=KV+Kowdley&author=VAC+Luketic&author=ME+Harrison&author=T+Mccashland&author=AS+Befeler&publication_year=2010&hl=en']",20044810,https://doi.org/10.1002/hep.23432, Treeprasertsuk 2010 {published data only}  ,excluded,CD008759-bbs2-0100, No data for 2 × 2 table 
CD008759-bib-0104,"Valente Pinto M, Castanhinha S, Pereira L, Lopes AI, Barreto C. ",Liver disease in children with cystic fibrosis ‐ The contribution of ultrasound evaluation, Journal of Cystic Fibrosis ,2013,12,    ,['citation-journal']," Valente Pinto M, Castanhinha S, Pereira L, Lopes AI, Barreto C. Liver disease in children with cystic fibrosis ‐ The contribution of ultrasound evaluation.  Journal of Cystic Fibrosis 2013;12(Suppl 1):S112. CENTRAL    Google Scholar     ","['', 'https://scholar.google.com/scholar_lookup?title=Liver+disease+in+children+with+cystic+fibrosis+‐+The+contribution+of+ultrasound+evaluation&author=M+ValentePinto&author=S+Castanhinha&author=L+Pereira&author=AI+Lopes&author=C+Barreto&publication_year=2013&hl=en']",,, Valente {published data only}  ,excluded,CD008759-bbs2-0101, No data for 2 × 2 table 
CD008759-bib-0105,"Yu JY, Liu XN, Wang D, Cui JJ. ",Non‐invasive predictive factors of esophageal varices in patients with post‐hepatitis B cirrhosis, Journal of Binzhou Medical University ,2008,31,    ,['citation-journal']," Yu JY, Liu XN, Wang D, Cui JJ. Non‐invasive predictive factors of esophageal varices in patients with post‐hepatitis B cirrhosis.  Journal of Binzhou Medical University 2008;31:345‐9. CENTRAL    Google Scholar     ","['', 'https://scholar.google.com/scholar_lookup?title=Non‐invasive+predictive+factors+of+esophageal+varices+in+patients+with+post‐hepatitis+B+cirrhosis+&author=JY+Yu&author=XN+Liu&author=D+Wang&author=JJ+Cui&publication_year=2008&hl=en']",,, Yu 2008 {published data only}  ,excluded,CD008759-bbs2-0102, Different definition of the target condition (data reported only for severe vs moderate small and no varices)  
CD008759-bib-0106,"Zaman A, Hapke R, Flora K, Rosen HR, Benner K. ",Factors predicting the presence of esophageal or gastric varices in patients with advanced liver disease, American Journal of Gastroenterology ,1999,94,    ,['citation-journal']," Zaman A, Hapke R, Flora K, Rosen HR, Benner K. Factors predicting the presence of esophageal or gastric varices in patients with advanced liver disease.  American Journal of Gastroenterology 1999;94(11):3292‐6. [PUBMED: 10566732]CENTRAL    Link to article     Google Scholar     ","['', 'https://doi.org/10.1111/j.1572-0241.1999.01540.x', 'https://scholar.google.com/scholar_lookup?title=Factors+predicting+the+presence+of+esophageal+or+gastric+varices+in+patients+with+advanced+liver+disease+&author=A+Zaman&author=R+Hapke&author=K+Flora&author=HR+Rosen&author=K+Benner&publication_year=1999&hl=en']",10566732,https://doi.org/10.1111/j.1572-0241.1999.01540.x, Zaman 1999 {published data only}  ,excluded,CD008759-bbs2-0103, Overlap with Zaman 2001  
CD008759-bib-0107,"Zhang J, Tao R, You Z, Dai Y, Fan Y, Cui J, et al. ",Gamna‐Gandy bodies of the spleen detected with susceptibility weighted imaging: maybe a new potential non‐invasive marker of esophageal varices, PloS One ,2013,8,    ,['citation-journal']," Zhang J, Tao R, You Z, Dai Y, Fan Y, Cui J, et al. Gamna‐Gandy bodies of the spleen detected with susceptibility weighted imaging: maybe a new potential non‐invasive marker of esophageal varices.  PloS One 2013;8(1):e55626. [CRS: 6800131000104538; EMBASE: 2013079030]CENTRAL    Link to article     PubMed     Google Scholar     ","['', 'https://doi.org/10.1371/journal.pone.0055626', 'https://www.ncbi.nlm.nih.gov/pubmed/23383250', 'https://scholar.google.com/scholar_lookup?title=Gamna‐Gandy+bodies+of+the+spleen+detected+with+susceptibility+weighted+imaging:+maybe+a+new+potential+non‐invasive+marker+of+esophageal+varices+&author=J+Zhang&author=R+Tao&author=Z+You&author=Y+Dai&author=Y+Fan&author=J+Cui&publication_year=2013&hl=en']",23383250,https://doi.org/10.1371/journal.pone.0055626, Zhang 2013 {published data only}  ,excluded,CD008759-bbs2-0104, Reference standard different from endoscopy 
CD008759-bib-0108,"Zhang C‐X, Xu J‐M, Li J‐B, Kong D‐R, Wang L, Xu X‐Y, et al. ",Predict esophageal varices via routine trans‐abdominal ultrasound: a design of classification analysis model, Journal of Gastroenterology and Hepatology (Australia) ,2016,31,    ,['citation-journal']," Zhang C‐X, Xu J‐M, Li J‐B, Kong D‐R, Wang L, Xu X‐Y, et al. Predict esophageal varices via routine trans‐abdominal ultrasound: a design of classification analysis model.  Journal of Gastroenterology and Hepatology (Australia) 2016;31(1):194‐9. [CRS: 6800131000104397; EMBASE: 20160106034]CENTRAL    Link to article     Google Scholar     ","['', 'https://doi.org/10.1111/jgh.13045', 'https://scholar.google.com/scholar_lookup?title=Predict+esophageal+varices+via+routine+trans‐abdominal+ultrasound:+a+design+of+classification+analysis+model+&author=C‐X+Zhang&author=J‐M+Xu&author=J‐B+Li&author=D‐R+Kong&author=L+Wang&author=X‐Y+Xu&publication_year=2016&hl=en']",,https://doi.org/10.1111/jgh.13045, Zhang 2016 {published data only}  ,excluded,CD008759-bbs2-0105, No data for 2 × 2 table. Published data not consistent (see Table 3: sensitivity and specificity not consistent with positive and negative predictive values)  
CD008759-bib-0109,"Abraldes JG, Bureau C, Stefanescu H, Augustin S, Ney M, Blasco H, et al. ","Non‐invasive tools and risk of clinically significant portal hypertension and varices in compensated cirrhosis: the ""Anticipate"" study",,,,]   ,['citation-other']," Abraldes JG, Bureau C, Stefanescu H, Augustin S, Ney M, Blasco H, et al. Non‐invasive tools and risk of clinically significant portal hypertension and varices in compensated cirrhosis: the ""Anticipate"" study. Hepatology 2016 Sep 17 [Epub ahead of print]. [DOI: 10.1002/hep.28824]    ",[],,, Abraldes 2016 ,additional,CD008759-bbs2-0106,
CD008759-bib-0110,"Adams PC, Arthur MJ, Boyer TD, DeLeve LD, Di Bisceglie AM, Hall M, et al. ",Screening in liver disease: report of an AASLD clinical workshop," Hepatology (Baltimore, Md) ",2004,39,    ,['citation-journal']," Adams PC, Arthur MJ, Boyer TD, DeLeve LD, Di Bisceglie AM, Hall M, et al. Screening in liver disease: report of an AASLD clinical workshop.  Hepatology (Baltimore, Md) 2004;39(5):1204‐12. [PUBMED: 15122748]    Link to article     PubMed     Google Scholar     ","['https://doi.org/10.1002/hep.20169', 'https://www.ncbi.nlm.nih.gov/pubmed/15122748', 'https://scholar.google.com/scholar_lookup?title=Screening+in+liver+disease:+report+of+an+AASLD+clinical+workshop&author=PC+Adams&author=MJ+Arthur&author=TD+Boyer&author=LD+DeLeve&author=AM+Bisceglie&author=M+Hall&publication_year=2004&hl=en']",15122748,https://doi.org/10.1002/hep.20169, Adams 2004 ,additional,CD008759-bbs2-0107,
CD008759-bib-0111,"Arguedas MR, Heudebert GR, Eloubeidi MA, Abrams GA, Fallon MB. ","Cost‐effectiveness of screening, surveillance, and primary prophylaxis strategies for esophageal varices", American Journal of Gastroenterology ,2002,97,    ,['citation-journal']," Arguedas MR, Heudebert GR, Eloubeidi MA, Abrams GA, Fallon MB. Cost‐effectiveness of screening, surveillance, and primary prophylaxis strategies for esophageal varices.  American Journal of Gastroenterology 2002;97(9):2441‐52. [PUBMED: 12358270]    Link to article     Google Scholar     ","['https://doi.org/10.1111/j.1572-0241.2002.06000.x', 'https://scholar.google.com/scholar_lookup?title=Cost‐effectiveness+of+screening,+surveillance,+and+primary+prophylaxis+strategies+for+esophageal+varices+&author=MR+Arguedas&author=GR+Heudebert&author=MA+Eloubeidi&author=GA+Abrams&author=MB+Fallon&publication_year=2002&hl=en']",12358270,https://doi.org/10.1111/j.1572-0241.2002.06000.x, Arguedas 2002 ,additional,CD008759-bbs2-0108,
CD008759-bib-0112,"ASGE Standards of Practice Committee, Ben‐Menachem T, Decker GA, Early DS, Evans J, Fanelli RD, Fisher DA, et al. ",Adverse events of upper GI endoscopy, Gastrointestinal Endoscopy ,2012,76,    ,['citation-journal']," ASGE Standards of Practice Committee, Ben‐Menachem T, Decker GA, Early DS, Evans J, Fanelli RD, Fisher DA, et al. Adverse events of upper GI endoscopy.  Gastrointestinal Endoscopy 2012;76:707‐18.    Link to article     PubMed     Google Scholar     ","['https://doi.org/10.1016/j.gie.2012.03.252', 'https://www.ncbi.nlm.nih.gov/pubmed/22985638', 'https://scholar.google.com/scholar_lookup?title=Adverse+events+of+upper+GI+endoscopy&author=T+Ben‐Menachem&author=GA+Decker&author=DS+Early&author=J+Evans&author=RD+Fanelli&author=DA+Fisher&publication_year=2012&hl=en']",22985638,https://doi.org/10.1016/j.gie.2012.03.252, ASGE Standards of Practice Committee 2012 ,additional,CD008759-bbs2-0109,
CD008759-bib-0113,"Bambha K, Kim WR, Pedersen R, Bida JP, Kremers WK, Kamath PS. ",Predictors of early re‐bleeding and mortality after acute variceal haemorrhage in patients with cirrhosis, Gut ,2008,57,    ,['citation-journal']," Bambha K, Kim WR, Pedersen R, Bida JP, Kremers WK, Kamath PS. Predictors of early re‐bleeding and mortality after acute variceal haemorrhage in patients with cirrhosis.  Gut 2008;57(6):814‐20. [PUBMED: 18250126]    Link to article     PubMed     Google Scholar     ","['https://doi.org/10.1136/gut.2007.137489', 'https://www.ncbi.nlm.nih.gov/pubmed/18250126', 'https://scholar.google.com/scholar_lookup?title=Predictors+of+early+re‐bleeding+and+mortality+after+acute+variceal+haemorrhage+in+patients+with+cirrhosis+&author=K+Bambha&author=WR+Kim&author=R+Pedersen&author=JP+Bida&author=WK+Kremers&author=PS+Kamath&publication_year=2008&hl=en']",18250126,https://doi.org/10.1136/gut.2007.137489, Bambha 2008 ,additional,CD008759-bbs2-0110,
CD008759-bib-0114,"Bellentani S, Tiribelli C, Saccoccio G, Sodde M, Fratti N, De Martin C, et al. ",Prevalence of chronic liver disease in the general population of northern Italy: the Dionysos study," Hepatology (Baltimore, Md) ",1994,20,    ,['citation-journal']," Bellentani S, Tiribelli C, Saccoccio G, Sodde M, Fratti N, De Martin C, et al. Prevalence of chronic liver disease in the general population of northern Italy: the Dionysos study.  Hepatology (Baltimore, Md) 1994;20(6):1442‐9. [PUBMED: 7982643]    Link to article     PubMed     Google Scholar     ","['https://doi.org/10.1002/hep.1840200611', 'https://www.ncbi.nlm.nih.gov/pubmed/7982643', 'https://scholar.google.com/scholar_lookup?title=Prevalence+of+chronic+liver+disease+in+the+general+population+of+northern+Italy:+the+Dionysos+study+&author=S+Bellentani&author=C+Tiribelli&author=G+Saccoccio&author=M+Sodde&author=N+Fratti&author=C+Martin&publication_year=1994&hl=en']",7982643,https://doi.org/10.1002/hep.1840200611, Bellentani 1994 ,additional,CD008759-bbs2-0111,
CD008759-bib-0115,"Bendtsen F, Skovgaard LT, Sorensen TI, Matzen P. ",Agreement among multiple observers on endoscopic diagnosis of esophageal varices before bleeding," Hepatology (Baltimore, Md) ",1990,11,    ,['citation-journal']," Bendtsen F, Skovgaard LT, Sorensen TI, Matzen P. Agreement among multiple observers on endoscopic diagnosis of esophageal varices before bleeding.  Hepatology (Baltimore, Md) 1990;11(3):341‐7. [PUBMED: 2312048]    Link to article     PubMed     Google Scholar     ","['https://doi.org/10.1002/hep.1840110302', 'https://www.ncbi.nlm.nih.gov/pubmed/2312048', 'https://scholar.google.com/scholar_lookup?title=Agreement+among+multiple+observers+on+endoscopic+diagnosis+of+esophageal+varices+before+bleeding+&author=F+Bendtsen&author=LT+Skovgaard&author=TI+Sorensen&author=P+Matzen&publication_year=1990&hl=en']",2312048,https://doi.org/10.1002/hep.1840110302, Bendtsen 1990 ,additional,CD008759-bbs2-0112,
CD008759-bib-0116,"Cales P, Buscail L, Bretagne JF, Champigneulle B, Bourbon P, Duclos B, et al. ",Interobserver and intercenter agreement of gastro‐esophageal endoscopic signs in cirrhosis. Results of a prospective multicenter study, Gastroenterologie Clinique et Biologique ,1989,13,    ,['citation-journal']," Cales P, Buscail L, Bretagne JF, Champigneulle B, Bourbon P, Duclos B, et al. Interobserver and intercenter agreement of gastro‐esophageal endoscopic signs in cirrhosis. Results of a prospective multicenter study [Concordance inter‐observateurs inter‐centres des signes endoscopiques gastro‐oesophagiens au cours de la cirrhose. Resultats d'une etude prospective multicentrique].  Gastroenterologie Clinique et Biologique 1989;13(12):967‐73. [PUBMED: 2696663]    PubMed     Google Scholar     ","['https://www.ncbi.nlm.nih.gov/pubmed/2696663', 'https://scholar.google.com/scholar_lookup?title=Interobserver+and+intercenter+agreement+of+gastro‐esophageal+endoscopic+signs+in+cirrhosis.+Results+of+a+prospective+multicenter+study+&author=P+Cales&author=L+Buscail&author=JF+Bretagne&author=B+Champigneulle&author=P+Bourbon&author=B+Duclos&publication_year=1989&hl=en']",2696663,, Cales 1989 ,additional,CD008759-bbs2-0113,
CD008759-bib-0117,"Cales P, Desmorat H, Vinel JP, Caucanas JP, Ravaud A, Gerin P, et al. ",Incidence of large oesophageal varices in patients with cirrhosis: application to prophylaxis of first bleeding, Gut ,1990,31,    ,['citation-journal']," Cales P, Desmorat H, Vinel JP, Caucanas JP, Ravaud A, Gerin P, et al. Incidence of large oesophageal varices in patients with cirrhosis: application to prophylaxis of first bleeding.  Gut 1990;31(11):1298‐302. [PUBMED: 2253916]    Link to article     PubMed     Google Scholar     ","['https://doi.org/10.1136/gut.31.11.1298', 'https://www.ncbi.nlm.nih.gov/pubmed/2253916', 'https://scholar.google.com/scholar_lookup?title=Incidence+of+large+oesophageal+varices+in+patients+with+cirrhosis:+application+to+prophylaxis+of+first+bleeding+&author=P+Cales&author=H+Desmorat&author=JP+Vinel&author=JP+Caucanas&author=A+Ravaud&author=P+Gerin&publication_year=1990&hl=en']",2253916,https://doi.org/10.1136/gut.31.11.1298, Cales 1990 ,additional,CD008759-bbs2-0114,
CD008759-bib-0118,"Chawla S, Katz A, Attar BM, Gupta A, Sandhu DS, Agarwal R. ",Platelet count/spleen diameter ratio to predict the presence of esophageal varices in patients with cirrhosis: a systematic review, European Journal of Gastroenterology and Hepatology ,2012,24,    ,['citation-journal']," Chawla S, Katz A, Attar BM, Gupta A, Sandhu DS, Agarwal R. Platelet count/spleen diameter ratio to predict the presence of esophageal varices in patients with cirrhosis: a systematic review.  European Journal of Gastroenterology and Hepatology 2012;24:431‐6.    Link to article     PubMed     Google Scholar     ","['https://doi.org/10.1097/MEG.0b013e3283505015', 'https://www.ncbi.nlm.nih.gov/pubmed/22410714', 'https://scholar.google.com/scholar_lookup?title=Platelet+count/spleen+diameter+ratio+to+predict+the+presence+of+esophageal+varices+in+patients+with+cirrhosis:+a+systematic+review+&author=S+Chawla&author=A+Katz&author=BM+Attar&author=A+Gupta&author=DS+Sandhu&author=R+Agarwal&publication_year=2012&hl=en']",22410714,https://doi.org/10.1097/MEG.0b013e3283505015, Chawla 2012 ,additional,CD008759-bbs2-0115,
CD008759-bib-0119,"Colli A, Fraquelli M, Casazza G, Conte D, Nikolova D, Duca P, et al. ",The architecture of diagnostic research: from bench to bedside ‐ research guidelines using liver stiffness as an example," Hepatology (Baltimore, Md) ",2014,60,    ,['citation-journal']," Colli A, Fraquelli M, Casazza G, Conte D, Nikolova D, Duca P, et al. The architecture of diagnostic research: from bench to bedside ‐ research guidelines using liver stiffness as an example.  Hepatology (Baltimore, Md) 2014;60:408‐18. [DOI: 10.1002/hep.26948]    Link to article     PubMed     Google Scholar     ","['https://doi.org/10.1002/hep.26948', 'https://www.ncbi.nlm.nih.gov/pubmed/24277656', 'https://scholar.google.com/scholar_lookup?title=The+architecture+of+diagnostic+research:+from+bench+to+bedside+‐+research+guidelines+using+liver+stiffness+as+an+example+&author=A+Colli&author=M+Fraquelli&author=G+Casazza&author=D+Conte&author=D+Nikolova&author=P+Duca&publication_year=2014&hl=en']",24277656,https://doi.org/10.1002/hep.26948, Colli 2014a ,additional,CD008759-bbs2-0116,
CD008759-bib-0120,"Colli A, Gana JC, Turner D, Yap J, Adams‐Webber T, Ling SC, et al. ",Capsule endoscopy for the diagnosis of oesophageal varices in people with chronic liver disease or portal vein thrombosis, Cochrane Database of Systematic Reviews ,2014,,    ,['citation-journal']," Colli A, Gana JC, Turner D, Yap J, Adams‐Webber T, Ling SC, et al. Capsule endoscopy for the diagnosis of oesophageal varices in people with chronic liver disease or portal vein thrombosis.  Cochrane Database of Systematic Reviews 2014, Issue 10. [DOI: 10.1002/14651858.CD008760.pub2]    Link to article     Google Scholar     ","['https://doi.org/10.1002/14651858.CD008760.pub2', 'https://scholar.google.com/scholar_lookup?title=Capsule+endoscopy+for+the+diagnosis+of+oesophageal+varices+in+people+with+chronic+liver+disease+or+portal+vein+thrombosis+&author=A+Colli&author=JC+Gana&author=D+Turner&author=J+Yap&author=T+Adams‐Webber&author=SC+Ling&publication_year=2014&hl=en']",,https://doi.org/10.1002/14651858.CD008760.pub2, Colli 2014b ,additional,CD008759-bbs2-0117,
CD008759-bib-0121,"Cotton PB, Hawes RH, Barkun A, Ginsberg GG, Amman S, Cohen J, et al. ",Excellence in endoscopy: toward practical metrics, Gastrointestinal Endoscopy ,2006,63,    ,['citation-journal']," Cotton PB, Hawes RH, Barkun A, Ginsberg GG, Amman S, Cohen J, et al. Excellence in endoscopy: toward practical metrics.  Gastrointestinal Endoscopy 2006;63:286‐91.    Link to article     PubMed     Google Scholar     ","['https://doi.org/10.1016/j.gie.2005.04.048', 'https://www.ncbi.nlm.nih.gov/pubmed/16427937', 'https://scholar.google.com/scholar_lookup?title=Excellence+in+endoscopy:+toward+practical+metrics&author=PB+Cotton&author=RH+Hawes&author=A+Barkun&author=GG+Ginsberg&author=S+Amman&author=J+Cohen&publication_year=2006&hl=en']",16427937,https://doi.org/10.1016/j.gie.2005.04.048, Cotton 2006 ,additional,CD008759-bbs2-0118,
CD008759-bib-0122,"D'Amico G, Pagliaro L, Bosch J. ",Pharmacological treatment of portal hypertension: an evidence‐based approach, Seminars in Liver Disease ,1999,19,    ,['citation-journal']," D'Amico G, Pagliaro L, Bosch J. Pharmacological treatment of portal hypertension: an evidence‐based approach.  Seminars in Liver Disease 1999;19(4):475‐505. [PUBMED: 10643630]    Link to article     PubMed     Google Scholar     ","['https://doi.org/10.1055/s-2007-1007133', 'https://www.ncbi.nlm.nih.gov/pubmed/10643630', ""https://scholar.google.com/scholar_lookup?title=Pharmacological+treatment+of+portal+hypertension:+an+evidence‐based+approach&author=G+D'Amico&author=L+Pagliaro&author=J+Bosch&publication_year=1999&hl=en""]",10643630,https://doi.org/10.1055/s-2007-1007133, D'Amico 1999 ,additional,CD008759-bbs2-0119,
CD008759-bib-0123,"D'Amico G, De Franchis R. ",Upper digestive bleeding in cirrhosis. Post‐therapeutic outcome and prognostic indicators," Hepatology (Baltimore, Md) ",2003,38,    ,['citation-journal']," D'Amico G, De Franchis R. Upper digestive bleeding in cirrhosis. Post‐therapeutic outcome and prognostic indicators.  Hepatology (Baltimore, Md) 2003;38(3):599‐612. [PUBMED: 12939586]    Link to article     PubMed     Google Scholar     ","['https://doi.org/10.1053/jhep.2003.50385', 'https://www.ncbi.nlm.nih.gov/pubmed/12939586', ""https://scholar.google.com/scholar_lookup?title=Upper+digestive+bleeding+in+cirrhosis.+Post‐therapeutic+outcome+and+prognostic+indicators&author=G+D'Amico&author=R+Franchis&publication_year=2003&hl=en""]",12939586,https://doi.org/10.1053/jhep.2003.50385, D'Amico 2003 ,additional,CD008759-bbs2-0120,
CD008759-bib-0124,"D'Amico G, Garcia‐Pagan JC, Luca A, Bosch J. ",Hepatic vein pressure gradient reduction and prevention of variceal bleeding in cirrhosis: a systematic review, Gastroenterology ,2006,131,    ,['citation-journal']," D'Amico G, Garcia‐Pagan JC, Luca A, Bosch J. Hepatic vein pressure gradient reduction and prevention of variceal bleeding in cirrhosis: a systematic review.  Gastroenterology 2006;131(5):1611‐24. [PUBMED: 17101332]    Link to article     PubMed     Google Scholar     ","['https://doi.org/10.1053/j.gastro.2006.09.013', 'https://www.ncbi.nlm.nih.gov/pubmed/17101332', ""https://scholar.google.com/scholar_lookup?title=Hepatic+vein+pressure+gradient+reduction+and+prevention+of+variceal+bleeding+in+cirrhosis:+a+systematic+review+&author=G+D'Amico&author=JC+Garcia‐Pagan&author=A+Luca&author=J+Bosch&publication_year=2006&hl=en""]",17101332,https://doi.org/10.1053/j.gastro.2006.09.013, D'Amico 2006 a ,additional,CD008759-bbs2-0121,
CD008759-bib-0125,"D’Amico G, Garcia‐Tsao G, Pagliaro L. ",Natural history and prognostic indicators of survival in cirrhosis: a systematic review of 118 studies, Journal of Hepatology ,2006,44,    ,['citation-journal']," D’Amico G, Garcia‐Tsao G, Pagliaro L. Natural history and prognostic indicators of survival in cirrhosis: a systematic review of 118 studies.  Journal of Hepatology 2006;44:217–31.    Link to article     PubMed     Google Scholar     ","['https://doi.org/10.1016/j.jhep.2005.10.013', 'https://www.ncbi.nlm.nih.gov/pubmed/16298014', 'https://scholar.google.com/scholar_lookup?title=Natural+history+and+prognostic+indicators+of+survival+in+cirrhosis:+a+systematic+review+of+118+studies+&author=G+D’Amico&author=G+Garcia‐Tsao&author=L+Pagliaro&publication_year=2006&hl=en']",16298014,https://doi.org/10.1016/j.jhep.2005.10.013, D'Amico 2006 b ,additional,CD008759-bbs2-0122,
