reference_id,authors,title,journal,year,volume,citation_footer,citation_type,citation,urls,pubmed_id,doi,header,reference_type,study_id,exclusion_reason
CD008759-bib-0076,"Amarapurkar DN, Parikh SS, Shankaran K, Chopra K, Dhawan P, Kalro RH, et al. ",Correlation between splenomegaly and oesophageal varices in patients with liver cirrhosis,,1994,,    ,['citation-other']," Amarapurkar DN, Parikh SS, Shankaran K, Chopra K, Dhawan P, Kalro RH, et al. Correlation between splenomegaly and oesophageal varices in patients with liver cirrhosis. Endoscopy1994; Vol. 26, issue 6:563. [PUBMED: 7828573]CENTRAL    Google Scholar     ","['', 'https://scholar.google.com/scholar_lookup?title=Correlation+between+splenomegaly+and+oesophageal+varices+in+patients+with+liver+cirrhosis&author=DN+Amarapurkar&author=SS+Parikh&author=K+Shankaran&author=K+Chopra&author=P+Dhawan&author=RH+Kalro&publication_year=1994&hl=en']",7828573,, Amarapurkar 1994 {published data only}  ,excluded,CD008759-bbs2-0073," In only a minority of patients, spleen length was assessed by ultrasound "
CD008759-bib-0077,"Barrera F, Riquelme A, Soza A, Contreras A, Barrios G, Padilla O, et al. ",Platelet count/spleen diameter ratio for non‐invasive prediction of high risk esophageal varices in cirrhotic patients, Annals of Hepatology ,2009,8,    ,['citation-journal']," Barrera F, Riquelme A, Soza A, Contreras A, Barrios G, Padilla O, et al. Platelet count/spleen diameter ratio for non‐invasive prediction of high risk esophageal varices in cirrhotic patients.  Annals of Hepatology 2009;8(4):325‐30. CENTRAL    Link to article     PubMed     Google Scholar     ","['', 'https://doi.org/10.1016/S1665-2681(19)31745-4', 'https://www.ncbi.nlm.nih.gov/pubmed/20009131', 'https://scholar.google.com/scholar_lookup?title=Platelet+count/spleen+diameter+ratio+for+non‐invasive+prediction+of+high+risk+esophageal+varices+in+cirrhotic+patients+&author=F+Barrera&author=A+Riquelme&author=A+Soza&author=A+Contreras&author=G+Barrios&author=O+Padilla&publication_year=2009&hl=en']",20009131,https://doi.org/10.1016/S1665-2681(19)31745-4, Barrera 2009 {published data only}  ,excluded,CD008759-bbs2-0074, No data for 2 × 2 table 
CD008759-bib-0078,"Chalasani N, Imperiale TF, Ismail A, Sood G, Carey M, Wilcox CM, et al. ",Predictors of large esophageal varices in patients with cirrhosis, American Journal of Gastroenterology ,1999,94,    ,['citation-journal']," Chalasani N, Imperiale TF, Ismail A, Sood G, Carey M, Wilcox CM, et al. Predictors of large esophageal varices in patients with cirrhosis.  American Journal of Gastroenterology 1999;94(11):3285‐91. [PUBMED: 10566731]CENTRAL    Link to article     Google Scholar     ","['', 'https://doi.org/10.1111/j.1572-0241.1999.1539_a.x', 'https://scholar.google.com/scholar_lookup?title=Predictors+of+large+esophageal+varices+in+patients+with+cirrhosis&author=N+Chalasani&author=TF+Imperiale&author=A+Ismail&author=G+Sood&author=M+Carey&author=CM+Wilcox&publication_year=1999&hl=en']",10566731,https://doi.org/10.1111/j.1572-0241.1999.1539_a.x, Chalasani 1999 {published data only}  ,excluded,CD008759-bbs2-0075, Study provides data only for combination of splenomegaly and platelet count as predictors of oesophageal varices. Individual 2 × 2 tables for platelet count or presence/absence of splenomegaly are not extractable from manuscript  
CD008759-bib-0079,"Cho EJ, Kim MY, Lee JH, Lee IY, Lim YL, Choi DH, et al. ",Diagnostic and prognostic values of noninvasive predictors of portal hypertension in patients with alcoholic cirrhosis, PloS One ,2015,10,    ,['citation-journal']," Cho EJ, Kim MY, Lee JH, Lee IY, Lim YL, Choi DH, et al. Diagnostic and prognostic values of noninvasive predictors of portal hypertension in patients with alcoholic cirrhosis.  PloS One 2015;10(7):e0133935. [CRS: 6800131000104272; JC‐‐NLM: Journal ID:101285081; OI:SOURCE:: NLM. PMC4511411; PUBMED: 26196942]CENTRAL    Link to article     PubMed     Google Scholar     ","['', 'https://doi.org/10.1371/journal.pone.0133935', 'https://www.ncbi.nlm.nih.gov/pubmed/26196942', 'https://scholar.google.com/scholar_lookup?title=Diagnostic+and+prognostic+values+of+noninvasive+predictors+of+portal+hypertension+in+patients+with+alcoholic+cirrhosis+&author=EJ+Cho&author=MY+Kim&author=JH+Lee&author=IY+Lee&author=YL+Lim&author=DH+Choi&publication_year=2015&hl=en']",26196942,https://doi.org/10.1371/journal.pone.0133935, Cho 2015 {published data only}  ,excluded,CD008759-bbs2-0076, No data for 2 × 2 table (Table S3 provides unreliable data) 
CD008759-bib-0080,"El Guindi M, El Arabi H, El Henawy I, Basiouny H. ",Non‐invasive parameters as predictors for esophageal varices in children with chronic liver disease,,2008,,    ,['citation-other']," El Guindi M, El Arabi H, El Henawy I, Basiouny H. Non‐invasive parameters as predictors for esophageal varices in children with chronic liver disease. Hepatology (Baltimore, Md)2008; Vol. 48, issue 4 Suppl:1040A. CENTRAL    Google Scholar     ","['', 'https://scholar.google.com/scholar_lookup?title=Non‐invasive+parameters+as+predictors+for+esophageal+varices+in+children+with+chronic+liver+disease+&author=M+Guindi&author=H+Arabi&author=I+Henawy&author=H+Basiouny&publication_year=2008&hl=en']",,, El Guindi 2008 {published data only}  ,excluded,CD008759-bbs2-0077, No data for 2 × 2 table 
CD008759-bib-0081,"El Sherif AM, Abou‐Shady MA, Al Bahrawy AM, Bakr RM, Hosny A. ",Nitric oxide levels in chronic liver disease patients with and without oesophageal varices, Hepatology International ,2008,2,    ,['citation-journal']," El Sherif AM, Abou‐Shady MA, Al Bahrawy AM, Bakr RM, Hosny A. Nitric oxide levels in chronic liver disease patients with and without oesophageal varices.  Hepatology International 2008;2:341‐5. CENTRAL    Link to article     PubMed     Google Scholar     ","['', 'https://doi.org/10.1007/s12072-008-9077-y', 'https://www.ncbi.nlm.nih.gov/pubmed/19669263', 'https://scholar.google.com/scholar_lookup?title=Nitric+oxide+levels+in+chronic+liver+disease+patients+with+and+without+oesophageal+varices+&author=AM+Sherif&author=MA+Abou‐Shady&author=AM+AlBahrawy&author=RM+Bakr&author=A+Hosny&publication_year=2008&hl=en']",19669263,https://doi.org/10.1007/s12072-008-9077-y, El‐Sherif 2008 {published data only}  ,excluded,CD008759-bbs2-0078, No data for 2 × 2 table. Published data not consistent. Study authors contacted by email. They did not respond  
CD008759-bib-0082,"Fagundes ED, Ferreira AR, Roquete ML, Penna FJ, Goulart EM, Figueiredo Filho PP, et al. ",Clinical and laboratory predictors of esophageal varices in children and adolescents with portal hypertension syndrome, Journal of Pediatric Gastroenterology and Nutrition ,2008,46,    ,['citation-journal']," Fagundes ED, Ferreira AR, Roquete ML, Penna FJ, Goulart EM, Figueiredo Filho PP, et al. Clinical and laboratory predictors of esophageal varices in children and adolescents with portal hypertension syndrome.  Journal of Pediatric Gastroenterology and Nutrition 2008;46(2):178‐83. [PUBMED: 18223377]CENTRAL    Link to article     PubMed     Google Scholar     ","['', 'https://doi.org/10.1097/MPG.0b013e318156ff07', 'https://www.ncbi.nlm.nih.gov/pubmed/18223377', 'https://scholar.google.com/scholar_lookup?title=Clinical+and+laboratory+predictors+of+esophageal+varices+in+children+and+adolescents+with+portal+hypertension+syndrome+&author=ED+Fagundes&author=AR+Ferreira&author=ML+Roquete&author=FJ+Penna&author=EM+Goulart&author=PP+FigueiredoFilho&publication_year=2008&hl=en']",18223377,https://doi.org/10.1097/MPG.0b013e318156ff07, Fagundes 2008 {published data only}  ,excluded,CD008759-bbs2-0079, Not acceptable reference standard 
CD008759-bib-0083,"Gana JC, Turner D, Roberts EA, Ling SC. ",Derivation of a clinical prediction rule for the noninvasive diagnosis of varices in children, Journal of Pediatric Gastroenterology and Nutrition ,2010,50,    ,['citation-journal']," Gana JC, Turner D, Roberts EA, Ling SC. Derivation of a clinical prediction rule for the noninvasive diagnosis of varices in children.  Journal of Pediatric Gastroenterology and Nutrition 2010;50:188‐93. CENTRAL    Link to article     PubMed     Google Scholar     ","['', 'https://doi.org/10.1097/MPG.0b013e3181b64437', 'https://www.ncbi.nlm.nih.gov/pubmed/19966576', 'https://scholar.google.com/scholar_lookup?title=Derivation+of+a+clinical+prediction+rule+for+the+noninvasive+diagnosis+of+varices+in+children+&author=JC+Gana&author=D+Turner&author=EA+Roberts&author=SC+Ling&publication_year=2010&hl=en']",19966576,https://doi.org/10.1097/MPG.0b013e3181b64437, Gana 2010 {published data only}  ,excluded,CD008759-bbs2-0080, No data on index tests of interest 
CD008759-bib-0084,"Giannini EG, Anwar E, Bashir K, Savarino V, Agha A. ",Platelet count/spleen diameter ratio and AASLD criterion for screening esophageal varices in patients with hepatitis C virus related compensated cirrhosis,,2007,,    ,['citation-other']," Giannini EG, Anwar E, Bashir K, Savarino V, Agha A. Platelet count/spleen diameter ratio and AASLD criterion for screening esophageal varices in patients with hepatitis C virus related compensated cirrhosis. Hepatology (Baltimore, Md)2007; Vol. 46, issue 4 Suppl 1:568A. CENTRAL    Google Scholar     ","['', 'https://scholar.google.com/scholar_lookup?title=Platelet+count/spleen+diameter+ratio+and+AASLD+criterion+for+screening+esophageal+varices+in+patients+with+hepatitis+C+virus+related+compensated+cirrhosis+&author=EG+Giannini&author=E+Anwar&author=K+Bashir&author=V+Savarino&author=A+Agha&publication_year=2007&hl=en']",,, Giannini 2007 {published data only}  ,excluded,CD008759-bbs2-0081, Same data as Agha 2009 (n = 311 patients)  
CD008759-bib-0085,"Hong WD, Zhu QH, Huang ZM, Chen XR, Jiang ZC, Xu SH, et al. ",Predictors of esophageal varices in patients with HBV‐related cirrhosis: a retrospective study, BMC Gastroenterology ,2009,9,    ,['citation-journal']," Hong WD, Zhu QH, Huang ZM, Chen XR, Jiang ZC, Xu SH, et al. Predictors of esophageal varices in patients with HBV‐related cirrhosis: a retrospective study.  BMC Gastroenterology 2009;9:11. [PUBMED: 19196464]CENTRAL    Link to article     PubMed     Google Scholar     ","['', 'https://doi.org/10.1186/1471-230X-9-11', 'https://www.ncbi.nlm.nih.gov/pubmed/19196464', 'https://scholar.google.com/scholar_lookup?title=Predictors+of+esophageal+varices+in+patients+with+HBV‐related+cirrhosis:+a+retrospective+study+&author=WD+Hong&author=QH+Zhu&author=ZM+Huang&author=XR+Chen&author=ZC+Jiang&author=SH+Xu&publication_year=2009&hl=en']",19196464,https://doi.org/10.1186/1471-230X-9-11, Hong 2009 {published data only}  ,excluded,CD008759-bbs2-0082, Different index test (spleen width) 
CD008759-bib-0086,"Koncoro H, Mariadi K, Somayana G, Suryadarma GA, Purwadi N, Wibawa DN. ",Prediction of large esophageal varices among patients with liver cirrhosis in Sanglah Hospital Danpasar, Journal of Gastroenterology and Hepatology ,2014,29,    ,['citation-journal']," Koncoro H, Mariadi K, Somayana G, Suryadarma GA, Purwadi N, Wibawa DN. Prediction of large esophageal varices among patients with liver cirrhosis in Sanglah Hospital Danpasar.  Journal of Gastroenterology and Hepatology 2014;29(Suppl S3):193. CENTRAL    PubMed     Google Scholar     ","['', 'https://www.ncbi.nlm.nih.gov/pubmed/24224779', 'https://scholar.google.com/scholar_lookup?title=Prediction+of+large+esophageal+varices+among+patients+with+liver+cirrhosis+in+Sanglah+Hospital+Danpasar+&author=H+Koncoro&author=K+Mariadi&author=G+Somayana&author=GA+Suryadarma&author=N+Purwadi&author=DN+Wibawa&publication_year=2014&hl=en']",24224779,, Koncoro 2014 {published data only}  ,excluded,CD008759-bbs2-0083, No definition of the reference standard used 
CD008759-bib-0087,"Lee JH, Yoon JH, Lee CH, Myung SJ, Keam B, Kim BH, et al. ",Complete blood count reflects the degree of oesophageal varices and liver fibrosis in virus‐related chronic liver disease patients, Journal of Viral Hepatitis ,2009,16,    ,['citation-journal']," Lee JH, Yoon JH, Lee CH, Myung SJ, Keam B, Kim BH, et al. Complete blood count reflects the degree of oesophageal varices and liver fibrosis in virus‐related chronic liver disease patients.  Journal of Viral Hepatitis 2009;16(6):444‐52. [PUBMED: 19200133]CENTRAL    Link to article     PubMed     Google Scholar     ","['', 'https://doi.org/10.1111/j.1365-2893.2009.01091.x', 'https://www.ncbi.nlm.nih.gov/pubmed/19200133', 'https://scholar.google.com/scholar_lookup?title=Complete+blood+count+reflects+the+degree+of+oesophageal+varices+and+liver+fibrosis+in+virus‐related+chronic+liver+disease+patients+&author=JH+Lee&author=JH+Yoon&author=CH+Lee&author=SJ+Myung&author=B+Keam&author=BH+Kim&publication_year=2009&hl=en']",19200133,https://doi.org/10.1111/j.1365-2893.2009.01091.x, Lee 2009 {published data only}  ,excluded,CD008759-bbs2-0084, No data for 2 × 2 table 
CD008759-bib-0088,"Malik K, Batool F, Khan SA, ul Amir Z. ",Platelet count/splenic size ratio as a non‐invasive parameter to predict the presence of esophageal varices in cirrhotics, Rawal Medical Journal ,2015,40,    ,['citation-journal']," Malik K, Batool F, Khan SA, ul Amir Z. Platelet count/splenic size ratio as a non‐invasive parameter to predict the presence of esophageal varices in cirrhotics.  Rawal Medical Journal 2015;40(4):371‐4. [CRS: 6800131000063484; EMBASE: 2015504984]CENTRAL    Google Scholar     ","['', 'https://scholar.google.com/scholar_lookup?title=Platelet+count/splenic+size+ratio+as+a+non‐invasive+parameter+to+predict+the+presence+of+esophageal+varices+in+cirrhotics+&author=K+Malik&author=F+Batool&author=SA+Khan&author=Z+ulAmir&publication_year=2015&hl=en']",,, Malik 2015 {published data only}  ,excluded,CD008759-bbs2-0085, No data for 2 × 2 table 
CD008759-bib-0089,"Nashaat EH, Abd‐Elaziz H, Sabry M, Ibrahim AA. ",Non‐endoscopic predictors of esophageal varices and portal hypertensive gastropathy, Nature and Science ,2010,8,    ,['citation-journal']," Nashaat EH, Abd‐Elaziz H, Sabry M, Ibrahim AA. Non‐endoscopic predictors of esophageal varices and portal hypertensive gastropathy.  Nature and Science 2010;8:43‐50. CENTRAL    Google Scholar     ","['', 'https://scholar.google.com/scholar_lookup?title=Non‐endoscopic+predictors+of+esophageal+varices+and+portal+hypertensive+gastropathy&author=EH+Nashaat&author=H+Abd‐Elaziz&author=M+Sabry&author=AA+Ibrahim&publication_year=2010&hl=en']",,, Nashaat 2010 {published data only}  ,excluded,CD008759-bbs2-0086, No data for 2 × 2 table. Published data not consistent 
CD008759-bib-0090,"Nazish Z, Inayatullah M, Tanweer S. ",Non endoscopic predictors of esophageal varices in cirrhotics, Medical Forum Monthly ,2011,22,    ,['citation-journal']," Nazish Z, Inayatullah M, Tanweer S. Non endoscopic predictors of esophageal varices in cirrhotics.  Medical Forum Monthly 2011;22:3‐7. CENTRAL    Google Scholar     ","['', 'https://scholar.google.com/scholar_lookup?title=Non+endoscopic+predictors+of+esophageal+varices+in+cirrhotics&author=Z+Nazish&author=M+Inayatullah&author=S+Tanweer&publication_year=2011&hl=en']",,, Nazish 2011 {published data only}  ,excluded,CD008759-bbs2-0087, No data for 2 × 2 table 
CD008759-bib-0091,"Ng FH, Wong SY, Loo CK, Lam KM, Lai CW, Cheng CS. ",Prediction of oesophagogastric varices in patients with liver cirrhosis, Journal of Gastroenterology and Hepatology ,1999,14,    ,['citation-journal']," Ng FH, Wong SY, Loo CK, Lam KM, Lai CW, Cheng CS. Prediction of oesophagogastric varices in patients with liver cirrhosis.  Journal of Gastroenterology and Hepatology 1999;14(8):785‐90. [PUBMED: 10482429]CENTRAL    Link to article     PubMed     Google Scholar     ","['', 'https://doi.org/10.1046/j.1440-1746.1999.01949.x', 'https://www.ncbi.nlm.nih.gov/pubmed/10482429', 'https://scholar.google.com/scholar_lookup?title=Prediction+of+oesophagogastric+varices+in+patients+with+liver+cirrhosis&author=FH+Ng&author=SY+Wong&author=CK+Loo&author=KM+Lam&author=CW+Lai&author=CS+Cheng&publication_year=1999&hl=en']",10482429,https://doi.org/10.1046/j.1440-1746.1999.01949.x, Ng 1999 {published data only}  ,excluded,CD008759-bbs2-0088, Study identified patients with oesophagogastric varices 
CD008759-bib-0092,"Park Y, Kim SU, Park SY, Kim BK, Park JY, Kim DY, et al. ",A novel model to predict esophageal varices in patients with compensated cirrhosis using acoustic radiation force impulse elastography, PLoS One ,2015,10,    ,['citation-journal']," Park Y, Kim SU, Park SY, Kim BK, Park JY, Kim DY, et al. A novel model to predict esophageal varices in patients with compensated cirrhosis using acoustic radiation force impulse elastography.  PLoS One 2015;10(3):e0121009. CENTRAL    Link to article     PubMed     Google Scholar     ","['', 'https://doi.org/10.1371/journal.pone.0121009', 'https://www.ncbi.nlm.nih.gov/pubmed/25826654', 'https://scholar.google.com/scholar_lookup?title=A+novel+model+to+predict+esophageal+varices+in+patients+with+compensated+cirrhosis+using+acoustic+radiation+force+impulse+elastography+&author=Y+Park&author=SU+Kim&author=SY+Park&author=BK+Kim&author=JY+Park&author=DY+Kim&publication_year=2015&hl=en']",25826654,https://doi.org/10.1371/journal.pone.0121009, Park 2015 {published data only}  ,excluded,CD008759-bbs2-0089, No data for 2 × 2 table 
CD008759-bib-0093,"Qamar AA, Grace ND, Groszmann RJ, Garcia‐Tsao G, Bosch J, Burroughs AK. ",Platelet count is not a predictor of the presence or development of gastroesophageal varices in cirrhosis," Hepatology (Baltimore, Md) ",2008,47,    ,['citation-journal']," Qamar AA, Grace ND, Groszmann RJ, Garcia‐Tsao G, Bosch J, Burroughs AK. Platelet count is not a predictor of the presence or development of gastroesophageal varices in cirrhosis.  Hepatology (Baltimore, Md) 2008;47:153‐9. CENTRAL    Link to article     PubMed     Google Scholar     ","['', 'https://doi.org/10.1002/hep.21941', 'https://www.ncbi.nlm.nih.gov/pubmed/18161700', 'https://scholar.google.com/scholar_lookup?title=Platelet+count+is+not+a+predictor+of+the+presence+or+development+of+gastroesophageal+varices+in+cirrhosis+&author=AA+Qamar&author=ND+Grace&author=RJ+Groszmann&author=G+Garcia‐Tsao&author=J+Bosch&author=AK+Burroughs&publication_year=2008&hl=en']",18161700,https://doi.org/10.1002/hep.21941, Qamar 2008 {published data only}  ,excluded,CD008759-bbs2-0090, No data for 2 × 2 table 
CD008759-bib-0094,"Rockey DC, Elliott A, Lyles T. ",Prediction of esophageal varices and variceal hemorrhage in patients with acute upper gastrointestinal bleeding, Journal of Investigative Medicine ,2016,64,    ,['citation-journal']," Rockey DC, Elliott A, Lyles T. Prediction of esophageal varices and variceal hemorrhage in patients with acute upper gastrointestinal bleeding.  Journal of Investigative Medicine 2016;64(3):745‐51. [CRS: 6800131000104572]CENTRAL    Link to article     PubMed     Google Scholar     ","['', 'https://doi.org/10.1136/jim-2015-000047', 'https://www.ncbi.nlm.nih.gov/pubmed/26912006', 'https://scholar.google.com/scholar_lookup?title=Prediction+of+esophageal+varices+and+variceal+hemorrhage+in+patients+with+acute+upper+gastrointestinal+bleeding+&author=DC+Rockey&author=A+Elliott&author=T+Lyles&publication_year=2016&hl=en']",26912006,https://doi.org/10.1136/jim-2015-000047, Rockey 2016 {published data only}  ,excluded,CD008759-bbs2-0091, Only patients wih acute upper gastrointestinal bleeding were included. 
CD008759-bib-0095,"Sebastiani G, Albert A, Castera l, Halfon P, Bourliere M, Angeli P, et al. ","Prediction of oesophageal varices in hepatic cirrhosis by simple non invasive markers: results of a multicenter, international study",,2008,,    ,['citation-other']," Sebastiani G, Albert A, Castera l, Halfon P, Bourliere M, Angeli P, et al. Prediction of oesophageal varices in hepatic cirrhosis by simple non invasive markers: results of a multicenter, international study. Hepatology (Baltimore, Md)2008; Vol. 48, issue 4 Suppl:624A. CENTRAL    Google Scholar     ","['', 'https://scholar.google.com/scholar_lookup?title=Prediction+of+oesophageal+varices+in+hepatic+cirrhosis+by+simple+non+invasive+markers:+results+of+a+multicenter,+international+study+&author=G+Sebastiani&author=A+Albert&author=l+Castera&author=P+Halfon&author=M+Bourliere&author=P+Angeli&publication_year=2008&hl=en']",,, Sebastiani 2008 {published data only}  ,excluded,CD008759-bbs2-0092, Preliminary data (Sebastiani 2010)  
CD008759-bib-0096,"Sethar GH, Ahmed R, Rathi SK, Shaikh NA. ",Platelet count/splenic size ratio: a parameter to predict the presence of esophageal varices in cirrhotics, Journal of the College of Physicians and Surgeons ‐ Pakistan ,2006,16,    ,['citation-journal']," Sethar GH, Ahmed R, Rathi SK, Shaikh NA. Platelet count/splenic size ratio: a parameter to predict the presence of esophageal varices in cirrhotics.  Journal of the College of Physicians and Surgeons ‐ Pakistan 2006;16(3):183‐6. [PUBMED: 16542615]CENTRAL    PubMed     Google Scholar     ","['', 'https://www.ncbi.nlm.nih.gov/pubmed/16542615', 'https://scholar.google.com/scholar_lookup?title=Platelet+count/splenic+size+ratio:+a+parameter+to+predict+the+presence+of+esophageal+varices+in+cirrhotics+&author=GH+Sethar&author=R+Ahmed&author=SK+Rathi&author=NA+Shaikh&publication_year=2006&hl=en']",16542615,, Sethar 2006 {published data only}  ,excluded,CD008759-bbs2-0093, No data for 2 × 2 table 
CD008759-bib-0097,"Shah ZH, Sarwar S, Saleem K, Abaidullah S, Mehboob F, Afzal A. ",Identification of non‐endoscopic predictors of esophageal varices in cirrhosis, Pakistan Journal of Medical and Health Sciences ,2011,5,    ,['citation-journal']," Shah ZH, Sarwar S, Saleem K, Abaidullah S, Mehboob F, Afzal A. Identification of non‐endoscopic predictors of esophageal varices in cirrhosis.  Pakistan Journal of Medical and Health Sciences 2011;5:257‐61. CENTRAL    Google Scholar     ","['', 'https://scholar.google.com/scholar_lookup?title=Identification+of+non‐endoscopic+predictors+of+esophageal+varices+in+cirrhosis&author=ZH+Shah&author=S+Sarwar&author=K+Saleem&author=S+Abaidullah&author=F+Mehboob&author=A+Afzal&publication_year=2011&hl=en']",,, Shah 2011 {published data only}  ,excluded,CD008759-bbs2-0094, No data for 2 × 2 table 
CD008759-bib-0098,"Sharma SK, Aggarwal R. ","Prediction of large esophageal varices in patients with cirrhosis of the liver using clinical, laboratory and imaging parameters", Journal of Gastroenterology and Hepatology ,2007,22,    ,['citation-journal']," Sharma SK, Aggarwal R. Prediction of large esophageal varices in patients with cirrhosis of the liver using clinical, laboratory and imaging parameters.  Journal of Gastroenterology and Hepatology 2007;22(11):1909‐15. [PUBMED: 17914969]CENTRAL    Link to article     PubMed     Google Scholar     ","['', 'https://doi.org/10.1111/j.1440-1746.2006.04501.x', 'https://www.ncbi.nlm.nih.gov/pubmed/17914969', 'https://scholar.google.com/scholar_lookup?title=Prediction+of+large+esophageal+varices+in+patients+with+cirrhosis+of+the+liver+using+clinical,+laboratory+and+imaging+parameters+&author=SK+Sharma&author=R+Aggarwal&publication_year=2007&hl=en']",17914969,https://doi.org/10.1111/j.1440-1746.2006.04501.x, Sharma 2007 {published data only}  ,excluded,CD008759-bbs2-0095, Platelet data for large oesophageal varices were not extractable from the text. Study proposes predictor function model derived from multi‐variate analysis as better model to predict large oesophageal varices  
CD008759-bib-0099,"Takuma Y, Nouso K, Morimoto Y, Tomokuni J, Sahara A, Takabatake H, et al. ",Portal hypertension in patients with liver cirrhosis: diagnostic accuracy of spleen stiffness, Radiology ,2016,279,    ,['citation-journal']," Takuma Y, Nouso K, Morimoto Y, Tomokuni J, Sahara A, Takabatake H, et al. Portal hypertension in patients with liver cirrhosis: diagnostic accuracy of spleen stiffness.  Radiology 2016;279(2):609‐19. [CRS: 6800131000104355; EMBASE: 20160357558]CENTRAL    Link to article     PubMed     Google Scholar     ","['', 'https://doi.org/10.1148/radiol.2015150690', 'https://www.ncbi.nlm.nih.gov/pubmed/26588019', 'https://scholar.google.com/scholar_lookup?title=Portal+hypertension+in+patients+with+liver+cirrhosis:+diagnostic+accuracy+of+spleen+stiffness+&author=Y+Takuma&author=K+Nouso&author=Y+Morimoto&author=J+Tomokuni&author=A+Sahara&author=H+Takabatake&publication_year=2016&hl=en']",26588019,https://doi.org/10.1148/radiol.2015150690, Takuma 2016 {published data only}  ,excluded,CD008759-bbs2-0096, No data for 2 × 2 table 
CD008759-bib-0100,"Tao W, Yang SQ, Lv XC, Yang L. ",Value of the platelet count/spleen diameter ratio on diagnosis of esophageal varices in patients with cirrhosis, Journal of Ningxia Medical College ,2008,30,    ,['citation-journal']," Tao W, Yang SQ, Lv XC, Yang L. Value of the platelet count/spleen diameter ratio on diagnosis of esophageal varices in patients with cirrhosis.  Journal of Ningxia Medical College 2008;30:349‐50. CENTRAL    Google Scholar     ","['', 'https://scholar.google.com/scholar_lookup?title=Value+of+the+platelet+count/spleen+diameter+ratio+on+diagnosis+of+esophageal+varices+in+patients+with+cirrhosis+&author=W+Tao&author=SQ+Yang&author=XC+Lv&author=L+Yang&publication_year=2008&hl=en']",,, Tao 2008 {published data only}  ,excluded,CD008759-bbs2-0097, No data for 2 × 2 table. Published data not consistent 
