reference_id,authors,title,journal,year,volume,citation_footer,citation_type,citation,urls,pubmed_id,doi,header,reference_type,study_id,exclusion_reason
CD011420-bib-0093,"Singh L, Grover N. ",Detection of TB antigen by rapid test kit, Medical Journal Armed Forces India ,2011,67,    ,['citation-journal']," Singh L, Grover N. Detection of TB antigen by rapid test kit.  Medical Journal Armed Forces India 2011;67(2):196‐7. CENTRAL    Link to article     Google Scholar     ","['', 'https://doi.org/10.1016/S0377-1237(11)60038-5', 'https://scholar.google.com/scholar_lookup?title=Detection+of+TB+antigen+by+rapid+test+kit&author=L+Singh&author=N+Grover&publication_year=2011&hl=en']",,https://doi.org/10.1016/S0377-1237(11)60038-5, Singh 2011 {published data only}  ,excluded,CD011420-bbs2-0093, Index test not studied 
CD011420-bib-0094,"Sun D, Dorman S, Shah M, Manabe YC, Moodley VM, Nicol MP, et al. ",Cost utility of lateral‐flow urine lipoarabinomannan for tuberculosis diagnosis in HIV‐infected African adults, International Journal of Tuberculosis and Lung Disease ,2013,17,    ,['citation-journal']," Sun D, Dorman S, Shah M, Manabe YC, Moodley VM, Nicol MP, et al. Cost utility of lateral‐flow urine lipoarabinomannan for tuberculosis diagnosis in HIV‐infected African adults.  International Journal of Tuberculosis and Lung Disease 2013;17(4):552‐8. CENTRAL    Link to article     Google Scholar     ","['', 'https://doi.org/10.5588/ijtld.12.0627', 'https://scholar.google.com/scholar_lookup?title=Cost+utility+of+lateral‐flow+urine+lipoarabinomannan+for+tuberculosis+diagnosis+in+HIV‐infected+African+adults+&author=D+Sun&author=S+Dorman&author=M+Shah&author=YC+Manabe&author=VM+Moodley&author=MP+Nicol&publication_year=2013&hl=en']",,https://doi.org/10.5588/ijtld.12.0627, Sun 2013 {published data only}  ,excluded,CD011420-bbs2-0094, Insufficient data 
CD011420-bib-0095,"Suwanpimolkul G, Kawkitinarong K, Manosuthi W, Sophonphan J, Gatechompol S, Ohata PJ, et al. ",Utility of urine lipoarabinomannan (LAM) in diagnosing tuberculosis and predicting mortality with and without HIV: prospective TB cohort from the Thailand big city TB research network, International Journal of Infectious Diseases ,2017,59,    ,['citation-journal']," Suwanpimolkul G, Kawkitinarong K, Manosuthi W, Sophonphan J, Gatechompol S, Ohata PJ, et al. Utility of urine lipoarabinomannan (LAM) in diagnosing tuberculosis and predicting mortality with and without HIV: prospective TB cohort from the Thailand big city TB research network.  International Journal of Infectious Diseases 2017;59:96‐102. [DOI: 10.1016/j.ijid.2017.04.017]CENTRAL    Link to article     PubMed     Google Scholar     ","['', 'https://doi.org/10.1016/j.ijid.2017.04.017', 'https://www.ncbi.nlm.nih.gov/pubmed/28457751', 'https://scholar.google.com/scholar_lookup?title=Utility+of+urine+lipoarabinomannan+(LAM)+in+diagnosing+tuberculosis+and+predicting+mortality+with+and+without+HIV:+prospective+TB+cohort+from+the+Thailand+big+city+TB+research+network+&author=G+Suwanpimolkul&author=K+Kawkitinarong&author=W+Manosuthi&author=J+Sophonphan&author=S+Gatechompol&author=PJ+Ohata&publication_year=2017&hl=en']",28457751,https://doi.org/10.1016/j.ijid.2017.04.017, Suwanpimolkul 2017 {published data only}  ,excluded,CD011420-bbs2-0095, Did not use manufacturer's current recommended positivity threshold 
CD011420-bib-0096,"Tessema TA, Hamasur B, Bjun G, Svenson S, Bjorvatn B. ",Diagnostic evaluation of urinary lipoarabinomannan at an Ethiopian tuberculosis centre, Scandinavian Journal of Infectious Diseases ,2001,33,    ,['citation-journal']," Tessema TA, Hamasur B, Bjun G, Svenson S, Bjorvatn B. Diagnostic evaluation of urinary lipoarabinomannan at an Ethiopian tuberculosis centre.  Scandinavian Journal of Infectious Diseases 2001;33(4):279‐84. CENTRAL    PubMed     Google Scholar     ","['', 'https://www.ncbi.nlm.nih.gov/pubmed/11345220', 'https://scholar.google.com/scholar_lookup?title=Diagnostic+evaluation+of+urinary+lipoarabinomannan+at+an+Ethiopian+tuberculosis+centre&author=TA+Tessema&author=B+Hamasur&author=G+Bjun&author=S+Svenson&author=B+Bjorvatn&publication_year=2001&hl=en']",11345220,, Tessema 2001 {published data only}  ,excluded,CD011420-bbs2-0096, Index test not studied 
CD011420-bib-0097,"Tessema TA, Bjune G, Assefa G, Svenson S, Hamasur B, Bjorvatn B. ",Clinical and radiological features in relation to urinary excretion of lipoarabinomannan in Ethiopian tuberculosis patients, Scandinavian Journal of Infectious Diseases ,2002,34,    ,['citation-journal']," Tessema TA, Bjune G, Assefa G, Svenson S, Hamasur B, Bjorvatn B. Clinical and radiological features in relation to urinary excretion of lipoarabinomannan in Ethiopian tuberculosis patients.  Scandinavian Journal of Infectious Diseases 2002;34(3):167‐71. CENTRAL    Link to article     PubMed     Google Scholar     ","['', 'https://doi.org/10.1080/00365540110077254', 'https://www.ncbi.nlm.nih.gov/pubmed/12030387', 'https://scholar.google.com/scholar_lookup?title=Clinical+and+radiological+features+in+relation+to+urinary+excretion+of+lipoarabinomannan+in+Ethiopian+tuberculosis+patients+&author=TA+Tessema&author=G+Bjune&author=G+Assefa&author=S+Svenson&author=B+Hamasur&author=B+Bjorvatn&publication_year=2002&hl=en']",12030387,https://doi.org/10.1080/00365540110077254, Tessema 2002a {published data only}  ,excluded,CD011420-bbs2-0097, Index test not studied 
CD011420-bib-0098,"Tessema TA, Bjune G, Hamasur B, Svenson S, Syre H, Bjorvatn B. ","Circulating antibodies to lipoarabinomannan in relation to sputum microscopy, clinical features and urinary anti‐lipoarabinomannan detection in pulmonary tuberculosis", Scandinavian Journal of Infectious Diseases ,2002,34,    ,['citation-journal']," Tessema TA, Bjune G, Hamasur B, Svenson S, Syre H, Bjorvatn B. Circulating antibodies to lipoarabinomannan in relation to sputum microscopy, clinical features and urinary anti‐lipoarabinomannan detection in pulmonary tuberculosis.  Scandinavian Journal of Infectious Diseases 2002;34(2):97‐103. CENTRAL    PubMed     Google Scholar     ","['', 'https://www.ncbi.nlm.nih.gov/pubmed/11928861', 'https://scholar.google.com/scholar_lookup?title=Circulating+antibodies+to+lipoarabinomannan+in+relation+to+sputum+microscopy,+clinical+features+and+urinary+anti‐lipoarabinomannan+detection+in+pulmonary+tuberculosis+&author=TA+Tessema&author=G+Bjune&author=B+Hamasur&author=S+Svenson&author=H+Syre&author=B+Bjorvatn&publication_year=2002&hl=en']",11928861,, Tessema 2002b {published data only}  ,excluded,CD011420-bbs2-0098, Index test not studied 
CD011420-bib-0099,"Tlali M, Fielding K, Charalambous S, Karat A, Hoffmann C, Johnson S, et al. ",Sensitivity of the TB Determine LAM test compared to sputum culture gold standard TB in ambulant HIV positive participants enrolled in the TB fast track study in South Africa,,2014,,    ,['citation-other']," Tlali M, Fielding K, Charalambous S, Karat A, Hoffmann C, Johnson S, et al. Sensitivity of the TB Determine LAM test compared to sputum culture gold standard TB in ambulant HIV positive participants enrolled in the TB fast track study in South Africa. 4th South African TB Conference. Durban, 2014. CENTRAL    Google Scholar     ","['', 'https://scholar.google.com/scholar_lookup?title=Sensitivity+of+the+TB+Determine+LAM+test+compared+to+sputum+culture+gold+standard+TB+in+ambulant+HIV+positive+participants+enrolled+in+the+TB+fast+track+study+in+South+Africa+&author=M+Tlali&author=K+Fielding&author=S+Charalambous&author=A+Karat&author=C+Hoffmann&author=S+Johnson&publication_year=2014&hl=en']",,, Tlali 2014 {unpublished data only}  ,excluded,CD011420-bbs2-0099, Insufficient or duplicate data 
CD011420-bib-0100,"Van Rie A, Jong E, Mkhwanazi M, Sanne I. ",Diagnosing TB in those hardest to diagnose: urine lipoarabinomannan for suspects of disseminated and extrapulmonary TB,,2013,,    ,['citation-other']," Van Rie A, Jong E, Mkhwanazi M, Sanne I. Diagnosing TB in those hardest to diagnose: urine lipoarabinomannan for suspects of disseminated and extrapulmonary TB. Conference on Retroviruses and Opportunistic Infections (CROI). Atlanta (GA), 2013:443. CENTRAL    Google Scholar     ","['', 'https://scholar.google.com/scholar_lookup?title=Diagnosing+TB+in+those+hardest+to+diagnose:+urine+lipoarabinomannan+for+suspects+of+disseminated+and+extrapulmonary+TB+&author=A+Rie&author=E+Jong&author=M+Mkhwanazi&author=I+Sanne&publication_year=2013&hl=en']",,, Van Rie 2013 {unpublished data only}  ,excluded,CD011420-bbs2-0100, Insufficient or duplicate data 
CD011420-bib-0101,"Wood R, Racow K, Bekker LG, Middelkoop K, Vogt M, Kreiswirth BN, et al. ",Lipoarabinomannan in urine during tuberculosis treatment: association with host and pathogen factors and mycobacteriuria, BMC Infectious Diseases ,2012,12,    ,['citation-journal']," Wood R, Racow K, Bekker LG, Middelkoop K, Vogt M, Kreiswirth BN, et al. Lipoarabinomannan in urine during tuberculosis treatment: association with host and pathogen factors and mycobacteriuria.  BMC Infectious Diseases 2012;12:47. CENTRAL    Link to article     PubMed     Google Scholar     ","['', 'https://doi.org/10.1186/1471-2334-12-47', 'https://www.ncbi.nlm.nih.gov/pubmed/22369353', 'https://scholar.google.com/scholar_lookup?title=Lipoarabinomannan+in+urine+during+tuberculosis+treatment:+association+with+host+and+pathogen+factors+and+mycobacteriuria+&author=R+Wood&author=K+Racow&author=LG+Bekker&author=K+Middelkoop&author=M+Vogt&author=BN+Kreiswirth&publication_year=2012&hl=en']",22369353,https://doi.org/10.1186/1471-2334-12-47, Wood 2012 {published data only}  ,excluded,CD011420-bbs2-0101, Index test not studied 
CD011420-bib-0102,"Zijenah LS, Kadzirange G, Bandason T, Chipiti MM, Gwambiwa B, Makoga F, et al. ","Comparative performance characteristics of the urine lipoarabinomannan strip test and sputum smear microscopy in hospitalized HIV‐infected patients with suspected tuberculosis in Harare, Zimbabwe",,2016,,    ,['citation-other']," Zijenah LS, Kadzirange G, Bandason T, Chipiti MM, Gwambiwa B, Makoga F, et al. Comparative performance characteristics of the urine lipoarabinomannan strip test and sputum smear microscopy in hospitalized HIV‐infected patients with suspected tuberculosis in Harare, Zimbabwe. BMC Infectious Diseases2016; Vol. 16:20. [10.1186/s12879‐016‐1339‐z]CENTRAL    Google Scholar     ","['', 'https://scholar.google.com/scholar_lookup?title=Comparative+performance+characteristics+of+the+urine+lipoarabinomannan+strip+test+and+sputum+smear+microscopy+in+hospitalized+HIV‐infected+patients+with+suspected+tuberculosis+in+Harare,+Zimbabwe+&author=LS+Zijenah&author=G+Kadzirange&author=T+Bandason&author=MM+Chipiti&author=B+Gwambiwa&author=F+Makoga&publication_year=2016&hl=en']",,, Zijenah 2016 {published data only}  ,excluded,CD011420-bbs2-0102, Second reference (complementary data) to Peter 2016  
CD011420-bib-0103,Abbott. ,Alere DetermineTM TB LAM Ag Product Information,,,,. alere.com/en/home/product‐details/determine‐tb‐lam.html (accessed July 18 2017:IN02740004 Rev. 07 2017/08.   ,['citation-other'], Abbott. Alere DetermineTM TB LAM Ag Product Information. alere.com/en/home/product‐details/determine‐tb‐lam.html (accessed July 18 2017:IN02740004 Rev. 07 2017/08.    ,[],,, Alere 2017 ,additional,CD011420-bbs2-0103,
CD011420-bib-0104,"Balshem H, Helfand M, Schünemann HJ, Oxman AD, Kunz R, Brozek J, et al. ",GRADE guidelines: 3. Rating the quality of evidence, Journal of Clinical Epidemiology ,2011,64(4),    ,['citation-journal']," Balshem H, Helfand M, Schünemann HJ, Oxman AD, Kunz R, Brozek J, et al. GRADE guidelines: 3. Rating the quality of evidence.  Journal of Clinical Epidemiology 2011;64(4):401‐6.    Link to article     Google Scholar     ","['https://doi.org/10.1016/j.jclinepi.2010.07.015', 'https://scholar.google.com/scholar_lookup?title=GRADE+guidelines:+3.+Rating+the+quality+of+evidence&author=H+Balshem&author=M+Helfand&author=HJ+Schünemann&author=AD+Oxman&author=R+Kunz&author=J+Brozek&publication_year=2011&hl=en']",,https://doi.org/10.1016/j.jclinepi.2010.07.015, Balshem 2011 ,additional,CD011420-bbs2-0104,
CD011420-bib-0105,"Batz HG, Cooke GS, Reid SD. ",Towards lab‐free tuberculosis diagnosis. August 2011,,,,". msfaccess.org/sites/default/files/MSF_assets/TB/Docs/TB_Report_TowardsLabFreeTBDX_2011_ENG.pdf. London: Imperial College, (accessed 16 November 2014).   ",['citation-other']," Batz HG, Cooke GS, Reid SD. Towards lab‐free tuberculosis diagnosis. August 2011. msfaccess.org/sites/default/files/MSF_assets/TB/Docs/TB_Report_TowardsLabFreeTBDX_2011_ENG.pdf. London: Imperial College, (accessed 16 November 2014).    ",[],,, Batz 2011 ,additional,CD011420-bbs2-0105,
CD011420-bib-0106,"Boyles TH, Griesel R, Stewart A, Mendelson M, Maartens G. ",Incremental yield and cost of urine Determine TB‐LAM and sputum induction in seriously ill adults with HIV, International Journal of Infectious Diseases ,2018,75,    ,['citation-journal']," Boyles TH, Griesel R, Stewart A, Mendelson M, Maartens G. Incremental yield and cost of urine Determine TB‐LAM and sputum induction in seriously ill adults with HIV.  International Journal of Infectious Diseases 2018;75:67‐73.    Link to article     PubMed     Google Scholar     ","['https://doi.org/10.1016/j.ijid.2018.08.005', 'https://www.ncbi.nlm.nih.gov/pubmed/30125689', 'https://scholar.google.com/scholar_lookup?title=Incremental+yield+and+cost+of+urine+Determine+TB‐LAM+and+sputum+induction+in+seriously+ill+adults+with+HIV+&author=TH+Boyles&author=R+Griesel&author=A+Stewart&author=M+Mendelson&author=G+Maartens&publication_year=2018&hl=en']",30125689,https://doi.org/10.1016/j.ijid.2018.08.005, Boyles 2018 ,additional,CD011420-bbs2-0106,
CD011420-bib-0107,Brennan PJ. ,"Structure, function, and biogenesis of the cell wall of Mycobacterium tuberculosis", Tuberculosis (Edinb) ,2003,83,    ,['citation-journal']," Brennan PJ. Structure, function, and biogenesis of the cell wall of Mycobacterium tuberculosis.  Tuberculosis (Edinb) 2003;83(1‐3):91‐7.    Link to article     PubMed     Google Scholar     ","['https://doi.org/10.1016/S1472-9792(02)00089-6', 'https://www.ncbi.nlm.nih.gov/pubmed/12758196', 'https://scholar.google.com/scholar_lookup?title=Structure,+function,+and+biogenesis+of+the+cell+wall+of+Mycobacterium+tuberculosis&author=PJ+Brennan&publication_year=2003&hl=en']",12758196,https://doi.org/10.1016/S1472-9792(02)00089-6, Brennan 2003 ,additional,CD011420-bbs2-0107,
CD011420-bib-0108,"Briken V, Porcelli SA, Besra GS, Kremer L. ",Mycobacterial lipoarabinomannan and related lipoglycans: from biogenesis to modulation of the immune response, Molecular Microbiology ,2004,53,    ,['citation-journal']," Briken V, Porcelli SA, Besra GS, Kremer L. Mycobacterial lipoarabinomannan and related lipoglycans: from biogenesis to modulation of the immune response.  Molecular Microbiology 2004;53(2):391‐403.    Link to article     PubMed     Google Scholar     ","['https://doi.org/10.1111/j.1365-2958.2004.04183.x', 'https://www.ncbi.nlm.nih.gov/pubmed/15228522', 'https://scholar.google.com/scholar_lookup?title=Mycobacterial+lipoarabinomannan+and+related+lipoglycans:+from+biogenesis+to+modulation+of+the+immune+response+&author=V+Briken&author=SA+Porcelli&author=GS+Besra&author=L+Kremer&publication_year=2004&hl=en']",15228522,https://doi.org/10.1111/j.1365-2958.2004.04183.x, Briken 2004 ,additional,CD011420-bbs2-0108,
CD011420-bib-0109,"Broger T, Sossen B, du Toit E, Kerkhoff AD, Schutz C, Reipold EI, et al. ",Novel lipoarabinomannan point‐of‐care tuberculosis test for people living with HIV: a diagnostic accuracy study, Lancet Infectious Diseases ,2019,19,    ,['citation-journal']," Broger T, Sossen B, du Toit E, Kerkhoff AD, Schutz C, Reipold EI, et al. Novel lipoarabinomannan point‐of‐care tuberculosis test for people living with HIV: a diagnostic accuracy study.  Lancet Infectious Diseases 2019;19(8):852‐61. [DOI: 10.1016/S1473‐3099(19)30001‐5]    Link to article     PubMed     Google Scholar     ","['https://doi.org/10.1016/S1473-3099(19)30001-5', 'https://www.ncbi.nlm.nih.gov/pubmed/31155318', 'https://scholar.google.com/scholar_lookup?title=Novel+lipoarabinomannan+point‐of‐care+tuberculosis+test+for+people+living+with+HIV:+a+diagnostic+accuracy+study+&author=T+Broger&author=B+Sossen&author=E+duToit&author=AD+Kerkhoff&author=C+Schutz&author=EI+Reipold&publication_year=2019&hl=en']",31155318,https://doi.org/10.1016/S1473-3099(19)30001-5, Broger 2019 ,additional,CD011420-bbs2-0109,
CD011420-bib-0110,"Cain KP, McCarthy KD, Heilig CM, Monkongdee P, Tasaneeyapan T, Kanara N, et al. ",An algorithm for tuberculosis screening and diagnosis in people with HIV, New England Journal of Medicine ,2010,362,    ,['citation-journal']," Cain KP, McCarthy KD, Heilig CM, Monkongdee P, Tasaneeyapan T, Kanara N, et al. An algorithm for tuberculosis screening and diagnosis in people with HIV.  New England Journal of Medicine 2010;362(8):707‐16.    Link to article     Google Scholar     ","['https://doi.org/10.1056/NEJMoa0907488', 'https://scholar.google.com/scholar_lookup?title=An+algorithm+for+tuberculosis+screening+and+diagnosis+in+people+with+HIV&author=KP+Cain&author=KD+McCarthy&author=CM+Heilig&author=P+Monkongdee&author=T+Tasaneeyapan&author=N+Kanara&publication_year=2010&hl=en']",,https://doi.org/10.1056/NEJMoa0907488, Cain 2010 ,additional,CD011420-bbs2-0110,
CD011420-bib-0111,"Chu H, Cole SR. ",Bivariate meta‐analysis of sensitivity and specificity with sparse data: a generalized linear mixed model approach, Journal of Clinical Epidemiology ,2006,59,    ,['citation-journal']," Chu H, Cole SR. Bivariate meta‐analysis of sensitivity and specificity with sparse data: a generalized linear mixed model approach.  Journal of Clinical Epidemiology 2006;59(12):1331–2.    Link to article     Google Scholar     ","['https://doi.org/10.1016/j.jclinepi.2006.06.011', 'https://scholar.google.com/scholar_lookup?title=Bivariate+meta‐analysis+of+sensitivity+and+specificity+with+sparse+data:+a+generalized+linear+mixed+model+approach+&author=H+Chu&author=SR+Cole&publication_year=2006&hl=en']",,https://doi.org/10.1016/j.jclinepi.2006.06.011, Chu 2006 ,additional,CD011420-bbs2-0111,
CD011420-bib-0112,"Chu H, Chen S, Louis TA. ",Random effects models in a meta‐analysis of the accuracy of two diagnostic tests without a gold standard, Journal of the American Statistical Association ,2009,104,    ,['citation-journal']," Chu H, Chen S, Louis TA. Random effects models in a meta‐analysis of the accuracy of two diagnostic tests without a gold standard.  Journal of the American Statistical Association 2009;104(486):512‐23.    Link to article     PubMed     Google Scholar     ","['https://doi.org/10.1198/jasa.2009.0017', 'https://www.ncbi.nlm.nih.gov/pubmed/19562044', 'https://scholar.google.com/scholar_lookup?title=Random+effects+models+in+a+meta‐analysis+of+the+accuracy+of+two+diagnostic+tests+without+a+gold+standard+&author=H+Chu&author=S+Chen&author=TA+Louis&publication_year=2009&hl=en']",19562044,https://doi.org/10.1198/jasa.2009.0017, Chu 2009 ,additional,CD011420-bbs2-0112,
CD011420-bib-0113,Veritas Health Innovation. ,Covidence systematic review software. Available at www.covidence.org,,2017,,.   ,['citation-other']," Veritas Health Innovation. Covidence systematic review software. Available at www.covidence.org. Melbourne: Veritas Health Innovation, 2017.    ",[],,, Covidence 2017 [Computer program] ,additional,CD011420-bbs2-0113,
CD011420-bib-0114,Foundation for Innovative New Diagnostics (FIND). ,"Call for trial partners now open to advance evaluation of an innovative, sensitive point‐of‐care test that detects tuberculosis in HIV‐positive people",,,,. finddx.org/publication/pr‐26sep18/ (accessed 14 June 2019).   ,['citation-other']," Foundation for Innovative New Diagnostics (FIND). Call for trial partners now open to advance evaluation of an innovative, sensitive point‐of‐care test that detects tuberculosis in HIV‐positive people. finddx.org/publication/pr‐26sep18/ (accessed 14 June 2019).    ",[],,, FIND 2018 ,additional,CD011420-bbs2-0114,
CD011420-bib-0115,"Flores LL, Pai M, Colford JM, Riley LW. ",In‐house nucleic acid amplification tests for the detection of Mycobacterium tuberculosis in sputum specimens: meta‐analysis and meta‐regression, BMC Microbiology ,2005,5,    ,['citation-journal']," Flores LL, Pai M, Colford JM, Riley LW. In‐house nucleic acid amplification tests for the detection of Mycobacterium tuberculosis in sputum specimens: meta‐analysis and meta‐regression.  BMC Microbiology 2005;5:55.    Link to article     PubMed     Google Scholar     ","['https://doi.org/10.1186/1471-2180-5-55', 'https://www.ncbi.nlm.nih.gov/pubmed/16202138', 'https://scholar.google.com/scholar_lookup?title=In‐house+nucleic+acid+amplification+tests+for+the+detection+of+Mycobacterium+tuberculosis+in+sputum+specimens:+meta‐analysis+and+meta‐regression+&author=LL+Flores&author=M+Pai&author=JM+Colford&author=LW+Riley&publication_year=2005&hl=en']",16202138,https://doi.org/10.1186/1471-2180-5-55, Flores 2005 ,additional,CD011420-bbs2-0115,
CD011420-bib-0116,"Ford N, Matteelli A, Shubber Z, Hermans S, Meintjes G, Grinsztejn B, et al. ",TB as a cause of hospitalization and in‐hospital mortality among people living with HIV worldwide: a systematic review and meta‐analysis, Journal of the International AIDS Society ,2016,19,    ,['citation-journal']," Ford N, Matteelli A, Shubber Z, Hermans S, Meintjes G, Grinsztejn B, et al. TB as a cause of hospitalization and in‐hospital mortality among people living with HIV worldwide: a systematic review and meta‐analysis.  Journal of the International AIDS Society 2016;19(1):20714.    Link to article     PubMed     Google Scholar     ","['https://doi.org/10.7448/IAS.19.1.20714', 'https://www.ncbi.nlm.nih.gov/pubmed/26765347', 'https://scholar.google.com/scholar_lookup?title=TB+as+a+cause+of+hospitalization+and+in‐hospital+mortality+among+people+living+with+HIV+worldwide:+a+systematic+review+and+meta‐analysis+&author=N+Ford&author=A+Matteelli&author=Z+Shubber&author=S+Hermans&author=G+Meintjes&author=B+Grinsztejn&publication_year=2016&hl=en']",26765347,https://doi.org/10.7448/IAS.19.1.20714, Ford 2016 ,additional,CD011420-bbs2-0116,
CD011420-bib-0117,"Getahun H, Harrington M, O'Brien R, Nunn P. ",Diagnosis of smear‐negative pulmonary tuberculosis in people with HIV infection or AIDS in resource‐constrained settings: informing urgent policy changes, Lancet ,2007,369,    ,['citation-journal']," Getahun H, Harrington M, O'Brien R, Nunn P. Diagnosis of smear‐negative pulmonary tuberculosis in people with HIV infection or AIDS in resource‐constrained settings: informing urgent policy changes.  Lancet 2007;369(9578):2042‐9.    Link to article     PubMed     Google Scholar     ","['https://doi.org/10.1016/S0140-6736(07)60284-0', 'https://www.ncbi.nlm.nih.gov/pubmed/17574096', ""https://scholar.google.com/scholar_lookup?title=Diagnosis+of+smear‐negative+pulmonary+tuberculosis+in+people+with+HIV+infection+or+AIDS+in+resource‐constrained+settings:+informing+urgent+policy+changes+&author=H+Getahun&author=M+Harrington&author=R+O'Brien&author=P+Nunn&publication_year=2007&hl=en""]",17574096,https://doi.org/10.1016/S0140-6736(07)60284-0, Getahun 2007 ,additional,CD011420-bbs2-0117,
CD011420-bib-0118,"Getahun H, Gunneberg C, Granich R, Nunn P. ",HIV infection—associated tuberculosis: the epidemiology and the response, Clinical Infectious Diseases ,2010,50,    ,['citation-journal']," Getahun H, Gunneberg C, Granich R, Nunn P. HIV infection—associated tuberculosis: the epidemiology and the response.  Clinical Infectious Diseases 2010;50(Suppl 3):S201–7.    Link to article     PubMed     Google Scholar     ","['https://doi.org/10.1086/651492', 'https://www.ncbi.nlm.nih.gov/pubmed/20397949', 'https://scholar.google.com/scholar_lookup?title=HIV+infection—associated+tuberculosis:+the+epidemiology+and+the+response&author=H+Getahun&author=C+Gunneberg&author=R+Granich&author=P+Nunn&publication_year=2010&hl=en']",20397949,https://doi.org/10.1086/651492, Getahun 2010 ,additional,CD011420-bbs2-0118,
CD011420-bib-0119,"Getahun H, Kittikraisak W, Heilig CM, Corbett EL, Ayles H, Cain KP, et al. ",Development of a standardized screening rule for tuberculosis in people living with HIV in resource‐constrained settings: individual participant data meta‐analysis of observational studies, PLOS Medicine ,2011,8,    ,['citation-journal']," Getahun H, Kittikraisak W, Heilig CM, Corbett EL, Ayles H, Cain KP, et al. Development of a standardized screening rule for tuberculosis in people living with HIV in resource‐constrained settings: individual participant data meta‐analysis of observational studies.  PLOS Medicine 2011;8(1):e1000391.    Link to article     PubMed     Google Scholar     ","['https://doi.org/10.1371/journal.pmed.1000391', 'https://www.ncbi.nlm.nih.gov/pubmed/21267059', 'https://scholar.google.com/scholar_lookup?title=Development+of+a+standardized+screening+rule+for+tuberculosis+in+people+living+with+HIV+in+resource‐constrained+settings:+individual+participant+data+meta‐analysis+of+observational+studies+&author=H+Getahun&author=W+Kittikraisak&author=CM+Heilig&author=EL+Corbett&author=H+Ayles&author=KP+Cain&publication_year=2011&hl=en']",21267059,https://doi.org/10.1371/journal.pmed.1000391, Getahun 2011 ,additional,CD011420-bbs2-0119,
