reference_id,authors,title,journal,year,volume,citation_footer,citation_type,citation,urls,pubmed_id,doi,header,reference_type,study_id,exclusion_reason
CD011420-bib-0070,"Musarurwa C, Zijenah LS, Mhandire DZ, Bandason T, Mhandire K, Chipiti MM, et al. ",Higher serum 25‐hydroxyvitamin D concentrations are associated with active pulmonary tuberculosis in hospitalised HIV infected patients in a low income tropical setting: a cross sectional study, BMC Pulmonary Medicine ,2018,18,    ,['citation-journal']," Musarurwa C, Zijenah LS, Mhandire DZ, Bandason T, Mhandire K, Chipiti MM, et al. Higher serum 25‐hydroxyvitamin D concentrations are associated with active pulmonary tuberculosis in hospitalised HIV infected patients in a low income tropical setting: a cross sectional study.  BMC Pulmonary Medicine 2018;18(1):67. [DOI: 10.1186/s12890‐018‐0640‐6]CENTRAL    Link to article     PubMed     Google Scholar     ","['', 'https://doi.org/10.1186/s12890-018-0640-6', 'https://www.ncbi.nlm.nih.gov/pubmed/29739378', 'https://scholar.google.com/scholar_lookup?title=Higher+serum+25‐hydroxyvitamin+D+concentrations+are+associated+with+active+pulmonary+tuberculosis+in+hospitalised+HIV+infected+patients+in+a+low+income+tropical+setting:+a+cross+sectional+study+&author=C+Musarurwa&author=LS+Zijenah&author=DZ+Mhandire&author=T+Bandason&author=K+Mhandire&author=MM+Chipiti&publication_year=2018&hl=en']",29739378,https://doi.org/10.1186/s12890-018-0640-6, Musarurwa 2018 {published data only}  ,excluded,CD011420-bbs2-0070, Not a diagnostic accuracy study 
CD011420-bib-0071,"Mutetwa R, Boehme C, Dimairo M, Bandason T, Munyati SS, Mangwanya D, et al. ",Diagnostic accuracy of commercial urinary lipoarabinomannan detection in African tuberculosis suspects and patients, International Journal of Tuberculosis and Lung Disease ,2009,13,    ,['citation-journal']," Mutetwa R, Boehme C, Dimairo M, Bandason T, Munyati SS, Mangwanya D, et al. Diagnostic accuracy of commercial urinary lipoarabinomannan detection in African tuberculosis suspects and patients.  International Journal of Tuberculosis and Lung Disease 2009;13(10):1253‐9. CENTRAL    Google Scholar     ","['', 'https://scholar.google.com/scholar_lookup?title=Diagnostic+accuracy+of+commercial+urinary+lipoarabinomannan+detection+in+African+tuberculosis+suspects+and+patients+&author=R+Mutetwa&author=C+Boehme&author=M+Dimairo&author=T+Bandason&author=SS+Munyati&author=D+Mangwanya&publication_year=2009&hl=en']",,, Mutetwa 2009 {published data only}  ,excluded,CD011420-bbs2-0071, Index test not studied 
CD011420-bib-0072,"Nakiyingi L, Ssengooba W, Nakanjako D, Armstrong D, Holshouser M, Kirenga BJ, et al. ",Predictors and outcomes of mycobacteremia among HIV‐infected smear‐ negative presumptive tuberculosis patients in Uganda, BMC Infectious Diseases ,2015,15,    ,['citation-journal']," Nakiyingi L, Ssengooba W, Nakanjako D, Armstrong D, Holshouser M, Kirenga BJ, et al. Predictors and outcomes of mycobacteremia among HIV‐infected smear‐ negative presumptive tuberculosis patients in Uganda.  BMC Infectious Diseases 2015;15:62. [DOI: 10.1186/s12879‐015‐0812‐4]CENTRAL    Link to article     PubMed     Google Scholar     ","['', 'https://doi.org/10.1186/s12879-015-0812-4', 'https://www.ncbi.nlm.nih.gov/pubmed/25888317', 'https://scholar.google.com/scholar_lookup?title=Predictors+and+outcomes+of+mycobacteremia+among+HIV‐infected+smear‐+negative+presumptive+tuberculosis+patients+in+Uganda+&author=L+Nakiyingi&author=W+Ssengooba&author=D+Nakanjako&author=D+Armstrong&author=M+Holshouser&author=BJ+Kirenga&publication_year=2015&hl=en']",25888317,https://doi.org/10.1186/s12879-015-0812-4, Nakiyingi 2015 {published data only}  ,excluded,CD011420-bbs2-0072, Second reference (complementary data) to Nakiyingi 2014  
CD011420-bib-0073,"Nakiyingi L, Nonyane BA, Ssengooba W, Kirenga BJ, Nakanjako D, Lubega G, et al. ",Predictors for MTB culture‐positivity among HIV‐infected smear‐negative presumptive tuberculosis patients in Uganda: Application of new tuberculosis diagnostic technology, PLOS One ,2015,10,    ,['citation-journal']," Nakiyingi L, Nonyane BA, Ssengooba W, Kirenga BJ, Nakanjako D, Lubega G, et al. Predictors for MTB culture‐positivity among HIV‐infected smear‐negative presumptive tuberculosis patients in Uganda: Application of new tuberculosis diagnostic technology.  PLOS One 2015;10(7):e0133756. [DOI: 10.1371/journal.pone.0133756]CENTRAL    Link to article     PubMed     Google Scholar     ","['', 'https://doi.org/10.1371/journal.pone.0133756', 'https://www.ncbi.nlm.nih.gov/pubmed/26222142', 'https://scholar.google.com/scholar_lookup?title=Predictors+for+MTB+culture‐positivity+among+HIV‐infected+smear‐negative+presumptive+tuberculosis+patients+in+Uganda:+Application+of+new+tuberculosis+diagnostic+technology+&author=L+Nakiyingi&author=BA+Nonyane&author=W+Ssengooba&author=BJ+Kirenga&author=D+Nakanjako&author=G+Lubega&publication_year=2015&hl=en']",26222142,https://doi.org/10.1371/journal.pone.0133756, Nakiyingi 2015a {published data only}  ,excluded,CD011420-bbs2-0073, Second reference (complementary data) to Nakiyingi 2014  
CD011420-bib-0074,"Nicol MP, Allen V, Workman L, Isaacs W, Munro J, Pienaar S, et al. ",Urine lipoarabinomannan testing for diagnosis of pulmonary tuberculosis in children: a prospective study, Lancet Global Health ,2014,2,    ,['citation-journal']," Nicol MP, Allen V, Workman L, Isaacs W, Munro J, Pienaar S, et al. Urine lipoarabinomannan testing for diagnosis of pulmonary tuberculosis in children: a prospective study.  Lancet Global Health 2014;2(5):e278–84. CENTRAL    Link to article     PubMed     Google Scholar     ","['', 'https://doi.org/10.1016/S2214-109X(14)70195-0', 'https://www.ncbi.nlm.nih.gov/pubmed/24818083', 'https://scholar.google.com/scholar_lookup?title=Urine+lipoarabinomannan+testing+for+diagnosis+of+pulmonary+tuberculosis+in+children:+a+prospective+study+&author=MP+Nicol&author=V+Allen&author=L+Workman&author=W+Isaacs&author=J+Munro&author=S+Pienaar&publication_year=2014&hl=en']",24818083,https://doi.org/10.1016/S2214-109X(14)70195-0, Nicol 2014 {published data only}  ,excluded,CD011420-bbs2-0074, Paediatric population 
CD011420-bib-0075,"Patel VB, Bhigjee AI, Paruk HF, Singh R, Meldau R, Connolly C, et al. ",Utility of a novel lipoarabinomannan assay for the diagnosis of tuberculous meningitis in a resource‐poor high‐HIV prevalence setting, Cerebrospinal Fluid Research ,2009,6,    ,['citation-journal']," Patel VB, Bhigjee AI, Paruk HF, Singh R, Meldau R, Connolly C, et al. Utility of a novel lipoarabinomannan assay for the diagnosis of tuberculous meningitis in a resource‐poor high‐HIV prevalence setting.  Cerebrospinal Fluid Research 2009;6:13. CENTRAL    Link to article     PubMed     Google Scholar     ","['', 'https://doi.org/10.1186/1743-8454-6-13', 'https://www.ncbi.nlm.nih.gov/pubmed/19878608', 'https://scholar.google.com/scholar_lookup?title=Utility+of+a+novel+lipoarabinomannan+assay+for+the+diagnosis+of+tuberculous+meningitis+in+a+resource‐poor+high‐HIV+prevalence+setting+&author=VB+Patel&author=AI+Bhigjee&author=HF+Paruk&author=R+Singh&author=R+Meldau&author=C+Connolly&publication_year=2009&hl=en']",19878608,https://doi.org/10.1186/1743-8454-6-13, Patel 2009 {published data only}  ,excluded,CD011420-bbs2-0075, Index test not studied 
CD011420-bib-0076,"Patel VB, Singh R, Connolly C, Kasprowicz V, Zumla A, Ndungu T, et al. ",Comparison of a clinical prediction rule and a LAM antigen‐detection assay for the rapid diagnosis of TBM in a high HIV prevalence setting, PLOS One ,2010,5,    ,['citation-journal']," Patel VB, Singh R, Connolly C, Kasprowicz V, Zumla A, Ndungu T, et al. Comparison of a clinical prediction rule and a LAM antigen‐detection assay for the rapid diagnosis of TBM in a high HIV prevalence setting.  PLOS One 2010;5(12):e15664. CENTRAL    Link to article     PubMed     Google Scholar     ","['', 'https://doi.org/10.1371/journal.pone.0015664', 'https://www.ncbi.nlm.nih.gov/pubmed/21203513', 'https://scholar.google.com/scholar_lookup?title=Comparison+of+a+clinical+prediction+rule+and+a+LAM+antigen‐detection+assay+for+the+rapid+diagnosis+of+TBM+in+a+high+HIV+prevalence+setting+&author=VB+Patel&author=R+Singh&author=C+Connolly&author=V+Kasprowicz&author=A+Zumla&author=T+Ndungu&publication_year=2010&hl=en']",21203513,https://doi.org/10.1371/journal.pone.0015664, Patel 2010 {published data only}  ,excluded,CD011420-bbs2-0076, Index test not studied 
CD011420-bib-0077,"Peter JG, Haripesad A, Mottay L, Kraus S, Meldau R, Dheda K. ",The clinical utility of urine lipoarabinomannan and the novel point‐of‐care lateral flow strip test (Determine TB) for the diagnosis of tuberculosis in hospitalised patients with HIV‐related advanced immunosuppression," American Journal of Respiratory and Critical Care Medicine Conference: American Thoracic Society International Conference, ATS ",2011,183,    ,['citation-journal']," Peter JG, Haripesad A, Mottay L, Kraus S, Meldau R, Dheda K. The clinical utility of urine lipoarabinomannan and the novel point‐of‐care lateral flow strip test (Determine TB) for the diagnosis of tuberculosis in hospitalised patients with HIV‐related advanced immunosuppression.  American Journal of Respiratory and Critical Care Medicine Conference: American Thoracic Society International Conference, ATS 2011;183:A5313. CENTRAL    Google Scholar     ","['', 'https://scholar.google.com/scholar_lookup?title=The+clinical+utility+of+urine+lipoarabinomannan+and+the+novel+point‐of‐care+lateral+flow+strip+test+(Determine+TB)+for+the+diagnosis+of+tuberculosis+in+hospitalised+patients+with+HIV‐related+advanced+immunosuppression+&author=JG+Peter&author=A+Haripesad&author=L+Mottay&author=S+Kraus&author=R+Meldau&author=K+Dheda&publication_year=2011&hl=en']",,, Peter 2011 {published data only}  ,excluded,CD011420-bbs2-0077, Insufficient or duplicate data 
CD011420-bib-0078,"Peter JG, Cashmore TJ, Meldau R, Theron G, van Zyl‐Smit R, Dheda K. ",Diagnostic accuracy of induced sputum LAM ELISA for tuberculosis diagnosis in sputum‐scarce patients, International Journal of Tuberculosis and Lung Disease ,2012,16,    ,['citation-journal']," Peter JG, Cashmore TJ, Meldau R, Theron G, van Zyl‐Smit R, Dheda K. Diagnostic accuracy of induced sputum LAM ELISA for tuberculosis diagnosis in sputum‐scarce patients.  International Journal of Tuberculosis and Lung Disease 2012;16(8):1108‐12. CENTRAL    Link to article     Google Scholar     ","['', 'https://doi.org/10.5588/ijtld.11.0614', 'https://scholar.google.com/scholar_lookup?title=Diagnostic+accuracy+of+induced+sputum+LAM+ELISA+for+tuberculosis+diagnosis+in+sputum‐scarce+patients+&author=JG+Peter&author=TJ+Cashmore&author=R+Meldau&author=G+Theron&author=R+Zyl‐Smit&author=K+Dheda&publication_year=2012&hl=en']",,https://doi.org/10.5588/ijtld.11.0614, Peter 2012b {published data only}  ,excluded,CD011420-bbs2-0078, Insufficient or duplicate data 
CD011420-bib-0079,"Peter JG, Theron G, Muchinga TE, Govender U, Dheda K. ",The diagnostic accuracy of urine‐based Xpert MTB/RIF in HIV‐infected hospitalised patients who are smear‐negative or sputum scarce, PLOS One ,2012,7,    ,['citation-journal']," Peter JG, Theron G, Muchinga TE, Govender U, Dheda K. The diagnostic accuracy of urine‐based Xpert MTB/RIF in HIV‐infected hospitalised patients who are smear‐negative or sputum scarce.  PLOS One 2012;7(7):e39966. CENTRAL    Link to article     PubMed     Google Scholar     ","['', 'https://doi.org/10.1371/journal.pone.0039966', 'https://www.ncbi.nlm.nih.gov/pubmed/22815718', 'https://scholar.google.com/scholar_lookup?title=The+diagnostic+accuracy+of+urine‐based+Xpert+MTB/RIF+in+HIV‐infected+hospitalised+patients+who+are+smear‐negative+or+sputum+scarce+&author=JG+Peter&author=G+Theron&author=TE+Muchinga&author=U+Govender&author=K+Dheda&publication_year=2012&hl=en']",22815718,https://doi.org/10.1371/journal.pone.0039966, Peter 2012c {published data only}  ,excluded,CD011420-bbs2-0079, Insufficient or duplicate data 
CD011420-bib-0080,"Peter JG, Theron G, Dheda K. ",Can point‐of‐care urine LAM strip testing for tuberculosis add value to clinical decision making in hospitalised HIV‐infected persons?, PLOS One ,2013,8,    ,['citation-journal']," Peter JG, Theron G, Dheda K. Can point‐of‐care urine LAM strip testing for tuberculosis add value to clinical decision making in hospitalised HIV‐infected persons?.  PLOS One 2013;8(2):e54875. CENTRAL    Link to article     PubMed     Google Scholar     ","['', 'https://doi.org/10.1371/journal.pone.0054875', 'https://www.ncbi.nlm.nih.gov/pubmed/23390504', 'https://scholar.google.com/scholar_lookup?title=Can+point‐of‐care+urine+LAM+strip+testing+for+tuberculosis+add+value+to+clinical+decision+making+in+hospitalised+HIV‐infected+persons?+&author=JG+Peter&author=G+Theron&author=K+Dheda&publication_year=2013&hl=en']",23390504,https://doi.org/10.1371/journal.pone.0054875, Peter 2013 {published data only}  ,excluded,CD011420-bbs2-0080, Insufficient or duplicate data 
CD011420-bib-0081,"Reddy KP, Gupta‐Wright A, Fielding K, Costantini S, Zheng A, Corbett EL, et al. ",Cost‐effectiveness of urine TB screening for hospitalized people with HIV in Africa,,2018,,    ,['citation-other']," Reddy KP, Gupta‐Wright A, Fielding K, Costantini S, Zheng A, Corbett EL, et al. Cost‐effectiveness of urine TB screening for hospitalized people with HIV in Africa. Topics in Antiviral Medicine. 2018; Vol. 26, issue Supplement 1:518s. CENTRAL    Google Scholar     ","['', 'https://scholar.google.com/scholar_lookup?title=Cost‐effectiveness+of+urine+TB+screening+for+hospitalized+people+with+HIV+in+Africa&author=KP+Reddy&author=A+Gupta‐Wright&author=K+Fielding&author=S+Costantini&author=A+Zheng&author=EL+Corbett&publication_year=2018&hl=en']",,, Reddy 2018 {published data only}  ,excluded,CD011420-bbs2-0081, Abstract 
CD011420-bib-0082,"Reid S, Kancheya N, Kapata N, Kruuner A, Henostroza G, Harris J. ","Detection of lipoarabinomannan in urine for the diagnosis of tuberculosis in ART clinic enrollees in Lusaka, Zambia",,,,   ,['citation-other']," Reid S, Kancheya N, Kapata N, Kruuner A, Henostroza G, Harris J. Detection of lipoarabinomannan in urine for the diagnosis of tuberculosis in ART clinic enrollees in Lusaka, Zambia. www.cidrz.org/past‐studies/ (accessed 4 September 2015). CENTRAL    ",[''],,, Reid 2015 {unpublished data only}  ,excluded,CD011420-bbs2-0082, Insufficient data 
CD011420-bib-0083,"Reither K, Saathoff E, Jung J, Minja LT, Kroidl I, Saad E, et al. ",Low sensitivity of a urine LAM‐ELISA in the diagnosis of pulmonary tuberculosis, BMC Infectious Diseases ,2009,9,    ,['citation-journal']," Reither K, Saathoff E, Jung J, Minja LT, Kroidl I, Saad E, et al. Low sensitivity of a urine LAM‐ELISA in the diagnosis of pulmonary tuberculosis.  BMC Infectious Diseases 2009;9:141. CENTRAL    Link to article     PubMed     Google Scholar     ","['', 'https://doi.org/10.1186/1471-2334-9-141', 'https://www.ncbi.nlm.nih.gov/pubmed/19715562', 'https://scholar.google.com/scholar_lookup?title=Low+sensitivity+of+a+urine+LAM‐ELISA+in+the+diagnosis+of+pulmonary+tuberculosis&author=K+Reither&author=E+Saathoff&author=J+Jung&author=LT+Minja&author=I+Kroidl&author=E+Saad&publication_year=2009&hl=en']",19715562,https://doi.org/10.1186/1471-2334-9-141, Reither 2009 {published data only}  ,excluded,CD011420-bbs2-0083, Index test not studied 
CD011420-bib-0084,"Sabur NF, Esmail A, Brar MS, Dheda K. ",Diagnosing tuberculosis in hospitalized HIV‐infected individuals who cannot produce sputum: is urine lipoarabinomannan testing the answer?, BMC Infectious Diseases ,2017,17,    ,['citation-journal']," Sabur NF, Esmail A, Brar MS, Dheda K. Diagnosing tuberculosis in hospitalized HIV‐infected individuals who cannot produce sputum: is urine lipoarabinomannan testing the answer?.  BMC Infectious Diseases 2017;17(1):803. [DOI: 10.1186/s12879‐017‐2914‐7]CENTRAL    Link to article     PubMed     Google Scholar     ","['', 'https://doi.org/10.1186/s12879-017-2914-7', 'https://www.ncbi.nlm.nih.gov/pubmed/29282005', 'https://scholar.google.com/scholar_lookup?title=Diagnosing+tuberculosis+in+hospitalized+HIV‐infected+individuals+who+cannot+produce+sputum:+is+urine+lipoarabinomannan+testing+the+answer?+&author=NF+Sabur&author=A+Esmail&author=MS+Brar&author=K+Dheda&publication_year=2017&hl=en']",29282005,https://doi.org/10.1186/s12879-017-2914-7, Sabur 2017 {published data only}  ,excluded,CD011420-bbs2-0084, Reference standard not satisfied 
CD011420-bib-0085,"Sada E, Aguilar D, Torres M, Herrera T. ",Detection of lipoarabinomannan as a diagnostic test for tuberculosis, Journal of Clinical Microbiology ,1992,30,    ,['citation-journal']," Sada E, Aguilar D, Torres M, Herrera T. Detection of lipoarabinomannan as a diagnostic test for tuberculosis.  Journal of Clinical Microbiology 1992;30(9):2415‐8. CENTRAL    Link to article     PubMed     Google Scholar     ","['', 'https://doi.org/10.1128/jcm.30.9.2415-2418.1992', 'https://www.ncbi.nlm.nih.gov/pubmed/1401008', 'https://scholar.google.com/scholar_lookup?title=Detection+of+lipoarabinomannan+as+a+diagnostic+test+for+tuberculosis&author=E+Sada&author=D+Aguilar&author=M+Torres&author=T+Herrera&publication_year=1992&hl=en']",1401008,https://doi.org/10.1128/jcm.30.9.2415-2418.1992, Sada 1992 {published data only}  ,excluded,CD011420-bbs2-0085, Index test not studied 
CD011420-bib-0086,"Sahle SN, Asress DT, Tullu KD, Weldemariam AG, Tola HH, Awas YA, et al. ","Performance of point‐of‐care urine test in diagnosing tuberculosis suspects with and without HIV infection in selected peripheral health settings of Addis Ababa, Ethiopia", BMC Research Notes ,2017,10,    ,['citation-journal']," Sahle SN, Asress DT, Tullu KD, Weldemariam AG, Tola HH, Awas YA, et al. Performance of point‐of‐care urine test in diagnosing tuberculosis suspects with and without HIV infection in selected peripheral health settings of Addis Ababa, Ethiopia.  BMC Research Notes 2017;10(1):74. [DOI: 10.1186/s13104‐017‐2404‐4]CENTRAL    Link to article     PubMed     Google Scholar     ","['', 'https://doi.org/10.1186/s13104-017-2404-4', 'https://www.ncbi.nlm.nih.gov/pubmed/28137314', 'https://scholar.google.com/scholar_lookup?title=Performance+of+point‐of‐care+urine+test+in+diagnosing+tuberculosis+suspects+with+and+without+HIV+infection+in+selected+peripheral+health+settings+of+Addis+Ababa,+Ethiopia+&author=SN+Sahle&author=DT+Asress&author=KD+Tullu&author=AG+Weldemariam&author=HH+Tola&author=YA+Awas&publication_year=2017&hl=en']",28137314,https://doi.org/10.1186/s13104-017-2404-4, Sahle 2017 {published data only}  ,excluded,CD011420-bbs2-0086, Did not use manufacturer's current recommended positivity threshold 
CD011420-bib-0087,"Savolainen L, Kantele A, Sandboge B, Sirén M, Valleala H, Tuompo R, et al. ",Modification of Clearview tuberculosis (TB) enzyme‐linked immunosorbent assay for TB patients not infected with HIV, Clinical and Vaccine Immunology ,2013,20,    ,['citation-journal']," Savolainen L, Kantele A, Sandboge B, Sirén M, Valleala H, Tuompo R, et al. Modification of Clearview tuberculosis (TB) enzyme‐linked immunosorbent assay for TB patients not infected with HIV.  Clinical and Vaccine Immunology 2013;20(9):1479‐82. CENTRAL    Link to article     PubMed     Google Scholar     ","['', 'https://doi.org/10.1128/CVI.00375-13', 'https://www.ncbi.nlm.nih.gov/pubmed/23825194', 'https://scholar.google.com/scholar_lookup?title=Modification+of+Clearview+tuberculosis+(TB)+enzyme‐linked+immunosorbent+assay+for+TB+patients+not+infected+with+HIV+&author=L+Savolainen&author=A+Kantele&author=B+Sandboge&author=M+Sirén&author=H+Valleala&author=R+Tuompo&publication_year=2013&hl=en']",23825194,https://doi.org/10.1128/CVI.00375-13, Savolainen 2013 {published data only}  ,excluded,CD011420-bbs2-0087, Index test not studied 
CD011420-bib-0088,"Schmidt R, Jacak J, Schirwitz C, Stadler V, Michel G, Marmé N, et al. ",Single‐molecule detection on a protein‐array assay platform for the exposure of a tuberculosis antigen, Journal of Proteome Research ,2011,10,    ,['citation-journal']," Schmidt R, Jacak J, Schirwitz C, Stadler V, Michel G, Marmé N, et al. Single‐molecule detection on a protein‐array assay platform for the exposure of a tuberculosis antigen.  Journal of Proteome Research 2011;10(3):1316‐22. CENTRAL    Link to article     PubMed     Google Scholar     ","['', 'https://doi.org/10.1021/pr101070j', 'https://www.ncbi.nlm.nih.gov/pubmed/21247063', 'https://scholar.google.com/scholar_lookup?title=Single‐molecule+detection+on+a+protein‐array+assay+platform+for+the+exposure+of+a+tuberculosis+antigen+&author=R+Schmidt&author=J+Jacak&author=C+Schirwitz&author=V+Stadler&author=G+Michel&author=N+Marmé&publication_year=2011&hl=en']",21247063,https://doi.org/10.1021/pr101070j, Schmidt 2011 {published data only}  ,excluded,CD011420-bbs2-0088, Index test not studied 
CD011420-bib-0089,"Shah M, Variava E, Holmes CB, Coppin A, Golub JE, McCallum J, et al. ",Diagnostic accuracy of a urine lipoarabinomannan test for tuberculosis in hospitalised patients in a high HIV prevalence setting, Journal of Acquired Immune Deficiency Syndromes ,2009,52,    ,['citation-journal']," Shah M, Variava E, Holmes CB, Coppin A, Golub JE, McCallum J, et al. Diagnostic accuracy of a urine lipoarabinomannan test for tuberculosis in hospitalised patients in a high HIV prevalence setting.  Journal of Acquired Immune Deficiency Syndromes 2009;52(2):145‐51. CENTRAL    Link to article     PubMed     Google Scholar     ","['', 'https://doi.org/10.1097/QAI.0b013e3181b98430', 'https://www.ncbi.nlm.nih.gov/pubmed/19692904', 'https://scholar.google.com/scholar_lookup?title=Diagnostic+accuracy+of+a+urine+lipoarabinomannan+test+for+tuberculosis+in+hospitalised+patients+in+a+high+HIV+prevalence+setting+&author=M+Shah&author=E+Variava&author=CB+Holmes&author=A+Coppin&author=JE+Golub&author=J+McCallum&publication_year=2009&hl=en']",19692904,https://doi.org/10.1097/QAI.0b013e3181b98430, Shah 2009 {published data only}  ,excluded,CD011420-bbs2-0089, Index test not studied 
CD011420-bib-0090,"Shah M, Martinson NA, Chaisson RE, Martin DJ, Variava E, Dorman SE. ",Quantitative analysis of a urine‐based assay for detection of lipoarabinomannan in patients with tuberculosis, Journal of Clinical Microbiology ,2010,48,    ,['citation-journal']," Shah M, Martinson NA, Chaisson RE, Martin DJ, Variava E, Dorman SE. Quantitative analysis of a urine‐based assay for detection of lipoarabinomannan in patients with tuberculosis.  Journal of Clinical Microbiology 2010;48(8):2972‐4. CENTRAL    Link to article     PubMed     Google Scholar     ","['', 'https://doi.org/10.1128/JCM.00363-10', 'https://www.ncbi.nlm.nih.gov/pubmed/20534796', 'https://scholar.google.com/scholar_lookup?title=Quantitative+analysis+of+a+urine‐based+assay+for+detection+of+lipoarabinomannan+in+patients+with+tuberculosis+&author=M+Shah&author=NA+Martinson&author=RE+Chaisson&author=DJ+Martin&author=E+Variava&author=SE+Dorman&publication_year=2010&hl=en']",20534796,https://doi.org/10.1128/JCM.00363-10, Shah 2010 {published data only}  ,excluded,CD011420-bbs2-0090, Index test not studied 
CD011420-bib-0091,"Shah M, Dowdy D, Joloba M, Ssengooba W, Manabe YC, Ellner J, et al. ",Cost‐effectiveness of novel algorithms for rapid diagnosis of tuberculosis in HIV‐infected individuals in Uganda, AIDS ,2013,27,    ,['citation-journal']," Shah M, Dowdy D, Joloba M, Ssengooba W, Manabe YC, Ellner J, et al. Cost‐effectiveness of novel algorithms for rapid diagnosis of tuberculosis in HIV‐infected individuals in Uganda.  AIDS 2013;27(18):2883‐92. CENTRAL    Link to article     PubMed     Google Scholar     ","['', 'https://doi.org/10.1097/QAD.0000000000000008', 'https://www.ncbi.nlm.nih.gov/pubmed/25119690', 'https://scholar.google.com/scholar_lookup?title=Cost‐effectiveness+of+novel+algorithms+for+rapid+diagnosis+of+tuberculosis+in+HIV‐infected+individuals+in+Uganda+&author=M+Shah&author=D+Dowdy&author=M+Joloba&author=W+Ssengooba&author=YC+Manabe&author=J+Ellner&publication_year=2013&hl=en']",25119690,https://doi.org/10.1097/QAD.0000000000000008, Shah 2013 {published data only}  ,excluded,CD011420-bbs2-0091, Insufficient or duplicate data 
CD011420-bib-0092,"Shah M, Ssengooba W, Armstrong D, Nakiyingi L, Holshouser M, Ellner JJ, et al. ",Comparative performance of urinary lipoarabinomannan assays and Xpert MTB/RIF in HIV‐infected individuals, AIDS ,2014,28,    ,['citation-journal']," Shah M, Ssengooba W, Armstrong D, Nakiyingi L, Holshouser M, Ellner JJ, et al. Comparative performance of urinary lipoarabinomannan assays and Xpert MTB/RIF in HIV‐infected individuals.  AIDS 2014;28(9):1307‐14. CENTRAL    Link to article     PubMed     Google Scholar     ","['', 'https://doi.org/10.1097/QAD.0000000000000264', 'https://www.ncbi.nlm.nih.gov/pubmed/24637544', 'https://scholar.google.com/scholar_lookup?title=Comparative+performance+of+urinary+lipoarabinomannan+assays+and+Xpert+MTB/RIF+in+HIV‐infected+individuals+&author=M+Shah&author=W+Ssengooba&author=D+Armstrong&author=L+Nakiyingi&author=M+Holshouser&author=JJ+Ellner&publication_year=2014&hl=en']",24637544,https://doi.org/10.1097/QAD.0000000000000264, Shah 2014 {published data only}  ,excluded,CD011420-bbs2-0092, Insufficient or duplicate data 
