reference_id,authors,title,journal,year,volume,citation_footer,citation_type,citation,urls,pubmed_id,doi,header,reference_type,study_id,exclusion_reason
CD010355-bib-0002,"Auriant I, Jallot A, Herve P, Cerrina J, Ladurie FLR, Fournier JL, et al. ",A comparison of non‐invasive positive pressure ventilation (NPPV) and conventional therapy in patients with acute hypoxemic respiratory failure (AHRF) following lung resection, American Journal of Respiratory and Critical Care Medicine ,2001,163,    ,['citation-journal']," Auriant I, Jallot A, Herve P, Cerrina J, Ladurie FLR, Fournier JL, et al. A comparison of non‐invasive positive pressure ventilation (NPPV) and conventional therapy in patients with acute hypoxemic respiratory failure (AHRF) following lung resection.  American Journal of Respiratory and Critical Care Medicine 2001;163(5 Suppl):A:248. CENTRAL    Google Scholar     ","['', 'https://scholar.google.com/scholar_lookup?title=A+comparison+of+non‐invasive+positive+pressure+ventilation+(NPPV)+and+conventional+therapy+in+patients+with+acute+hypoxemic+respiratory+failure+(AHRF)+following+lung+resection+&author=I+Auriant&author=A+Jallot&author=P+Herve&author=J+Cerrina&author=FLR+Ladurie&author=JL+Fournier&publication_year=2001&hl=en']",,, Auriant 2001 {published data only}  ,included,CD010355-bbs2-0001,
CD010355-bib-0001,"Auriant I, Jallot A, Hervé P, Cerrina J, Le Roy Ladurie F, Fournier JL, et al. ",Non‐invasive ventilation reduces mortality in acute respiratory failure following lung resection, American Journal of Respiratory and Critical Care Medicine ,2001,164,    ,['citation-journal']," Auriant I, Jallot A, Hervé P, Cerrina J, Le Roy Ladurie F, Fournier JL, et al. Non‐invasive ventilation reduces mortality in acute respiratory failure following lung resection.  American Journal of Respiratory and Critical Care Medicine 2001;164(7):1231‐5. CENTRAL    Link to article     PubMed     Google Scholar     ","['', 'https://doi.org/10.1164/ajrccm.164.7.2101089', 'https://www.ncbi.nlm.nih.gov/pubmed/11673215', 'https://scholar.google.com/scholar_lookup?title=Non‐invasive+ventilation+reduces+mortality+in+acute+respiratory+failure+following+lung+resection+&author=I+Auriant&author=A+Jallot&author=P+Hervé&author=J+Cerrina&author=F+RoyLadurie&author=JL+Fournier&publication_year=2001&hl=en']",11673215,https://doi.org/10.1164/ajrccm.164.7.2101089, Auriant 2001 {published data only}  ,included,CD010355-bbs2-0001,
CD010355-bib-0003,"Barbagallo M, Ortu A, Spadini E, Salvadori A, Ampollini L, Internullo E, et al. ",Prophylactic use of helmet CPAP after pulmonary lobectomy: a prospective randomized controlled study, Respiratory Care ,2012,57,    ,['citation-journal']," Barbagallo M, Ortu A, Spadini E, Salvadori A, Ampollini L, Internullo E, et al. Prophylactic use of helmet CPAP after pulmonary lobectomy: a prospective randomized controlled study.  Respiratory Care 2012;57(9):1418‐24. CENTRAL    Link to article     PubMed     Google Scholar     ","['', 'https://doi.org/10.4187/respcare.00838', 'https://www.ncbi.nlm.nih.gov/pubmed/22613197', 'https://scholar.google.com/scholar_lookup?title=Prophylactic+use+of+helmet+CPAP+after+pulmonary+lobectomy:+a+prospective+randomized+controlled+study+&author=M+Barbagallo&author=A+Ortu&author=E+Spadini&author=A+Salvadori&author=L+Ampollini&author=E+Internullo&publication_year=2012&hl=en']",22613197,https://doi.org/10.4187/respcare.00838, Barbagallo 2012 {published data only}  ,included,CD010355-bbs2-0002,
CD010355-bib-0004,"Danner BC, Koerber W, Emmert A, Olgemoeller U, Doerge H, Quintel M, et al. ",Non‐invasive pressure support ventilation in major lung resection for high risk patients: does it matter?, Open Journal of Thoracic Surgery ,2012,2,    ,['citation-journal']," Danner BC, Koerber W, Emmert A, Olgemoeller U, Doerge H, Quintel M, et al. Non‐invasive pressure support ventilation in major lung resection for high risk patients: does it matter?.  Open Journal of Thoracic Surgery 2012;2:63‐71. CENTRAL    Link to article     Google Scholar     ","['', 'https://doi.org/10.4236/ojts.2012.23014', 'https://scholar.google.com/scholar_lookup?title=Non‐invasive+pressure+support+ventilation+in+major+lung+resection+for+high+risk+patients:+does+it+matter?+&author=BC+Danner&author=W+Koerber&author=A+Emmert&author=U+Olgemoeller&author=H+Doerge&author=M+Quintel&publication_year=2012&hl=en']",,https://doi.org/10.4236/ojts.2012.23014, Danner 2012 {published data only}  ,included,CD010355-bbs2-0003,
CD010355-bib-0005,"Garutti I, Puente‐Maestu L, Laso J, Sevilla R, Ferrando A, Frias I, et al. ",Comparison of gas exchange after lung resection with a Boussignac CPAP or Venturi mask, British Journal of Anaesthesia ,2014,112,    ,['citation-journal']," Garutti I, Puente‐Maestu L, Laso J, Sevilla R, Ferrando A, Frias I, et al. Comparison of gas exchange after lung resection with a Boussignac CPAP or Venturi mask.  British Journal of Anaesthesia 2014;112(5):929‐35. CENTRAL    Link to article     PubMed     Google Scholar     ","['', 'https://doi.org/10.1093/bja/aet477', 'https://www.ncbi.nlm.nih.gov/pubmed/24496783', 'https://scholar.google.com/scholar_lookup?title=Comparison+of+gas+exchange+after+lung+resection+with+a+Boussignac+CPAP+or+Venturi+mask+&author=I+Garutti&author=L+Puente‐Maestu&author=J+Laso&author=R+Sevilla&author=A+Ferrando&author=I+Frias&publication_year=2014&hl=en']",24496783,https://doi.org/10.1093/bja/aet477, Garutti 2014 {published data only}  ,included,CD010355-bbs2-0004,
CD010355-bib-0006,"Hernández EG, Pérez AR, Gilard JF, Álamo MNM, Socorro ME, Suárez PR, et al. ",Prophylactic use of non‐invasive mechanical ventilation in lung resection, European Review for Medical and Pharmacological Sciences ,2018,22,    ,['citation-journal']," Hernández EG, Pérez AR, Gilard JF, Álamo MNM, Socorro ME, Suárez PR, et al. Prophylactic use of non‐invasive mechanical ventilation in lung resection.  European Review for Medical and Pharmacological Sciences 2018;22:190‐8. CENTRAL    PubMed     Google Scholar     ","['', 'https://www.ncbi.nlm.nih.gov/pubmed/29364487', 'https://scholar.google.com/scholar_lookup?title=Prophylactic+use+of+non‐invasive+mechanical+ventilation+in+lung+resection&author=EG+Hernández&author=AR+Pérez&author=JF+Gilard&author=MNM+Álamo&author=ME+Socorro&author=PR+Suárez&publication_year=2018&hl=en']",29364487,, Hernández 2018 {published data only}  ,included,CD010355-bbs2-0005,
CD010355-bib-0007,"Ludwig C, Angenendt S, Martins R, Mayer V, Stoelben E. ",Intermittent positive pressure breathing after lung surgery, Asian Cardiovascular & Thoracic Annals ,2011,19,    ,['citation-journal']," Ludwig C, Angenendt S, Martins R, Mayer V, Stoelben E. Intermittent positive pressure breathing after lung surgery.  Asian Cardiovascular & Thoracic Annals 2011;19(1):10‐13. CENTRAL    Link to article     PubMed     Google Scholar     ","['', 'https://doi.org/10.1177/0218492310394664', 'https://www.ncbi.nlm.nih.gov/pubmed/21357311', 'https://scholar.google.com/scholar_lookup?title=Intermittent+positive+pressure+breathing+after+lung+surgery&author=C+Ludwig&author=S+Angenendt&author=R+Martins&author=V+Mayer&author=E+Stoelben&publication_year=2011&hl=en']",21357311,https://doi.org/10.1177/0218492310394664, Ludwig 2011 {published data only}  ,included,CD010355-bbs2-0006,
CD010355-bib-0008,"Perrin C, Jullien V, Vénissac N, Berthier F, Padovani B, Guillot F, et al. ",Prophylactic use of non‐invasive ventilation in patients undergoing lung resectional surgery, Respiratory Medicine ,2007,101,    ,['citation-journal']," Perrin C, Jullien V, Vénissac N, Berthier F, Padovani B, Guillot F, et al. Prophylactic use of non‐invasive ventilation in patients undergoing lung resectional surgery.  Respiratory Medicine 2007;101:1572‐8. CENTRAL    Link to article     PubMed     Google Scholar     ","['', 'https://doi.org/10.1016/j.rmed.2006.12.002', 'https://www.ncbi.nlm.nih.gov/pubmed/17257820', 'https://scholar.google.com/scholar_lookup?title=Prophylactic+use+of+non‐invasive+ventilation+in+patients+undergoing+lung+resectional+surgery+&author=C+Perrin&author=V+Jullien&author=N+Vénissac&author=F+Berthier&author=B+Padovani&author=F+Guillot&publication_year=2007&hl=en']",17257820,https://doi.org/10.1016/j.rmed.2006.12.002, Perrin 2007 {published data only}  ,included,CD010355-bbs2-0007,
CD010355-bib-0009,"Roceto LS, Galhardo FDM, Saad IAB, Toro IFC. ",Continuous positive airway pressure (CPAP) after lung resection: a randomized clinical trial, Sao Paulo Medical Journal ,2014,132,    ,['citation-journal']," Roceto LS, Galhardo FDM, Saad IAB, Toro IFC. Continuous positive airway pressure (CPAP) after lung resection: a randomized clinical trial [Pressão positiva contínua nas vias aéreas (CPAP) após ressecção pulmonar: ensaio clínico randomizado].  Sao Paulo Medical Journal 2014;132(1):41‐7. CENTRAL    Link to article     PubMed     Google Scholar     ","['', 'https://doi.org/10.1590/1516-3180.2014.1321525', 'https://www.ncbi.nlm.nih.gov/pubmed/24474079', 'https://scholar.google.com/scholar_lookup?title=Continuous+positive+airway+pressure+(CPAP)+after+lung+resection:+a+randomized+clinical+trial+&author=LS+Roceto&author=FDM+Galhardo&author=IAB+Saad&author=IFC+Toro&publication_year=2014&hl=en']",24474079,https://doi.org/10.1590/1516-3180.2014.1321525, Roceto 2014 {published data only}  ,included,CD010355-bbs2-0008,
CD010355-bib-0010,"Aguilo R, Togores B, Pons S, Rubi M, Barbe F, Agusti AGN. ",Non‐invasive ventilatory support after lung resectional surgery, Chest ,1997,112,    ,['citation-journal']," Aguilo R, Togores B, Pons S, Rubi M, Barbe F, Agusti AGN. Non‐invasive ventilatory support after lung resectional surgery.  Chest 1997;112(1):117‐21. CENTRAL    Link to article     PubMed     Google Scholar     ","['', 'https://doi.org/10.1378/chest.112.1.117', 'https://www.ncbi.nlm.nih.gov/pubmed/9228366', 'https://scholar.google.com/scholar_lookup?title=Non‐invasive+ventilatory+support+after+lung+resectional+surgery&author=R+Aguilo&author=B+Togores&author=S+Pons&author=M+Rubi&author=F+Barbe&author=AGN+Agusti&publication_year=1997&hl=en']",9228366,https://doi.org/10.1378/chest.112.1.117, Aguilo 1997 {published data only}  ,excluded,CD010355-bbs2-0009, Mixed population with few participants who underwent lung resection for NSCLC 
CD010355-bib-0011,"Ingwersen UM, Larsen KR, Bertelsen MT, Nielsen KK, Laub M, Sandermann J, et al. ",Three different mask physiotherapy regimens for prevention of post‐operative pulmonary complications after heart and pulmonary surgery, Intensive Care Medicine ,1993,19,    ,['citation-journal']," Ingwersen UM, Larsen KR, Bertelsen MT, Nielsen KK, Laub M, Sandermann J, et al. Three different mask physiotherapy regimens for prevention of post‐operative pulmonary complications after heart and pulmonary surgery.  Intensive Care Medicine 1993;19:294‐8. CENTRAL    Link to article     PubMed     Google Scholar     ","['', 'https://doi.org/10.1007/BF01690551', 'https://www.ncbi.nlm.nih.gov/pubmed/8408940', 'https://scholar.google.com/scholar_lookup?title=Three+different+mask+physiotherapy+regimens+for+prevention+of+post‐operative+pulmonary+complications+after+heart+and+pulmonary+surgery+&author=UM+Ingwersen&author=KR+Larsen&author=MT+Bertelsen&author=KK+Nielsen&author=M+Laub&author=J+Sandermann&publication_year=1993&hl=en']",8408940,https://doi.org/10.1007/BF01690551, Ingwersen 1993 {published data only}  ,excluded,CD010355-bbs2-0010, The interventions compared did not fulfil the criteria for this review. The study compared 3 different types of NIPPV with no control group.  
CD010355-bib-0012,"Liao G, Chen R, He J. ",Prophylactic use of non‐invasive positive pressure ventilation in post‐thoracic surgery patients: a prospective randomized control study, Journal of Thoracic Diseases ,2010,2,    ,['citation-journal']," Liao G, Chen R, He J. Prophylactic use of non‐invasive positive pressure ventilation in post‐thoracic surgery patients: a prospective randomized control study.  Journal of Thoracic Diseases 2010;2:205‐9. CENTRAL    Google Scholar     ","['', 'https://scholar.google.com/scholar_lookup?title=Prophylactic+use+of+non‐invasive+positive+pressure+ventilation+in+post‐thoracic+surgery+patients:+a+prospective+randomized+control+study+&author=G+Liao&author=R+Chen&author=J+He&publication_year=2010&hl=en']",,, Liao 2010 {published data only}  ,excluded,CD010355-bbs2-0011, Mixed population with few participants who underwent lung resection for NSCLC 
CD010355-bib-0013,"Nery F, Lopes AJ, Domingos DN, Cunha RF, Peixoto MG, Higa C, et al. ",CPAP increases 6‐minutes walk distance after lung resection surgery, Respiratory Care ,2012,57,    ,['citation-journal']," Nery F, Lopes AJ, Domingos DN, Cunha RF, Peixoto MG, Higa C, et al. CPAP increases 6‐minutes walk distance after lung resection surgery.  Respiratory Care 2012;57(3):363‐9. CENTRAL    Link to article     PubMed     Google Scholar     ","['', 'https://doi.org/10.4187/respcare.01267', 'https://www.ncbi.nlm.nih.gov/pubmed/21968296', 'https://scholar.google.com/scholar_lookup?title=CPAP+increases+6‐minutes+walk+distance+after+lung+resection+surgery&author=F+Nery&author=AJ+Lopes&author=DN+Domingos&author=RF+Cunha&author=MG+Peixoto&author=C+Higa&publication_year=2012&hl=en']",21968296,https://doi.org/10.4187/respcare.01267, Nery 2012 {published data only}  ,excluded,CD010355-bbs2-0012, Mixed population with few participants who underwent lung resection for NSCLC 
CD010355-bib-0014,"Arozullah AM, Conde MV, Lawrence VA. ",Preoperative evaluation for postoperative pulmonary complications, Medical Clinics of North America ,2003,87,    ,['citation-journal']," Arozullah AM, Conde MV, Lawrence VA. Preoperative evaluation for postoperative pulmonary complications.  Medical Clinics of North America 2003;87(1):153‐73.    Link to article     Google Scholar     ","['https://doi.org/10.1016/S0025-7125(02)00151-7', 'https://scholar.google.com/scholar_lookup?title=Preoperative+evaluation+for+postoperative+pulmonary+complications&author=AM+Arozullah&author=MV+Conde&author=VA+Lawrence&publication_year=2003&hl=en']",,https://doi.org/10.1016/S0025-7125(02)00151-7, Arozullah 2003 ,additional,CD010355-bbs2-0013,
CD010355-bib-0015,"Brochard L, Mancebo J, Elliott MW. ",Non‐invasive ventilation for acute respiratory failure, European Respiratory Journal ,2002,19,    ,['citation-journal']," Brochard L, Mancebo J, Elliott MW. Non‐invasive ventilation for acute respiratory failure.  European Respiratory Journal 2002;19(4):712‐21.    Link to article     Google Scholar     ","['https://doi.org/10.1183/09031936.02.00295502', 'https://scholar.google.com/scholar_lookup?title=Non‐invasive+ventilation+for+acute+respiratory+failure&author=L+Brochard&author=J+Mancebo&author=MW+Elliott&publication_year=2002&hl=en']",,https://doi.org/10.1183/09031936.02.00295502, Brochard 2002 ,additional,CD010355-bbs2-0014,
CD010355-bib-0016,Brooks‐Brunn JA. ,Postoperative atelectasis and pneumonia, Heart & Lung ,1995,24,    ,['citation-journal'], Brooks‐Brunn JA. Postoperative atelectasis and pneumonia.  Heart & Lung 1995;24:94‐115.    Link to article     PubMed     Google Scholar     ,"['https://doi.org/10.1016/S0147-9563(05)80004-4', 'https://www.ncbi.nlm.nih.gov/pubmed/7759282', 'https://scholar.google.com/scholar_lookup?title=Postoperative+atelectasis+and+pneumonia&author=JA+Brooks‐Brunn&publication_year=1995&hl=en']",7759282,https://doi.org/10.1016/S0147-9563(05)80004-4, Brooks‐Brunn 1995 ,additional,CD010355-bbs2-0015,
CD010355-bib-0017,"Ferlay J, Shin HR, Bray F, Forman D, Mathers C, Parkin DM. ",Estimates of worldwide burden of cancer in 2008: GLOBOCAN 2008, International Journal of Cancer ,2010,127,    ,['citation-journal']," Ferlay J, Shin HR, Bray F, Forman D, Mathers C, Parkin DM. Estimates of worldwide burden of cancer in 2008: GLOBOCAN 2008.  International Journal of Cancer 2010;127:2893‐917.    Link to article     PubMed     Google Scholar     ","['https://doi.org/10.1002/ijc.25516', 'https://www.ncbi.nlm.nih.gov/pubmed/21351269', 'https://scholar.google.com/scholar_lookup?title=Estimates+of+worldwide+burden+of+cancer+in+2008:+GLOBOCAN+2008&author=J+Ferlay&author=HR+Shin&author=F+Bray&author=D+Forman&author=C+Mathers&author=DM+Parkin&publication_year=2010&hl=en']",21351269,https://doi.org/10.1002/ijc.25516, Ferlay 2010 ,additional,CD010355-bbs2-0016,
CD010355-bib-0018,"Higgins JPT, Green S (editors). ","Cochrane Handbook for Systematic Reviews of Interventions Version 5.1.0 [updated March 2011]. The Cochrane Collaboration, 2011",,,,. Available from www.cochrane‐handbook.org.   ,['citation-other']," Higgins JPT, Green S (editors). Cochrane Handbook for Systematic Reviews of Interventions Version 5.1.0 [updated March 2011]. The Cochrane Collaboration, 2011. Available from www.cochrane‐handbook.org.    ",[],,, Higgins 2011 ,additional,CD010355-bbs2-0017,
CD010355-bib-0019,"Igai H, Takahashi M, Ohata K, Yamashina A, Matsuoka T, Kameiama K, et al. ",Surgical treatment for non small cell lung cancer in octogenarians ‐ the usefulness of video‐assisted thoracic surgery, Interactive Cardiovascular and Thoracic Surgery ,2009,9,    ,['citation-journal']," Igai H, Takahashi M, Ohata K, Yamashina A, Matsuoka T, Kameiama K, et al. Surgical treatment for non small cell lung cancer in octogenarians ‐ the usefulness of video‐assisted thoracic surgery.  Interactive Cardiovascular and Thoracic Surgery 2009;9:274‐7.    Link to article     PubMed     Google Scholar     ","['https://doi.org/10.1510/icvts.2008.199455', 'https://www.ncbi.nlm.nih.gov/pubmed/19423508', 'https://scholar.google.com/scholar_lookup?title=Surgical+treatment+for+non+small+cell+lung+cancer+in+octogenarians+‐+the+usefulness+of+video‐assisted+thoracic+surgery+&author=H+Igai&author=M+Takahashi&author=K+Ohata&author=A+Yamashina&author=T+Matsuoka&author=K+Kameiama&publication_year=2009&hl=en']",19423508,https://doi.org/10.1510/icvts.2008.199455, Igai 2009 ,additional,CD010355-bbs2-0018,
CD010355-bib-0020,"Jemal A, Bray F, Center MM, Ferlay J, Ward E, Forman D. ",Global cancer statistics, CA: A Cancer Journal for Clinicians ,2011,61,    ,['citation-journal']," Jemal A, Bray F, Center MM, Ferlay J, Ward E, Forman D. Global cancer statistics.  CA: A Cancer Journal for Clinicians 2011;61:69‐90.    Link to article     PubMed     Google Scholar     ","['https://doi.org/10.3322/caac.20107', 'https://www.ncbi.nlm.nih.gov/pubmed/21296855', 'https://scholar.google.com/scholar_lookup?title=Global+cancer+statistics&author=A+Jemal&author=F+Bray&author=J+Ferlay&author=E+Ward&author=D+Forman&publication_year=2011&hl=en']",21296855,https://doi.org/10.3322/caac.20107, Jemal 2011 ,additional,CD010355-bbs2-0019,
CD010355-bib-0021,"Kutlu CA, Williams EA, Evans TW, Pastorino U, Goldstraw P. ",Acute lung injury and acute respiratory distress syndrome after pulmonary resection, Annals of Thoracic Surgery ,2000,69,    ,['citation-journal']," Kutlu CA, Williams EA, Evans TW, Pastorino U, Goldstraw P. Acute lung injury and acute respiratory distress syndrome after pulmonary resection.  Annals of Thoracic Surgery 2000;69:376‐80.    Link to article     Google Scholar     ","['https://doi.org/10.1016/S0003-4975(99)01090-5', 'https://scholar.google.com/scholar_lookup?title=Acute+lung+injury+and+acute+respiratory+distress+syndrome+after+pulmonary+resection&author=CA+Kutlu&author=EA+Williams&author=TW+Evans&author=U+Pastorino&author=P+Goldstraw&publication_year=2000&hl=en']",,https://doi.org/10.1016/S0003-4975(99)01090-5, Kutlu 2000 ,additional,CD010355-bbs2-0020,
CD010355-bib-0022,"Lorut C, Rabbat A, Chatelier G, Lefevre A, Roche N, Regnard JF, et al. ",The place of routine immediate non‐invasive ventilation following pulmonary resection in preventing pulmonary complications in patients with COPD (POPVNI Trial), Revue des Maladies Respiratoires ,2005,22,    ,['citation-journal']," Lorut C, Rabbat A, Chatelier G, Lefevre A, Roche N, Regnard JF, et al. The place of routine immediate non‐invasive ventilation following pulmonary resection in preventing pulmonary complications in patients with COPD (POPVNI Trial) [Intérêt de la ventilation non invasive (VNI) systématique in post‐opératoire immédiat d'une résection pulmonaire pour prévenir les complications pulmonaires chez les patients BPCO (essai POPVNI)].  Revue des Maladies Respiratoires 2005;22(1 Pt 1):127‐34.    PubMed     Google Scholar     ","['https://www.ncbi.nlm.nih.gov/pubmed/15968765', 'https://scholar.google.com/scholar_lookup?title=The+place+of+routine+immediate+non‐invasive+ventilation+following+pulmonary+resection+in+preventing+pulmonary+complications+in+patients+with+COPD+(POPVNI+Trial)+&author=C+Lorut&author=A+Rabbat&author=G+Chatelier&author=A+Lefevre&author=N+Roche&author=JF+Regnard&publication_year=2005&hl=en']",15968765,, Lorut 2005 ,additional,CD010355-bbs2-0021,
CD010355-bib-0023,"Martin TJ, Hovis JD, Costantino JP, Bierman MI, Donahoe MP, Rogers RM, et al. ","A randomized, prospective evaluation of noninvasive ventilation for acute respiratory failure", American Journal of Respiratory & Critical Care Medicine ,2000,161,    ,['citation-journal']," Martin TJ, Hovis JD, Costantino JP, Bierman MI, Donahoe MP, Rogers RM, et al. A randomized, prospective evaluation of noninvasive ventilation for acute respiratory failure.  American Journal of Respiratory & Critical Care Medicine 2000;161(3 Pt 1):807‐13.    Link to article     Google Scholar     ","['https://doi.org/10.1164/ajrccm.161.3.9808143', 'https://scholar.google.com/scholar_lookup?title=A+randomized,+prospective+evaluation+of+noninvasive+ventilation+for+acute+respiratory+failure+&author=TJ+Martin&author=JD+Hovis&author=JP+Costantino&author=MI+Bierman&author=MP+Donahoe&author=RM+Rogers&publication_year=2000&hl=en']",,https://doi.org/10.1164/ajrccm.161.3.9808143, Martin 2000 ,additional,CD010355-bbs2-0022,
CD010355-bib-0024,"Nakagawa M, Tanaka H, Tsukuma H, Kishi Y. ",Relationship between the duration of the preoperative smoke‐free period and the incidence of postoperative pulmonary complications after pulmonary surgery, Chest ,2001,120,    ,['citation-journal']," Nakagawa M, Tanaka H, Tsukuma H, Kishi Y. Relationship between the duration of the preoperative smoke‐free period and the incidence of postoperative pulmonary complications after pulmonary surgery.  Chest 2001;120(3):705‐10.    Link to article     PubMed     Google Scholar     ","['https://doi.org/10.1378/chest.120.3.705', 'https://www.ncbi.nlm.nih.gov/pubmed/11555496', 'https://scholar.google.com/scholar_lookup?title=Relationship+between+the+duration+of+the+preoperative+smoke‐free+period+and+the+incidence+of+postoperative+pulmonary+complications+after+pulmonary+surgery+&author=M+Nakagawa&author=H+Tanaka&author=H+Tsukuma&author=Y+Kishi&publication_year=2001&hl=en']",11555496,https://doi.org/10.1378/chest.120.3.705, Nakagawa 2001 ,additional,CD010355-bbs2-0023,
CD010355-bib-0025,National Institute for Health and Clinical Excellence (NICE). ,"Lung cancer. The diagnosis and treatment of lung cancer, 2011. http://guidance.nice.org.uk/CG121",,,,. (accessed 26 November 2012).   ,['citation-other']," National Institute for Health and Clinical Excellence (NICE). Lung cancer. The diagnosis and treatment of lung cancer, 2011. http://guidance.nice.org.uk/CG121. (accessed 26 November 2012).    ",[],,, NICE 2011 ,additional,CD010355-bbs2-0024,
CD010355-bib-0026,"The Nordic Cochrane Centre, The Cochrane Collaboration. ",Review Manager (RevMan),,2014,,.   ,['citation-other']," The Nordic Cochrane Centre, The Cochrane Collaboration. Review Manager (RevMan). Version 5.3. Copenhagen: The Nordic Cochrane Centre, The Cochrane Collaboration, 2014.    ",[],,, RevMan 2014 [Computer program] ,additional,CD010355-bbs2-0025,
CD010355-bib-0027,"Rivera MP, Mehta AC. ",Initial diagnosis of lung cancer: ACCP evidence‐based clinical practice guidelines, Chest ,2007,132,    ,['citation-journal']," Rivera MP, Mehta AC. Initial diagnosis of lung cancer: ACCP evidence‐based clinical practice guidelines.  Chest 2007;132:131S‐48S.    Link to article     PubMed     Google Scholar     ","['https://doi.org/10.1378/chest.07-1357', 'https://www.ncbi.nlm.nih.gov/pubmed/17873165', 'https://scholar.google.com/scholar_lookup?title=Initial+diagnosis+of+lung+cancer:+ACCP+evidence‐based+clinical+practice+guidelines&author=MP+Rivera&author=AC+Mehta&publication_year=2007&hl=en']",17873165,https://doi.org/10.1378/chest.07-1357, Rivera 2007 ,additional,CD010355-bbs2-0026,
CD010355-bib-0028,"Schettino GP, Reis MA, Galas F, Park M, Franca S, Okamoto V. ",Non‐invasive positive pressure ventilation, Jornal Brasileiro de Pneumologia ,2007,33 Suppl 2,    ,['citation-journal']," Schettino GP, Reis MA, Galas F, Park M, Franca S, Okamoto V. Non‐invasive positive pressure ventilation [Ventilação mecânica não invasiva com pressão positiva].  Jornal Brasileiro de Pneumologia 2007;33 Suppl 2:92‐105.    Google Scholar     ",['https://scholar.google.com/scholar_lookup?title=Non‐invasive+positive+pressure+ventilation&author=GP+Schettino&author=MA+Reis&author=F+Galas&author=M+Park&author=S+Franca&author=V+Okamoto&publication_year=2007&hl=en'],,, Schettino 2007 ,additional,CD010355-bbs2-0027,
