reference_id,authors,title,journal,year,volume,citation_footer,citation_type,citation,urls,pubmed_id,doi,header,reference_type,study_id,exclusion_reason
CD012599-bib-0317,"Li W, Zhou Y. ",[Measurement of pregnancy‐associated plasma protein A in maternal peripheral blood and Down syndrome] [Chinese], Chung‐Hua Fu Chan Ko Tsa Chih ,1999,34,    ,['citation-journal']," Li W, Zhou Y. [Measurement of pregnancy‐associated plasma protein A in maternal peripheral blood and Down syndrome] [Chinese].  Chung‐Hua Fu Chan Ko Tsa Chih 1999;34(10):631‐3. CENTRAL    Google Scholar     ","['', 'https://scholar.google.com/scholar_lookup?title=[Measurement+of+pregnancy‐associated+plasma+protein+A+in+maternal+peripheral+blood+and+Down+syndrome]+[Chinese]+&author=W+Li&author=Y+Zhou&publication_year=1999&hl=en']",,, Li 1999 {published data only}  ,excluded,CD012599-bbs2-0314, Unable to obtain translation 
CD012599-bib-0318,"Li HW, Hui PW, Tang MH, Lau ET, Yeung WS, Ho PC, et al. ",Maternal serum anti‐Mullerian hormone level is not superior to chronological age in predicting Down syndrome pregnancies, Prenatal Diagnosis ,2010,30,    ,['citation-journal']," Li HW, Hui PW, Tang MH, Lau ET, Yeung WS, Ho PC, et al. Maternal serum anti‐Mullerian hormone level is not superior to chronological age in predicting Down syndrome pregnancies.  Prenatal Diagnosis 2010;30(4):320‐4. CENTRAL    Link to article     Google Scholar     ","['', 'https://doi.org/10.1002/pd.2455', 'https://scholar.google.com/scholar_lookup?title=Maternal+serum+anti‐Mullerian+hormone+level+is+not+superior+to+chronological+age+in+predicting+Down+syndrome+pregnancies+&author=HW+Li&author=PW+Hui&author=MH+Tang&author=ET+Lau&author=WS+Yeung&author=PC+Ho&publication_year=2010&hl=en']",,https://doi.org/10.1002/pd.2455, Li 2010 {published data only}  ,excluded,CD012599-bbs2-0315, No diagnostic data 
CD012599-bib-0319,"Liao S, Wang Y, Ye G. ","[AFP, uE3, ß‐hCG levels applied for prenatal diagnosis of Down's syndrome]. [Chinese]", Chung‐Hua Fu Chan Ko Tsa Chih ,1997,32,    ,['citation-journal']," Liao S, Wang Y, Ye G. [AFP, uE3, ß‐hCG levels applied for prenatal diagnosis of Down's syndrome]. [Chinese].  Chung‐Hua Fu Chan Ko Tsa Chih 1997;32(11):655‐8. CENTRAL    Google Scholar     ","['', ""https://scholar.google.com/scholar_lookup?title=[AFP,+uE3,+ß‐hCG+levels+applied+for+prenatal+diagnosis+of+Down's+syndrome].+[Chinese]&author=S+Liao&author=Y+Wang&author=G+Ye&publication_year=1997&hl=en""]",,, Liao 1997 {published data only}  ,excluded,CD012599-bbs2-0316, Unable to obtain translation 
CD012599-bib-0320,"Liao AW, Heath V, Kametas N, Spencer K, Nicolaides KH. ",First‐trimester screening for trisomy 21 in singleton pregnancies achieved by assisted reproduction, Human Reproduction ,2001,16,    ,['citation-journal']," Liao AW, Heath V, Kametas N, Spencer K, Nicolaides KH. First‐trimester screening for trisomy 21 in singleton pregnancies achieved by assisted reproduction.  Human Reproduction 2001;16(7):1501‐4. CENTRAL    Link to article     Google Scholar     ","['', 'https://doi.org/10.1093/humrep/16.7.1501', 'https://scholar.google.com/scholar_lookup?title=First‐trimester+screening+for+trisomy+21+in+singleton+pregnancies+achieved+by+assisted+reproduction+&author=AW+Liao&author=V+Heath&author=N+Kametas&author=K+Spencer&author=KH+Nicolaides&publication_year=2001&hl=en']",,https://doi.org/10.1093/humrep/16.7.1501, Liao 2001 {published data only}  ,excluded,CD012599-bbs2-0317, Unable to extract useful data 
CD012599-bib-0321,"Lim KI, Pugash D, Dansereau J, Wilson RD. ",Nuchal index: a gestational age independent ultrasound marker for the detection of Down syndrome, Prenatal Diagnosis ,2002,22,    ,['citation-journal']," Lim KI, Pugash D, Dansereau J, Wilson RD. Nuchal index: a gestational age independent ultrasound marker for the detection of Down syndrome.  Prenatal Diagnosis 2002;22(13):1233‐7. CENTRAL    Link to article     Google Scholar     ","['', 'https://doi.org/10.1002/pd.497', 'https://scholar.google.com/scholar_lookup?title=Nuchal+index:+a+gestational+age+independent+ultrasound+marker+for+the+detection+of+Down+syndrome+&author=KI+Lim&author=D+Pugash&author=J+Dansereau&author=RD+Wilson&publication_year=2002&hl=en']",,https://doi.org/10.1002/pd.497, Lim 2002 {published data only}  ,excluded,CD012599-bbs2-0318, Second trimester ultrasound 
CD012599-bib-0322,"Lippman A, Evans JA. ",Screening for maternal serum alpha‐fetoprotein: what about the low side?, CMAJ ,1987,136,    ,['citation-journal']," Lippman A, Evans JA. Screening for maternal serum alpha‐fetoprotein: what about the low side?.  CMAJ 1987;136(8):801‐4. CENTRAL    Google Scholar     ","['', 'https://scholar.google.com/scholar_lookup?title=Screening+for+maternal+serum+alpha‐fetoprotein:+what+about+the+low+side?&author=A+Lippman&author=JA+Evans&publication_year=1987&hl=en']",,, Lippman 1987 {published data only}  ,excluded,CD012599-bbs2-0319, Editorial 
CD012599-bib-0323,"Liu YH, Li LF, Wu YM. ",[Analysis of Down syndrome screening by maternal serum detection in mid‐pregnancy]. [Chinese], Nan Fang Yi Ke Da Xue Xue Bao = Journal of Southern Medical University ,2010,30,    ,['citation-journal']," Liu YH, Li LF, Wu YM. [Analysis of Down syndrome screening by maternal serum detection in mid‐pregnancy]. [Chinese].  Nan Fang Yi Ke Da Xue Xue Bao = Journal of Southern Medical University 2010;30(3):532‐4. CENTRAL    Google Scholar     ","['', 'https://scholar.google.com/scholar_lookup?title=[Analysis+of+Down+syndrome+screening+by+maternal+serum+detection+in+mid‐pregnancy].+[Chinese]+&author=YH+Liu&author=LF+Li&author=YM+Wu&publication_year=2010&hl=en']",,, Liu 2010 {published data only}  ,excluded,CD012599-bbs2-0320, Not possible to separate out data for cases of Down’s syndrome 
CD012599-bib-0324,"Lo TK, Lai FK, Leung WC, Lau WL, Tang LC, Chin RK. ",A new policy for prenatal screening and diagnosis of Down syndrome for pregnant women with advanced maternal age in a public hospital, Journal of Maternal‐Fetal & Neonatal Medicine ,2010,23,    ,['citation-journal']," Lo TK, Lai FK, Leung WC, Lau WL, Tang LC, Chin RK. A new policy for prenatal screening and diagnosis of Down syndrome for pregnant women with advanced maternal age in a public hospital.  Journal of Maternal‐Fetal & Neonatal Medicine 2010;23(8):914‐9. CENTRAL    Link to article     Google Scholar     ","['', 'https://doi.org/10.3109/14767050903370327', 'https://scholar.google.com/scholar_lookup?title=A+new+policy+for+prenatal+screening+and+diagnosis+of+Down+syndrome+for+pregnant+women+with+advanced+maternal+age+in+a+public+hospital+&author=TK+Lo&author=FK+Lai&author=WC+Leung&author=WL+Lau&author=LC+Tang&author=RK+Chin&publication_year=2010&hl=en']",,https://doi.org/10.3109/14767050903370327, Lo 2010 {published data only}  ,excluded,CD012599-bbs2-0321, Pooled test results 
CD012599-bib-0325,"Lustig L, Clarke S, Cunningham G, Schonberg R, Tompkinson G. ",California's experience with low MS‐AFP results, American Journal of Medical Genetics ,1988,31,    ,['citation-journal']," Lustig L, Clarke S, Cunningham G, Schonberg R, Tompkinson G. California's experience with low MS‐AFP results.  American Journal of Medical Genetics 1988;31(1):211‐22. CENTRAL    Link to article     Google Scholar     ","['', 'https://doi.org/10.1002/ajmg.1320310128', ""https://scholar.google.com/scholar_lookup?title=California's+experience+with+low+MS‐AFP+results&author=L+Lustig&author=S+Clarke&author=G+Cunningham&author=R+Schonberg&author=G+Tompkinson&publication_year=1988&hl=en""]",,https://doi.org/10.1002/ajmg.1320310128, Lustig 1988 {published data only}  ,excluded,CD012599-bbs2-0322, Gestational age by LMP only 
CD012599-bib-0326,Luthgens K. ,Comparison of the new PRC software with the established algorithm of the FMF UK for the detection of trisomy 21 and 18/13, Fetal Diagnosis and Therapy ,2008,24,    ,['citation-journal'], Luthgens K. Comparison of the new PRC software with the established algorithm of the FMF UK for the detection of trisomy 21 and 18/13.  Fetal Diagnosis and Therapy 2008;24(4):376‐84. CENTRAL    Link to article     Google Scholar     ,"['', 'https://doi.org/10.1159/000165116', 'https://scholar.google.com/scholar_lookup?title=Comparison+of+the+new+PRC+software+with+the+established+algorithm+of+the+FMF+UK+for+the+detection+of+trisomy+21+and+18/13+&author=K+Luthgens&publication_year=2008&hl=en']",,https://doi.org/10.1159/000165116, Luthgens 2008 {published data only}  ,excluded,CD012599-bbs2-0323, FPR and DR obtained from different cohorts 
CD012599-bib-0327,"MacDonald ML, Wagner RM, Slotnick RN. ","Sensitivity and specificity of screening for Down syndrome with alpha‐fetoprotein, hCG, unconjugated estriol, and maternal age.[see comment]", Obstetrics & Gynecology ,1991,77,    ,['citation-journal']," MacDonald ML, Wagner RM, Slotnick RN. Sensitivity and specificity of screening for Down syndrome with alpha‐fetoprotein, hCG, unconjugated estriol, and maternal age.[see comment].  Obstetrics & Gynecology 1991;77(1):63‐8. CENTRAL    Google Scholar     ","['', 'https://scholar.google.com/scholar_lookup?title=Sensitivity+and+specificity+of+screening+for+Down+syndrome+with+alpha‐fetoprotein,+hCG,+unconjugated+estriol,+and+maternal+age.[see+comment]+&author=ML+MacDonald&author=RM+Wagner&author=RN+Slotnick&publication_year=1991&hl=en']",,, MacDonald 1991 {published data only}  ,excluded,CD012599-bbs2-0324, Fewer than 80% of gestational ages estimated by USS 
CD012599-bib-0328,"Macintosh MCM, Iles R, Teisner B, Sharma K, Chard T, Grudzinskas J, et al. ","Maternal serum human chorionic gonadotrophin and pregnancy‐associated plasma protein A, markers for fetal Down syndrome at 8‐14 weeks", Prenatal Diagnosis ,1994,14,    ,['citation-journal']," Macintosh MCM, Iles R, Teisner B, Sharma K, Chard T, Grudzinskas J, et al. Maternal serum human chorionic gonadotrophin and pregnancy‐associated plasma protein A, markers for fetal Down syndrome at 8‐14 weeks.  Prenatal Diagnosis 1994;14(3):203‐8. CENTRAL    Link to article     Google Scholar     ","['', 'https://doi.org/10.1002/pd.1970140311', 'https://scholar.google.com/scholar_lookup?title=Maternal+serum+human+chorionic+gonadotrophin+and+pregnancy‐associated+plasma+protein+A,+markers+for+fetal+Down+syndrome+at+8‐14+weeks+&author=MCM+Macintosh&author=R+Iles&author=B+Teisner&author=K+Sharma&author=T+Chard&author=J+Grudzinskas&publication_year=1994&hl=en']",,https://doi.org/10.1002/pd.1970140311, Macintosh 1994 {published data only}  ,excluded,CD012599-bbs2-0325, Unable to extract useful data 
CD012599-bib-0329,"Macintosh MCM, Nicolaides KH, Noble P, Chard T, Gunn L, Iles R. ",Urinary ß‐core hCG: Screening for aneuploidies in early pregnancy (11‐14 weeks' gestation), Prenatal Diagnosis ,1997,17,    ,['citation-journal']," Macintosh MCM, Nicolaides KH, Noble P, Chard T, Gunn L, Iles R. Urinary ß‐core hCG: Screening for aneuploidies in early pregnancy (11‐14 weeks' gestation).  Prenatal Diagnosis 1997;17(5):401‐5. CENTRAL    Link to article     Google Scholar     ","['', 'https://doi.org/10.1002/(SICI)1097-0223(199705)17:5<401::AID-PD40>3.0.CO;2-M', ""https://scholar.google.com/scholar_lookup?title=Urinary+ß‐core+hCG:+Screening+for+aneuploidies+in+early+pregnancy+(11‐14+weeks'+gestation)&author=MCM+Macintosh&author=KH+Nicolaides&author=P+Noble&author=T+Chard&author=L+Gunn&author=R+Iles&publication_year=1997&hl=en""]",,https://doi.org/10.1002/(SICI)1097-0223(199705)17:5<401::AID-PD40>3.0.CO;2-M, Macintosh 1997 {published data only}  ,excluded,CD012599-bbs2-0326, Unable to extract useful data 
CD012599-bib-0330,"MacRae AR, Chodirker BN, Davies GA, Palomaki GE, Knight GJ, Minett J, et al. ",Second and first trimester estimation of risk for Down syndrome: implementation and performance in the SAFER study, Prenatal Diagnosis ,2010,30,    ,['citation-journal']," MacRae AR, Chodirker BN, Davies GA, Palomaki GE, Knight GJ, Minett J, et al. Second and first trimester estimation of risk for Down syndrome: implementation and performance in the SAFER study.  Prenatal Diagnosis 2010;30(5):459‐66. CENTRAL    Link to article     Google Scholar     ","['', 'https://doi.org/10.1002/pd.2502', 'https://scholar.google.com/scholar_lookup?title=Second+and+first+trimester+estimation+of+risk+for+Down+syndrome:+implementation+and+performance+in+the+SAFER+study+&author=AR+MacRae&author=BN+Chodirker&author=GA+Davies&author=GE+Palomaki&author=GJ+Knight&author=J+Minett&publication_year=2010&hl=en']",,https://doi.org/10.1002/pd.2502, MacRae 2010 {published data only}  ,excluded,CD012599-bbs2-0327, Pooled test results 
CD012599-bib-0331,"Macri JN, Kasturi RV, Krantz DA, Cook EJ, Moore ND, Young JA, et al. ",Maternal serum Down syndrome screening: free ß‐protein is a more effective marker than human chorionic gonadotropin.[see comment], American Journal of Obstetrics & Gynecology ,1990,163,    ,['citation-journal']," Macri JN, Kasturi RV, Krantz DA, Cook EJ, Moore ND, Young JA, et al. Maternal serum Down syndrome screening: free ß‐protein is a more effective marker than human chorionic gonadotropin.[see comment].  American Journal of Obstetrics & Gynecology 1990;163(4):1248‐53. CENTRAL    Link to article     Google Scholar     ","['', 'https://doi.org/10.1016/0002-9378(90)90700-H', 'https://scholar.google.com/scholar_lookup?title=Maternal+serum+Down+syndrome+screening:+free+ß‐protein+is+a+more+effective+marker+than+human+chorionic+gonadotropin.[see+comment]+&author=JN+Macri&author=RV+Kasturi&author=DA+Krantz&author=EJ+Cook&author=ND+Moore&author=JA+Young&publication_year=1990&hl=en']",,https://doi.org/10.1016/0002-9378(90)90700-H, Macri 1994 {published data only}  ,excluded,CD012599-bbs2-0328, Likely fewer than 80% evaluated for gestational age by ultrasound examination 
CD012599-bib-0332,"Macri JN, Spencer K, Garver K, Buchanan PD, Say B, Carpenter NJ, et al. ",Maternal serum free ß hCG screening: results of studies including 480 cases of Down syndrome.[see comment], Prenatal Diagnosis ,1994,14,    ,['citation-journal']," Macri JN, Spencer K, Garver K, Buchanan PD, Say B, Carpenter NJ, et al. Maternal serum free ß hCG screening: results of studies including 480 cases of Down syndrome.[see comment].  Prenatal Diagnosis 1994;14(2):97‐103. CENTRAL    Link to article     Google Scholar     ","['', 'https://doi.org/10.1002/pd.1970140204', 'https://scholar.google.com/scholar_lookup?title=Maternal+serum+free+ß+hCG+screening:+results+of+studies+including+480+cases+of+Down+syndrome.[see+comment]+&author=JN+Macri&author=K+Spencer&author=K+Garver&author=PD+Buchanan&author=B+Say&author=NJ+Carpenter&publication_year=1994&hl=en']",,https://doi.org/10.1002/pd.1970140204, Macri 1994 {published data only}  ,excluded,CD012599-bbs2-0328, Likely fewer than 80% evaluated for gestational age by ultrasound examination 
CD012599-bib-0333,"Spencer K, Macri JN. ",Early detection of Down's syndrome using free ß human choriogonadotropin, Annals of Clinical Biochemistry ,1992,19,    ,['citation-journal']," Spencer K, Macri JN. Early detection of Down's syndrome using free ß human choriogonadotropin.  Annals of Clinical Biochemistry 1992;19(3):349‐50. CENTRAL    Link to article     Google Scholar     ","['', 'https://doi.org/10.1177/000456329202900319', ""https://scholar.google.com/scholar_lookup?title=Early+detection+of+Down's+syndrome+using+free+ß+human+choriogonadotropin&author=K+Spencer&author=JN+Macri&publication_year=1992&hl=en""]",,https://doi.org/10.1177/000456329202900319, Macri 1994 {published data only}  ,excluded,CD012599-bbs2-0328, Likely fewer than 80% evaluated for gestational age by ultrasound examination 
CD012599-bib-0334,"Macri JN, Anderson RW, Krantz DA, Larsen JW, Buchanan PD. ",Prenatal maternal dried blood screening with alpha‐fetoprotein and free ß‐human chorionic gonadotropin for open neural tube defect and Down syndrome, American Journal of Obstetrics and Gynecology ,1996,174,    ,['citation-journal']," Macri JN, Anderson RW, Krantz DA, Larsen JW, Buchanan PD. Prenatal maternal dried blood screening with alpha‐fetoprotein and free ß‐human chorionic gonadotropin for open neural tube defect and Down syndrome.  American Journal of Obstetrics and Gynecology 1996;174(2):566‐72. CENTRAL    Link to article     Google Scholar     ","['', 'https://doi.org/10.1016/S0002-9378(96)70429-5', 'https://scholar.google.com/scholar_lookup?title=Prenatal+maternal+dried+blood+screening+with+alpha‐fetoprotein+and+free+ß‐human+chorionic+gonadotropin+for+open+neural+tube+defect+and+Down+syndrome+&author=JN+Macri&author=RW+Anderson&author=DA+Krantz&author=JW+Larsen&author=PD+Buchanan&publication_year=1996&hl=en']",,https://doi.org/10.1016/S0002-9378(96)70429-5, Macri 1996 {published data only}  ,excluded,CD012599-bbs2-0329, Likely fewer than 80% evaluated for gestational age by ultrasound examination 
CD012599-bib-0335,"Malone FD, D'Alton ME. ",Ultrasound clinics. Fetal nuchal fold translucency screening, Contemporary OB/GYN ,1998,43,    ,['citation-journal']," Malone FD, D'Alton ME. Ultrasound clinics. Fetal nuchal fold translucency screening.  Contemporary OB/GYN 1998;43(3):117‐8. CENTRAL    Google Scholar     ","['', ""https://scholar.google.com/scholar_lookup?title=Ultrasound+clinics.+Fetal+nuchal+fold+translucency+screening&author=FD+Malone&author=ME+D'Alton&publication_year=1998&hl=en""]",,, Malone 1998 {published data only}  ,excluded,CD012599-bbs2-0330, Review article 
CD012599-bib-0336,"Malone FD, D'Alton ME. ",First‐trimester sonographic screening for Down syndrome, Obstetrics and Gynecology ,2003,102,    ,['citation-journal']," Malone FD, D'Alton ME. First‐trimester sonographic screening for Down syndrome.  Obstetrics and Gynecology 2003;102(5):1066‐79. CENTRAL    Google Scholar     ","['', ""https://scholar.google.com/scholar_lookup?title=First‐trimester+sonographic+screening+for+Down+syndrome&author=FD+Malone&author=ME+D'Alton&publication_year=2003&hl=en""]",,, Malone 2003 {published data only}  ,excluded,CD012599-bbs2-0331, Review article 
CD012599-bib-0337,"Mandryka‐Stankewycz S, Perenc M, Dec G, Sieroszewski P. ",[Noninvasive prenatal test in the first trimester of pregnancy (NT and estimation of beta‐hCG and PAPP‐A) in the diagnosis of fetal abnormalities in Polish population‐‐comparison of the biochemistry own normal ranges and literature reported data]. [Polish], Ginekologia Polska ,2009,80,    ,['citation-journal']," Mandryka‐Stankewycz S, Perenc M, Dec G, Sieroszewski P. [Noninvasive prenatal test in the first trimester of pregnancy (NT and estimation of beta‐hCG and PAPP‐A) in the diagnosis of fetal abnormalities in Polish population‐‐comparison of the biochemistry own normal ranges and literature reported data]. [Polish].  Ginekologia Polska 2009;80(11):851‐5. CENTRAL    Google Scholar     ","['', 'https://scholar.google.com/scholar_lookup?title=[Noninvasive+prenatal+test+in+the+first+trimester+of+pregnancy+(NT+and+estimation+of+beta‐hCG+and+PAPP‐A)+in+the+diagnosis+of+fetal+abnormalities+in+Polish+population‐‐comparison+of+the+biochemistry+own+normal+ranges+and+literature+reported+data].+[Polish]+&author=S+Mandryka‐Stankewycz&author=M+Perenc&author=G+Dec&author=P+Sieroszewski&publication_year=2009&hl=en']",,, Mandryka‐Stankewycz 2009 {published data only}  ,excluded,CD012599-bbs2-0332, No diagnostic data 
CD012599-bib-0338,"Mangione R, Guyon F, Taine L, Wen ZQ, Roux D, Vergnaud A, et al. ",Pregnancy outcome and prognosis in fetuses with increased first‐trimester nuchal translucency, Fetal Diagnosis and Therapy ,2001,16,    ,['citation-journal']," Mangione R, Guyon F, Taine L, Wen ZQ, Roux D, Vergnaud A, et al. Pregnancy outcome and prognosis in fetuses with increased first‐trimester nuchal translucency.  Fetal Diagnosis and Therapy 2001;16(6):360‐3. CENTRAL    Link to article     Google Scholar     ","['', 'https://doi.org/10.1159/000053941', 'https://scholar.google.com/scholar_lookup?title=Pregnancy+outcome+and+prognosis+in+fetuses+with+increased+first‐trimester+nuchal+translucency&author=R+Mangione&author=F+Guyon&author=L+Taine&author=ZQ+Wen&author=D+Roux&author=A+Vergnaud&publication_year=2001&hl=en']",,https://doi.org/10.1159/000053941, Mangione 2001 {published data only}  ,excluded,CD012599-bbs2-0333, Abnormal screening results only 
CD012599-bib-0339,"Markov D, Dimitrova V. ",[Ultrasound screening for chromosomal anomalies by assessment of the fetal nasal bone during 11‐14 weeks of gestation‐‐a pilot study]. [Bulgarian], Akusherstvo i Ginekologiia ,2008,47,    ,['citation-journal']," Markov D, Dimitrova V. [Ultrasound screening for chromosomal anomalies by assessment of the fetal nasal bone during 11‐14 weeks of gestation‐‐a pilot study]. [Bulgarian].  Akusherstvo i Ginekologiia 2008;47(1):3‐9. CENTRAL    Google Scholar     ","['', 'https://scholar.google.com/scholar_lookup?title=[Ultrasound+screening+for+chromosomal+anomalies+by+assessment+of+the+fetal+nasal+bone+during+11‐14+weeks+of+gestation‐‐a+pilot+study].+[Bulgarian]+&author=D+Markov&author=V+Dimitrova&publication_year=2008&hl=en']",,, Markov 2008 {published data only}  ,excluded,CD012599-bbs2-0334, Unable to obtain paper 
CD012599-bib-0340,"Maymon R, Shulman A. ",Comparison of triple serum screening and pregnancy outcome in oocyte donation versus IVF pregnancies, Human Reproduction ,2001,16,    ,['citation-journal']," Maymon R, Shulman A. Comparison of triple serum screening and pregnancy outcome in oocyte donation versus IVF pregnancies.  Human Reproduction 2001;16(4):691‐5. CENTRAL    Link to article     Google Scholar     ","['', 'https://doi.org/10.1093/humrep/16.4.691', 'https://scholar.google.com/scholar_lookup?title=Comparison+of+triple+serum+screening+and+pregnancy+outcome+in+oocyte+donation+versus+IVF+pregnancies+&author=R+Maymon&author=A+Shulman&publication_year=2001&hl=en']",,https://doi.org/10.1093/humrep/16.4.691, Maymon 2001a {published data only}  ,excluded,CD012599-bbs2-0335, No Down's syndrome pregnancies in study population 
CD012599-bib-0341,"Maymon R, Dreazen E, Buckovsky I, Weinraub Z, Herman A. ",Does a 'notched' nuchal translucency indicate Down syndrome fetuses or other adverse pregnancy outcome?, Prenatal Diagnosis ,2001,21,    ,['citation-journal']," Maymon R, Dreazen E, Buckovsky I, Weinraub Z, Herman A. Does a 'notched' nuchal translucency indicate Down syndrome fetuses or other adverse pregnancy outcome?.  Prenatal Diagnosis 2001;21(5):403‐8. CENTRAL    Link to article     Google Scholar     ","['', 'https://doi.org/10.1002/pd.61', ""https://scholar.google.com/scholar_lookup?title=Does+a+'notched'+nuchal+translucency+indicate+Down+syndrome+fetuses+or+other+adverse+pregnancy+outcome?+&author=R+Maymon&author=E+Dreazen&author=I+Buckovsky&author=Z+Weinraub&author=A+Herman&publication_year=2001&hl=en""]",,https://doi.org/10.1002/pd.61, Maymon 2001b {published data only}  ,excluded,CD012599-bbs2-0336, No normal test results included therefore unable to extract meaningful data 
CD012599-bib-0342,"Maymon R, Shulman A. ",Serial first‐ and second‐trimester Down's syndrome screening tests among IVF‐versus naturally‐conceived singletons, Human Reproduction ,2002,17,    ,['citation-journal']," Maymon R, Shulman A. Serial first‐ and second‐trimester Down's syndrome screening tests among IVF‐versus naturally‐conceived singletons.  Human Reproduction 2002;17(4):1081‐5. CENTRAL    Link to article     Google Scholar     ","['', 'https://doi.org/10.1093/humrep/17.4.1081', ""https://scholar.google.com/scholar_lookup?title=Serial+first‐+and+second‐trimester+Down's+syndrome+screening+tests+among+IVF‐versus+naturally‐conceived+singletons+&author=R+Maymon&author=A+Shulman&publication_year=2002&hl=en""]",,https://doi.org/10.1093/humrep/17.4.1081, Maymon 2002 {published data only}  ,excluded,CD012599-bbs2-0337, No Down's syndrome pregnancies in study population 
CD012599-bib-0343,"Maymon R, Shulman A. ",Integrated first‐ and second‐trimester Down syndrome screening test among unaffected IVF pregnancies, Prenatal Diagnosis ,2004,24,    ,['citation-journal']," Maymon R, Shulman A. Integrated first‐ and second‐trimester Down syndrome screening test among unaffected IVF pregnancies.  Prenatal Diagnosis 2004;24(2):125‐9. CENTRAL    Link to article     Google Scholar     ","['', 'https://doi.org/10.1002/pd.809', 'https://scholar.google.com/scholar_lookup?title=Integrated+first‐+and+second‐trimester+Down+syndrome+screening+test+among+unaffected+IVF+pregnancies+&author=R+Maymon&author=A+Shulman&publication_year=2004&hl=en']",,https://doi.org/10.1002/pd.809, Maymon 2004 {published data only}  ,excluded,CD012599-bbs2-0338, No Down's syndrome pregnancies in study population 
CD012599-bib-0344,"Maymon R, Cuckle H, Jones R, Reish O, Sharony R, Herman A. ",Predicting the result of additional second‐trimester markers from a woman's first‐trimester marker profile: A new concept in Down syndrome screening, Prenatal Diagnosis ,2005,25,    ,['citation-journal']," Maymon R, Cuckle H, Jones R, Reish O, Sharony R, Herman A. Predicting the result of additional second‐trimester markers from a woman's first‐trimester marker profile: A new concept in Down syndrome screening.  Prenatal Diagnosis 2005;25(12):1102‐6. CENTRAL    Link to article     Google Scholar     ","['', 'https://doi.org/10.1002/pd.1256', ""https://scholar.google.com/scholar_lookup?title=Predicting+the+result+of+additional+second‐trimester+markers+from+a+woman's+first‐trimester+marker+profile:+A+new+concept+in+Down+syndrome+screening+&author=R+Maymon&author=H+Cuckle&author=R+Jones&author=O+Reish&author=R+Sharony&author=A+Herman&publication_year=2005&hl=en""]",,https://doi.org/10.1002/pd.1256, Maymon 2005 {published data only}  ,excluded,CD012599-bbs2-0339, Modelled data 
