reference_id,authors,title,journal,year,volume,citation_footer,citation_type,citation,urls,pubmed_id,doi,header,reference_type,study_id,exclusion_reason
CD012599-bib-0001,"Aagaard‐Tillery KM, Malone FD, Nyberg DA, Porter TF, Cuckle HS, Fuchs K, et al. ",Role of second‐trimester genetic sonography after Down syndrome screening, Obstetrics & Gynecology ,2009,114,    ,['citation-journal']," Aagaard‐Tillery KM, Malone FD, Nyberg DA, Porter TF, Cuckle HS, Fuchs K, et al. Role of second‐trimester genetic sonography after Down syndrome screening.  Obstetrics & Gynecology 2009;114(6):1189‐96. CENTRAL    Link to article     Google Scholar     ","['', 'https://doi.org/10.1097/AOG.0b013e3181c15064', 'https://scholar.google.com/scholar_lookup?title=Role+of+second‐trimester+genetic+sonography+after+Down+syndrome+screening&author=KM+Aagaard‐Tillery&author=FD+Malone&author=DA+Nyberg&author=TF+Porter&author=HS+Cuckle&author=K+Fuchs&publication_year=2009&hl=en']",,https://doi.org/10.1097/AOG.0b013e3181c15064, Aagaard‐Tillery 2009 {published data only}  ,included,CD012599-bbs2-0001,
CD012599-bib-0002,"Audibert F, Dommergues M, Benattar C, Taieb J, Thalabard JC, Frydman R. ",Screening for Down syndrome using first‐trimester ultrasound and second‐trimester maternal serum markers in a low‐risk population: a prospective longitudinal study, Ultrasound in Obstetrics & Gynecology ,2001,18,    ,['citation-journal']," Audibert F, Dommergues M, Benattar C, Taieb J, Thalabard JC, Frydman R. Screening for Down syndrome using first‐trimester ultrasound and second‐trimester maternal serum markers in a low‐risk population: a prospective longitudinal study.  Ultrasound in Obstetrics & Gynecology 2001;18(1):26‐31. CENTRAL    Link to article     Google Scholar     ","['', 'https://doi.org/10.1046/j.1469-0705.2001.00457.x', 'https://scholar.google.com/scholar_lookup?title=Screening+for+Down+syndrome+using+first‐trimester+ultrasound+and+second‐trimester+maternal+serum+markers+in+a+low‐risk+population:+a+prospective+longitudinal+study+&author=F+Audibert&author=M+Dommergues&author=C+Benattar&author=J+Taieb&author=JC+Thalabard&author=R+Frydman&publication_year=2001&hl=en']",,https://doi.org/10.1046/j.1469-0705.2001.00457.x, Audibert 2001 {published data only}  ,included,CD012599-bbs2-0002,
CD012599-bib-0003,"Babbur V, Lees CC, Goodburn SF, Morris N, Breeze AC, Hackett GA. ",Prospective audit of a one‐centre combined nuchal translucency and triple test programme for the detection of trisomy 21, Prenatal Diagnosis ,2005,25,    ,['citation-journal']," Babbur V, Lees CC, Goodburn SF, Morris N, Breeze AC, Hackett GA. Prospective audit of a one‐centre combined nuchal translucency and triple test programme for the detection of trisomy 21.  Prenatal Diagnosis 2005;25(6):465‐9. CENTRAL    Link to article     Google Scholar     ","['', 'https://doi.org/10.1002/pd.1163', 'https://scholar.google.com/scholar_lookup?title=Prospective+audit+of+a+one‐centre+combined+nuchal+translucency+and+triple+test+programme+for+the+detection+of+trisomy+21+&author=V+Babbur&author=CC+Lees&author=SF+Goodburn&author=N+Morris&author=AC+Breeze&author=GA+Hackett&publication_year=2005&hl=en']",,https://doi.org/10.1002/pd.1163, Babbur 2005 {published data only}  ,included,CD012599-bbs2-0003,
CD012599-bib-0004,"Baviera G, Chimicata S, De Domenico R, Granese R, Carbone C, Dugo N, et al. ",First‐ and second‐trimester ADAM12s in Down syndrome screening, Clinical Chemistry ,2010,56,    ,['citation-journal']," Baviera G, Chimicata S, De Domenico R, Granese R, Carbone C, Dugo N, et al. First‐ and second‐trimester ADAM12s in Down syndrome screening.  Clinical Chemistry 2010;56(8):1355‐7. CENTRAL    Link to article     Google Scholar     ","['', 'https://doi.org/10.1373/clinchem.2009.139816', 'https://scholar.google.com/scholar_lookup?title=First‐+and+second‐trimester+ADAM12s+in+Down+syndrome+screening&author=G+Baviera&author=S+Chimicata&author=R+Domenico&author=R+Granese&author=C+Carbone&author=N+Dugo&publication_year=2010&hl=en']",,https://doi.org/10.1373/clinchem.2009.139816, Baviera 2010 {published data only}  ,included,CD012599-bbs2-0004,
CD012599-bib-0005,"Benattar C, Audibert F, Taieb J, Ville Y, Roberto A, Lindenbaum A, et al. ",Efficiency of ultrasound and biochemical markers for Down's syndrome risk screening. A prospective study, Fetal Diagnosis and Therapy ,1999,14,    ,['citation-journal']," Benattar C, Audibert F, Taieb J, Ville Y, Roberto A, Lindenbaum A, et al. Efficiency of ultrasound and biochemical markers for Down's syndrome risk screening. A prospective study.  Fetal Diagnosis and Therapy 1999;14(2):112‐7. CENTRAL    Link to article     Google Scholar     ","['', 'https://doi.org/10.1159/000020900', ""https://scholar.google.com/scholar_lookup?title=Efficiency+of+ultrasound+and+biochemical+markers+for+Down's+syndrome+risk+screening.+A+prospective+study+&author=C+Benattar&author=F+Audibert&author=J+Taieb&author=Y+Ville&author=A+Roberto&author=A+Lindenbaum&publication_year=1999&hl=en""]",,https://doi.org/10.1159/000020900, Benattar 1999 {published data only}  ,included,CD012599-bbs2-0005,
CD012599-bib-0006,"Bestwick JP, Huttly WJ, Wald NJ. ",Distribution of nuchal translucency in antenatal screening for Down's syndrome, Journal of Medical Screening ,2010,17,    ,['citation-journal']," Bestwick JP, Huttly WJ, Wald NJ. Distribution of nuchal translucency in antenatal screening for Down's syndrome.  Journal of Medical Screening 2010;17(1):8‐12 (Erratum in Journal of Medical Screening 2010;17(2):106). CENTRAL    Link to article     Google Scholar     ","['', 'https://doi.org/10.1258/jms.2010.009107', ""https://scholar.google.com/scholar_lookup?title=Distribution+of+nuchal+translucency+in+antenatal+screening+for+Down's+syndrome&author=JP+Bestwick&author=WJ+Huttly&author=NJ+Wald&publication_year=2010&hl=en""]",,https://doi.org/10.1258/jms.2010.009107, Bestwick 2010 {published data only}  ,included,CD012599-bbs2-0006,
CD012599-bib-0007,"Cuckle HS, Malone FD, Wright D, Porter TF, Nyberg DA, Comstock CH, et al. ",Contingent screening for Down syndrome‐results from the FaSTER trial, Prenatal Diagnosis ,2008,28,    ,['citation-journal']," Cuckle HS, Malone FD, Wright D, Porter TF, Nyberg DA, Comstock CH, et al. Contingent screening for Down syndrome‐results from the FaSTER trial.  Prenatal Diagnosis 2008;28(2):89‐94. CENTRAL    Link to article     Google Scholar     ","['', 'https://doi.org/10.1002/pd.1913', 'https://scholar.google.com/scholar_lookup?title=Contingent+screening+for+Down+syndrome‐results+from+the+FaSTER+trial&author=HS+Cuckle&author=FD+Malone&author=D+Wright&author=TF+Porter&author=DA+Nyberg&author=CH+Comstock&publication_year=2008&hl=en']",,https://doi.org/10.1002/pd.1913, Cuckle 2008 {published data only}  ,included,CD012599-bbs2-0007,
CD012599-bib-0008,"Goh HH, Anandakumr C, Tain CF, Leong WP, Aw BL, Wong YC, et al. ",Establishment and appraisal of a prenatal screening test for Down's syndrome based on the triple test of maternal serum parameters in a Singapore population, Singapore Journal of Obstetrics and Gynaecology ,1996,27,    ,['citation-journal']," Goh HH, Anandakumr C, Tain CF, Leong WP, Aw BL, Wong YC, et al. Establishment and appraisal of a prenatal screening test for Down's syndrome based on the triple test of maternal serum parameters in a Singapore population.  Singapore Journal of Obstetrics and Gynaecology 1996;27(2):81‐8. CENTRAL    Google Scholar     ","['', ""https://scholar.google.com/scholar_lookup?title=Establishment+and+appraisal+of+a+prenatal+screening+test+for+Down's+syndrome+based+on+the+triple+test+of+maternal+serum+parameters+in+a+Singapore+population+&author=HH+Goh&author=C+Anandakumr&author=CF+Tain&author=WP+Leong&author=BL+Aw&author=YC+Wong&publication_year=1996&hl=en""]",,, Goh 1996 {published data only}  ,included,CD012599-bbs2-0008,
CD012599-bib-0009,"Guanciali‐Franchi P, Iezzi I, Matarrelli B, Morizio E, Calabrese G, Palka G. ",Effectiveness of crosstrimester test in selecting high‐risk pregnant women to undergo invasive prenatal diagnosis, Prenatal Diagnosis ,2010,30,    ,['citation-journal']," Guanciali‐Franchi P, Iezzi I, Matarrelli B, Morizio E, Calabrese G, Palka G. Effectiveness of crosstrimester test in selecting high‐risk pregnant women to undergo invasive prenatal diagnosis.  Prenatal Diagnosis 2010;30(8):795‐6. CENTRAL    Link to article     Google Scholar     ","['', 'https://doi.org/10.1002/pd.2539', 'https://scholar.google.com/scholar_lookup?title=Effectiveness+of+crosstrimester+test+in+selecting+high‐risk+pregnant+women+to+undergo+invasive+prenatal+diagnosis+&author=P+Guanciali‐Franchi&author=I+Iezzi&author=B+Matarrelli&author=E+Morizio&author=G+Calabrese&author=G+Palka&publication_year=2010&hl=en']",,https://doi.org/10.1002/pd.2539, Guanciali‐Franchi 2010 {published data only}  ,included,CD012599-bbs2-0009,
CD012599-bib-0010,"Habayeb O, Goodburn S, Chudleigh T, Brockelsby J, Missfelder‐Lobos H, Hackett G, et al. ",The NTplus method of screening for Down syndrome: achieving the 2010 targets?, Prenatal Diagnosis ,2010,30,    ,['citation-journal']," Habayeb O, Goodburn S, Chudleigh T, Brockelsby J, Missfelder‐Lobos H, Hackett G, et al. The NTplus method of screening for Down syndrome: achieving the 2010 targets?.  Prenatal Diagnosis 2010;30(5):434‐7. CENTRAL    Google Scholar     ","['', 'https://scholar.google.com/scholar_lookup?title=The+NTplus+method+of+screening+for+Down+syndrome:+achieving+the+2010+targets?&author=O+Habayeb&author=S+Goodburn&author=T+Chudleigh&author=J+Brockelsby&author=H+Missfelder‐Lobos&author=G+Hackett&publication_year=2010&hl=en']",,, Habayeb 2010 {published data only}  ,included,CD012599-bbs2-0010,
CD012599-bib-0011,"Herman A, Dreazen E, Tovbin J, Weinraub Z, Bukovsky Y, Maymon R. ",Comparison between disclosure and non‐disclosure approaches for trisomy 21 screening tests," Human Reproduction (Oxford, England) ",2002,17,    ,['citation-journal']," Herman A, Dreazen E, Tovbin J, Weinraub Z, Bukovsky Y, Maymon R. Comparison between disclosure and non‐disclosure approaches for trisomy 21 screening tests.  Human Reproduction (Oxford, England) 2002;17(5):1358‐62. CENTRAL    Link to article     Google Scholar     ","['', 'https://doi.org/10.1093/humrep/17.5.1358', 'https://scholar.google.com/scholar_lookup?title=Comparison+between+disclosure+and+non‐disclosure+approaches+for+trisomy+21+screening+tests+&author=A+Herman&author=E+Dreazen&author=J+Tovbin&author=Z+Weinraub&author=Y+Bukovsky&author=R+Maymon&publication_year=2002&hl=en']",,https://doi.org/10.1093/humrep/17.5.1358, Herman 2002 {published data only}  ,included,CD012599-bbs2-0011,
CD012599-bib-0012,"Lam YH, Lee CP, Sin SY, Tang R, Wong HS, Wong SF, et al. ",Comparison and integration of first trimester fetal nuchal translucency and second trimester maternal serum screening for fetal Down syndrome, Prenatal Diagnosis ,2002,22,    ,['citation-journal']," Lam YH, Lee CP, Sin SY, Tang R, Wong HS, Wong SF, et al. Comparison and integration of first trimester fetal nuchal translucency and second trimester maternal serum screening for fetal Down syndrome.  Prenatal Diagnosis 2002;22(8):730‐5. CENTRAL    Google Scholar     ","['', 'https://scholar.google.com/scholar_lookup?title=Comparison+and+integration+of+first+trimester+fetal+nuchal+translucency+and+second+trimester+maternal+serum+screening+for+fetal+Down+syndrome+&author=YH+Lam&author=CP+Lee&author=SY+Sin&author=R+Tang&author=HS+Wong&author=SF+Wong&publication_year=2002&hl=en']",,, Lam 2002 {published data only}  ,included,CD012599-bbs2-0012,
CD012599-bib-0013,"Malone FD, Canick JA, Ball RH, Nyberg DA, Comstock CH, Bukowski R, et al. ","First‐trimester or second‐trimester screening, or both, for Down's syndrome (see comment)", New England Journal of Medicine ,2005,353,    ,['citation-journal']," Malone FD, Canick JA, Ball RH, Nyberg DA, Comstock CH, Bukowski R, et al. First‐trimester or second‐trimester screening, or both, for Down's syndrome (see comment).  New England Journal of Medicine 2005;353(19):2001‐11. CENTRAL    Link to article     Google Scholar     ","['', 'https://doi.org/10.1056/NEJMoa043693', ""https://scholar.google.com/scholar_lookup?title=First‐trimester+or+second‐trimester+screening,+or+both,+for+Down's+syndrome+(see+comment)&author=FD+Malone&author=JA+Canick&author=RH+Ball&author=DA+Nyberg&author=CH+Comstock&author=R+Bukowski&publication_year=2005&hl=en""]",,https://doi.org/10.1056/NEJMoa043693, Malone 2005 {published data only}  ,included,CD012599-bbs2-0013,
CD012599-bib-0014,"Okun N, Summers AM, Hoffman B, Huang T, Winsor E, Chitayat D, et al. ",Prospective experience with integrated prenatal screening and first trimester combined screening for trisomy 21 in a large Canadian urban center, Prenatal Diagnosis ,2008,28,    ,['citation-journal']," Okun N, Summers AM, Hoffman B, Huang T, Winsor E, Chitayat D, et al. Prospective experience with integrated prenatal screening and first trimester combined screening for trisomy 21 in a large Canadian urban center.  Prenatal Diagnosis 2008;28(11):987‐92. CENTRAL    Link to article     PubMed     Google Scholar     ","['', 'https://doi.org/10.1002/pd.2084', 'https://www.ncbi.nlm.nih.gov/pubmed/18925623', 'https://scholar.google.com/scholar_lookup?title=Prospective+experience+with+integrated+prenatal+screening+and+first+trimester+combined+screening+for+trisomy+21+in+a+large+Canadian+urban+center+&author=N+Okun&author=AM+Summers&author=B+Hoffman&author=T+Huang&author=E+Winsor&author=D+Chitayat&publication_year=2008&hl=en']",18925623,https://doi.org/10.1002/pd.2084, Okun 2008 Integrated {published data only}  ,included,CD012599-bbs2-0014,
CD012599-bib-0015,"Palomaki GE, Wright DE, Summers AM, Neveux LM, Meier C, O'Donnell A, et al. ",Repeated measurement of pregnancy‐associated plasma protein‐A (PAPP‐A) in Down syndrome screening: a validation study, Prenatal Diagnosis ,2006,26,    ,['citation-journal']," Palomaki GE, Wright DE, Summers AM, Neveux LM, Meier C, O'Donnell A, et al. Repeated measurement of pregnancy‐associated plasma protein‐A (PAPP‐A) in Down syndrome screening: a validation study.  Prenatal Diagnosis 2006;26(8):730‐9. CENTRAL    Link to article     Google Scholar     ","['', 'https://doi.org/10.1002/pd.1497', ""https://scholar.google.com/scholar_lookup?title=Repeated+measurement+of+pregnancy‐associated+plasma+protein‐A+(PAPP‐A)+in+Down+syndrome+screening:+a+validation+study+&author=GE+Palomaki&author=DE+Wright&author=AM+Summers&author=LM+Neveux&author=C+Meier&author=A+O'Donnell&publication_year=2006&hl=en""]",,https://doi.org/10.1002/pd.1497, Palomaki 2006 {published data only}  ,included,CD012599-bbs2-0015,
CD012599-bib-0016,"Rodrigues LC, Ramos‐Dias AM, Carvalho V, Cirurgiao F. ",Evaluation of four years of prenatal screening for aneuploidies in Hospital S. Francisco Xavier using the integrated test, Journal of Medical Screening ,2009,16,    ,['citation-journal']," Rodrigues LC, Ramos‐Dias AM, Carvalho V, Cirurgiao F. Evaluation of four years of prenatal screening for aneuploidies in Hospital S. Francisco Xavier using the integrated test.  Journal of Medical Screening 2009;16(1):46‐7. CENTRAL    Link to article     Google Scholar     ","['', 'https://doi.org/10.1258/jms.2009.009019', 'https://scholar.google.com/scholar_lookup?title=Evaluation+of+four+years+of+prenatal+screening+for+aneuploidies+in+Hospital+S.+Francisco+Xavier+using+the+integrated+test+&author=LC+Rodrigues&author=AM+Ramos‐Dias&author=V+Carvalho&author=F+Cirurgiao&publication_year=2009&hl=en']",,https://doi.org/10.1258/jms.2009.009019, Rodrigues 2009 {published data only}  ,included,CD012599-bbs2-0016,
CD012599-bib-0017,"Rozenberg P, Malagrida L, Cuckle H, Durand‐Zaleski I, Nisand I, Audibert F, et al. ",Down's syndrome screening with nuchal translucency at 12(+0)‐14(+0) weeks and maternal serum markers at 14(+1)‐17(+0) weeks: a prospective study, Human Reproduction ,2002,17,    ,['citation-journal']," Rozenberg P, Malagrida L, Cuckle H, Durand‐Zaleski I, Nisand I, Audibert F, et al. Down's syndrome screening with nuchal translucency at 12(+0)‐14(+0) weeks and maternal serum markers at 14(+1)‐17(+0) weeks: a prospective study.  Human Reproduction 2002;17(4):1093‐8. CENTRAL    Link to article     Google Scholar     ","['', 'https://doi.org/10.1093/humrep/17.4.1093', ""https://scholar.google.com/scholar_lookup?title=Down's+syndrome+screening+with+nuchal+translucency+at+12(+0)‐14(+0)+weeks+and+maternal+serum+markers+at+14(+1)‐17(+0)+weeks:+a+prospective+study+&author=P+Rozenberg&author=L+Malagrida&author=H+Cuckle&author=I+Durand‐Zaleski&author=I+Nisand&author=F+Audibert&publication_year=2002&hl=en""]",,https://doi.org/10.1093/humrep/17.4.1093, Rozenberg 2002 {published data only}  ,included,CD012599-bbs2-0017,
CD012599-bib-0018,"Schuchter K, Hafner E, Stangl G, Ogris E, Philipp K. ",Sequential screening for trisomy 21 by nuchal translucency measurement in the first trimester and maternal serum biochemistry in the second trimester in a low‐risk population, Ultrasound in Obstetrics & Gynecology ,2001,18,    ,['citation-journal']," Schuchter K, Hafner E, Stangl G, Ogris E, Philipp K. Sequential screening for trisomy 21 by nuchal translucency measurement in the first trimester and maternal serum biochemistry in the second trimester in a low‐risk population.  Ultrasound in Obstetrics & Gynecology 2001;18(1):23‐5. CENTRAL    Link to article     Google Scholar     ","['', 'https://doi.org/10.1046/j.1469-0705.2001.00458.x', 'https://scholar.google.com/scholar_lookup?title=Sequential+screening+for+trisomy+21+by+nuchal+translucency+measurement+in+the+first+trimester+and+maternal+serum+biochemistry+in+the+second+trimester+in+a+low‐risk+population+&author=K+Schuchter&author=E+Hafner&author=G+Stangl&author=E+Ogris&author=K+Philipp&publication_year=2001&hl=en']",,https://doi.org/10.1046/j.1469-0705.2001.00458.x, Schuchter 2001 {published data only}  ,included,CD012599-bbs2-0018,
CD012599-bib-0020,"Wald NJ, Rodeck C, Hackshaw AK, Rudnicka A. ",SURUSS in perspective, Seminars in Perinatology ,2005,29,    ,['citation-journal']," Wald NJ, Rodeck C, Hackshaw AK, Rudnicka A. SURUSS in perspective.  Seminars in Perinatology 2005;29(4):225‐35. CENTRAL    Link to article     PubMed     Google Scholar     ","['', 'https://doi.org/10.1053/j.semperi.2005.05.006', 'https://www.ncbi.nlm.nih.gov/pubmed/16104673', 'https://scholar.google.com/scholar_lookup?title=SURUSS+in+perspective&author=NJ+Wald&author=C+Rodeck&author=AK+Hackshaw&author=A+Rudnicka&publication_year=2005&hl=en']",16104673,https://doi.org/10.1053/j.semperi.2005.05.006, Wald 2003b {published data only}  ,included,CD012599-bbs2-0019,
CD012599-bib-0019,"Wald NJ, Rodeck C, Hackshaw AK, Rudnicka A. ",SURUSS in perspective (see comment), BJOG: an international journal of obstetrics and gynaecology ,2004,111,    ,['citation-journal']," Wald NJ, Rodeck C, Hackshaw AK, Rudnicka A. SURUSS in perspective (see comment).  BJOG: an international journal of obstetrics and gynaecology 2004;111(6):521‐31. CENTRAL    Link to article     Google Scholar     ","['', 'https://doi.org/10.1111/j.1471-0528.2004.00193.x', 'https://scholar.google.com/scholar_lookup?title=SURUSS+in+perspective+(see+comment)&author=NJ+Wald&author=C+Rodeck&author=AK+Hackshaw&author=A+Rudnicka&publication_year=2004&hl=en']",,https://doi.org/10.1111/j.1471-0528.2004.00193.x, Wald 2003b {published data only}  ,included,CD012599-bbs2-0019,
CD012599-bib-0022,"Wald NJ, Rodeck C, Hackshaw AK, Walters J, Chitty L, Mackinson AM. ","First and second trimester antenatal screening for Down's syndrome: the results of the Serum, Urine and Ultrasound Screening Study (SURUSS)", Journal of Medical Screening ,2003,10,    ,['citation-journal']," Wald NJ, Rodeck C, Hackshaw AK, Walters J, Chitty L, Mackinson AM. First and second trimester antenatal screening for Down's syndrome: the results of the Serum, Urine and Ultrasound Screening Study (SURUSS).  Journal of Medical Screening 2003;10(2):56‐104. CENTRAL    Google Scholar     ","['', ""https://scholar.google.com/scholar_lookup?title=First+and+second+trimester+antenatal+screening+for+Down's+syndrome:+the+results+of+the+Serum,+Urine+and+Ultrasound+Screening+Study+(SURUSS)+&author=NJ+Wald&author=C+Rodeck&author=AK+Hackshaw&author=J+Walters&author=L+Chitty&author=AM+Mackinson&publication_year=2003&hl=en""]",,, Wald 2003b {published data only}  ,included,CD012599-bbs2-0019,
CD012599-bib-0021,"Wald NJ, Rodeck C, Hackshaw AK, Walters J, Chitty L, Mackinson AM, et al. ","First and second trimester antenatal screening for Down's syndrome: the results of the Serum, Urine and Ultrasound Screening Study (SURUSS)"," Health Technology Assessment (Winchester, England) ",2003,7,    ,['citation-journal']," Wald NJ, Rodeck C, Hackshaw AK, Walters J, Chitty L, Mackinson AM, et al. First and second trimester antenatal screening for Down's syndrome: the results of the Serum, Urine and Ultrasound Screening Study (SURUSS).  Health Technology Assessment (Winchester, England) 2003;7(11):1‐77. CENTRAL    Google Scholar     ","['', ""https://scholar.google.com/scholar_lookup?title=First+and+second+trimester+antenatal+screening+for+Down's+syndrome:+the+results+of+the+Serum,+Urine+and+Ultrasound+Screening+Study+(SURUSS)+&author=NJ+Wald&author=C+Rodeck&author=AK+Hackshaw&author=J+Walters&author=L+Chitty&author=AM+Mackinson&publication_year=2003&hl=en""]",,, Wald 2003b {published data only}  ,included,CD012599-bbs2-0019,
CD012599-bib-0023,"Wald NJ, Huttly WJ, Murphy KW, Ali K, Bestwick JP, Rodeck CH. ",Antenatal screening for Down's syndrome using the Integrated test at two London hospitals, Journal of Medical Screening ,2009,16,    ,['citation-journal']," Wald NJ, Huttly WJ, Murphy KW, Ali K, Bestwick JP, Rodeck CH. Antenatal screening for Down's syndrome using the Integrated test at two London hospitals.  Journal of Medical Screening 2009;16(1):7‐10. CENTRAL    Link to article     Google Scholar     ","['', 'https://doi.org/10.1258/jms.2009.008094', ""https://scholar.google.com/scholar_lookup?title=Antenatal+screening+for+Down's+syndrome+using+the+Integrated+test+at+two+London+hospitals&author=NJ+Wald&author=WJ+Huttly&author=KW+Murphy&author=K+Ali&author=JP+Bestwick&author=CH+Rodeck&publication_year=2009&hl=en""]",,https://doi.org/10.1258/jms.2009.008094, Wald 2009 {published data only}  ,included,CD012599-bbs2-0020,
CD012599-bib-0024,"Wright D, Bradbury I, Malone F, D'Alton M, Summers A, Huang T, et al. ",Cross‐trimester repeated measures testing for Down's syndrome screening: an assessment," Health Technology Assessment (Winchester, England) ",2010,14,    ,['citation-journal']," Wright D, Bradbury I, Malone F, D'Alton M, Summers A, Huang T, et al. Cross‐trimester repeated measures testing for Down's syndrome screening: an assessment.  Health Technology Assessment (Winchester, England) 2010;14(33):1‐80. CENTRAL    Link to article     Google Scholar     ","['', 'https://doi.org/10.3310/hta14330', ""https://scholar.google.com/scholar_lookup?title=Cross‐trimester+repeated+measures+testing+for+Down's+syndrome+screening:+an+assessment&author=D+Wright&author=I+Bradbury&author=F+Malone&author=M+D'Alton&author=A+Summers&author=T+Huang&publication_year=2010&hl=en""]",,https://doi.org/10.3310/hta14330, Wright 2010 FASTER trial {published data only}  ,included,CD012599-bbs2-0021,
CD012599-bib-0025,"Wright D, Bradbury I, Malone F, D'Alton M, Summers A, Huang T, et al. ",Cross‐trimester repeated measures testing for Down's syndrome screening: an assessment," Health Technology Assessment (Winchester, England) ",2010,14,    ,['citation-journal']," Wright D, Bradbury I, Malone F, D'Alton M, Summers A, Huang T, et al. Cross‐trimester repeated measures testing for Down's syndrome screening: an assessment.  Health Technology Assessment (Winchester, England) 2010;14(33):1‐80. CENTRAL    Link to article     Google Scholar     ","['', 'https://doi.org/10.3310/hta14330', ""https://scholar.google.com/scholar_lookup?title=Cross‐trimester+repeated+measures+testing+for+Down's+syndrome+screening:+an+assessment&author=D+Wright&author=I+Bradbury&author=F+Malone&author=M+D'Alton&author=A+Summers&author=T+Huang&publication_year=2010&hl=en""]",,https://doi.org/10.3310/hta14330, Wright 2010 North York {published data only}  ,included,CD012599-bbs2-0022,
CD012599-bib-0026,"Aagaard‐Tillery KM, Flint Porter T, Malone FD, Nyberg DA, Collins J, Comstock CH, et al. ",Influence of maternal BMI on genetic sonography in the FaSTER trial, Prenatal Diagnosis ,2010,30,    ,['citation-journal']," Aagaard‐Tillery KM, Flint Porter T, Malone FD, Nyberg DA, Collins J, Comstock CH, et al. Influence of maternal BMI on genetic sonography in the FaSTER trial.  Prenatal Diagnosis 2010;30(1):14‐22. CENTRAL    Link to article     Google Scholar     ","['', 'https://doi.org/10.1002/pd.2399', 'https://scholar.google.com/scholar_lookup?title=Influence+of+maternal+BMI+on+genetic+sonography+in+the+FaSTER+trial&author=KM+Aagaard‐Tillery&author=T+FlintPorter&author=FD+Malone&author=DA+Nyberg&author=J+Collins&author=CH+Comstock&publication_year=2010&hl=en']",,https://doi.org/10.1002/pd.2399, Aagaard‐Tillery 2010 {published data only}  ,excluded,CD012599-bbs2-0023, Results presented in another study 
