reference_id,authors,title,journal,year,volume,citation_footer,citation_type,citation,urls,pubmed_id,doi,header,reference_type,study_id,exclusion_reason
CD012599-bib-0483,"Schielen PC, Wildschut HI, Loeber JG. ",Down syndrome screening: determining the cutoff level of risk for invasive testing, Prenatal Diagnosis ,2009,29,    ,['citation-journal']," Schielen PC, Wildschut HI, Loeber JG. Down syndrome screening: determining the cutoff level of risk for invasive testing.  Prenatal Diagnosis 2009;29(2):190‐2. CENTRAL    Link to article     Google Scholar     ","['', 'https://doi.org/10.1002/pd.2165', 'https://scholar.google.com/scholar_lookup?title=Down+syndrome+screening:+determining+the+cutoff+level+of+risk+for+invasive+testing&author=PC+Schielen&author=HI+Wildschut&author=JG+Loeber&publication_year=2009&hl=en']",,https://doi.org/10.1002/pd.2165, Schielen 2009 {published data only}  ,excluded,CD012599-bbs2-0478, Full study information not given 
CD012599-bib-0484,"Schiott KM, Christiansen M, Petersen OB, Sorensen TL, Uldbjerg N. ","The ""Consecutive Combined Test""‐‐using double test from week 8 + 0 and nuchal translucency scan, for first trimester screening for Down syndrome", Prenatal Diagnosis ,2006,26,    ,['citation-journal']," Schiott KM, Christiansen M, Petersen OB, Sorensen TL, Uldbjerg N. The ""Consecutive Combined Test""‐‐using double test from week 8 + 0 and nuchal translucency scan, for first trimester screening for Down syndrome.  Prenatal Diagnosis 2006;26(12):1105‐9. CENTRAL    Link to article     Google Scholar     ","['', 'https://doi.org/10.1002/pd.1487', 'https://scholar.google.com/scholar_lookup?title=The+']",,https://doi.org/10.1002/pd.1487, Schiott 2006 {published data only}  ,excluded,CD012599-bbs2-0479, Unable to extract useful data 
CD012599-bib-0485,"Schmidt P, Rom J, Maul H, Vaske B, Hillemanns P, Scharf A. ",Advanced first trimester screening (AFS): an improved test strategy for the individual risk assessment of fetal aneuploidies and malformations, Archives of Gynecology & Obstetrics ,2007,276,    ,['citation-journal']," Schmidt P, Rom J, Maul H, Vaske B, Hillemanns P, Scharf A. Advanced first trimester screening (AFS): an improved test strategy for the individual risk assessment of fetal aneuploidies and malformations.  Archives of Gynecology & Obstetrics 2007;276(2):159‐66. CENTRAL    Link to article     Google Scholar     ","['', 'https://doi.org/10.1007/s00404-007-0324-6', 'https://scholar.google.com/scholar_lookup?title=Advanced+first+trimester+screening+(AFS):+an+improved+test+strategy+for+the+individual+risk+assessment+of+fetal+aneuploidies+and+malformations+&author=P+Schmidt&author=J+Rom&author=H+Maul&author=B+Vaske&author=P+Hillemanns&author=A+Scharf&publication_year=2007&hl=en']",,https://doi.org/10.1007/s00404-007-0324-6, Schmidt 2007a {published data only}  ,excluded,CD012599-bbs2-0480, Not specific to Down’s syndrome 
CD012599-bib-0486,"Schmidt P, Staboulidou I, Soergel P, Wustemann M, Hillemanns P, Scharf A. ","Comparison of Nicolaides' risk evaluation for Down's syndrome with a novel software: an analysis of 1,463 cases", Archives of Gynecology & Obstetrics ,2007,275,    ,['citation-journal']," Schmidt P, Staboulidou I, Soergel P, Wustemann M, Hillemanns P, Scharf A. Comparison of Nicolaides' risk evaluation for Down's syndrome with a novel software: an analysis of 1,463 cases.  Archives of Gynecology & Obstetrics 2007;275(6):469‐74. CENTRAL    Link to article     Google Scholar     ","['', 'https://doi.org/10.1007/s00404-006-0288-y', ""https://scholar.google.com/scholar_lookup?title=Comparison+of+Nicolaides'+risk+evaluation+for+Down's+syndrome+with+a+novel+software:+an+analysis+of+1,463+cases+&author=P+Schmidt&author=I+Staboulidou&author=P+Soergel&author=M+Wustemann&author=P+Hillemanns&author=A+Scharf&publication_year=2007&hl=en""]",,https://doi.org/10.1007/s00404-006-0288-y, Schmidt 2007b {published data only}  ,excluded,CD012599-bbs2-0481, No separate Down’s syndrome data 
CD012599-bib-0487,"Schmidt P, Pruggmayer M, Steinborn A, Schippert C, Staboulidou I, Hillemanns P, et al. ","Are nuchal translucency, pregnancy associated plasma protein‐A or free‐beta‐human chorionic gonadotropin depending on maternal age? A multicenter study of 8,116 pregnancies", Archives of Gynecology & Obstetrics ,2007,276,    ,['citation-journal']," Schmidt P, Pruggmayer M, Steinborn A, Schippert C, Staboulidou I, Hillemanns P, et al. Are nuchal translucency, pregnancy associated plasma protein‐A or free‐beta‐human chorionic gonadotropin depending on maternal age? A multicenter study of 8,116 pregnancies.  Archives of Gynecology & Obstetrics 2007;276(3):259‐62. CENTRAL    Link to article     Google Scholar     ","['', 'https://doi.org/10.1007/s00404-007-0342-4', 'https://scholar.google.com/scholar_lookup?title=Are+nuchal+translucency,+pregnancy+associated+plasma+protein‐A+or+free‐beta‐human+chorionic+gonadotropin+depending+on+maternal+age?+A+multicenter+study+of+8,116+pregnancies+&author=P+Schmidt&author=M+Pruggmayer&author=A+Steinborn&author=C+Schippert&author=I+Staboulidou&author=P+Hillemanns&publication_year=2007&hl=en']",,https://doi.org/10.1007/s00404-007-0342-4, Schmidt 2007c {published data only}  ,excluded,CD012599-bbs2-0482, No diagnostic data 
CD012599-bib-0488,"Schmidt P, Hormansdorfer C, Pruggmayer M, Schutte C, Neumann A, Gerritzen A, et al. ","Improved prenatal aneuploidy screening using the novel advanced first‐trimester screening algorithm: a multicenter study of 10,017 pregnancies", Journal of Clinical Ultrasound ,2008,36,    ,['citation-journal']," Schmidt P, Hormansdorfer C, Pruggmayer M, Schutte C, Neumann A, Gerritzen A, et al. Improved prenatal aneuploidy screening using the novel advanced first‐trimester screening algorithm: a multicenter study of 10,017 pregnancies.  Journal of Clinical Ultrasound 2008;36(7):397‐402. CENTRAL    Link to article     Google Scholar     ","['', 'https://doi.org/10.1002/jcu.20509', 'https://scholar.google.com/scholar_lookup?title=Improved+prenatal+aneuploidy+screening+using+the+novel+advanced+first‐trimester+screening+algorithm:+a+multicenter+study+of+10,017+pregnancies+&author=P+Schmidt&author=C+Hormansdorfer&author=M+Pruggmayer&author=C+Schutte&author=A+Neumann&author=A+Gerritzen&publication_year=2008&hl=en']",,https://doi.org/10.1002/jcu.20509, Schmidt 2008a {published data only}  ,excluded,CD012599-bbs2-0483, Not specific to Down’s syndrome 
CD012599-bib-0489,"Schmidt P, Staboulidou I, Elsasser M, Vaske B, Hillemanns P, Scharf A. ",How imprecise may the measurement of fetal nuchal translucency be without worsening first‐trimester screening?, Fetal Diagnosis and Therapy ,2008,24,    ,['citation-journal']," Schmidt P, Staboulidou I, Elsasser M, Vaske B, Hillemanns P, Scharf A. How imprecise may the measurement of fetal nuchal translucency be without worsening first‐trimester screening?.  Fetal Diagnosis and Therapy 2008;24(3):291‐5. CENTRAL    Link to article     Google Scholar     ","['', 'https://doi.org/10.1159/000158520', 'https://scholar.google.com/scholar_lookup?title=How+imprecise+may+the+measurement+of+fetal+nuchal+translucency+be+without+worsening+first‐trimester+screening?+&author=P+Schmidt&author=I+Staboulidou&author=M+Elsasser&author=B+Vaske&author=P+Hillemanns&author=A+Scharf&publication_year=2008&hl=en']",,https://doi.org/10.1159/000158520, Schmidt 2008b {published data only}  ,excluded,CD012599-bbs2-0484, Not specific to Down’s syndrome 
CD012599-bib-0490,"Schmidt P, Hormansdorfer C, Oehler K, Hartel H, Hillemanns P, Scharf A. ",[Three‐dimensional scatter plot analysis to estimate the risk of foetal aneuloidy]. [German], Zeitschrift fur Geburtshilfe und Neonatologie ,2008,212,    ,['citation-journal']," Schmidt P, Hormansdorfer C, Oehler K, Hartel H, Hillemanns P, Scharf A. [Three‐dimensional scatter plot analysis to estimate the risk of foetal aneuloidy]. [German].  Zeitschrift fur Geburtshilfe und Neonatologie 2008;212(4):127‐35. CENTRAL    Link to article     Google Scholar     ","['', 'https://doi.org/10.1055/s-2008-1004708', 'https://scholar.google.com/scholar_lookup?title=[Three‐dimensional+scatter+plot+analysis+to+estimate+the+risk+of+foetal+aneuloidy].+[German]+&author=P+Schmidt&author=C+Hormansdorfer&author=K+Oehler&author=H+Hartel&author=P+Hillemanns&author=A+Scharf&publication_year=2008&hl=en']",,https://doi.org/10.1055/s-2008-1004708, Schmidt 2008c {published data only}  ,excluded,CD012599-bbs2-0485, Not specific to Down’s syndrome 
CD012599-bib-0491,"Schmidt P, Hormansdorfer C, Golatta M, Scharf A. ",Analysis of the distribution shift of detected aneuploidies by age independent first trimester screening, Archives of Gynecology & Obstetrics ,2010,281,    ,['citation-journal']," Schmidt P, Hormansdorfer C, Golatta M, Scharf A. Analysis of the distribution shift of detected aneuploidies by age independent first trimester screening.  Archives of Gynecology & Obstetrics 2010;281(3):393‐9. CENTRAL    Link to article     Google Scholar     ","['', 'https://doi.org/10.1007/s00404-009-1137-6', 'https://scholar.google.com/scholar_lookup?title=Analysis+of+the+distribution+shift+of+detected+aneuploidies+by+age+independent+first+trimester+screening+&author=P+Schmidt&author=C+Hormansdorfer&author=M+Golatta&author=A+Scharf&publication_year=2010&hl=en']",,https://doi.org/10.1007/s00404-009-1137-6, Schmidt 2010 {published data only}  ,excluded,CD012599-bbs2-0486, No follow‐up data for test negatives 
CD012599-bib-0492,"Schuchter K, Wald N, Hackshaw AK, Hafner E, Liebhart E. ",The distribution of nuchal translucency at 10‐13 weeks of pregnancy, Prenatal Diagnosis ,1998,18,    ,['citation-journal']," Schuchter K, Wald N, Hackshaw AK, Hafner E, Liebhart E. The distribution of nuchal translucency at 10‐13 weeks of pregnancy.  Prenatal Diagnosis 1998;18(3):281‐6. CENTRAL    Link to article     Google Scholar     ","['', 'https://doi.org/10.1002/(SICI)1097-0223(199803)18:3<281::AID-PD306>3.0.CO;2-6', 'https://scholar.google.com/scholar_lookup?title=The+distribution+of+nuchal+translucency+at+10‐13+weeks+of+pregnancy&author=K+Schuchter&author=N+Wald&author=AK+Hackshaw&author=E+Hafner&author=E+Liebhart&publication_year=1998&hl=en']",,https://doi.org/10.1002/(SICI)1097-0223(199803)18:3<281::AID-PD306>3.0.CO;2-6, Schuchter 1998 {published data only}  ,excluded,CD012599-bbs2-0487, No Down's pregnancies in study population 
CD012599-bib-0493,"Scott F, Boogert A, Smart S, Anderson J. ",Maternal serum screening and routine 18‐week ultrasound in the detection of all chromosomal abnormalities, Australian & New Zealand Journal of Obstetrics & Gynaecology ,1995,35,    ,['citation-journal']," Scott F, Boogert A, Smart S, Anderson J. Maternal serum screening and routine 18‐week ultrasound in the detection of all chromosomal abnormalities.  Australian & New Zealand Journal of Obstetrics & Gynaecology 1995;35(2):165‐8. CENTRAL    Link to article     Google Scholar     ","['', 'https://doi.org/10.1111/j.1479-828X.1995.tb01860.x', 'https://scholar.google.com/scholar_lookup?title=Maternal+serum+screening+and+routine+18‐week+ultrasound+in+the+detection+of+all+chromosomal+abnormalities+&author=F+Scott&author=A+Boogert&author=S+Smart&author=J+Anderson&publication_year=1995&hl=en']",,https://doi.org/10.1111/j.1479-828X.1995.tb01860.x, Scott 1995 {published data only}  ,excluded,CD012599-bbs2-0488, Less than 5 Down's syndrome pregnancies in study population 
CD012599-bib-0494,"Seeds JW, Watson WJ. ",Ultrasound and maternal serum alpha‐fetoprotein screening: A complementary relationship, Ultrasound Quarterly ,1990,8,    ,['citation-journal']," Seeds JW, Watson WJ. Ultrasound and maternal serum alpha‐fetoprotein screening: A complementary relationship.  Ultrasound Quarterly 1990;8(2):145‐66. CENTRAL    Link to article     Google Scholar     ","['', 'https://doi.org/10.1097/00013644-199000820-00003', 'https://scholar.google.com/scholar_lookup?title=Ultrasound+and+maternal+serum+alpha‐fetoprotein+screening:+A+complementary+relationship&author=JW+Seeds&author=WJ+Watson&publication_year=1990&hl=en']",,https://doi.org/10.1097/00013644-199000820-00003, Seeds 1990 {published data only}  ,excluded,CD012599-bbs2-0489, Review article 
CD012599-bib-0495,"Seki K, Mitsui C, Nagata I. ",Measurement of urinary free ß‐human chorionic gonadotropin by immunoradiometric assay, Gynecologic and Obstetric Investigation ,1995,40,    ,['citation-journal']," Seki K, Mitsui C, Nagata I. Measurement of urinary free ß‐human chorionic gonadotropin by immunoradiometric assay.  Gynecologic and Obstetric Investigation 1995;40(3):162‐7. CENTRAL    Link to article     Google Scholar     ","['', 'https://doi.org/10.1159/000292328', 'https://scholar.google.com/scholar_lookup?title=Measurement+of+urinary+free+ß‐human+chorionic+gonadotropin+by+immunoradiometric+assay&author=K+Seki&author=C+Mitsui&author=I+Nagata&publication_year=1995&hl=en']",,https://doi.org/10.1159/000292328, Seki 1995 {published data only}  ,excluded,CD012599-bbs2-0490, No Down's syndrome pregnancies in study population 
CD012599-bib-0496,"Shenhav S, Gemer O, Sherman DJ, Peled R, Segal S. ",Midtrimester triple‐test levels in women with chronic hypertension and altered renal function, Prenatal Diagnosis ,2003,23,    ,['citation-journal']," Shenhav S, Gemer O, Sherman DJ, Peled R, Segal S. Midtrimester triple‐test levels in women with chronic hypertension and altered renal function.  Prenatal Diagnosis 2003;23(2):166‐7. CENTRAL    Link to article     Google Scholar     ","['', 'https://doi.org/10.1002/pd.564', 'https://scholar.google.com/scholar_lookup?title=Midtrimester+triple‐test+levels+in+women+with+chronic+hypertension+and+altered+renal+function+&author=S+Shenhav&author=O+Gemer&author=DJ+Sherman&author=R+Peled&author=S+Segal&publication_year=2003&hl=en']",,https://doi.org/10.1002/pd.564, Shenhav 2003 {published data only}  ,excluded,CD012599-bbs2-0491, No Down's syndrome pregnancies 
CD012599-bib-0497,"Shintaku Y, Takabayashi T, Sasaki H, Ozawa N, Shinkawa O, Hamazaki Y, et al. ",[Screening for chromosomal anomalies with maternal serum alpha‐fetoprotein]. [Japanese], Nippon Sanka Fujinka Gakkai Zasshi ‐ Acta Obstetrica et Gynaecologica Japonica ,1989,41,    ,['citation-journal']," Shintaku Y, Takabayashi T, Sasaki H, Ozawa N, Shinkawa O, Hamazaki Y, et al. [Screening for chromosomal anomalies with maternal serum alpha‐fetoprotein]. [Japanese].  Nippon Sanka Fujinka Gakkai Zasshi ‐ Acta Obstetrica et Gynaecologica Japonica 1989;41(2):185‐90. CENTRAL    Google Scholar     ","['', 'https://scholar.google.com/scholar_lookup?title=[Screening+for+chromosomal+anomalies+with+maternal+serum+alpha‐fetoprotein].+[Japanese]&author=Y+Shintaku&author=T+Takabayashi&author=H+Sasaki&author=N+Ozawa&author=O+Shinkawa&author=Y+Hamazaki&publication_year=1989&hl=en']",,, Shintaku 1989 {published data only}  ,excluded,CD012599-bbs2-0492, Unable to extract useful data 
CD012599-bib-0498,"Shulman A, Maymon R. ",Mid‐gestation Down syndrome screening test and pregnancy outcome among unstimulated assisted‐conception pregnancies, Prenatal Diagnosis ,2003,23,    ,['citation-journal']," Shulman A, Maymon R. Mid‐gestation Down syndrome screening test and pregnancy outcome among unstimulated assisted‐conception pregnancies.  Prenatal Diagnosis 2003;23(8):625‐8. CENTRAL    Link to article     Google Scholar     ","['', 'https://doi.org/10.1002/pd.650', 'https://scholar.google.com/scholar_lookup?title=Mid‐gestation+Down+syndrome+screening+test+and+pregnancy+outcome+among+unstimulated+assisted‐conception+pregnancies+&author=A+Shulman&author=R+Maymon&publication_year=2003&hl=en']",,https://doi.org/10.1002/pd.650, Shulman 2003 {published data only}  ,excluded,CD012599-bbs2-0493, No Down's syndrome pregnancies in population 
CD012599-bib-0499,"Sieroszewski P, Perenc M, Budecka EB, Sobala W, Deutinger J. ",Sonographical integrated test for detection of chromosomal aberrations, Ultraschall in der Medizin ,2008,29,    ,['citation-journal']," Sieroszewski P, Perenc M, Budecka EB, Sobala W, Deutinger J. Sonographical integrated test for detection of chromosomal aberrations.  Ultraschall in der Medizin 2008;29(2):190‐6. CENTRAL    Link to article     Google Scholar     ","['', 'https://doi.org/10.1055/s-2007-963294', 'https://scholar.google.com/scholar_lookup?title=Sonographical+integrated+test+for+detection+of+chromosomal+aberrations&author=P+Sieroszewski&author=M+Perenc&author=EB+Budecka&author=W+Sobala&author=J+Deutinger&publication_year=2008&hl=en']",,https://doi.org/10.1055/s-2007-963294, Sieroszewski 2008 {published data only}  ,excluded,CD012599-bbs2-0494, No Down’s syndrome specific information for specificity 
CD012599-bib-0500,Simon‐Bouy B. ,[Markers for trisomy 21][French], Fertilite Contraception Sexualite ,1999,27,    ,['citation-journal'], Simon‐Bouy B. [Markers for trisomy 21][French].  Fertilite Contraception Sexualite 1999;27(9):289‐91. CENTRAL    Google Scholar     ,"['', 'https://scholar.google.com/scholar_lookup?title=[Markers+for+trisomy+21][French]&author=B+Simon‐Bouy&publication_year=1999&hl=en']",,, Simon‐Bouy 1999 {published data only}  ,excluded,CD012599-bbs2-0495, Review article 
CD012599-bib-0501,"Simpson JL, Baum LD, Marder R, Elias S, Ober C, Martin AO. ",Maternal serum alpha‐fetoprotein screening: low and high values for detection of genetic abnormalities, American Journal of Obstetrics and Gynecology ,1986,155,    ,['citation-journal']," Simpson JL, Baum LD, Marder R, Elias S, Ober C, Martin AO. Maternal serum alpha‐fetoprotein screening: low and high values for detection of genetic abnormalities.  American Journal of Obstetrics and Gynecology 1986;155(3):593‐7. CENTRAL    Link to article     Google Scholar     ","['', 'https://doi.org/10.1016/0002-9378(86)90285-1', 'https://scholar.google.com/scholar_lookup?title=Maternal+serum+alpha‐fetoprotein+screening:+low+and+high+values+for+detection+of+genetic+abnormalities+&author=JL+Simpson&author=LD+Baum&author=R+Marder&author=S+Elias&author=C+Ober&author=AO+Martin&publication_year=1986&hl=en']",,https://doi.org/10.1016/0002-9378(86)90285-1, Simpson 1986 {published data only}  ,excluded,CD012599-bbs2-0496, Gestational age confirmed by USS in less than 80% of population 
CD012599-bib-0502,"Smith C, Grube GL, Wilson S. ",Maternal serum alpha‐fetoprotein screening and the role of ultrasound, Journal of Diagnostic Medical Sonography ,1990,6,    ,['citation-journal']," Smith C, Grube GL, Wilson S. Maternal serum alpha‐fetoprotein screening and the role of ultrasound.  Journal of Diagnostic Medical Sonography 1990;6(6):312‐6. CENTRAL    Link to article     Google Scholar     ","['', 'https://doi.org/10.1177/875647939000600602', 'https://scholar.google.com/scholar_lookup?title=Maternal+serum+alpha‐fetoprotein+screening+and+the+role+of+ultrasound&author=C+Smith&author=GL+Grube&author=S+Wilson&publication_year=1990&hl=en']",,https://doi.org/10.1177/875647939000600602, Smith 1990 {published data only}  ,excluded,CD012599-bbs2-0497, Analysis of screen positive results 
CD012599-bib-0503,"Smith ER, Petersen J, Okorodudu AO, Bissell MG. ",Does the addition of unconjugated estriol in maternal serum screening improve the detection of trisomy 21? A meta‐analysis, Clinical Laboratory Management Review ,1996,10,    ,['citation-journal']," Smith ER, Petersen J, Okorodudu AO, Bissell MG. Does the addition of unconjugated estriol in maternal serum screening improve the detection of trisomy 21? A meta‐analysis.  Clinical Laboratory Management Review 1996;10(2):176‐81. CENTRAL    Google Scholar     ","['', 'https://scholar.google.com/scholar_lookup?title=Does+the+addition+of+unconjugated+estriol+in+maternal+serum+screening+improve+the+detection+of+trisomy+21?+A+meta‐analysis+&author=ER+Smith&author=J+Petersen&author=AO+Okorodudu&author=MG+Bissell&publication_year=1996&hl=en']",,, Smith 1996 {published data only}  ,excluded,CD012599-bbs2-0498, Review/meta‐analysis 
CD012599-bib-0504,"Smith NC, Hau C. ",A six year study of the antenatal detection of fetal abnormality in six Scottish health boards, British Journal of Obstetrics & Gynaecology ,1999,106,    ,['citation-journal']," Smith NC, Hau C. A six year study of the antenatal detection of fetal abnormality in six Scottish health boards.  British Journal of Obstetrics & Gynaecology 1999;106(3):206‐12. CENTRAL    Link to article     Google Scholar     ","['', 'https://doi.org/10.1111/j.1471-0528.1999.tb08232.x', 'https://scholar.google.com/scholar_lookup?title=A+six+year+study+of+the+antenatal+detection+of+fetal+abnormality+in+six+Scottish+health+boards+&author=NC+Smith&author=C+Hau&publication_year=1999&hl=en']",,https://doi.org/10.1111/j.1471-0528.1999.tb08232.x, Smith 1999 {published data only}  ,excluded,CD012599-bbs2-0499, Unable to extract useful data 
CD012599-bib-0505,"Smith‐Bindman R, Hosmer W, Feldstein VA, Deeks JJ, Goldberg JD. ",Second‐trimester ultrasound to detect fetuses with Down syndrome: a meta‐analysis.[see comment], JAMA ,2001,285,    ,['citation-journal']," Smith‐Bindman R, Hosmer W, Feldstein VA, Deeks JJ, Goldberg JD. Second‐trimester ultrasound to detect fetuses with Down syndrome: a meta‐analysis.[see comment].  JAMA 2001;285(8):1044‐55. CENTRAL    Link to article     Google Scholar     ","['', 'https://doi.org/10.1001/jama.285.8.1044', 'https://scholar.google.com/scholar_lookup?title=Second‐trimester+ultrasound+to+detect+fetuses+with+Down+syndrome:+a+meta‐analysis.[see+comment]+&author=R+Smith‐Bindman&author=W+Hosmer&author=VA+Feldstein&author=JJ+Deeks&author=JD+Goldberg&publication_year=2001&hl=en']",,https://doi.org/10.1001/jama.285.8.1044, Smith‐Bindman 2001 {published data only}  ,excluded,CD012599-bbs2-0500, Meta‐analysis of second trimester ultrasound markers 
CD012599-bib-0506,"Smith‐Bindman R, Chu P, Bacchetti P, Waters JJ, Mutton D, Alberman E. ",Prenatal screening for Down syndrome in England and Wales and population‐based birth outcomes, American Journal of Obstetrics and Gynecology ,2003,187,    ,['citation-journal']," Smith‐Bindman R, Chu P, Bacchetti P, Waters JJ, Mutton D, Alberman E. Prenatal screening for Down syndrome in England and Wales and population‐based birth outcomes.  American Journal of Obstetrics and Gynecology 2003;187(4):980‐5. CENTRAL    Link to article     Google Scholar     ","['', 'https://doi.org/10.1067/S0002-9378(03)00721-X', 'https://scholar.google.com/scholar_lookup?title=Prenatal+screening+for+Down+syndrome+in+England+and+Wales+and+population‐based+birth+outcomes+&author=R+Smith‐Bindman&author=P+Chu&author=P+Bacchetti&author=JJ+Waters&author=D+Mutton&author=E+Alberman&publication_year=2003&hl=en']",,https://doi.org/10.1067/S0002-9378(03)00721-X, Smith‐Bindman 2003 {published data only}  ,excluded,CD012599-bbs2-0501," Population study, not examining DTA "
CD012599-bib-0507,"Snijders RJM, Sebire NJ, Nicolaides KH. ",Maternal age and gestational age‐specific risk for chromosomal defects, Fetal Diagnosis and Therapy ,1995,10,    ,['citation-journal']," Snijders RJM, Sebire NJ, Nicolaides KH. Maternal age and gestational age‐specific risk for chromosomal defects.  Fetal Diagnosis and Therapy 1995;10(6):356‐67. CENTRAL    Link to article     Google Scholar     ","['', 'https://doi.org/10.1159/000264259', 'https://scholar.google.com/scholar_lookup?title=Maternal+age+and+gestational+age‐specific+risk+for+chromosomal+defects&author=RJM+Snijders&author=NJ+Sebire&author=KH+Nicolaides&publication_year=1995&hl=en']",,https://doi.org/10.1159/000264259, Snijders 1995 {published data only}  ,excluded,CD012599-bbs2-0502," Study of prevalence, not screening "
CD012599-bib-0508,"Snijders RJM, Sundberg K, Holzgreve W, Henry G, Nicolaides KH. ",Maternal age‐ and gestation‐specific risk for trisomy 21, Ultrasound in Obstetrics and Gynecology ,1999,13,    ,['citation-journal']," Snijders RJM, Sundberg K, Holzgreve W, Henry G, Nicolaides KH. Maternal age‐ and gestation‐specific risk for trisomy 21.  Ultrasound in Obstetrics and Gynecology 1999;13(3):167‐70. CENTRAL    Link to article     Google Scholar     ","['', 'https://doi.org/10.1046/j.1469-0705.1999.13030167.x', 'https://scholar.google.com/scholar_lookup?title=Maternal+age‐+and+gestation‐specific+risk+for+trisomy+21&author=RJM+Snijders&author=K+Sundberg&author=W+Holzgreve&author=G+Henry&author=KH+Nicolaides&publication_year=1999&hl=en']",,https://doi.org/10.1046/j.1469-0705.1999.13030167.x, Snijders 1999 {published data only}  ,excluded,CD012599-bbs2-0503," Study of prevalence, not screening "
CD012599-bib-0509,"Soergel P, Pruggmayer M, Schwerdtfeger R, Muhlhaus K, Scharf A. ","Screening for trisomy 21 with maternal age, fetal nuchal translucency and maternal serum biochemistry at 11‐14 weeks: a regional experience from Germany", Fetal Diagnosis and Therapy ,2006,21,    ,['citation-journal']," Soergel P, Pruggmayer M, Schwerdtfeger R, Muhlhaus K, Scharf A. Screening for trisomy 21 with maternal age, fetal nuchal translucency and maternal serum biochemistry at 11‐14 weeks: a regional experience from Germany.  Fetal Diagnosis and Therapy 2006;21(3):264‐8. CENTRAL    Link to article     Google Scholar     ","['', 'https://doi.org/10.1159/000091353', 'https://scholar.google.com/scholar_lookup?title=Screening+for+trisomy+21+with+maternal+age,+fetal+nuchal+translucency+and+maternal+serum+biochemistry+at+11‐14+weeks:+a+regional+experience+from+Germany+&author=P+Soergel&author=M+Pruggmayer&author=R+Schwerdtfeger&author=K+Muhlhaus&author=A+Scharf&publication_year=2006&hl=en']",,https://doi.org/10.1159/000091353, Soergel 2006 {published data only}  ,excluded,CD012599-bbs2-0504, Less than 80% follow‐up 
