reference_id,authors,title,journal,year,volume,citation_footer,citation_type,citation,urls,pubmed_id,doi,header,reference_type,study_id,exclusion_reason
CD009044-bib-0050,"Lecavalier L, Aman MG, Scahill L, McDougle CJ, McCracken JT, Vitiello B, et al. ",Validity of the Autism Diagnostic Interview‐Revised, American Journal of Mental Retardation ,2006,111,    ,['citation-journal']," Lecavalier L, Aman MG, Scahill L, McDougle CJ, McCracken JT, Vitiello B, et al. Validity of the Autism Diagnostic Interview‐Revised.  American Journal of Mental Retardation 2006;111(3):199‐215. [DOI: 10.1352/0895‐8017(2006)111[199:VOTADI]2.0.CO;2; PUBMED: 16597187]CENTRAL    Link to article     Google Scholar     ","['', 'https://doi.org/10.1352/0895-8017(2006)111[199:VOTADI]2.0.CO;2', 'https://scholar.google.com/scholar_lookup?title=Validity+of+the+Autism+Diagnostic+Interview‐Revised&author=L+Lecavalier&author=MG+Aman&author=L+Scahill&author=CJ+McDougle&author=JT+McCracken&author=B+Vitiello&publication_year=2006&hl=en']",,https://doi.org/10.1352/0895-8017(2006)111[199:VOTADI]2.0.CO;2, Lecavalier 2006 {published data only}  ,excluded,CD009044-bbs2-0050, No gold standard used as reference standard 
CD009044-bib-0051,"Le Couteur A, Rutter M, Lord C, Rios P, Robertson S, Holdgrafer M, et al. ",Autism Diagnostic Interview: a standardized investigator‐based instrument, Journal of Autism and Developmental Disorders ,1989,19,    ,['citation-journal']," Le Couteur A, Rutter M, Lord C, Rios P, Robertson S, Holdgrafer M, et al. Autism Diagnostic Interview: a standardized investigator‐based instrument.  Journal of Autism and Developmental Disorders 1989;19(3):363‐87. [PUBMED: 2793783]CENTRAL    Link to article     Google Scholar     ","['', 'https://doi.org/10.1007/BF02212936', 'https://scholar.google.com/scholar_lookup?title=Autism+Diagnostic+Interview:+a+standardized+investigator‐based+instrument&author=A+Couteur&author=M+Rutter&author=C+Lord&author=P+Rios&author=S+Robertson&author=M+Holdgrafer&publication_year=1989&hl=en']",2793783,https://doi.org/10.1007/BF02212936, Le Couteur 1989 {published data only}  ,excluded,CD009044-bbs2-0051, Participants recruited were above preschool age 
CD009044-bib-0052,"Le Couteur A, Haden G, Hammal D, McConachie H. ",Diagnosing autism spectrum disorders in pre‐school children using two standardised assessment instruments: the ADI‐R and the ADOS, Journal of Autism and Developmental Disorders ,2008,38,    ,['citation-journal']," Le Couteur A, Haden G, Hammal D, McConachie H. Diagnosing autism spectrum disorders in pre‐school children using two standardised assessment instruments: the ADI‐R and the ADOS.  Journal of Autism and Developmental Disorders 2008;38(2):362‐72. [DOI: 10.1007/s10803‐007‐0403‐3; PUBMED: 17605097]CENTRAL    Link to article     Google Scholar     ","['', 'https://doi.org/10.1007/s10803-007-0403-3', 'https://scholar.google.com/scholar_lookup?title=Diagnosing+autism+spectrum+disorders+in+pre‐school+children+using+two+standardised+assessment+instruments:+the+ADI‐R+and+the+ADOS+&author=A+Couteur&author=G+Haden&author=D+Hammal&author=H+McConachie&publication_year=2008&hl=en']",,https://doi.org/10.1007/s10803-007-0403-3, Le Couteur 2008 ADI‐R {published data only}  ,excluded,CD009044-bbs2-0052, Analyses conducted on different cutoff criteria for ADI‐R 
CD009044-bib-0053,"Leekam R, Libby SJ, Wing L, Gould J, Taylor C. ",The Diagnostic Interview for Social and Communication Disorders: algorithms for ICD‐10 childhood autism and Wing and Gould autistic spectrum disorder, Journal of Child Psychology and Psychiatry ,2002,43,    ,['citation-journal']," Leekam R, Libby SJ, Wing L, Gould J, Taylor C. The Diagnostic Interview for Social and Communication Disorders: algorithms for ICD‐10 childhood autism and Wing and Gould autistic spectrum disorder.  Journal of Child Psychology and Psychiatry 2002;43(3):327‐42. [PUBMED: 11944875]CENTRAL    Link to article     Google Scholar     ","['', 'https://doi.org/10.1111/1469-7610.00024', 'https://scholar.google.com/scholar_lookup?title=The+Diagnostic+Interview+for+Social+and+Communication+Disorders:+algorithms+for+ICD‐10+childhood+autism+and+Wing+and+Gould+autistic+spectrum+disorder+&author=R+Leekam&author=SJ+Libby&author=L+Wing&author=J+Gould&author=C+Taylor&publication_year=2002&hl=en']",11944875,https://doi.org/10.1111/1469-7610.00024, Leekam 2002 {published data only}  ,excluded,CD009044-bbs2-0053, Participants recruited were above preschool age 
CD009044-bib-0054,"Li J‐H, Zhong J‐M, Cai L‐Y, Chen Y, Zhou M‐Z. ",Comparison of clinical application of three autism rating scales, Chinese Journal of Contemporary Pediatrics ,2005,7,    ,['citation-journal']," Li J‐H, Zhong J‐M, Cai L‐Y, Chen Y, Zhou M‐Z. Comparison of clinical application of three autism rating scales.  Chinese Journal of Contemporary Pediatrics 2005;7(1):59‐62. CENTRAL    Google Scholar     ","['', 'https://scholar.google.com/scholar_lookup?title=Comparison+of+clinical+application+of+three+autism+rating+scales&author=J‐H+Li&author=J‐M+Zhong&author=L‐Y+Cai&author=Y+Chen&author=M‐Z+Zhou&publication_year=2005&hl=en']",,, Li 2005 {published data only}  ,excluded,CD009044-bbs2-0054, Two Chinese authors could not ascertain the age group 
CD009044-bib-0055,"Lord C, Storoschuk S, Rutter M, Pickles A. ",Using the ADI‐R to diagnose autism in preschool children, Infant Mental Health Journal ,1993,14,    ,['citation-journal']," Lord C, Storoschuk S, Rutter M, Pickles A. Using the ADI‐R to diagnose autism in preschool children.  Infant Mental Health Journal 1993;14(3):234‐52. [DOI: 10.1002/1097‐0355(199323)14:3<234::AID‐IMHJ2280140308>3.0.CO;2‐F]CENTRAL    Link to article     Google Scholar     ","['', 'https://doi.org/10.1002/1097-0355(199323)14:3<234::AID-IMHJ2280140308>3.0.CO;2-F', 'https://scholar.google.com/scholar_lookup?title=Using+the+ADI‐R+to+diagnose+autism+in+preschool+children&author=C+Lord&author=S+Storoschuk&author=M+Rutter&author=A+Pickles&publication_year=1993&hl=en']",,https://doi.org/10.1002/1097-0355(199323)14:3<234::AID-IMHJ2280140308>3.0.CO;2-F, Lord 1993 {published data only}  ,excluded,CD009044-bbs2-0055, Used different diagnostic groups of Autism versus non‐Autism (not ASD vs non‐ASD) 
CD009044-bib-0056,"Lord C, Rutter M, Le Couteur A. ",Autism Diagnostic Interview‐Revised: a revised version of a diagnostic interview for caregivers of individuals with possible pervasive developmental disorders, Journal of Autism and Developmental Disorders ,1994,24,    ,['citation-journal']," Lord C, Rutter M, Le Couteur A. Autism Diagnostic Interview‐Revised: a revised version of a diagnostic interview for caregivers of individuals with possible pervasive developmental disorders.  Journal of Autism and Developmental Disorders 1994;24(5):659‐85. [PUBMED: 7814313]CENTRAL    Link to article     Google Scholar     ","['', 'https://doi.org/10.1007/BF02172145', 'https://scholar.google.com/scholar_lookup?title=Autism+Diagnostic+Interview‐Revised:+a+revised+version+of+a+diagnostic+interview+for+caregivers+of+individuals+with+possible+pervasive+developmental+disorders+&author=C+Lord&author=M+Rutter&author=A+Couteur&publication_year=1994&hl=en']",7814313,https://doi.org/10.1007/BF02172145, Lord 1994 {published data only}  ,excluded,CD009044-bbs2-0056, Used different diagnostic groups of Autism versus non‐Autism (not ASD vs non‐ASD) 
CD009044-bib-0057,"Lord C, Risi S, DiLavore PS, Shulman C, Thurm A, Pickles A. ",Autism from 2 to 9 years of age, Archives of General Psychiatry ,2006,63,    ,['citation-journal']," Lord C, Risi S, DiLavore PS, Shulman C, Thurm A, Pickles A. Autism from 2 to 9 years of age.  Archives of General Psychiatry 2006;63(6):694‐701. [DOI: 10.1001/archpsyc.63.6.694; PUBMED: 16754843]CENTRAL    Link to article     Google Scholar     ","['', 'https://doi.org/10.1001/archpsyc.63.6.694', 'https://scholar.google.com/scholar_lookup?title=Autism+from+2+to+9+years+of+age&author=C+Lord&author=S+Risi&author=PS+DiLavore&author=C+Shulman&author=A+Thurm&author=A+Pickles&publication_year=2006&hl=en']",,https://doi.org/10.1001/archpsyc.63.6.694, Lord 2006 {published data only}  ,excluded,CD009044-bbs2-0057, Analyses conducted on different cutoff criteria for both ADOS (using ADOS‐PL cutoffs) and ADI‐R  
CD009044-bib-0058,"Lord C, Petkova E, Hus V, Gan W, Lu F, Martin DM, et al. ",A multisite study of the clinical diagnosis of different autism spectrum disorders, Archives of General Psychiatry ,2012,69,    ,['citation-journal']," Lord C, Petkova E, Hus V, Gan W, Lu F, Martin DM, et al. A multisite study of the clinical diagnosis of different autism spectrum disorders.  Archives of General Psychiatry 2012;69(3):306‐13. [DOI: 10.1001/archgenpsychiatry.2011.148; PMC3626112; PUBMED: 22065253]CENTRAL    Link to article     Google Scholar     ","['', 'https://doi.org/10.1001/archgenpsychiatry.2011.148', 'https://scholar.google.com/scholar_lookup?title=A+multisite+study+of+the+clinical+diagnosis+of+different+autism+spectrum+disorders&author=C+Lord&author=E+Petkova&author=V+Hus&author=W+Gan&author=F+Lu&author=DM+Martin&publication_year=2012&hl=en']",,https://doi.org/10.1001/archgenpsychiatry.2011.148, Lord 2012a {published data only}  ,excluded,CD009044-bbs2-0058, Not a DTA study 
CD009044-bib-0059,Lozowski‐Sullivan S. ,,Psychometric Properties of Diagnostic Assessment Instruments for Autism Spectrum Disorders in a Community Sample Aged 2 Through 17 Years [PhD thesis],2011,,   ,['citation-book']," Lozowski‐Sullivan S. Psychometric Properties of Diagnostic Assessment Instruments for Autism Spectrum Disorders in a Community Sample Aged 2 Through 17 Years [PhD thesis]. Kalamazoo (MI): Western Michigan University, 2011. [scholarworks.wmich.edu/cgi/viewcontent.cgi?article=1436&context=dissertations]CENTRAL    ",[''],,, Lozowski‐Sullivan 2011 {unpublished data only}  ,excluded,CD009044-bbs2-0059, Mean age > 6 years 
CD009044-bib-0060,"Luyster R, Gotham K, Guthrie W, Coffing M, Petrak R, Pierce K, et al. ",The Autism Diagnostic Observation Schedule‐Toddler Module: a new module of a standardized diagnostic measure for autism spectrum disorders, Journal of Autism and Developmental Disorders ,2009,39,    ,['citation-journal']," Luyster R, Gotham K, Guthrie W, Coffing M, Petrak R, Pierce K, et al. The Autism Diagnostic Observation Schedule‐Toddler Module: a new module of a standardized diagnostic measure for autism spectrum disorders.  Journal of Autism and Developmental Disorders 2009;39(9):1305‐20. CENTRAL    Link to article     Google Scholar     ","['', 'https://doi.org/10.1007/s10803-009-0746-z', 'https://scholar.google.com/scholar_lookup?title=The+Autism+Diagnostic+Observation+Schedule‐Toddler+Module:+a+new+module+of+a+standardized+diagnostic+measure+for+autism+spectrum+disorders+&author=R+Luyster&author=K+Gotham&author=W+Guthrie&author=M+Coffing&author=R+Petrak&author=K+Pierce&publication_year=2009&hl=en']",,https://doi.org/10.1007/s10803-009-0746-z, Luyster 2009 {published data only}  ,excluded,CD009044-bbs2-0060, Analyses conducted on different cutoff criteria for ADOS (using ADOS‐T criteria) 
CD009044-bib-0061,"Maljaars JN, Scholte I, Van Berckelaer‐Onnes E. ",Evaluation of the criterion and convergent validity of the Diagnostic Interview for Social and Communication Disorders in young and low‐functioning children, Autism ,2012,16,    ,['citation-journal']," Maljaars JN, Scholte I, Van Berckelaer‐Onnes E. Evaluation of the criterion and convergent validity of the Diagnostic Interview for Social and Communication Disorders in young and low‐functioning children.  Autism 2012;16(5):487‐97. CENTRAL    Link to article     Google Scholar     ","['', 'https://doi.org/10.1177/1362361311402857', 'https://scholar.google.com/scholar_lookup?title=Evaluation+of+the+criterion+and+convergent+validity+of+the+Diagnostic+Interview+for+Social+and+Communication+Disorders+in+young+and+low‐functioning+children+&author=JN+Maljaars&author=I+Scholte&author=E+Berckelaer‐Onnes&publication_year=2012&hl=en']",,https://doi.org/10.1177/1362361311402857, Maljaars 2012 {published data only}  ,excluded,CD009044-bbs2-0061, Mean age > 6 years 
CD009044-bib-0062,"Matson J, Hess J, Mahan S, Fodstad JC. ",Convergent validity of the Autism Spectrum Disorder‐Diagnostic for Children (ASD‐DC) and Autism Diagnostic Interview‐Revised (ADI‐R), Research in Autism Spectrum Disorders ,2010,4,    ,['citation-journal']," Matson J, Hess J, Mahan S, Fodstad JC. Convergent validity of the Autism Spectrum Disorder‐Diagnostic for Children (ASD‐DC) and Autism Diagnostic Interview‐Revised (ADI‐R).  Research in Autism Spectrum Disorders 2010;4(4):741‐5. CENTRAL    Link to article     Google Scholar     ","['', 'https://doi.org/10.1016/j.rasd.2010.01.013', 'https://scholar.google.com/scholar_lookup?title=Convergent+validity+of+the+Autism+Spectrum+Disorder‐Diagnostic+for+Children+(ASD‐DC)+and+Autism+Diagnostic+Interview‐Revised+(ADI‐R)+&author=J+Matson&author=J+Hess&author=S+Mahan&author=JC+Fodstad&publication_year=2010&hl=en']",,https://doi.org/10.1016/j.rasd.2010.01.013, Matson 2010 {published data only}  ,excluded,CD009044-bbs2-0062, Participants recruited were above preschool age 
CD009044-bib-0063,"Mayes SD, Calhoun SL, Murray MJ, Morrow JD, Yurich KKL, Mahr F, et al. ","Comparison of scores on the Checklist for Autism Spectrum Disorder, Childhood Autism Rating Scale, and Gilliam Asperger's Disorder Scale for children with low functioning autism, high functioning autism, Asperger's disorder, ADHD, and typical development", Journal of Autism and Developmental Disorders ,2009,39,    ,['citation-journal']," Mayes SD, Calhoun SL, Murray MJ, Morrow JD, Yurich KKL, Mahr F, et al. Comparison of scores on the Checklist for Autism Spectrum Disorder, Childhood Autism Rating Scale, and Gilliam Asperger's Disorder Scale for children with low functioning autism, high functioning autism, Asperger's disorder, ADHD, and typical development.  Journal of Autism and Developmental Disorders 2009;39(12):1682‐93. CENTRAL    Link to article     Google Scholar     ","['', 'https://doi.org/10.1007/s10803-009-0812-6', ""https://scholar.google.com/scholar_lookup?title=Comparison+of+scores+on+the+Checklist+for+Autism+Spectrum+Disorder,+Childhood+Autism+Rating+Scale,+and+Gilliam+Asperger's+Disorder+Scale+for+children+with+low+functioning+autism,+high+functioning+autism,+Asperger's+disorder,+ADHD,+and+typical+development+&author=SD+Mayes&author=SL+Calhoun&author=MJ+Murray&author=JD+Morrow&author=KKL+Yurich&author=F+Mahr&publication_year=2009&hl=en""]",,https://doi.org/10.1007/s10803-009-0812-6, Mayes 2009 {published data only}  ,excluded,CD009044-bbs2-0063, Mean age > 6 years 
CD009044-bib-0064,"Mayes SD, Calhoun SL, Murray MJ, Morrow JD, Yurich KKL, Cothren S, et al. ",Use of the Childhood Autism Rating Scale (CARS) for children with high functioning autism or Asperger syndrome, Focus on Autism and Other Developmental Disabilities ,2012,27,    ,['citation-journal']," Mayes SD, Calhoun SL, Murray MJ, Morrow JD, Yurich KKL, Cothren S, et al. Use of the Childhood Autism Rating Scale (CARS) for children with high functioning autism or Asperger syndrome.  Focus on Autism and Other Developmental Disabilities 2012;27(1):31‐8. CENTRAL    Link to article     Google Scholar     ","['', 'https://doi.org/10.1177/1088357611406902', 'https://scholar.google.com/scholar_lookup?title=Use+of+the+Childhood+Autism+Rating+Scale+(CARS)+for+children+with+high+functioning+autism+or+Asperger+syndrome+&author=SD+Mayes&author=SL+Calhoun&author=MJ+Murray&author=JD+Morrow&author=KKL+Yurich&author=S+Cothren&publication_year=2012&hl=en']",,https://doi.org/10.1177/1088357611406902, Mayes 2012 {published data only}  ,excluded,CD009044-bbs2-0064, Not a DTA study 
CD009044-bib-0065,"Mazefsky CA, Oswald DP. ","The discriminative ability and diagnostic utility of the ADOS‐G, ADI‐R, and GARS for children in a clinical setting", Autism ,2006,10,    ,['citation-journal']," Mazefsky CA, Oswald DP. The discriminative ability and diagnostic utility of the ADOS‐G, ADI‐R, and GARS for children in a clinical setting.  Autism 2006;10(6):533‐49. CENTRAL    Link to article     Google Scholar     ","['', 'https://doi.org/10.1177/1362361306068505', 'https://scholar.google.com/scholar_lookup?title=The+discriminative+ability+and+diagnostic+utility+of+the+ADOS‐G,+ADI‐R,+and+GARS+for+children+in+a+clinical+setting+&author=CA+Mazefsky&author=DP+Oswald&publication_year=2006&hl=en']",,https://doi.org/10.1177/1362361306068505, Mazefsky 2006 ADI‐R {published data only}  ,excluded,CD009044-bbs2-0065, Used different diagnostic groups of Autism versus non‐Autism (not ASD vs non‐ASD) 
CD009044-bib-0066,"Mazefsky CA, Oswald DP. ","The discriminative ability and diagnostic utility of the ADOS‐G, ADI‐R, and GARS for children in a clinical setting", Autism ,2006,10,    ,['citation-journal']," Mazefsky CA, Oswald DP. The discriminative ability and diagnostic utility of the ADOS‐G, ADI‐R, and GARS for children in a clinical setting.  Autism 2006;10(6):533‐49. CENTRAL    Link to article     Google Scholar     ","['', 'https://doi.org/10.1177/1362361306068505', 'https://scholar.google.com/scholar_lookup?title=The+discriminative+ability+and+diagnostic+utility+of+the+ADOS‐G,+ADI‐R,+and+GARS+for+children+in+a+clinical+setting+&author=CA+Mazefsky&author=DP+Oswald&publication_year=2006&hl=en']",,https://doi.org/10.1177/1362361306068505, Mazefsky 2006 GARS {published data only}  ,excluded,CD009044-bbs2-0066, Used different diagnostic groups of Autism versus non‐Autism (not ASD vs non‐ASD) 
CD009044-bib-0067,"McGarry Klose L, Plotts C, Kozeneski N, Skinner Foster J. ",A review of assessment tools for diagnosis of autism spectrum disorders: implications for school practice, Assessment for Effective Intervention ,2012,37,    ,['citation-journal']," McGarry Klose L, Plotts C, Kozeneski N, Skinner Foster J. A review of assessment tools for diagnosis of autism spectrum disorders: implications for school practice.  Assessment for Effective Intervention 2012;37(4):236‐42. CENTRAL    Link to article     Google Scholar     ","['', 'https://doi.org/10.1177/1534508411415090', 'https://scholar.google.com/scholar_lookup?title=A+review+of+assessment+tools+for+diagnosis+of+autism+spectrum+disorders:+implications+for+school+practice+&author=L+McGarryKlose&author=C+Plotts&author=N+Kozeneski&author=J+SkinnerFoster&publication_year=2012&hl=en']",,https://doi.org/10.1177/1534508411415090, McGarry Klose 2012 {published data only}  ,excluded,CD009044-bbs2-0067, No DTA raw data reported 
CD009044-bib-0068,Mick K. ,Diagnosing autism: comparison of the Childhood Autism Rating Scale (CARS) and the Autism Diagnostic Observation Schedule (ADOS),,2007,,    ,['citation-other'], Mick K. Diagnosing autism: comparison of the Childhood Autism Rating Scale (CARS) and the Autism Diagnostic Observation Schedule (ADOS). ProQuest Information and Learning2007. CENTRAL    Google Scholar     ,"['', 'https://scholar.google.com/scholar_lookup?title=Diagnosing+autism:+comparison+of+the+Childhood+Autism+Rating+Scale+(CARS)+and+the+Autism+Diagnostic+Observation+Schedule+(ADOS)+&author=K+Mick&publication_year=2007&hl=en']",,, Mick 2007 {published data only}  ,excluded,CD009044-bbs2-0068, Thesis participants recruited were above preschool age 
CD009044-bib-0069,"Molloy CA, Murray DS, Akers R, Mitchell T, Manning‐Courtney P. ",Use of the Autism Diagnostic Observation Schedule (ADOS) in a clinical setting, Autism ,2011,15,    ,['citation-journal']," Molloy CA, Murray DS, Akers R, Mitchell T, Manning‐Courtney P. Use of the Autism Diagnostic Observation Schedule (ADOS) in a clinical setting.  Autism 2011;15(2):143‐62. CENTRAL    Link to article     Google Scholar     ","['', 'https://doi.org/10.1177/1362361310379241', 'https://scholar.google.com/scholar_lookup?title=Use+of+the+Autism+Diagnostic+Observation+Schedule+(ADOS)+in+a+clinical+setting&author=CA+Molloy&author=DS+Murray&author=R+Akers&author=T+Mitchell&author=P+Manning‐Courtney&publication_year=2011&hl=en']",,https://doi.org/10.1177/1362361310379241, Molloy 2011 {published data only}  ,excluded,CD009044-bbs2-0069," Mean age of groups studied was > 6 years. One group studied was < 5 years and was assessed on Module 2 of ADOS, but no DTA results were reported  "
CD009044-bib-0070,"Moss J, Magiati I, Charman T, Howlin P. ",Stability of the Autism Diagnostic Interview – Revised from pre‐school to elementary school age in children with autism spectrum disorder, Journal of Autism and Developmental Disorders ,2008,38,    ,['citation-journal']," Moss J, Magiati I, Charman T, Howlin P. Stability of the Autism Diagnostic Interview – Revised from pre‐school to elementary school age in children with autism spectrum disorder.  Journal of Autism and Developmental Disorders 2008;38:1081‐91. CENTRAL    Link to article     Google Scholar     ","['', 'https://doi.org/10.1007/s10803-007-0487-9', 'https://scholar.google.com/scholar_lookup?title=Stability+of+the+Autism+Diagnostic+Interview+–+Revised+from+pre‐school+to+elementary+school+age+in+children+with+autism+spectrum+disorder+&author=J+Moss&author=I+Magiati&author=T+Charman&author=P+Howlin&publication_year=2008&hl=en']",,https://doi.org/10.1007/s10803-007-0487-9, Moss 2008 {published data only}  ,excluded,CD009044-bbs2-0070, No gold standard used and no non‐ASD comparison group included. Study of diagnostic stability over time  
CD009044-bib-0071,"Nordin V, Gillberg C. ",Autism spectrum disorders in children with physical or mental disability or both. II: screening aspects, Developmental Medicine and Child Neurology ,1996,38,    ,['citation-journal']," Nordin V, Gillberg C. Autism spectrum disorders in children with physical or mental disability or both. II: screening aspects.  Developmental Medicine and Child Neurology 1996;38(4):314‐24. [PUBMED: 8641536]CENTRAL    Link to article     Google Scholar     ","['', 'https://doi.org/10.1111/j.1469-8749.1996.tb12097.x', 'https://scholar.google.com/scholar_lookup?title=Autism+spectrum+disorders+in+children+with+physical+or+mental+disability+or+both.+II:+screening+aspects+&author=V+Nordin&author=C+Gillberg&publication_year=1996&hl=en']",8641536,https://doi.org/10.1111/j.1469-8749.1996.tb12097.x, Nordin 1996 {published data only}  ,excluded,CD009044-bbs2-0071, No DTA result 
CD009044-bib-0072,"Noterdaeme M, Kurz U, Mildenberger K, Sitter S, Amorosa H. ",Exclusion of receptive speech disorders with the ADOS (Autism Diagnostic Observation Schedule), Zeitschrift fur Kinder‐und Jugendpsychiatrie und Psychotherapie ,1999,27,    ,['citation-journal']," Noterdaeme M, Kurz U, Mildenberger K, Sitter S, Amorosa H. Exclusion of receptive speech disorders with the ADOS (Autism Diagnostic Observation Schedule) [Ausschluß rezeptiver sprachstörungen mittels des ADOS (Autism Diagnostic Observation Schedule)].  Zeitschrift fur Kinder‐und Jugendpsychiatrie und Psychotherapie 1999;27(4):251‐7. [DOI: 10.1024//1422‐4917.27.4.251; PUBMED: 10637975]CENTRAL    Link to article     Google Scholar     ","['', 'https://doi.org/10.1024//1422-4917.27.4.251', 'https://scholar.google.com/scholar_lookup?title=Exclusion+of+receptive+speech+disorders+with+the+ADOS+(Autism+Diagnostic+Observation+Schedule)+&author=M+Noterdaeme&author=U+Kurz&author=K+Mildenberger&author=S+Sitter&author=H+Amorosa&publication_year=1999&hl=en']",,https://doi.org/10.1024//1422-4917.27.4.251, Noterdaeme 1999 {published data only}  ,excluded,CD009044-bbs2-0072," 8 children with average ages of 10.6 (SD = 2) and 10.0 (SD = 2), respectively. Excluded on the basis of age  "
CD009044-bib-0073,"Nygren G, Hagberg B, Billstedt E, Skoglund A, Gillberg C, Johansson M. ",The Swedish version of the Diagnostic Interview for Social and Communication Disorders (DISCO‐10). Psychometric properties, Journal of Autism and Developmental Disorders ,2009,39,    ,['citation-journal']," Nygren G, Hagberg B, Billstedt E, Skoglund A, Gillberg C, Johansson M. The Swedish version of the Diagnostic Interview for Social and Communication Disorders (DISCO‐10). Psychometric properties.  Journal of Autism and Developmental Disorders 2009;39(5):730–41. [DOI: 10.1007/s10803‐008‐0678‐z; PUBMED: 19148741]CENTRAL    Link to article     Google Scholar     ","['', 'https://doi.org/10.1007/s10803-008-0678-z', 'https://scholar.google.com/scholar_lookup?title=The+Swedish+version+of+the+Diagnostic+Interview+for+Social+and+Communication+Disorders+(DISCO‐10).+Psychometric+properties+&author=G+Nygren&author=B+Hagberg&author=E+Billstedt&author=A+Skoglund&author=C+Gillberg&author=M+Johansson&publication_year=2009&hl=en']",,https://doi.org/10.1007/s10803-008-0678-z, Nygren 2009 {published data only}  ,excluded,CD009044-bbs2-0073, Mean age of group is 7.8 years (i.e. > 6 years) 
