reference_id,authors,title,journal,year,volume,citation_footer,citation_type,citation,urls,pubmed_id,doi,header,reference_type,study_id,exclusion_reason
CD009044-bib-0025,"Charman T, Taylor E, Drew A, Cockerill H, Brown JA, Baird G. ",Outcomes at 7 years of children diagnosed with autism at age 2: predictive validity of assessments conducted at 2 and 3 years of age and pattern of symptom change over time, Journal of Child Psychology and Psychiatry ,2005,46,    ,['citation-journal']," Charman T, Taylor E, Drew A, Cockerill H, Brown JA, Baird G. Outcomes at 7 years of children diagnosed with autism at age 2: predictive validity of assessments conducted at 2 and 3 years of age and pattern of symptom change over time.  Journal of Child Psychology and Psychiatry 2005;46(5):500‐13. [DOI: 10.1111/j.1469‐7610.2004.00377.x; PUBMED: 15845130]CENTRAL    Link to article     Google Scholar     ","['', 'https://doi.org/10.1111/j.1469-7610.2004.00377.x', 'https://scholar.google.com/scholar_lookup?title=Outcomes+at+7+years+of+children+diagnosed+with+autism+at+age+2:+predictive+validity+of+assessments+conducted+at+2+and+3+years+of+age+and+pattern+of+symptom+change+over+time+&author=T+Charman&author=E+Taylor&author=A+Drew&author=H+Cockerill&author=JA+Brown&author=G+Baird&publication_year=2005&hl=en']",,https://doi.org/10.1111/j.1469-7610.2004.00377.x, Charman 2005 {published data only}  ,excluded,CD009044-bbs2-0025, No DTA result 
CD009044-bib-0026,"Charman T, Gotham K. ",Measurement issues: screening and diagnostic instruments for autism spectrum disorders ‐ lessons from research and practice, Child and Adolescent Mental Health ,2013,18,    ,['citation-journal']," Charman T, Gotham K. Measurement issues: screening and diagnostic instruments for autism spectrum disorders ‐ lessons from research and practice.  Child and Adolescent Mental Health 2013;18(1):52‐63. [DOI: 10.1111/j.1475‐3588.2012.00664.x; PMC3607539; PUBMED: 23539140]CENTRAL    Link to article     Google Scholar     ","['', 'https://doi.org/10.1111/j.1475-3588.2012.00664.x', 'https://scholar.google.com/scholar_lookup?title=Measurement+issues:+screening+and+diagnostic+instruments+for+autism+spectrum+disorders+‐+lessons+from+research+and+practice+&author=T+Charman&author=K+Gotham&publication_year=2013&hl=en']",,https://doi.org/10.1111/j.1475-3588.2012.00664.x, Charman 2013 {published data only}  ,excluded,CD009044-bbs2-0026, No DTA data reported 
CD009044-bib-0027,"Chawarska K, Klin A, Paul R, Volkmar F. ",Autism spectrum disorder in the second year: stability and change in syndrome expression, Journal of Child Psychology and Psychiatry ,2007,48,    ,['citation-journal']," Chawarska K, Klin A, Paul R, Volkmar F. Autism spectrum disorder in the second year: stability and change in syndrome expression.  Journal of Child Psychology and Psychiatry 2007;48(2):128‐38. [DOI: 10.1111/j.1469‐7610.2006.01685.x; PUBMED: 17300551]CENTRAL    Link to article     Google Scholar     ","['', 'https://doi.org/10.1111/j.1469-7610.2006.01685.x', 'https://scholar.google.com/scholar_lookup?title=Autism+spectrum+disorder+in+the+second+year:+stability+and+change+in+syndrome+expression&author=K+Chawarska&author=A+Klin&author=R+Paul&author=F+Volkmar&publication_year=2007&hl=en']",,https://doi.org/10.1111/j.1469-7610.2006.01685.x, Chawarska 2007 {published data only}  ,excluded,CD009044-bbs2-0027, No DTA result 
CD009044-bib-0028,"Chuthapisith J, Taycharpipranai P, Ruangdaraganon N, Warrington R, Skuse D. ","Translation and validation of the Developmental, Dimensional and Diagnostic Interview (3di) for diagnosis of autism spectrum disorder in Thai children", Autism ,2012,16,    ,['citation-journal']," Chuthapisith J, Taycharpipranai P, Ruangdaraganon N, Warrington R, Skuse D. Translation and validation of the Developmental, Dimensional and Diagnostic Interview (3di) for diagnosis of autism spectrum disorder in Thai children.  Autism 2012;16(4):350‐6. [DOI: 10.1177/1362361311433770; PUBMED: 22399447]CENTRAL    Link to article     Google Scholar     ","['', 'https://doi.org/10.1177/1362361311433770', 'https://scholar.google.com/scholar_lookup?title=Translation+and+validation+of+the+Developmental,+Dimensional+and+Diagnostic+Interview+(3di)+for+diagnosis+of+autism+spectrum+disorder+in+Thai+children+&author=J+Chuthapisith&author=P+Taycharpipranai&author=N+Ruangdaraganon&author=R+Warrington&author=D+Skuse&publication_year=2012&hl=en']",,https://doi.org/10.1177/1362361311433770, Chuthapisith 2012 {published data only}  ,excluded,CD009044-bbs2-0028," Reports on shortened, not full, version of the Thai 3di "
CD009044-bib-0029,"Clancy H, Dugdalei A, Rendle‐Shortt J. ",The diagnosis of infantile autism, Developmental Medicine and Child Neurology ,1969,11,    ,['citation-journal']," Clancy H, Dugdalei A, Rendle‐Shortt J. The diagnosis of infantile autism.  Developmental Medicine and Child Neurology 1969;11(4):432‐42. [PUBMED: 5805347]CENTRAL    Link to article     Google Scholar     ","['', 'https://doi.org/10.1111/j.1469-8749.1969.tb01461.x', 'https://scholar.google.com/scholar_lookup?title=The+diagnosis+of+infantile+autism&author=H+Clancy&author=A+Dugdalei&author=J+Rendle‐Shortt&publication_year=1969&hl=en']",5805347,https://doi.org/10.1111/j.1469-8749.1969.tb01461.x, Clancy 1969 {published data only}  ,excluded,CD009044-bbs2-0029, Mean age > 6 years 
CD009044-bib-0030,"Constantino JN, Zhang Y, Abbacchi AM, Calhoun A, Scofield F, Grafeman SJ. ",Rapid phenotyping of autism spectrum disorders: inclusion of direct observation in feasible paradigms for clinical assessment, Neuropsychiatry ,2012,2,    ,['citation-journal']," Constantino JN, Zhang Y, Abbacchi AM, Calhoun A, Scofield F, Grafeman SJ. Rapid phenotyping of autism spectrum disorders: inclusion of direct observation in feasible paradigms for clinical assessment.  Neuropsychiatry 2012;2(3):203‐12. [DOI: 10.2217/NPY.12.28]CENTRAL    Link to article     Google Scholar     ","['', 'https://doi.org/10.2217/npy.12.28', 'https://scholar.google.com/scholar_lookup?title=Rapid+phenotyping+of+autism+spectrum+disorders:+inclusion+of+direct+observation+in+feasible+paradigms+for+clinical+assessment+&author=JN+Constantino&author=Y+Zhang&author=AM+Abbacchi&author=A+Calhoun&author=F+Scofield&author=SJ+Grafeman&publication_year=2012&hl=en']",,https://doi.org/10.2217/npy.12.28, Constantino 2012 {published data only}  ,excluded,CD009044-bbs2-0030, Mean age > 6 years 
CD009044-bib-0031,"de Bildt A, Sytema S, Ketelaars C, Kraijer D, Mulder E, Volkmar F, et al. ","Interrelationship between Autism Diagnostic Observation Schedule‐Generic (ADOS‐G), Autism Diagnostic Interview‐Revised (ADI‐R), and the Diagnostic and Statistical Manual of Mental Disorders (DSM‐IV‐TR) classification in children and adolescents with mental retardation", Journal of Autism and Developmental Disorders ,2004,34,    ,['citation-journal']," de Bildt A, Sytema S, Ketelaars C, Kraijer D, Mulder E, Volkmar F, et al. Interrelationship between Autism Diagnostic Observation Schedule‐Generic (ADOS‐G), Autism Diagnostic Interview‐Revised (ADI‐R), and the Diagnostic and Statistical Manual of Mental Disorders (DSM‐IV‐TR) classification in children and adolescents with mental retardation.  Journal of Autism and Developmental Disorders 2004;34(2):129‐37. [PUBMED: 15162932]CENTRAL    Google Scholar     ","['', 'https://scholar.google.com/scholar_lookup?title=Interrelationship+between+Autism+Diagnostic+Observation+Schedule‐Generic+(ADOS‐G),+Autism+Diagnostic+Interview‐Revised+(ADI‐R),+and+the+Diagnostic+and+Statistical+Manual+of+Mental+Disorders+(DSM‐IV‐TR)+classification+in+children+and+adolescents+with+mental+retardation+&author=A+Bildt&author=S+Sytema&author=C+Ketelaars&author=D+Kraijer&author=E+Mulder&author=F+Volkmar&publication_year=2004&hl=en']",15162932,, de Bildt 2004 {published data only}  ,excluded,CD009044-bbs2-0031, Age range > 6 years 
CD009044-bib-0032,"de Bildt A, Sytema S, van Lang NDJ, Minderaa RB, van Engeland H, de Jonge MV. ",Evaluation of the ADOS revised algorithm: the applicability in 558 Dutch children and adolescents, Journal of Autism and Developmental Disorders ,2009,39,    ,['citation-journal']," de Bildt A, Sytema S, van Lang NDJ, Minderaa RB, van Engeland H, de Jonge MV. Evaluation of the ADOS revised algorithm: the applicability in 558 Dutch children and adolescents.  Journal of Autism and Developmental Disorders 2009;39(9):1350‐8. [DOI: 10.1007/s10803‐009‐0749‐9; PMC2727366 ; PUBMED: 19452268]CENTRAL    Link to article     Google Scholar     ","['', 'https://doi.org/10.1007/s10803-009-0749-9', 'https://scholar.google.com/scholar_lookup?title=Evaluation+of+the+ADOS+revised+algorithm:+the+applicability+in+558+Dutch+children+and+adolescents+&author=A+Bildt&author=S+Sytema&author=NDJ+Lang&author=RB+Minderaa&author=H+Engeland&author=MV+Jonge&publication_year=2009&hl=en']",,https://doi.org/10.1007/s10803-009-0749-9, de Bildt 2009 {published data only}  ,excluded,CD009044-bbs2-0032, Age range > 6 years 
CD009044-bib-0033,"de Bildt A, Oosterling IJ, van Lang NDJ, Kuijper S, Dekker V, Sytema S, et al. ",How to use the ADI‐R for classifying autism spectrum disorders? Psychometric properties of criteria from the literature in 1204 Dutch children, Journal of Autism and Developmental Disorders ,2013,43,    ,['citation-journal']," de Bildt A, Oosterling IJ, van Lang NDJ, Kuijper S, Dekker V, Sytema S, et al. How to use the ADI‐R for classifying autism spectrum disorders? Psychometric properties of criteria from the literature in 1204 Dutch children.  Journal of Autism and Developmental Disorders 2013;43(10):2280–94. [DOI: 10.1007/s10803‐013‐1783‐1; PUBMED: 23397166]CENTRAL    Link to article     Google Scholar     ","['', 'https://doi.org/10.1007/s10803-013-1783-1', 'https://scholar.google.com/scholar_lookup?title=How+to+use+the+ADI‐R+for+classifying+autism+spectrum+disorders?+Psychometric+properties+of+criteria+from+the+literature+in+1204+Dutch+children+&author=A+Bildt&author=IJ+Oosterling&author=NDJ+Lang&author=S+Kuijper&author=V+Dekker&author=S+Sytema&publication_year=2013&hl=en']",,https://doi.org/10.1007/s10803-013-1783-1, de Bildt 2013 {published data only}  ,excluded,CD009044-bbs2-0033, Mean age > 6 years 
CD009044-bib-0034,"Diken IH, Ardiç A, Diken Ö, Gilliam JE. ",Exploring the validity and reliability of Turkish version of Gilliam Autism Rating Scale‐2: Turkish standardization study, Eğitim ve Bilim (Education and Science) ,2012,37,    ,['citation-journal']," Diken IH, Ardiç A, Diken Ö, Gilliam JE. Exploring the validity and reliability of Turkish version of Gilliam Autism Rating Scale‐2: Turkish standardization study.  Eğitim ve Bilim (Education and Science) 2012;37(166):318‐28. CENTRAL    Google Scholar     ","['', 'https://scholar.google.com/scholar_lookup?title=Exploring+the+validity+and+reliability+of+Turkish+version+of+Gilliam+Autism+Rating+Scale‐2:+Turkish+standardization+study+&author=IH+Diken&author=A+Ardiç&author=Ö+Diken&author=JE+Gilliam&publication_year=2012&hl=en']",,, Diken 2012a {published data only}  ,excluded,CD009044-bbs2-0034, Mean age > 6 years 
CD009044-bib-0035,"Diken IH, Diken O, Gilliam JE, Ardic A, Sweeney D. ",Validity and reliability of Turkish version of Gilliam Autism Rating Scale‐2: results of preliminary study, International Journal of Special Education ,2012,27,    ,['citation-journal']," Diken IH, Diken O, Gilliam JE, Ardic A, Sweeney D. Validity and reliability of Turkish version of Gilliam Autism Rating Scale‐2: results of preliminary study.  International Journal of Special Education 2012;27(2):207‐15. [files.eric.ed.gov/fulltext/EJ982874.pdf]CENTRAL    Google Scholar     ","['', 'https://scholar.google.com/scholar_lookup?title=Validity+and+reliability+of+Turkish+version+of+Gilliam+Autism+Rating+Scale‐2:+results+of+preliminary+study+&author=IH+Diken&author=O+Diken&author=JE+Gilliam&author=A+Ardic&author=D+Sweeney&publication_year=2012&hl=en']",,, Diken 2012b {published data only}  ,excluded,CD009044-bbs2-0035, Mean age > 6 years 
CD009044-bib-0036,"DiLalla DL, Rogers SJ. ",Domains of the Childhood Autism Rating Scale: relevance for diagnosis and treatment, Journal of Autism and Developmental Disorders ,1994,24,    ,['citation-journal']," DiLalla DL, Rogers SJ. Domains of the Childhood Autism Rating Scale: relevance for diagnosis and treatment.  Journal of Autism and Developmental Disorders 1994;24(2):115‐28. [PUBMED: 8040157]CENTRAL    Link to article     Google Scholar     ","['', 'https://doi.org/10.1007/BF02172092', 'https://scholar.google.com/scholar_lookup?title=Domains+of+the+Childhood+Autism+Rating+Scale:+relevance+for+diagnosis+and+treatment&author=DL+DiLalla&author=SJ+Rogers&publication_year=1994&hl=en']",8040157,https://doi.org/10.1007/BF02172092, DiLalla 1994 {published data only}  ,excluded,CD009044-bbs2-0036, Different cutoff criteria used to investigate factor structure of the CARS; therefore did not meet review criteria  
CD009044-bib-0037,"Eaves RC, Wood‐Groves S, Williams TO, Fall A‐M. ",Reliability and validity of the Pervasive Developmental Disorders Rating Scale and the Gilliam Autism Rating Scale, Education and Training in Developmental Disabilities ,2006,41,    ,['citation-journal']," Eaves RC, Wood‐Groves S, Williams TO, Fall A‐M. Reliability and validity of the Pervasive Developmental Disorders Rating Scale and the Gilliam Autism Rating Scale.  Education and Training in Developmental Disabilities 2006;41(3):300‐9. [ www.jstor.org/stable/23880203]CENTRAL    Google Scholar     ","['', 'https://scholar.google.com/scholar_lookup?title=Reliability+and+validity+of+the+Pervasive+Developmental+Disorders+Rating+Scale+and+the+Gilliam+Autism+Rating+Scale+&author=RC+Eaves&author=S+Wood‐Groves&author=TO+Williams&author=A‐M+Fall&publication_year=2006&hl=en']",,, Eaves 2006 {published data only}  ,excluded,CD009044-bbs2-0037, Mean age > 6 years 
CD009044-bib-0038,"Falkmer T, Anderson K, Falkmer M, Horlin C. ",Diagnostic procedures in autism spectrum disorders: a systematic literature review, European Child & Adolescent Psychiatry ,2013,22,    ,['citation-journal']," Falkmer T, Anderson K, Falkmer M, Horlin C. Diagnostic procedures in autism spectrum disorders: a systematic literature review.  European Child & Adolescent Psychiatry 2013;22(6):329–40. [DOI: 10.1007/s00787‐013‐0375‐0; PUBMED: 23322184]CENTRAL    Link to article     Google Scholar     ","['', 'https://doi.org/10.1007/s00787-013-0375-0', 'https://scholar.google.com/scholar_lookup?title=Diagnostic+procedures+in+autism+spectrum+disorders:+a+systematic+literature+review&author=T+Falkmer&author=K+Anderson&author=M+Falkmer&author=C+Horlin&publication_year=2013&hl=en']",,https://doi.org/10.1007/s00787-013-0375-0, Falkmer 2013 {published data only}  ,excluded,CD009044-bbs2-0038, Not a DTA study 
CD009044-bib-0039,Fisch GS. ,"Autism and epistemology III: child development, behavioral stability, and reliability of measurement", American Journal of Medical Genetics Part A ,2012,158a,    ,['citation-journal']," Fisch GS. Autism and epistemology III: child development, behavioral stability, and reliability of measurement.  American Journal of Medical Genetics Part A 2012;158a(5):969‐79. [DOI: 10.1002/ajmg.a.35269; PUBMED: 22488915]CENTRAL    Link to article     Google Scholar     ","['', 'https://doi.org/10.1002/ajmg.a.35269', 'https://scholar.google.com/scholar_lookup?title=Autism+and+epistemology+III:+child+development,+behavioral+stability,+and+reliability+of+measurement+&author=GS+Fisch&publication_year=2012&hl=en']",,https://doi.org/10.1002/ajmg.a.35269, Fisch 2012 {published data only}  ,excluded,CD009044-bbs2-0039, Not a DTA study 
CD009044-bib-0040,Goldfischer HM. ,,Improving the Diagnositc Utility of the Childhood Autism Rating Scale [PhD Thesis],2001,,   ,['citation-book']," Goldfischer HM. Improving the Diagnositc Utility of the Childhood Autism Rating Scale [PhD Thesis]. Oxford (OH): Miami University, 2001. CENTRAL    ",[''],,, Goldfischer 2001 {unpublished data only}  ,excluded,CD009044-bbs2-0040, Mean age > 6 years 
CD009044-bib-0041,"Gotham K, Risi S, Pickles A, Lord C. ",The Autism Diagnostic Observation Schedule: revised algorithms for improved diagnostic validity, Journal of Autism and Developmental Disorders ,2007,37,    ,['citation-journal']," Gotham K, Risi S, Pickles A, Lord C. The Autism Diagnostic Observation Schedule: revised algorithms for improved diagnostic validity.  Journal of Autism and Developmental Disorders 2007;37(4):613‐27. [DOI: 10.1007/s10803‐006‐0280‐1; PUBMED: 17180459]CENTRAL    Link to article     Google Scholar     ","['', 'https://doi.org/10.1007/s10803-006-0280-1', 'https://scholar.google.com/scholar_lookup?title=The+Autism+Diagnostic+Observation+Schedule:+revised+algorithms+for+improved+diagnostic+validity+&author=K+Gotham&author=S+Risi&author=A+Pickles&author=C+Lord&publication_year=2007&hl=en']",,https://doi.org/10.1007/s10803-006-0280-1, Gotham 2007 {published data only}  ,excluded,CD009044-bbs2-0041," Study to further develop the ADOS, so investigated use of different cutoff criteria from those used clinically. Seeking to establish ADOS‐2  "
CD009044-bib-0042,"Gotham K, Risi S, Dawson G, Tager‐Flusberg H, Joseph R, Carter A, et al. ",A replication of the Autism Diagnostic Observation Schedule (ADOS) revised algorithms, Journal of the American Academy of Child and Adolescent Psychiatry ,2008,47,    ,['citation-journal']," Gotham K, Risi S, Dawson G, Tager‐Flusberg H, Joseph R, Carter A, et al. A replication of the Autism Diagnostic Observation Schedule (ADOS) revised algorithms.  Journal of the American Academy of Child and Adolescent Psychiatry 2008;47(6):642‐51. [DOI: 10.1097/CHI.0b013e31816bffb7; PMC3057666; PUBMED: 18434924]CENTRAL    Link to article     Google Scholar     ","['', 'https://doi.org/10.1097/CHI.0b013e31816bffb7', 'https://scholar.google.com/scholar_lookup?title=A+replication+of+the+Autism+Diagnostic+Observation+Schedule+(ADOS)+revised+algorithms&author=K+Gotham&author=S+Risi&author=G+Dawson&author=H+Tager‐Flusberg&author=R+Joseph&author=A+Carter&publication_year=2008&hl=en']",,https://doi.org/10.1097/CHI.0b013e31816bffb7, Gotham 2008 {published data only}  ,excluded,CD009044-bbs2-0042," Study to further develop the ADOS, so investigated use of different cutoff criteria from those used clinically. Seeking to establish ADOS‐2  "
CD009044-bib-0043,"Guthrie W, Swineford LB, Nottke C, Wetherby AM. ",Early diagnosis of autism spectrum disorder: stability and change in clinical diagnosis and symptom presentation, Journal of Child Psychology and Psychiatry ,2013,54,    ,['citation-journal']," Guthrie W, Swineford LB, Nottke C, Wetherby AM. Early diagnosis of autism spectrum disorder: stability and change in clinical diagnosis and symptom presentation.  Journal of Child Psychology and Psychiatry 2013;54(5):582‐90. [DOI: 10.1111/jcpp.12008; PMC3556369; PUBMED: 23078094]CENTRAL    Link to article     Google Scholar     ","['', 'https://doi.org/10.1111/jcpp.12008', 'https://scholar.google.com/scholar_lookup?title=Early+diagnosis+of+autism+spectrum+disorder:+stability+and+change+in+clinical+diagnosis+and+symptom+presentation+&author=W+Guthrie&author=LB+Swineford&author=C+Nottke&author=AM+Wetherby&publication_year=2013&hl=en']",,https://doi.org/10.1111/jcpp.12008, Guthrie 2013 {published data only}  ,excluded,CD009044-bbs2-0043, Analyses conducted on different version of index tool (i.e. on ADOS‐T) 
CD009044-bib-0044,"Huerta M, Lord C. ",Diagnostic evaluation of autism spectrum disorders, Pediatric Clinics of North America ,2012,59,    ,['citation-journal']," Huerta M, Lord C. Diagnostic evaluation of autism spectrum disorders.  Pediatric Clinics of North America 2012;59(1):103‐11. [DOI: 10.1016/j.pcl.2011.10.018; NIHMS331663; PMC3269006; PUBMED: 22284796]CENTRAL    Link to article     Google Scholar     ","['', 'https://doi.org/10.1016/j.pcl.2011.10.018', 'https://scholar.google.com/scholar_lookup?title=Diagnostic+evaluation+of+autism+spectrum+disorders&author=M+Huerta&author=C+Lord&publication_year=2012&hl=en']",,https://doi.org/10.1016/j.pcl.2011.10.018, Huerta 2012 {published data only}  ,excluded,CD009044-bbs2-0044, Not a DTA study 
CD009044-bib-0045,Jackson LS. ,,"Translation, Validation, and Norm‐Referencing of the Spanish Adaptation of the Gilliam Autism Rating Scale‐2 [PhD thesis]",2012,,   ,['citation-book']," Jackson LS. Translation, Validation, and Norm‐Referencing of the Spanish Adaptation of the Gilliam Autism Rating Scale‐2 [PhD thesis]. Minneapolis (MN): Walden University, 2012. CENTRAL    ",[''],,, Jackson 2012 {unpublished data only}  ,excluded,CD009044-bbs2-0045, No DTA data to report 
CD009044-bib-0046,"Kamp‐Becker I, Ghahreman M, Heinzel‐Gutenbrunner M, Peters M, Remschmidt H, Becker K. ",Evaluation of the revised algorithm of Autism Diagnostic Observation Schedule (ADOS) in the diagnostic investigation of high‐functioning children and adolescents with autism spectrum disorders, Autism ,2013,17,    ,['citation-journal']," Kamp‐Becker I, Ghahreman M, Heinzel‐Gutenbrunner M, Peters M, Remschmidt H, Becker K. Evaluation of the revised algorithm of Autism Diagnostic Observation Schedule (ADOS) in the diagnostic investigation of high‐functioning children and adolescents with autism spectrum disorders.  Autism 2013;17(1):87‐102. [DOI: 10.1177/1362361311408932; PUBMED: 21610187]CENTRAL    Link to article     Google Scholar     ","['', 'https://doi.org/10.1177/1362361311408932', 'https://scholar.google.com/scholar_lookup?title=Evaluation+of+the+revised+algorithm+of+Autism+Diagnostic+Observation+Schedule+(ADOS)+in+the+diagnostic+investigation+of+high‐functioning+children+and+adolescents+with+autism+spectrum+disorders+&author=I+Kamp‐Becker&author=M+Ghahreman&author=M+Heinzel‐Gutenbrunner&author=M+Peters&author=H+Remschmidt&author=K+Becker&publication_year=2013&hl=en']",,https://doi.org/10.1177/1362361311408932, Kamp‐Becker 2013 {published data only}  ,excluded,CD009044-bbs2-0046, Mean age > 6 years 
CD009044-bib-0047,"Kim SH, Lord C. ",New Autism Diagnostic Interview ‐ Revised algorithms for toddlers and young preschoolers from 12‐47 months of age, Journal of Autism and Developmental Disorders ,2012,42,    ,['citation-journal']," Kim SH, Lord C. New Autism Diagnostic Interview ‐ Revised algorithms for toddlers and young preschoolers from 12‐47 months of age.  Journal of Autism and Developmental Disorders 2012;42(1):82‐93. [DOI: 10.1007/s10803‐011‐1213‐1]CENTRAL    Link to article     Google Scholar     ","['', 'https://doi.org/10.1007/s10803-011-1213-1', 'https://scholar.google.com/scholar_lookup?title=New+Autism+Diagnostic+Interview+‐+Revised+algorithms+for+toddlers+and+young+preschoolers+from+12‐47+months+of+age+&author=SH+Kim&author=C+Lord&publication_year=2012&hl=en']",,https://doi.org/10.1007/s10803-011-1213-1, Kim 2012a {published data only}  ,excluded,CD009044-bbs2-0047, Analyses conducted on different cutoff criteria for ADOS 
CD009044-bib-0048,"Kim SH, Thurm A, Shumway S, Lord C. ",Multisite study of New Autism Diagnositc Interview‐Revised (ADI‐R) algorithms for toddlers and young preschoolers, Journal of Autism and Developmental Disorders ,2013,43,    ,['citation-journal']," Kim SH, Thurm A, Shumway S, Lord C. Multisite study of New Autism Diagnositc Interview‐Revised (ADI‐R) algorithms for toddlers and young preschoolers.  Journal of Autism and Developmental Disorders 2013;43(7):1527‐38. [DOI: 10.1007/s10803‐012‐1696‐4; NIHMS419066; PMC3594108; PUBMED: 23114567]CENTRAL    Link to article     Google Scholar     ","['', 'https://doi.org/10.1007/s10803-012-1696-4', 'https://scholar.google.com/scholar_lookup?title=Multisite+study+of+New+Autism+Diagnositc+Interview‐Revised+(ADI‐R)+algorithms+for+toddlers+and+young+preschoolers+&author=SH+Kim&author=A+Thurm&author=S+Shumway&author=C+Lord&publication_year=2013&hl=en']",,https://doi.org/10.1007/s10803-012-1696-4, Kim 2013 {published data only}  ,excluded,CD009044-bbs2-0048, Analyses conducted on different cutoff criteria for ADOS 
CD009044-bib-0049,"Klose L, Plotts C, Kozeneski N, Skinner‐Foster J. ",A review of assessment tools for diagnosis of autism spectrum disorders: implications for school practice, Assessment for Effective Intervention ,2012,37,    ,['citation-journal']," Klose L, Plotts C, Kozeneski N, Skinner‐Foster J. A review of assessment tools for diagnosis of autism spectrum disorders: implications for school practice.  Assessment for Effective Intervention 2012;37:236‐42. CENTRAL    Link to article     Google Scholar     ","['', 'https://doi.org/10.1177/1534508411415090', 'https://scholar.google.com/scholar_lookup?title=A+review+of+assessment+tools+for+diagnosis+of+autism+spectrum+disorders:+implications+for+school+practice+&author=L+Klose&author=C+Plotts&author=N+Kozeneski&author=J+Skinner‐Foster&publication_year=2012&hl=en']",,https://doi.org/10.1177/1534508411415090, Klose 2012 {published data only}  ,excluded,CD009044-bbs2-0049, Not a DTA study 
