reference_id,authors,title,journal,year,volume,citation_footer,citation_type,citation,urls,pubmed_id,doi,header,reference_type,study_id,exclusion_reason
CD009044-bib-0001,"Chlebowski C, Green JA, Barton ML, Fein D. ",Using the Childhood Autism Rating Scale to diagnose autism spectrum disorders, Journal of Autism and Developmental Disorders ,2010,40,    ,['citation-journal']," Chlebowski C, Green JA, Barton ML, Fein D. Using the Childhood Autism Rating Scale to diagnose autism spectrum disorders.  Journal of Autism and Developmental Disorders 2010;40(7):787‐99. [DOI: 10.1007/s10803‐009‐0926‐x; PMC3612531; PUBMED: 20054630]CENTRAL    Link to article     Google Scholar     ","['', 'https://doi.org/10.1007/s10803-009-0926-x', 'https://scholar.google.com/scholar_lookup?title=Using+the+Childhood+Autism+Rating+Scale+to+diagnose+autism+spectrum+disorders&author=C+Chlebowski&author=JA+Green&author=ML+Barton&author=D+Fein&publication_year=2010&hl=en']",,https://doi.org/10.1007/s10803-009-0926-x, Chlebowski 2010 {published data only}  ,included,CD009044-bbs2-0001,
CD009044-bib-0002,"Corsello CM, Akshoomoff N, Stahmer AC. ",Diagnosis of autism spectrum disorders in 2‐year‐olds: a study of community practice, Journal of Child Psychology and Psychiatry ,2013,54,    ,['citation-journal']," Corsello CM, Akshoomoff N, Stahmer AC. Diagnosis of autism spectrum disorders in 2‐year‐olds: a study of community practice.  Journal of Child Psychology and Psychiatry 2013;54(2):178‐85. [DOI: 10.1111/j.1469‐7610.2012.02607.x; PMC3505251; PUBMED: 22905987]CENTRAL    Link to article     Google Scholar     ","['', 'https://doi.org/10.1111/j.1469-7610.2012.02607.x', 'https://scholar.google.com/scholar_lookup?title=Diagnosis+of+autism+spectrum+disorders+in+2‐year‐olds:+a+study+of+community+practice&author=CM+Corsello&author=N+Akshoomoff&author=AC+Stahmer&publication_year=2013&hl=en']",,https://doi.org/10.1111/j.1469-7610.2012.02607.x, Corsello 2013 {published data only}  ,included,CD009044-bbs2-0002,
CD009044-bib-0003,"Cox A, Klein K, Charman T, Baird G, Baron‐Cohen S, Swettenham J, et al. ",Autism spectrum disorders at 20 and 42 months of age: stability of clinical and ADI‐R diagnosis, Journal of Child Psychology and Psychiatry ,1999,40,    ,['citation-journal']," Cox A, Klein K, Charman T, Baird G, Baron‐Cohen S, Swettenham J, et al. Autism spectrum disorders at 20 and 42 months of age: stability of clinical and ADI‐R diagnosis.  Journal of Child Psychology and Psychiatry 1999;40(5):719‐32. [PUBMED: 10433406]CENTRAL    Link to article     Google Scholar     ","['', 'https://doi.org/10.1111/1469-7610.00488', 'https://scholar.google.com/scholar_lookup?title=Autism+spectrum+disorders+at+20+and+42+months+of+age:+stability+of+clinical+and+ADI‐R+diagnosis+&author=A+Cox&author=K+Klein&author=T+Charman&author=G+Baird&author=S+Baron‐Cohen&author=J+Swettenham&publication_year=1999&hl=en']",10433406,https://doi.org/10.1111/1469-7610.00488, Cox 1999 {published data only}  ,included,CD009044-bbs2-0003,
CD009044-bib-0004,"Gray KM, Tonge BJ, Sweeney DJ. ",Using the Autism Diagnostic Interview‐Revised and the Autism Diagnostic Observation Schedule with young children with developmental delay: evaluating diagnostic validity, Journal of Autism and Developmental Disorders ,2008,38,    ,['citation-journal']," Gray KM, Tonge BJ, Sweeney DJ. Using the Autism Diagnostic Interview‐Revised and the Autism Diagnostic Observation Schedule with young children with developmental delay: evaluating diagnostic validity.  Journal of Autism and Developmental Disorders 2008;38(4):657‐67. [DOI: 10.1007/s10803‐007‐0432‐y]CENTRAL    Link to article     Google Scholar     ","['', 'https://doi.org/10.1007/s10803-007-0432-y', 'https://scholar.google.com/scholar_lookup?title=Using+the+Autism+Diagnostic+Interview‐Revised+and+the+Autism+Diagnostic+Observation+Schedule+with+young+children+with+developmental+delay:+evaluating+diagnostic+validity+&author=KM+Gray&author=BJ+Tonge&author=DJ+Sweeney&publication_year=2008&hl=en']",,https://doi.org/10.1007/s10803-007-0432-y, Gray 2008 ADI‐R {published data only}  ,included,CD009044-bbs2-0004,
CD009044-bib-0005,"Gray KM, Tonge BJ, Sweeney DJ. ",Using the Autism Diagnostic Interview‐Revised and the Autism Diagnostic Observation Schedule with young children with developmental delay: evaluating diagnostic validity, Journal of Autism and Developmental Disorders ,2008,38,    ,['citation-journal']," Gray KM, Tonge BJ, Sweeney DJ. Using the Autism Diagnostic Interview‐Revised and the Autism Diagnostic Observation Schedule with young children with developmental delay: evaluating diagnostic validity.  Journal of Autism and Developmental Disorders 2008;38(4):657‐67. [DOI: 10.1007/s10803‐007‐0432‐y]CENTRAL    Link to article     Google Scholar     ","['', 'https://doi.org/10.1007/s10803-007-0432-y', 'https://scholar.google.com/scholar_lookup?title=Using+the+Autism+Diagnostic+Interview‐Revised+and+the+Autism+Diagnostic+Observation+Schedule+with+young+children+with+developmental+delay:+evaluating+diagnostic+validity+&author=KM+Gray&author=BJ+Tonge&author=DJ+Sweeney&publication_year=2008&hl=en']",,https://doi.org/10.1007/s10803-007-0432-y, Gray 2008 ADOS {published data only}  ,included,CD009044-bbs2-0005,
CD009044-bib-0006,"Kim SH, Lord C. ",Combining information from multiple sources for the diagnosis of autism spectrum disorders for toddlers and young preschoolers from 12 to 47 months of age, Journal of Child Psychology and Psychiatry ,2012,53,    ,['citation-journal']," Kim SH, Lord C. Combining information from multiple sources for the diagnosis of autism spectrum disorders for toddlers and young preschoolers from 12 to 47 months of age.  Journal of Child Psychology and Psychiatry 2012;53(2):143‐51. [DOI: 10.1111/j.1469‐7610.2011.02458.x; PMC3235227; PUBMED: 21883205]CENTRAL    Link to article     Google Scholar     ","['', 'https://doi.org/10.1111/j.1469-7610.2011.02458.x', 'https://scholar.google.com/scholar_lookup?title=Combining+information+from+multiple+sources+for+the+diagnosis+of+autism+spectrum+disorders+for+toddlers+and+young+preschoolers+from+12+to+47+months+of+age+&author=SH+Kim&author=C+Lord&publication_year=2012&hl=en']",,https://doi.org/10.1111/j.1469-7610.2011.02458.x, Kim 2012b ADOS Cohort A {published data only}  ,included,CD009044-bbs2-0006,
CD009044-bib-0007,"Kim SH, Lord C. ",Combining information from multiple sources for the diagnosis of autism spectrum disorders for toddlers and young preschoolers from 12 to 47 months of age, Journal of Child Psychology and Psychiatry ,2012,53,    ,['citation-journal']," Kim SH, Lord C. Combining information from multiple sources for the diagnosis of autism spectrum disorders for toddlers and young preschoolers from 12 to 47 months of age.  Journal of Child Psychology and Psychiatry 2012;53(2):143‐51. [DOI: 10.1111/j.1469‐7610.2011.02458.x; PMC3235227; PUBMED: 21883205]CENTRAL    Link to article     Google Scholar     ","['', 'https://doi.org/10.1111/j.1469-7610.2011.02458.x', 'https://scholar.google.com/scholar_lookup?title=Combining+information+from+multiple+sources+for+the+diagnosis+of+autism+spectrum+disorders+for+toddlers+and+young+preschoolers+from+12+to+47+months+of+age+&author=SH+Kim&author=C+Lord&publication_year=2012&hl=en']",,https://doi.org/10.1111/j.1469-7610.2011.02458.x, Kim 2012b ADOS Cohort B {published data only}  ,included,CD009044-bbs2-0007,
CD009044-bib-0008,"Le Couteur A, Haden G, Hammal D, McConachie H. ",Diagnosing autism spectrum disorders in pre‐school children using two standardised assessment instruments: the ADI‐R and the ADOS, Journal of Autism and Developmental Disorders ,2008,38,    ,['citation-journal']," Le Couteur A, Haden G, Hammal D, McConachie H. Diagnosing autism spectrum disorders in pre‐school children using two standardised assessment instruments: the ADI‐R and the ADOS.  Journal of Autism and Developmental Disorders 2008;38(2):362‐72. [DOI: 10.1007/s10803‐007‐0403‐3; PUBMED: 17605097]CENTRAL    Link to article     Google Scholar     ","['', 'https://doi.org/10.1007/s10803-007-0403-3', 'https://scholar.google.com/scholar_lookup?title=Diagnosing+autism+spectrum+disorders+in+pre‐school+children+using+two+standardised+assessment+instruments:+the+ADI‐R+and+the+ADOS+&author=A+Couteur&author=G+Haden&author=D+Hammal&author=H+McConachie&publication_year=2008&hl=en']",,https://doi.org/10.1007/s10803-007-0403-3, Le Couteur 2008 ADOS {published data only}  ,included,CD009044-bbs2-0008,
CD009044-bib-0009,"Lord C, Risi S, Lambrecht L, Cook EH, Leventhal BL, DiLavore PC, et al. ",The Autism Diagnostic Observation Schedule‐Generic: a standard measure of social and communication deficits associated with the spectrum of autism, Journal of Autism and Developmental Disorders ,2000,30,    ,['citation-journal']," Lord C, Risi S, Lambrecht L, Cook EH, Leventhal BL, DiLavore PC, et al. The Autism Diagnostic Observation Schedule‐Generic: a standard measure of social and communication deficits associated with the spectrum of autism.  Journal of Autism and Developmental Disorders 2000;30(3):205‐23. [PUBMED: 11055457]CENTRAL    Link to article     Google Scholar     ","['', 'https://doi.org/10.1023/A:1005592401947', 'https://scholar.google.com/scholar_lookup?title=The+Autism+Diagnostic+Observation+Schedule‐Generic:+a+standard+measure+of+social+and+communication+deficits+associated+with+the+spectrum+of+autism+&author=C+Lord&author=S+Risi&author=L+Lambrecht&author=EH+Cook&author=BL+Leventhal&author=PC+DiLavore&publication_year=2000&hl=en']",11055457,https://doi.org/10.1023/A:1005592401947, Lord 2000 {published data only}  ,included,CD009044-bbs2-0009,
CD009044-bib-0010,"Mazefsky CA, Oswald DP. ","The discriminative ability and diagnostic utility of the ADOS‐G, ADI‐R, and GARS for children in a clinical setting", Autism ,2006,10,    ,['citation-journal']," Mazefsky CA, Oswald DP. The discriminative ability and diagnostic utility of the ADOS‐G, ADI‐R, and GARS for children in a clinical setting.  Autism 2006;10(6):533‐49. [DOI: 10.1177/1362361306068505; PUBMED: 17088271]CENTRAL    Link to article     Google Scholar     ","['', 'https://doi.org/10.1177/1362361306068505', 'https://scholar.google.com/scholar_lookup?title=The+discriminative+ability+and+diagnostic+utility+of+the+ADOS‐G,+ADI‐R,+and+GARS+for+children+in+a+clinical+setting+&author=CA+Mazefsky&author=DP+Oswald&publication_year=2006&hl=en']",,https://doi.org/10.1177/1362361306068505, Mazefsky 2006 ADOS {published data only}  ,included,CD009044-bbs2-0010,
CD009044-bib-0011,"Oosterling I, Rommelse N, de Jonge M, van der Gaag RJ, Swinkels S, Roos S, et al. ",How useful is the Social Communication Questionnaire in toddlers at risk of autism spectrum disorder?, Journal of Child Psychology and Psychiatry ,2010,51,    ,['citation-journal']," Oosterling I, Rommelse N, de Jonge M, van der Gaag RJ, Swinkels S, Roos S, et al. How useful is the Social Communication Questionnaire in toddlers at risk of autism spectrum disorder?.  Journal of Child Psychology and Psychiatry 2010;51(11):1260‐8. [DOI: 10.1111/j.1469‐7610.2010.02246.x; PUBMED: 20626528]CENTRAL    Link to article     Google Scholar     ","['', 'https://doi.org/10.1111/j.1469-7610.2010.02246.x', 'https://scholar.google.com/scholar_lookup?title=How+useful+is+the+Social+Communication+Questionnaire+in+toddlers+at+risk+of+autism+spectrum+disorder?+&author=I+Oosterling&author=N+Rommelse&author=M+Jonge&author=RJ+Gaag&author=S+Swinkels&author=S+Roos&publication_year=2010&hl=en']",,https://doi.org/10.1111/j.1469-7610.2010.02246.x, Oosterling 2010b ADI‐R {published data only}  ,included,CD009044-bbs2-0011,
CD009044-bib-0012,"Oosterling I, Rommelse N, de Jonge M, van der Gaag RJ, Swinkels S, Roos S, et al. ",How useful is the Social Communication Questionnaire in toddlers at risk of autism spectrum disorder?, Journal of Child Psychology and Psychiatry ,2010,51,    ,['citation-journal']," Oosterling I, Rommelse N, de Jonge M, van der Gaag RJ, Swinkels S, Roos S, et al. How useful is the Social Communication Questionnaire in toddlers at risk of autism spectrum disorder?.  Journal of Child Psychology and Psychiatry 2010;51(11):1260‐8. [DOI: 10.1111/j.1469‐7610.2010.02246.x; PUBMED: 20626528]CENTRAL    Link to article     Google Scholar     ","['', 'https://doi.org/10.1111/j.1469-7610.2010.02246.x', 'https://scholar.google.com/scholar_lookup?title=How+useful+is+the+Social+Communication+Questionnaire+in+toddlers+at+risk+of+autism+spectrum+disorder?+&author=I+Oosterling&author=N+Rommelse&author=M+Jonge&author=RJ+Gaag&author=S+Swinkels&author=S+Roos&publication_year=2010&hl=en']",,https://doi.org/10.1111/j.1469-7610.2010.02246.x, Oosterling 2010b ADOS {published data only}  ,included,CD009044-bbs2-0012,
CD009044-bib-0013,"Risi S, Lord C, Gotham K, Corsello C, Chrysler C, Szatmari P, et al. ",Combining information from multiple sources in the diagnosis of autism spectrum disorders, Journal of the American Academy of Child and Adolescent Psychiatry ,2006,45,    ,['citation-journal']," Risi S, Lord C, Gotham K, Corsello C, Chrysler C, Szatmari P, et al. Combining information from multiple sources in the diagnosis of autism spectrum disorders.  Journal of the American Academy of Child and Adolescent Psychiatry 2006;45(9):1094‐103. CENTRAL    Link to article     Google Scholar     ","['', 'https://doi.org/10.1097/01.chi.0000227880.42780.0e', 'https://scholar.google.com/scholar_lookup?title=Combining+information+from+multiple+sources+in+the+diagnosis+of+autism+spectrum+disorders&author=S+Risi&author=C+Lord&author=K+Gotham&author=C+Corsello&author=C+Chrysler&author=P+Szatmari&publication_year=2006&hl=en']",,https://doi.org/10.1097/01.chi.0000227880.42780.0e, Risi 2006 Study 1 ADOS Cohort A {published data only}  ,included,CD009044-bbs2-0013,
CD009044-bib-0014,"Risi S, Lord C, Gotham K, Corsello C, Chrysler C, Szatmari P, et al. ",Combining information from multiple sources in the diagnosis of autism spectrum disorders, Journal of the American Academy of Child and Adolescent Psychiatry ,2006,45,    ,['citation-journal']," Risi S, Lord C, Gotham K, Corsello C, Chrysler C, Szatmari P, et al. Combining information from multiple sources in the diagnosis of autism spectrum disorders.  Journal of the American Academy of Child and Adolescent Psychiatry 2006;45(9):1094‐103. [DOI: 10.1097/01.chi.0000227880.42780.0e; PUBMED: 16926617]CENTRAL    Link to article     Google Scholar     ","['', 'https://doi.org/10.1097/01.chi.0000227880.42780.0e', 'https://scholar.google.com/scholar_lookup?title=Combining+information+from+multiple+sources+in+the+diagnosis+of+autism+spectrum+disorders&author=S+Risi&author=C+Lord&author=K+Gotham&author=C+Corsello&author=C+Chrysler&author=P+Szatmari&publication_year=2006&hl=en']",,https://doi.org/10.1097/01.chi.0000227880.42780.0e, Risi 2006 Study 1 ADOS Cohort B {published data only}  ,included,CD009044-bbs2-0014,
CD009044-bib-0015,"Russell PS, Daniel A, Russell S, Mammen P, Abel JS, Raj LE, et al. ","Diagnostic accuracy, reliability and validity of Childhood Autism Rating Scale in India", World Journal of Pediatrics ,2010,6,    ,['citation-journal']," Russell PS, Daniel A, Russell S, Mammen P, Abel JS, Raj LE, et al. Diagnostic accuracy, reliability and validity of Childhood Autism Rating Scale in India.  World Journal of Pediatrics 2010;6(2):141‐7. [DOI: 10.1007/s12519‐010‐0029‐y; PUBMED: 20490769]CENTRAL    Link to article     Google Scholar     ","['', 'https://doi.org/10.1007/s12519-010-0029-y', 'https://scholar.google.com/scholar_lookup?title=Diagnostic+accuracy,+reliability+and+validity+of+Childhood+Autism+Rating+Scale+in+India+&author=PS+Russell&author=A+Daniel&author=S+Russell&author=P+Mammen&author=JS+Abel&author=LE+Raj&publication_year=2010&hl=en']",,https://doi.org/10.1007/s12519-010-0029-y, Russell 2010 {published data only}  ,included,CD009044-bbs2-0015,
CD009044-bib-0016,"Ventola PE, Kleiman J, Pandey J, Barton M, Allen S, Green J, et al. ",Agreement among four diagnostic instruments for autism spectrum disorders in toddlers, Journal of Autism and Developmental Disorders ,2006,36,    ,['citation-journal']," Ventola PE, Kleiman J, Pandey J, Barton M, Allen S, Green J, et al. Agreement among four diagnostic instruments for autism spectrum disorders in toddlers.  Journal of Autism and Developmental Disorders 2006;36(7):839‐47. [DOI: 10.1007/s10803‐006‐0128‐8; PUBMED: 16897398]CENTRAL    Link to article     Google Scholar     ","['', 'https://doi.org/10.1007/s10803-006-0128-8', 'https://scholar.google.com/scholar_lookup?title=Agreement+among+four+diagnostic+instruments+for+autism+spectrum+disorders+in+toddlers&author=PE+Ventola&author=J+Kleiman&author=J+Pandey&author=M+Barton&author=S+Allen&author=J+Green&publication_year=2006&hl=en']",,https://doi.org/10.1007/s10803-006-0128-8, Ventola 2006 ADI‐R {published data only}  ,included,CD009044-bbs2-0016,
CD009044-bib-0017,"Ventola PE, Kleiman J, Pandey J, Barton M, Allen S, Green J, et al. ",Agreement among four diagnostic instruments for autism spectrum disorders in toddlers, Journal of Autism and Developmental Disorders ,2006,36,    ,['citation-journal']," Ventola PE, Kleiman J, Pandey J, Barton M, Allen S, Green J, et al. Agreement among four diagnostic instruments for autism spectrum disorders in toddlers.  Journal of Autism and Developmental Disorders 2006;36(7):839‐47. [DOI: 10.1007/s10803‐006‐0128‐8; PUBMED: 16897398]CENTRAL    Link to article     Google Scholar     ","['', 'https://doi.org/10.1007/s10803-006-0128-8', 'https://scholar.google.com/scholar_lookup?title=Agreement+among+four+diagnostic+instruments+for+autism+spectrum+disorders+in+toddlers&author=PE+Ventola&author=J+Kleiman&author=J+Pandey&author=M+Barton&author=S+Allen&author=J+Green&publication_year=2006&hl=en']",,https://doi.org/10.1007/s10803-006-0128-8, Ventola 2006 ADOS {published data only}  ,included,CD009044-bbs2-0017,
CD009044-bib-0018,"Ventola PE, Kleiman J, Pandey J, Barton M, Allen S, Green J, et al. ",Agreement among four diagnostic instruments for autism spectrum disorders in toddlers, Journal of Autism and Developmental Disorders ,2006,36,    ,['citation-journal']," Ventola PE, Kleiman J, Pandey J, Barton M, Allen S, Green J, et al. Agreement among four diagnostic instruments for autism spectrum disorders in toddlers.  Journal of Autism and Developmental Disorders 2006;36(7):839‐47. [DOI: 10.1007/s10803‐006‐0128‐8; PUBMED: 16897398]CENTRAL    Link to article     Google Scholar     ","['', 'https://doi.org/10.1007/s10803-006-0128-8', 'https://scholar.google.com/scholar_lookup?title=Agreement+among+four+diagnostic+instruments+for+autism+spectrum+disorders+in+toddlers&author=PE+Ventola&author=J+Kleiman&author=J+Pandey&author=M+Barton&author=S+Allen&author=J+Green&publication_year=2006&hl=en']",,https://doi.org/10.1007/s10803-006-0128-8, Ventola 2006 CARS {published data only}  ,included,CD009044-bbs2-0018,
CD009044-bib-0019,"Wiggins LD, Robins DL. ",Brief report: excluding the ADI‐R behavioral domain improves diagnostic agreement in toddlers, Journal of Autism and Developmental Disorders ,2008,38,    ,['citation-journal']," Wiggins LD, Robins DL. Brief report: excluding the ADI‐R behavioral domain improves diagnostic agreement in toddlers.  Journal of Autism and Developmental Disorders 2008;38(5):972‐6. [DOI: 10.1007/s10803‐007‐0456‐3; PUBMED: 17879150]CENTRAL    Link to article     Google Scholar     ","['', 'https://doi.org/10.1007/s10803-007-0456-3', 'https://scholar.google.com/scholar_lookup?title=Brief+report:+excluding+the+ADI‐R+behavioral+domain+improves+diagnostic+agreement+in+toddlers+&author=LD+Wiggins&author=DL+Robins&publication_year=2008&hl=en']",,https://doi.org/10.1007/s10803-007-0456-3, Wiggins 2008 ADI‐R {published data only}  ,included,CD009044-bbs2-0019,
CD009044-bib-0020,"Wiggins LD, Robins DL. ",Brief report: excluding the ADI‐R behavioral domain improves diagnostic agreement in toddlers, Journal of Autism and Developmental Disorders ,2008,38,    ,['citation-journal']," Wiggins LD, Robins DL. Brief report: excluding the ADI‐R behavioral domain improves diagnostic agreement in toddlers.  Journal of Autism and Developmental Disorders 2008;38(5):972‐6. [DOI: 10.1007/s10803‐007‐0456‐3; PUBMED: 17879150]CENTRAL    Link to article     Google Scholar     ","['', 'https://doi.org/10.1007/s10803-007-0456-3', 'https://scholar.google.com/scholar_lookup?title=Brief+report:+excluding+the+ADI‐R+behavioral+domain+improves+diagnostic+agreement+in+toddlers+&author=LD+Wiggins&author=DL+Robins&publication_year=2008&hl=en']",,https://doi.org/10.1007/s10803-007-0456-3, Wiggins 2008 ADOS {published data only}  ,included,CD009044-bbs2-0020,
CD009044-bib-0021,"Wiggins LD, Robins DL. ",Brief report: excluding the ADI‐R behavioral domain improves diagnostic agreement in toddlers, Journal of Autism and Developmental Disorders ,2008,38,    ,['citation-journal']," Wiggins LD, Robins DL. Brief report: excluding the ADI‐R behavioral domain improves diagnostic agreement in toddlers.  Journal of Autism and Developmental Disorders 2008;38(5):972‐6. [DOI: 10.1007/s10803‐007‐0456‐3; PUBMED: 17879150]CENTRAL    Link to article     Google Scholar     ","['', 'https://doi.org/10.1007/s10803-007-0456-3', 'https://scholar.google.com/scholar_lookup?title=Brief+report:+excluding+the+ADI‐R+behavioral+domain+improves+diagnostic+agreement+in+toddlers+&author=LD+Wiggins&author=DL+Robins&publication_year=2008&hl=en']",,https://doi.org/10.1007/s10803-007-0456-3, Wiggins 2008 CARS {published data only}  ,included,CD009044-bbs2-0021,
CD009044-bib-0022,"Becker MM, Wagner MB, Bosa CA, Schmidt C, Longo D, Papaleo C, et al. ",Translation and validation of Autism Diagnostic Interview‐Revised (ADI‐R) for autism diagnosis in Brazil, Arquivos de Neuro‐Psiquiatria ,2012,70,    ,['citation-journal']," Becker MM, Wagner MB, Bosa CA, Schmidt C, Longo D, Papaleo C, et al. Translation and validation of Autism Diagnostic Interview‐Revised (ADI‐R) for autism diagnosis in Brazil [Tradução e validação da ADI‐R (Autism Diagnostic Interview‐Revised) para diagnóstico de autismo no Brasil].  Arquivos de Neuro‐Psiquiatria 2012;70(3):185‐90. [DOI: 10.1590/S0004‐282X2012000300006]CENTRAL    Link to article     Google Scholar     ","['', 'https://doi.org/10.1590/S0004-282X2012000300006', 'https://scholar.google.com/scholar_lookup?title=Translation+and+validation+of+Autism+Diagnostic+Interview‐Revised+(ADI‐R)+for+autism+diagnosis+in+Brazil+&author=MM+Becker&author=MB+Wagner&author=CA+Bosa&author=C+Schmidt&author=D+Longo&author=C+Papaleo&publication_year=2012&hl=en']",,https://doi.org/10.1590/S0004-282X2012000300006, Becker 2012 {published data only}  ,excluded,CD009044-bbs2-0022, No DTA result 
CD009044-bib-0023,"Bölte S, Poustka F. ",The factor structure of the Autism Diagnostic Interview‐Revised (ADI‐R): a study on the dimensional versus the categorical classification of autistic disorders, Zeitschrift fur Kinder‐und Jugendpsychiatrie und Psychotherapie ,2001,29,    ,['citation-journal']," Bölte S, Poustka F. The factor structure of the Autism Diagnostic Interview‐Revised (ADI‐R): a study on the dimensional versus the categorical classification of autistic disorders [Die Faktorenstruktur des Autismus Diagnostischen Interviews‐Revision (ADI‐R): Eine Untersuchung zur dimensionalen versus kategorialen klassifikation autistischer störungen originalarbeit].  Zeitschrift fur Kinder‐und Jugendpsychiatrie und Psychotherapie 2001;29(3):221‐9. [DOI: 10.1024//1422‐4917.29.3.221; PUBMED: 11524898]CENTRAL    Link to article     Google Scholar     ","['', 'https://doi.org/10.1024//1422-4917.29.3.221', 'https://scholar.google.com/scholar_lookup?title=The+factor+structure+of+the+Autism+Diagnostic+Interview‐Revised+(ADI‐R):+a+study+on+the+dimensional+versus+the+categorical+classification+of+autistic+disorders+&author=S+Bölte&author=F+Poustka&publication_year=2001&hl=en']",,https://doi.org/10.1024//1422-4917.29.3.221, Bölte 2001 {published data only}  ,excluded,CD009044-bbs2-0023, No DTA result 
CD009044-bib-0024,"Bölte S, Poustka F. ",Diagnostic Observation Scale for autistic disorders: initial results of reliability and validity, Zeitschrift fur Kinder‐und Jugendpsychiatrie und Psychotherapie ,2004,32,    ,['citation-journal']," Bölte S, Poustka F. Diagnostic Observation Scale for autistic disorders: initial results of reliability and validity [Diagnostische Oeobachtungsskala für Autistische Störungen (ADOS): erste ergebnisse zur zuverlässigkeit und gültigkeit].  Zeitschrift fur Kinder‐und Jugendpsychiatrie und Psychotherapie 2004;32(1):45‐50. [DOI: 10.1024/1422‐4917.32.1.45; PUBMED: 14992047]CENTRAL    Link to article     Google Scholar     ","['', 'https://doi.org/10.1024/1422-4917.32.1.45', 'https://scholar.google.com/scholar_lookup?title=Diagnostic+Observation+Scale+for+autistic+disorders:+initial+results+of+reliability+and+validity+&author=S+Bölte&author=F+Poustka&publication_year=2004&hl=en']",,https://doi.org/10.1024/1422-4917.32.1.45, Bölte 2004 {published data only}  ,excluded,CD009044-bbs2-0024, Age range > 6 years 
