reference_id,authors,title,journal,year,volume,citation_footer,citation_type,citation,urls,pubmed_id,doi,header,reference_type,study_id,exclusion_reason
CD009044-bib-0100,American Psychiatric Association. ,,Diagnostic and Statistical Manual of Mental Disorders (DSM‐III),1980,,.   ,['citation-book']," American Psychiatric Association. Diagnostic and Statistical Manual of Mental Disorders (DSM‐III). 3rd Edition. Washington (DC): American Psychiatric Association, 1980.    ",[],,, APA 1980 ,additional,CD009044-bbs2-0100,
CD009044-bib-0101,American Psychiatric Association. ,,Diagnostic and Statistical Manual of Mental Disorders (DSM‐ III‐R),1987,,.   ,['citation-book']," American Psychiatric Association. Diagnostic and Statistical Manual of Mental Disorders (DSM‐ III‐R). 3rd Edition. Washington (DC): American Psychiatric Association, 1987.    ",[],,, APA 1987 ,additional,CD009044-bbs2-0101,
CD009044-bib-0102,American Psychiatric Association. ,,Diagnostic and Statistical Manual of Mental Disorders (DSM‐IV),1994,,.   ,['citation-book']," American Psychiatric Association. Diagnostic and Statistical Manual of Mental Disorders (DSM‐IV). 4th Edition. Washington (DC): American Psychiatric Association, 1994.    ",[],,, APA 1994 ,additional,CD009044-bbs2-0102,
CD009044-bib-0103,American Psychiatric Association. ,,Diagnostic and Statistical Manual of Mental Disorders (DSM‐IV‐TR),2000,,.   ,['citation-book']," American Psychiatric Association. Diagnostic and Statistical Manual of Mental Disorders (DSM‐IV‐TR). 4th Edition. Washington (DC): American Psychiatric Association, 2000.    ",[],,, APA 2000 ,additional,CD009044-bbs2-0103,
CD009044-bib-0104,American Psychiatric Association. ,,Diagnostic and Statistical Manual of Mental Disorders (DSM‐5),2013,,.   ,['citation-book']," American Psychiatric Association. Diagnostic and Statistical Manual of Mental Disorders (DSM‐5). 5th Edition. Washington (DC): American Psychiatric Association, 2013.    ",[],,, APA 2013 ,additional,CD009044-bbs2-0104,
CD009044-bib-0105,"Atladottir HO, Gyllenberg D, Langridge A, Sandin S, Hansen SN, Leonard H, et al. ",The increasing prevalence of reported diagnoses of childhood psychiatric disorders: a descriptive multinational comparison, European Child & Adolescent Psychiatry ,2015,24,    ,['citation-journal']," Atladottir HO, Gyllenberg D, Langridge A, Sandin S, Hansen SN, Leonard H, et al. The increasing prevalence of reported diagnoses of childhood psychiatric disorders: a descriptive multinational comparison.  European Child & Adolescent Psychiatry 2015;24(2):173‐83. [DOI: 10.1007/s00787‐014‐0553‐8; PUBMED: 24796725]    Link to article     Google Scholar     ","['https://doi.org/10.1007/s00787-014-0553-8', 'https://scholar.google.com/scholar_lookup?title=The+increasing+prevalence+of+reported+diagnoses+of+childhood+psychiatric+disorders:+a+descriptive+multinational+comparison+&author=HO+Atladottir&author=D+Gyllenberg&author=A+Langridge&author=S+Sandin&author=SN+Hansen&author=H+Leonard&publication_year=2015&hl=en']",,https://doi.org/10.1007/s00787-014-0553-8, Atladottir 2015 ,additional,CD009044-bbs2-0105,
CD009044-bib-0106,"Bates D, Mächler M, Bolker BM, Walker SC. ",Fitting linear mixed‐effects models using Ime4, Journal of Statistical Software ,2015,67,    ,['citation-journal']," Bates D, Mächler M, Bolker BM, Walker SC. Fitting linear mixed‐effects models using Ime4.  Journal of Statistical Software 2015;67(1):1‐48. [DOI: 10.18637/jss.v067.i01; cran.r‐project.org/web/packages/lme4/citation.html]    Link to article     Google Scholar     ","['https://doi.org/10.18637/jss.v067.i01', 'https://scholar.google.com/scholar_lookup?title=Fitting+linear+mixed‐effects+models+using+Ime4&author=D+Bates&author=M+Mächler&author=BM+Bolker&author=SC+Walker&publication_year=2015&hl=en']",,https://doi.org/10.18637/jss.v067.i01, Bates 2015 ,additional,CD009044-bbs2-0106,
CD009044-bib-0107,Centers for Disease Control and Prevention. ,"Prevalence of autism spectrum disorder among children aged 8 years ‐ Autism and Developmental Disabilities Monitoring Network, 11 Sites, United States, 2010",,,,. www.cdc.gov/mmwr/pdf/ss/ss6302.pdf (accessed before 16 April 2018).   ,['citation-other']," Centers for Disease Control and Prevention. Prevalence of autism spectrum disorder among children aged 8 years ‐ Autism and Developmental Disabilities Monitoring Network, 11 Sites, United States, 2010. www.cdc.gov/mmwr/pdf/ss/ss6302.pdf (accessed before 16 April 2018).    ",[],,, CDP 2016 ,additional,CD009044-bbs2-0107,
CD009044-bib-0108,"Cederlund M, Hagberg B, Billstedt E, Gillberg C, Gillberg C. ",Asperger syndrome and autism: a comparative longitudinal follow‐up study more than 5 years after original diagnosis, Journal of Autism and Developmental Disorders ,2008,38,    ,['citation-journal']," Cederlund M, Hagberg B, Billstedt E, Gillberg C, Gillberg C. Asperger syndrome and autism: a comparative longitudinal follow‐up study more than 5 years after original diagnosis.  Journal of Autism and Developmental Disorders 2008;38(1):72–85. [DOI: 10.1007/s10803‐007‐0364‐6; PUBMED: 17340200]    Link to article     Google Scholar     ","['https://doi.org/10.1007/s10803-007-0364-6', 'https://scholar.google.com/scholar_lookup?title=Asperger+syndrome+and+autism:+a+comparative+longitudinal+follow‐up+study+more+than+5+years+after+original+diagnosis+&author=M+Cederlund&author=B+Hagberg&author=E+Billstedt&author=C+Gillberg&author=C+Gillberg&publication_year=2008&hl=en']",,https://doi.org/10.1007/s10803-007-0364-6, Cederlund 2008 ,additional,CD009044-bbs2-0108,
CD009044-bib-0109,"Elsabbagh M, Divan G, Koh YJ, Kim YS, Kauchali S, Marcín C, et al. ",Global prevalence of autism and other pervasive developmental disorders, Autism Research ,2012,5,    ,['citation-journal']," Elsabbagh M, Divan G, Koh YJ, Kim YS, Kauchali S, Marcín C, et al. Global prevalence of autism and other pervasive developmental disorders.  Autism Research 2012;5(3):160‐79. [DOI: 10.1002/aur.239; PMC3763210; PUBMED: 22495912]    Link to article     Google Scholar     ","['https://doi.org/10.1002/aur.239', 'https://scholar.google.com/scholar_lookup?title=Global+prevalence+of+autism+and+other+pervasive+developmental+disorders&author=M+Elsabbagh&author=G+Divan&author=YJ+Koh&author=YS+Kim&author=S+Kauchali&author=C+Marcín&publication_year=2012&hl=en']",,https://doi.org/10.1002/aur.239, Elsabbagh 2012 ,additional,CD009044-bbs2-0109,
CD009044-bib-0110,"Filipek PA, Accardo PJ, Baranek GT, Cook EH, Dawson G, Gordon B, et al. ",The screening and diagnosis of autistic spectrum disorders, Journal of Autism and Developmental Disorders ,1999,29,    ,['citation-journal']," Filipek PA, Accardo PJ, Baranek GT, Cook EH, Dawson G, Gordon B, et al. The screening and diagnosis of autistic spectrum disorders.  Journal of Autism and Developmental Disorders 1999;29(6):439‐84. [PUBMED: 10638459]    Link to article     Google Scholar     ","['https://doi.org/10.1023/A:1021943802493', 'https://scholar.google.com/scholar_lookup?title=The+screening+and+diagnosis+of+autistic+spectrum+disorders&author=PA+Filipek&author=PJ+Accardo&author=GT+Baranek&author=EH+Cook&author=G+Dawson&author=B+Gordon&publication_year=1999&hl=en']",10638459,https://doi.org/10.1023/A:1021943802493, Filipek 1999 ,additional,CD009044-bbs2-0110,
CD009044-bib-0111,"Filipek PA, Accardo PJ, Ashwal S, Baranek GT, Cook EH, Dawson G, et al. ",Practice parameter: screening and diagnosis of autism: report of the Quality Standards Subcommittee of the American Academy of Neurology and Child Neurology Society, Neurology ,2000,55,    ,['citation-journal']," Filipek PA, Accardo PJ, Ashwal S, Baranek GT, Cook EH, Dawson G, et al. Practice parameter: screening and diagnosis of autism: report of the Quality Standards Subcommittee of the American Academy of Neurology and Child Neurology Society.  Neurology 2000;55(4):468‐79. [PUBMED: 10953176]    Link to article     Google Scholar     ","['https://doi.org/10.1212/WNL.55.4.468', 'https://scholar.google.com/scholar_lookup?title=Practice+parameter:+screening+and+diagnosis+of+autism:+report+of+the+Quality+Standards+Subcommittee+of+the+American+Academy+of+Neurology+and+Child+Neurology+Society+&author=PA+Filipek&author=PJ+Accardo&author=S+Ashwal&author=GT+Baranek&author=EH+Cook&author=G+Dawson&publication_year=2000&hl=en']",10953176,https://doi.org/10.1212/WNL.55.4.468, Filipek 2000 ,additional,CD009044-bbs2-0111,
CD009044-bib-0112,Fombonne E. ,Epidemiology of pervasive developmental disorders, Pediatric Research ,2009,65,    ,['citation-journal'], Fombonne E. Epidemiology of pervasive developmental disorders.  Pediatric Research 2009;65(6):591‐8. [DOI: 10.1203/PDR.0b013e31819e7203; PUBMED: 19218885]    Link to article     Google Scholar     ,"['https://doi.org/10.1203/PDR.0b013e31819e7203', 'https://scholar.google.com/scholar_lookup?title=Epidemiology+of+pervasive+developmental+disorders&author=E+Fombonne&publication_year=2009&hl=en']",,https://doi.org/10.1203/PDR.0b013e31819e7203, Fombonne 2009 ,additional,CD009044-bbs2-0112,
CD009044-bib-0113,"Gillberg IC, Gillberg C. ",Asperger syndrome ‐ some epidemiological considerations: a research note, Journal of Child Psychology and Psychiatry ,1989,30,    ,['citation-journal']," Gillberg IC, Gillberg C. Asperger syndrome ‐ some epidemiological considerations: a research note.  Journal of Child Psychology and Psychiatry 1989;30(4):631‐8. [PUBMED: 2670981]    Link to article     Google Scholar     ","['https://doi.org/10.1111/j.1469-7610.1989.tb00275.x', 'https://scholar.google.com/scholar_lookup?title=Asperger+syndrome+‐+some+epidemiological+considerations:+a+research+note&author=IC+Gillberg&author=C+Gillberg&publication_year=1989&hl=en']",2670981,https://doi.org/10.1111/j.1469-7610.1989.tb00275.x, Gillberg 1989 ,additional,CD009044-bbs2-0113,
CD009044-bib-0114,Gilliam JE. ,,The Gilliam Autism Rating Scale: GARS,1995,,.   ,['citation-book']," Gilliam JE. The Gilliam Autism Rating Scale: GARS. Austin (TX): Pro‐Ed, 1995.    ",[],,, Gilliam 1995 ,additional,CD009044-bbs2-0114,
CD009044-bib-0115,Gilliam JE. ,,Gilliam Autism Rating Scale (2nd Edition): GARS 2,2006,,.   ,['citation-book']," Gilliam JE. Gilliam Autism Rating Scale (2nd Edition): GARS 2. Austin (TX): Pro‐Ed, 2006.    ",[],,, Gilliam 2006 ,additional,CD009044-bbs2-0115,
CD009044-bib-0116,Gilliam JE. ,,Gilliam Autism Rating Scale (3rd Edition): GARS 3,2013,,.   ,['citation-book']," Gilliam JE. Gilliam Autism Rating Scale (3rd Edition): GARS 3. Austin (TX): Pro‐Ed, 2013.    ",[],,, Gilliam 2013 ,additional,CD009044-bbs2-0116,
CD009044-bib-0117,"Howlin P, Goode S, Hutton J, Rutter M. ",Adult outcome for children with autism, Journal of Child Psychology and Psychiatry ,2004,45,    ,['citation-journal']," Howlin P, Goode S, Hutton J, Rutter M. Adult outcome for children with autism.  Journal of Child Psychology and Psychiatry 2004;45(2):212‐29. [PUBMED: 14982237]    Link to article     Google Scholar     ","['https://doi.org/10.1111/j.1469-7610.2004.00215.x', 'https://scholar.google.com/scholar_lookup?title=Adult+outcome+for+children+with+autism&author=P+Howlin&author=S+Goode&author=J+Hutton&author=M+Rutter&publication_year=2004&hl=en']",14982237,https://doi.org/10.1111/j.1469-7610.2004.00215.x, Howlin 2004 ,additional,CD009044-bbs2-0117,
CD009044-bib-0118,"Johnson CP, Myers SM, Council on Children With Disabilities. ",Identification and evaluation of children with autism spectrum disorders, Pediatrics ,2007,120,    ,['citation-journal']," Johnson CP, Myers SM, Council on Children With Disabilities. Identification and evaluation of children with autism spectrum disorders.  Pediatrics 2007;120(5):1183‐215. [DOI: 10.1542/peds.2007‐2361]    Link to article     Google Scholar     ","['https://doi.org/10.1542/peds.2007-2361', 'https://scholar.google.com/scholar_lookup?title=Identification+and+evaluation+of+children+with+autism+spectrum+disorders&author=CP+Johnson&author=SM+Myers&publication_year=2007&hl=en']",,https://doi.org/10.1542/peds.2007-2361, Johnson 2007 ,additional,CD009044-bbs2-0118,
CD009044-bib-0119,"Kanner L, Eisenberg L. ","Early infantile autism, 1943‐1955", Psychiatric Research Reports of the American Psychiatric Association ,1957,26,    ,['citation-journal']," Kanner L, Eisenberg L. Early infantile autism, 1943‐1955.  Psychiatric Research Reports of the American Psychiatric Association 1957;26(7):55‐65. [PUBMED: 13432078]    Google Scholar     ","['https://scholar.google.com/scholar_lookup?title=Early+infantile+autism,+1943‐1955&author=L+Kanner&author=L+Eisenberg&publication_year=1957&hl=en']",13432078,, Kanner 1957 ,additional,CD009044-bbs2-0119,
CD009044-bib-0120,"Lord C, Rutter M, Le Couteur A. ",Autism Diagnostic Interview ‐ Revised: a revised version of a diagnostic interview for caregivers of individuals with possible pervasive developmental disorders, Journal of Autism and Developmental Disorders ,1994,24,    ,['citation-journal']," Lord C, Rutter M, Le Couteur A. Autism Diagnostic Interview ‐ Revised: a revised version of a diagnostic interview for caregivers of individuals with possible pervasive developmental disorders.  Journal of Autism and Developmental Disorders 1994;24(5):659‐85. [PUBMED: 7814313]    Link to article     Google Scholar     ","['https://doi.org/10.1007/BF02172145', 'https://scholar.google.com/scholar_lookup?title=Autism+Diagnostic+Interview+‐+Revised:+a+revised+version+of+a+diagnostic+interview+for+caregivers+of+individuals+with+possible+pervasive+developmental+disorders+&author=C+Lord&author=M+Rutter&author=A+Couteur&publication_year=1994&hl=en']",7814313,https://doi.org/10.1007/BF02172145, Lord 1994a ,additional,CD009044-bbs2-0120,
CD009044-bib-0121,"Lord C, Rutter M, DiLavore PC, Risi S. ",,Autism Diagnostic Observation Schedule (ADOS): Manual,1999,,.   ,['citation-book']," Lord C, Rutter M, DiLavore PC, Risi S. Autism Diagnostic Observation Schedule (ADOS): Manual. Los Angeles (CA): WPS, 1999.    ",[],,, Lord 1999 ,additional,CD009044-bbs2-0121,
CD009044-bib-0122,"Lord C, Risi S, Lambrecht L, Cook EH, Leventhal BL, DiLavore PC, et al. ",The Autism Diagnostic Observation Schedule–Generic: a standard measure of social and communication deficits associated with the spectrum of autism, Journal of Autism and Developmental Disorders ,2000,30,    ,['citation-journal']," Lord C, Risi S, Lambrecht L, Cook EH, Leventhal BL, DiLavore PC, et al. The Autism Diagnostic Observation Schedule–Generic: a standard measure of social and communication deficits associated with the spectrum of autism.  Journal of Autism and Developmental Disorders 2000;30(3):205‐23. [PUBMED: 11055457]    Link to article     Google Scholar     ","['https://doi.org/10.1023/A:1005592401947', 'https://scholar.google.com/scholar_lookup?title=The+Autism+Diagnostic+Observation+Schedule–Generic:+a+standard+measure+of+social+and+communication+deficits+associated+with+the+spectrum+of+autism+&author=C+Lord&author=S+Risi&author=L+Lambrecht&author=EH+Cook&author=BL+Leventhal&author=PC+DiLavore&publication_year=2000&hl=en']",11055457,https://doi.org/10.1023/A:1005592401947, Lord 2000a ,additional,CD009044-bbs2-0122,
CD009044-bib-0123,"Lord C, Rutter M, DiLavore PC, Risi S, Gotham K, Bishop SL, et al. ",,Autism Diagnostic Observation Schedule: ADOS‐2,2012,,.   ,['citation-book']," Lord C, Rutter M, DiLavore PC, Risi S, Gotham K, Bishop SL, et al. Autism Diagnostic Observation Schedule: ADOS‐2. 2nd Edition. Los Angeles (CA): Western Psychological Services, 2012.    ",[],,, Lord 2012b ,additional,CD009044-bbs2-0123,
CD009044-bib-0124,"Matson JL, Wilkins J, González M. ",Early identification and diagnosis in autism spectrum disorders in young children and infants: how early is too early?, Research in Autism Spectrum Disorders ,2008,2,    ,['citation-journal']," Matson JL, Wilkins J, González M. Early identification and diagnosis in autism spectrum disorders in young children and infants: how early is too early?.  Research in Autism Spectrum Disorders 2008;2(1):75‐84. [DOI: 10.1016/j.rasd.2007.03.002]    Link to article     Google Scholar     ","['https://doi.org/10.1016/j.rasd.2007.03.002', 'https://scholar.google.com/scholar_lookup?title=Early+identification+and+diagnosis+in+autism+spectrum+disorders+in+young+children+and+infants:+how+early+is+too+early?+&author=JL+Matson&author=J+Wilkins&author=M+González&publication_year=2008&hl=en']",,https://doi.org/10.1016/j.rasd.2007.03.002, Matson 2008 ,additional,CD009044-bbs2-0124,
CD009044-bib-0125,"Mazefsky CA, Oswald DP. ","The discriminative ability and diagnostic utility of ADOS‐G, ADI‐R and GARS for children in a clinical setting", Autism ,2006,10,    ,['citation-journal']," Mazefsky CA, Oswald DP. The discriminative ability and diagnostic utility of ADOS‐G, ADI‐R and GARS for children in a clinical setting.  Autism 2006;10(6):533‐49. [DOI: 10.1177/1362361306068505; PUBMED: 17088271]    Link to article     Google Scholar     ","['https://doi.org/10.1177/1362361306068505', 'https://scholar.google.com/scholar_lookup?title=The+discriminative+ability+and+diagnostic+utility+of+ADOS‐G,+ADI‐R+and+GARS+for+children+in+a+clinical+setting+&author=CA+Mazefsky&author=DP+Oswald&publication_year=2006&hl=en']",,https://doi.org/10.1177/1362361306068505, Mazefsky 2006a ,additional,CD009044-bbs2-0125,
CD009044-bib-0126,"Mazefsky CA, McPartland JC, Gastgeb HZ, Minshew NJ. ",Brief report: comparability of DSM‐IV and DSM‐5 ASD research samples, Journal of Autism and Developmental Disorders ,2013,43,    ,['citation-journal']," Mazefsky CA, McPartland JC, Gastgeb HZ, Minshew NJ. Brief report: comparability of DSM‐IV and DSM‐5 ASD research samples.  Journal of Autism and Developmental Disorders 2013;43(5):1236‐42. [DOI: 10.1007/s10803‐012‐1665‐y; PMC3635090; PUBMED: 23011251]    Link to article     Google Scholar     ","['https://doi.org/10.1007/s10803-012-1665-y', 'https://scholar.google.com/scholar_lookup?title=Brief+report:+comparability+of+DSM‐IV+and+DSM‐5+ASD+research+samples&author=CA+Mazefsky&author=JC+McPartland&author=HZ+Gastgeb&author=NJ+Minshew&publication_year=2013&hl=en']",,https://doi.org/10.1007/s10803-012-1665-y, Mazefsky 2013 ,additional,CD009044-bbs2-0126,
CD009044-bib-0127,"McConachie H, Randle V, Hammal D, Le Couteur A. ",A controlled trial of a training course for parents of children with suspected autism spectrum disorder, Journal of Pediatrics ,2005,147,    ,['citation-journal']," McConachie H, Randle V, Hammal D, Le Couteur A. A controlled trial of a training course for parents of children with suspected autism spectrum disorder.  Journal of Pediatrics 2005;147(3):335‐40. [DOI: 10.1016/j.jpeds.2005.03.056; PUBMED: 16182672]    Link to article     Google Scholar     ","['https://doi.org/10.1016/j.jpeds.2005.03.056', 'https://scholar.google.com/scholar_lookup?title=A+controlled+trial+of+a+training+course+for+parents+of+children+with+suspected+autism+spectrum+disorder+&author=H+McConachie&author=V+Randle&author=D+Hammal&author=A+Couteur&publication_year=2005&hl=en']",,https://doi.org/10.1016/j.jpeds.2005.03.056, McConachie 2005 ,additional,CD009044-bbs2-0127,
CD009044-bib-0128,Ministry of Health New Zealand. ,New Zealand autism spectrum disorder guideline,,,,. www.health.govt.nz/publication/new‐zealand‐autism‐spectrum‐disorder‐guideline (accessed 14 October 2014).   ,['citation-other'], Ministry of Health New Zealand. New Zealand autism spectrum disorder guideline. www.health.govt.nz/publication/new‐zealand‐autism‐spectrum‐disorder‐guideline (accessed 14 October 2014).    ,[],,, Ministry of Health New Zealand 2008 ,additional,CD009044-bbs2-0128,
CD009044-bib-0129,Ministry of Health Singapore. ,Autism Spectrum Disorders in Pre‐School Children,,,,. www.moh.gov.sg/content/moh_web/home/Publications/guidelines/cpg/2010/autism_spectrum_disorders_in_pre‐school_children.html (accessed 26 April 2018).   ,['citation-other'], Ministry of Health Singapore. Autism Spectrum Disorders in Pre‐School Children. www.moh.gov.sg/content/moh_web/home/Publications/guidelines/cpg/2010/autism_spectrum_disorders_in_pre‐school_children.html (accessed 26 April 2018).    ,[],,, Ministry of Health Singapore 2010 ,additional,CD009044-bbs2-0129,
CD009044-bib-0130,Missouri Autism Guidelines Initiative. ,"Autism spectrum disorders: Missouri best practice guidelines for screening, diagnosis and assessment",,,,. www.autismguidelines.dmh.mo.gov/pdf/Guidelines.pdf (accessed 14 October 2014).   ,['citation-other']," Missouri Autism Guidelines Initiative. Autism spectrum disorders: Missouri best practice guidelines for screening, diagnosis and assessment. www.autismguidelines.dmh.mo.gov/pdf/Guidelines.pdf (accessed 14 October 2014).    ",[],,, Missouri Autism Guidelines Initiative 2010 ,additional,CD009044-bbs2-0130,
CD009044-bib-0131,"Moher D, Liberati A, Tetzlaff J, Altman DG, PRISMA Group. ",Preferred reporting items for systematic reviews and meta‐analyses: the PRISMA statement, PLoS Medicine ,2009,6,    ,['citation-journal']," Moher D, Liberati A, Tetzlaff J, Altman DG, PRISMA Group. Preferred reporting items for systematic reviews and meta‐analyses: the PRISMA statement.  PLoS Medicine 2009;6(7):e1000097. [DOI: 10.1371/journal.pmed.1000097; PMC2707599; PUBMED: 19621072]    Link to article     PubMed     Google Scholar     ","['https://doi.org/10.1371/journal.pmed.1000097', 'https://www.ncbi.nlm.nih.gov/pubmed/19621072', 'https://scholar.google.com/scholar_lookup?title=Preferred+reporting+items+for+systematic+reviews+and+meta‐analyses:+the+PRISMA+statement&author=D+Moher&author=A+Liberati&author=J+Tetzlaff&author=DG+Altman&publication_year=2009&hl=en']",19621072,https://doi.org/10.1371/journal.pmed.1000097, Moher 2009 ,additional,CD009044-bbs2-0131,
CD009044-bib-0132,"Monteiro SA, Spinks‐Franklin A, Treadwell‐Deering D, Berry L, Sellers‐Vinson S, Smith E, et al. ",Prevalence of autism spectrum disorder in children referred for diagnostic autism evaluation, Clinical Pediatrics ,2015,54,    ,['citation-journal']," Monteiro SA, Spinks‐Franklin A, Treadwell‐Deering D, Berry L, Sellers‐Vinson S, Smith E, et al. Prevalence of autism spectrum disorder in children referred for diagnostic autism evaluation.  Clinical Pediatrics 2015;54(14):1322‐7. [DOI: 10.1177/0009922815592607; PUBMED: 26130396]    Link to article     Google Scholar     ","['https://doi.org/10.1177/0009922815592607', 'https://scholar.google.com/scholar_lookup?title=Prevalence+of+autism+spectrum+disorder+in+children+referred+for+diagnostic+autism+evaluation+&author=SA+Monteiro&author=A+Spinks‐Franklin&author=D+Treadwell‐Deering&author=L+Berry&author=S+Sellers‐Vinson&author=E+Smith&publication_year=2015&hl=en']",,https://doi.org/10.1177/0009922815592607, Monteiro 2015 ,additional,CD009044-bbs2-0132,
CD009044-bib-0133,New York State Department of Health. ,Report of the recommendations ‐ autism / pervasive developmental disorders: assessment and intervention for young children (age 0‐3 years),,,,. www.health.state.ny.us/community/infants_children/early_intervention/disorders/autism/index.htm#Table_of_Contents (accessed 14 October 2014).   ,['citation-other'], New York State Department of Health. Report of the recommendations ‐ autism / pervasive developmental disorders: assessment and intervention for young children (age 0‐3 years). www.health.state.ny.us/community/infants_children/early_intervention/disorders/autism/index.htm#Table_of_Contents (accessed 14 October 2014).    ,[],,, New York State Department of Health 2005 ,additional,CD009044-bbs2-0133,
CD009044-bib-0134,National Institute for Health and Care Excellence. ,"Autism spectrum disorder in under 19s: recognition, referral and diagnosis",,,,. www.nice.org.uk/guidance/cg128 (accessed before 15 May 2017).   ,['citation-other']," National Institute for Health and Care Excellence. Autism spectrum disorder in under 19s: recognition, referral and diagnosis. www.nice.org.uk/guidance/cg128 (accessed before 15 May 2017).    ",[],,, NICE 2011 ,additional,CD009044-bbs2-0134,
CD009044-bib-0135,National Institute for Health and Care Excellence. ,Autism spectrum disorder in under 19s: support and management,,,,. www.nice.org.uk/guidance/cg170 (accessed before 15 May 2017).   ,['citation-other'], National Institute for Health and Care Excellence. Autism spectrum disorder in under 19s: support and management. www.nice.org.uk/guidance/cg170 (accessed before 15 May 2017).    ,[],,, NICE 2013 ,additional,CD009044-bbs2-0135,
CD009044-bib-0136,Ohio Developmental Disabilities Council 2010. ,Autism: reaching for a brighter future. Service guidelines for individuals with autism spectrum disorder through the lifespan,,,,. www.ocali.org/up_doc/Autism_Service_Guidelines.pdf (accessed before 9 May 2018).   ,['citation-other'], Ohio Developmental Disabilities Council 2010. Autism: reaching for a brighter future. Service guidelines for individuals with autism spectrum disorder through the lifespan. www.ocali.org/up_doc/Autism_Service_Guidelines.pdf (accessed before 9 May 2018).    ,[],,, Ohio Developmental Disabilities Council 2010 ,additional,CD009044-bbs2-0136,
CD009044-bib-0137,"Oosterling, i. Personal communication",,,2015,,.   ,['citation-other']," Oosterling, i. Personal communication2015.    ",[],,," Oosterling, I (2015) ",additional,CD009044-bbs2-0137,
